start	end	text
3562400	3563400	Foutre rien !
3563400	3564400	Pour l'instant ça se passe bien !
3564400	3566400	Moi j'adore mon rythme de vie !
3566400	3568400	Je suis pigiste donc je peux bosser la nuit !
3568400	3570400	C'est pour ça qu'il suis sur plein de formes à Sturcy !
3571400	3573400	Contrairement à ceux qui demain matin ont des réunions très tôt !
3573400	3574400	Voilà exactement !
3574400	3576400	Et donc bah la vie est cool quoi !
3576400	3578400	Faireusement que ton formes c'est pas fini hein !
3578400	3579400	Je te rassure !
3579400	3580400	Allons-y allons-y !
3580400	3583400	Alors avec Captain Veuve on avait envie de vous poser une question à vous tous les trois !
3583400	3589400	Est-ce que le fait d'être journaliste dans les jeux vidéo est-ce que c'est pas toujours la profession un peu rêvée pour ceux qui aiment les gamers ?
3589400	3591400	Pour ceux qui ne sont pas journaliste dans les jeux vidéo !
3591400	3592400	Est-ce que c'est vrai ? Est-ce que c'est faux ?
3592400	3594400	Est-ce que c'est une profession de branleur ?
3594400	3595400	Il y a testeur de sextoy aussi !
3595400	3596400	Ouais ce qui est pas mal ouais !
3596400	3601400	Mais moi en fait quand j'ai dû choisir une carrière c'était soit journaliste de jeux vidéo soit acteur porno !
3601400	3605400	Je me suis dit bon journaliste de jeux vidéo mes parents vont préférer même si bon ça se discute un peu !
3605400	3607400	Oui mais c'est une histoire aussi il faut aussi être pourvu à un moment donné de faire une bref !
3607400	3608400	Mais bref oui voilà !
3608400	3616400	Non mais cela dit non non c'est vrai que c'est un peu le métier quand on dit que je suis journaliste dans le jeu vidéo les mecs me disent c'est trop bien tu te bois jeu toute la journée c'est génial et tout !
3616400	3617400	Et les meufs elles te disent quoi ?
3617400	3622400	Souvent ça marche pas bien avec les filles bizarrement je sais pas comment...
3622400	3625400	En général j'essaie de le pas dire en général je dis que je suis journaliste !
3625400	3626400	Je suis journaliste !
3626400	3627400	Après je dis dans l'informatique les jeux vidéo !
3627400	3630400	Et y'a Walou derrière dans les jeux vidéo !
3630400	3631400	C'est ça !
3631400	3634400	Mais c'est ça qui est marrant c'est que je sais pas si vous pensez comme moi les deux là mais en gros...
3634400	3637400	Non je refuse de penser comme toi quoi tu lui dis ça de toute façon !
3637400	3642400	Non mais moi j'ai toujours une sorte de petite réticence à le dire quand on me dit tu fais quoi dans la vie ?
3642400	3643400	Bah voilà je suis...
3643400	3645400	Ou pas par contre !
3645400	3646400	J'écris !
3646400	3650400	Non mais c'est pas un truc que c'est que forcément si tu dis ça on va te rétorquer
3650400	3651400	Oh ouais t'accord tu joues toute la journée quoi !
3651400	3653400	Oui voilà c'est des clichés c'est des gros clichés quoi !
3653400	3655400	Le cliché c'est pas ce que vous faites ?
3655400	3656400	Bah non justement !
3656400	3658400	Y'a quand même des jours c'est un peu vrai !
3658400	3660400	Certains jours c'est un peu vrai !
3660400	3661400	Y'a même des jours où tu ne fous rien !
3661400	3663400	Quand on doit tester Mass Effect 3 pendant une semaine on est bien content !
3663400	3664400	On joue à Mass Effect 3 toute la semaine !
3664400	3665400	Sauf à la fin !
3665400	3666400	Sauf à la même point !
3666400	3667400	Qu'est-ce que je voulais dire ?
3667400	3670400	Non alors je suis pas d'accord avec toi parce que moi au contraire je suis extrêmement fier de dire ça !
3670400	3671400	Mais c'est pas une question fière !
3671400	3678400	J'ai l'impression que ça fait un petit peu chier certaines personnes qui vont te dire que c'est pas journaliste ou je sais pas quoi !
3678400	3682400	C'est vrai d'ailleurs je sais pas ce que c'est qu'un journaliste mais bon bref !
3682400	3686400	Mais j'aime bien faire chier les gens en disant ça !
3686400	3689400	Effectivement d'assumer ce côté un peu branleur du truc !
3689400	3691400	Vous avez une carte de presse ou quoi ?
3691400	3692400	Moi c'est en cours mais...
3692400	3694400	Moi je l'ai jamais demandé parce que j'en ai pas vu !
3694400	3696400	Moi je suis en train de m'a demander ça fait tout à fait 4 ans que je veux pas la voir !
3696400	3697400	Mais on y a droit en tout cas !
3697400	3699400	Moi qui est droit mais faut que t'as des réductions au McDo !
3699400	3703400	Y'a un Mac Offer, tu rentres gratos dans les musées !
3703400	3705400	Mais je guivre au musée je sais pas !
3705400	3706400	Pour quoi faire !
3706400	3709400	Allez je vous propose un peu de parler de joystick !
3709400	3713400	On va peut-être parler encore du métier de journaliste de jeux vidéo !
3713400	3715400	C'est quand même pas que tous les jours que ça arrive !
3715400	3719400	Moi j'aimerais savoir le planning d'un journaliste de jeux vidéo !
3719400	3721400	Alors vous vous levez donc vers 11h !
3721400	3722400	Disons que les pigistes c'est des gros branleurs !
3722400	3723400	C'est beaucoup plus des branleurs que moi !
3723400	3724400	Maintenant j'ai plus le choix je dois me lever !
3724400	3726400	Attends ! Qui c'est qui bosse au bureau ?
3726400	3727400	Moi je dois aller au bureau !
3727400	3729400	Mais j'ai pris ma matinée j'ai posé RTT !
3729400	3730400	J'ai pas eu le choix !
3730400	3731400	Bon bref !
3731400	3732400	Alors le pigiste !
3732400	3733400	Alors ouais !
3733400	3734400	Le pigiste !
3734400	3735400	Allez-y racontez votre quotidien de pigiste !
3735400	3736400	Tu te lèves à 11h donc !
3736400	3738400	Le pigiste ne travaille pas sur place !
3738400	3739400	Tu travailles chez toi !
3739400	3740400	Il peut travailler chez lui, il peut travailler sur place !
3740400	3742400	Il bosse quand il veut en gros !
3742400	3744400	Quand on est pigiste on est freelance !
3744400	3745400	Du moment que tes papiers rentrent dans l'heure !
3745400	3747400	Du moment qu'on rend les articles à l'heure !
3747400	3748400	Par rapport au bouclage du magazine !
3748400	3749400	Tout va bien !
3749400	3751400	Ou avec deux jours de retard ça passe !
3751400	3752400	Oui ça dépend !
3752400	3754400	Ça arrive que les pigistes rendent leurs articles à temps !
3754400	3755400	Jamais !
3755400	3756400	Ouais c'est ça !
3756400	3757400	C'est un peu la légende du truc aussi !
3757400	3758400	Ah non !
3758400	3760400	Un pigiste rend toujours ses articles à la bourre !
3760400	3761400	C'est une règle !
3761400	3762400	Ah mais n'importe quoi !
3762400	3763400	Tu me rassures quand même !
3763400	3764400	C'est ça !
3764400	3767400	Mais sinon quand on est en interne on va dire comme moi !
3767400	3768400	C'est un peu plus carré !
3768400	3770400	On est obligé de s'occuper !
3770400	3771400	Tu bosses beaucoup moins !
3771400	3772400	Je bosse beaucoup !
3772400	3773400	Je bosse différemment on va dire que j'ai...
3773400	3775400	Tu as des horaires du bureau déjà non ?
3775400	3776400	J'ai des horaires de bureau voilà !
3776400	3777400	C'est un peu le concept !
3777400	3778400	11h 15h !
3778400	3779400	11h 15h à peu près !
3779400	3780400	Salopard !
3780400	3782400	Avec un déjeuner de midi à 14h à peu près !
3782400	3783400	C'est très sympa !
3783400	3784400	Et non non !
3784400	3786400	Tous les mois en gros on commence à s'occuper du magazine !
3786400	3787400	On voit ce qu'on met dedans !
3787400	3788400	Et puis on...
3788400	3789400	Alors comment on fait un magazine ?
3789400	3790400	Comment on fait ?
3790400	3792400	Alors comment on fait un magazine ?
3792400	3795400	En gros un magazine ça commence avec ce qu'on appelle un chemin de fer !
3795400	3796400	C'est un gros...
3796400	3799400	C'est un tableau Excel qui va représenter chaque page du magazine !
3799400	3804400	Et dans chacune de ces cases qui représentent chaque page on va mettre ce qu'il y a dans la page de ce magazine !
3804400	3808400	Donc des news, des tests, un dossier, n'importe quoi que ce soit !
3808400	3809400	Et ça va d'après-midi !
3809400	3810400	Vous entendez tout ce rêve là qui arrive ?
3810400	3812400	C'est incroyable !
3812400	3813400	Là je fais rêver les pays !
3813400	3814400	Excel là !
3814400	3816400	J'avais pensé qu'on pouvait faire un con !
3816400	3817400	Comment ça ?
3817400	3819400	J'ai jamais vu le rapport avec la SNCF mais bon !
3819400	3822400	Moi aussi, 70% de mon temps c'est travail sur Excel !
3822400	3823400	Trois putain !
3823400	3824400	Faut dire ça !
3824400	3825400	Faut dire ça comme fait !
3825400	3826400	Et le reste du temps c'est...
3826400	3827400	Le texte à pile de ton job vient de perdre au moins 15 points !
3827400	3828400	Et le reste du temps c'est des voyages de presse avec...
3828400	3829400	Mais on est là pour ça !
3829400	3831400	On compte sur vous !
3831400	3833400	Après vous avez l'infographie, vous avez la mise en paix...
3833400	3834400	Ouais alors voilà !
3834400	3838400	En fait une fois que les papiers sont commandés auprès des rédacteurs du magazine,
3838400	3840400	donc les rédacteurs rendent leurs articles...
3840400	3842400	Alors qui décide ce qu'il va y avoir dans le prochain numéro ?
3842400	3844400	Bah c'est le rédacteur en chef et le rédacteur en chef adjoint !
3844400	3845400	Donc toi !
3845400	3847400	On est en partie de boulot, on va dire !
3847400	3850400	Sauf quand il y a des M. Comédie Wallou qui nous proposent des trucs complètement improbables
3850400	3851400	qu'on accepte malheureusement !
3851400	3853400	Et rebelles !
3853400	3854400	Mais bon !
3854400	3855400	Mais sinon c'est toi qui dis,
3855400	3858400	un tel tu vas faire un papier sur tel jeu, un tel tu fais un papier sur...
3858400	3859400	Ça dépend !
3859400	3861400	En fait après quand on connaît les gens avec qui on travaille,
3861400	3863400	bah forcément on se dit bon bah tel type d'article,
3863400	3866400	si on a une idée d'article, tel type d'article ça va aller très bien à telle personne
3866400	3869400	parce qu'on sait que voilà, Kevin son kiff c'est les jeux d'action !
3869400	3870400	Diz !
3870400	3871400	Pardon ! Diz !
3871400	3872400	Est-ce que tu distribues les jeux ?
3872400	3873400	Et les jeux qu'il faut tester ?
3873400	3874400	Ouais en général quand on soin...
3874400	3877400	Tu t'appelles Diz, tu lui dis écoute j'ai un truc pour toi j'ai Farm Simulator !
3877400	3878400	Ah !
3878400	3879400	Là j'arrive en courant quoi !
3879400	3880400	Alors déjà c'est Farm Simulator !
3880400	3882400	Toilette et Bushing Simulator numéro 15 !
3882400	3885400	Y'a combien de personnes aujourd'hui qui font des articles,
3885400	3887400	personnes différentes qui font des articles dans la ligne ?
3887400	3890400	Bah là sur Joy on est je pense sur à peu près une petite dizaine !
3890400	3891400	Ah oui !
3891400	3892400	En plus ou moins régulier !
3892400	3893400	Parce qu'on se répartit de boulot comme on peut
3893400	3896400	parce que maintenant il y a 150 pages il faut bien remplir les pages !
3896400	3899400	Juste un petit entrec pour dire bonjour à Salomètre qui est sur le chat !
3899400	3900400	Hello !
3900400	3901400	Salomètre !
3901400	3902400	Salomètre !
3902400	3903400	C'est mon corps de bête !
3903400	3905400	Je vais te dire salut Salomètre !
3905400	3906400	Hello !
3906400	3907400	Dès qu'on parle de jeux vidéo !
3907400	3909400	On va juste se calmer deux minutes !
3909400	3911400	On va redorer un peu le blason de la profession !
3911400	3912400	Parce que là c'est vrai que...
3912400	3913400	Ah c'est sérieux une fille qui écoute quoi !
3913400	3916400	Tu nous livres une vision un peu austère et tristone !
3916400	3918400	Ah bah oui après on parle des bons côtés !
3918400	3923400	Voilà donc ce que c'est aussi être journaliste de jeux vidéo c'est se taper des voyages de presse de folie !
3923400	3924400	Ah !
3924400	3926400	Bah le 3...
3926400	3927400	Le 3...
3927400	3929400	C'est JK qui pourra en parler !
3929400	3930400	Si c'est extra !
3930400	3935400	Mais même en dehors de le 3 maintenant il y a de plus en plus d'événements organisés par les éditeurs pour justement avoir une visibilité !
3935400	3939400	À Saint-Péthesbourg, les trucs de malade où on t'a mis en treillis...
3939400	3941400	On va te faire ramper dans la bouche !
3941400	3942400	Qu'il n'aurait à l'E3...
3942400	3946400	Par exemple moi la semaine dernière j'étais à Rome par exemple pendant 3 jours pour découvrir 3 jeux !
3946400	3951400	Et donc entre les découvertes des jeux et des interviews j'ai pu aller me balader pour les édite !
3951400	3952400	Et donc t'es payé pour ça ?
3952400	3953400	Tu te frais payé ?
3953400	3955400	Non je suis payé après avoir rendu mon papier !
3955400	3957400	En fait mon temps de séjour sur place je ne gagne rien !
3957400	3959400	Tes frais sont payés ?
3959400	3960400	Oui !
3960400	3961400	Par rien !
3961400	3964400	Est-ce que tu perds des calories dans l'hôtel le soir et le lendemain tu vas te manger aux vidéos !
3964400	3965400	Exactement !
3965400	3966400	Et l'hôtel est bien ?
3966400	3967400	C'est peut-être un bel hôtel !
3967400	3969400	Est-ce qu'il y a des bons buffets dans les jeux vidéos ?
3969400	3971400	Ah les buffets sont pas mal en général !
3971400	3980400	En fait Dix tu es en train de nous dire que le jeu vidéo c'est pas juste des mecs qui sont derrière leur ordinateur en train de jouer et après derrière leur ordinateur en train d'écrire la piche !
3980400	3981400	Non justement !
3981400	3984400	En fait on suit...
3984400	3985400	Un régime incroyable !
3985400	3987400	Hormis les dossiers un peu en marge de tout !
3987400	3992400	En gros on suit la vie d'un jeu depuis son annonce, depuis sa première présentation
3992400	3996400	où là en fait la plupart du temps on va voir le jeu, on va dans les studios etc.
3996400	4003400	Et ensuite la deuxième partie c'est la preview et le test où là le jeu nous arrive et on va le mettre dans notre PC et y jouer quoi !
4003400	4006400	Voilà c'est les deux parties où on suit le jeu du début à la fin !
4007400	4010400	Vous avez des contacts privilégiés je pense avec les éditeurs, est-ce qu'ils vous appellent en vous disant
4010400	4013400	faut que tu viennes absolument voir ma dernière démo, le jeu qui va péter ?
4013400	4021400	En général ça se passe comme ça justement dans la semaine prochaine avec Kevin on part à Los Angeles pour découvrir un jeu qui n'a pas été encore annoncé donc compte pas dire !
4021400	4022400	Mais qui se vendra pas en peu...
4022400	4024400	Moi je vais aller voir un jeu, je peux vous en parler si vous voulez !
4024400	4027400	Vous pouvez l'annoncer ici de toute façon le podcast est pas diffusé avant deux semaines !
4027400	4028400	Pas du tout diffusé !
4028400	4030400	Ouais mais non !
4030400	4032400	On est plus parlé plus !
4032400	4035400	On passe à nous Joystick va se faire bannir de toutes les invitations !
4035400	4037400	Pour plus jamais inviter en voyage de presse !
4037400	4044400	Et non non donc là dans ce cas là c'est effectivement les éditeurs qui nous contactent en disant bon bah voilà on présente ce jeu à telle date est-ce que vous voulez venir ?
4044400	4048400	Nous après on voit comment on gère le truc soit faire une couverture soit faire un reportage etc.
4048400	4052400	Et c'est tous les mois comme ça en fait on part plus ou moins tous les mois !
4052400	4056400	Combien d'éditeurs t'ont proposé des pots de vin pour faire la grande question ?
4056400	4059400	Mais aucun bordel ! Mais j'attends que ça moi !
4059400	4061400	Non mais ouais justement c'est ça le fier !
4061400	4062400	C'est vrai c'est clean !
4062400	4067400	Avant que j'arrive dans le jeu vidéo j'entendais ouais le jeu vidéo c'est des pots de vin et tout mais que dalle j'ai pas touché un seul tupre !
4067400	4070400	Moi je m'occupe souvent des jeux de foot alors PES FIFA c'est la guerre !
4070400	4077400	Et combien de fois on m'a dit ouais t'as été payé par IE pour par Electronic Arts pour donner cette note là à PES machin !
4077400	4080400	Mais putain mais jamais quoi ! Mais j'attends que ça moi !
4080400	4081400	J'ai une question pour vous !
4081400	4082400	Un truc intéressant !
4082400	4087400	Est-ce que la personne qui se charge enfin est-ce que toi par exemple en tant que rédacteur en chef adjoint
4087400	4091400	Est-ce que tu sais d'un côté bon tu sais évidemment qu'est-ce qu'il va y avoir comme article etc
4091400	4096400	Est-ce que tu sais ce qui va passer comme pub ou est-ce que c'est juste le maquettiste qui sait qu'il rajoute quelle pub ?
4096400	4099400	Non alors honnêtement pour le moment c'est ça !
4099400	4103400	En général moi la pub nous on sait combien de pages de pub on a dans le magazine
4103400	4107400	Mais on sait pas à l'avance qu'est-ce qu'il y aura dans le magazine !
4107400	4111400	Une fois le magazine prêt voilà à la fin on a une pub là pour les casques pour les casques
4111400	4112400	On le sait pas !
4112400	4114400	Quand tu fais les articles on fait des trucs tu le sais pas !
4114400	4115400	Absolument pas !
4115400	4119400	Ça c'est le vieux fantasme à savoir que étant donné qu'il va y avoir trois pages de pub pour tel jeu tu vas être obligé
4119400	4121400	Non mais à la fin elles sont quand même passées !
4121400	4126400	Honnêtement sans vouloir enfin moi depuis que je travaillais dans ce métier
4126400	4130400	Jamais on m'a dit ah bah tel jeu faut que tu te mettes telle note parce qu'on a une campagne de pub
4130400	4135400	Après je dis pas que c'est jamais arrivé dans le milieu il y a eu des affaires un peu louches mais peut-être plus sur le web
4135400	4137400	Et vous ? Jamais t'as décroché ton numéro ?
4137400	4139400	Hello EA Games ? Oui euh...
4139400	4143400	Bon il est peut-être arrivé votre jeu là mais bon euh ça peut s'arranger comme ça
4143400	4144400	Non !
4144400	4145400	Un voyage à faire
4145400	4148400	Franchement non on est trop sympa quoi !
4148400	4150400	Parlons un peu des notes est-ce que c'est important la note ?
4150400	4151400	Est-ce que c'est un dispensaire ?
4151400	4152400	Ah on a combien de temps là ?
4152400	4154400	Vas-y vas-y lâche toi !
4154400	4157400	Alors moi j'ai un nouveau système à proposer c'est un système de notes sur 3
4157400	4158400	C'est pourri !
4158400	4159400	1, 2, 3...
4159400	4161400	Pas bien bien très bien !
4161400	4162400	Bah écoute t'as tout compris !
4162400	4164400	Vivant mort blessé !
4164400	4166400	C'est pas mal c'est pas mal !
4166400	4167400	Non mais c'est vrai ? Tu parles sérieusement ou pas ?
4167400	4168400	Mais c'est pas mal !
4168400	4169400	Moi j'aimerais bien ouais !
4169400	4170400	D'accord !
4170400	4171400	Pourquoi ?
4171400	4172400	Parce que c'est complètement con tu te retrouves à faire un...
4172400	4174400	Enfin bon j'enfonce des portes ouvertes mais...
4174400	4175400	Mais t'es pas un mec nuancé en fait !
4175400	4177400	Ou c'est de la merde ou c'est bien quoi !
4177400	4178400	Non mais vas-y what do you ?
4178400	4183400	Non mais c'est à dire que si t'as envie de te nuancer tu nuances dans le papier mais dans une note que tu mettes 14 ou 15 ça va pas changer
4183400	4184400	Bah voilà !
4184400	4186400	Moi je suis un peu d'accord avec ça dans le sens où des fois...
4186400	4187400	Mais tu vois d'accord !
4187400	4188400	Entre 17...
4188400	4190400	19 on se dit que le jeu est mortel a priori !
4190400	4193400	Entre 16 et 18 tu te dis qu'en fait bah...
4193400	4194400	C'est quand même très bien !
4194400	4197400	Oui c'est très bien mais tu sais pas trop pourquoi il y a 16 ou 18 quoi !
4197400	4198400	Enfin...
4198400	4200400	Mais c'est aussi parce qu'il y a différents trucs qui sont...
4200400	4203400	Il y a d'un côté il y a les graphismes, de l'autre il y a l'histoire, il y a l'interface...
4203400	4209400	Enfin maintenant c'est vrai que ça le côté disséquer la jouabilité, les graphismes, le son etc...
4209400	4210400	Ça se fait plus ou...
4210400	4212400	Ça se fait de moins en moins nous chez Joystick maintenant...
4212400	4215400	Ouais enfin il y a toujours des vestiges de ça et contre lesquels il faut lutter justement !
4215400	4217400	À part jeuxvideo.com qui fait encore ça...
4217400	4219400	Est-ce qu'on serait pas un petit peu d'accord là ?
4219400	4220400	Je crains...
4220400	4221400	Est-ce que ça serait pas la première fois de la soirée que ce serait un peu d'accord ?
4221400	4223400	Ce soir c'est toi qui prends !
4223400	4225400	Moi j'ai une question à vous poser justement en fonction...
4225400	4228400	Vous avez tous tous les types de consoles de...
4228400	4230400	Alors dans Joystick on séjour les consoles...
4230400	4233400	En fait pour le coup comme Joystick c'est un magazine 100% PC, on travaille sur PC...
4233400	4236400	Après moi chez moi j'ai une Xbox, j'ai une PS3, j'ai une DS...
4236400	4237400	Oui vous faites que de PC ?
4237400	4241400	Oui voilà mais je suis joueur surtout et j'ai une spécialité de PC d'autant plus que je travaille sur Joystick...
4241400	4243400	Et on installe PC pour un test de jeu ?
4243400	4246400	C'est quoi ? C'est un dual screen ? Un trial screen ?
4246400	4248400	Non général oui c'est un petit dual screen tranquille...
4248400	4249400	Tranquillou...
4249400	4252400	Non non mais c'est surtout un grand écran, c'est du 22-24 pouces...
4252400	4253400	Mais voilà...
4253400	4254400	C'est un grand écran ça ?
4254400	4255400	Bah pour jouer sans...
4255400	4256400	Après ça c'est un vidéoprojecteur monsieur !
4256400	4257400	Ah oui non non mais...
4257400	4258400	Ouais parce que disons que...
4258400	4259400	Un truc de branleur !
4259400	4264400	Quand tu dois passer 8 heures à tester un jeu, au bout d'un moment le vidéoprojecteur c'est un peu violent quoi...
4264400	4265400	Quand même...
4265400	4267400	Pour revenir juste un petit instant sur la note, tu m'avais expliqué tout à l'heure...
4267400	4273400	Avant l'émission que la note était extrêmement importante, qu'il y avait des sites qui faisaient de l'agrégation de notes et ça avait des conséquences pour les éditeurs...
4273400	4277400	En fait le problème actuellement c'est que même si on voulait se passer des notes, on peut pas...
4277400	4278400	Enfin on peut pas...
4278400	4290400	Techniquement, commercialement on va dire que c'est très risqué parce que les éditeurs en général se basent énormément sur les notes et sur malheureusement entre guillemets un site qui s'appelle Metacritic qui est devenu un site de référence...
4290400	4291400	Ah oui !
4291400	4294400	C'est plus en anglo-saxon mais c'est un site de référence en gros où on a les notes de tout...
4294400	4297400	Enfin tout ce qui est DVD, films, jeux vidéo etc...
4297400	4303400	Donc maintenant il suffit d'aller sur Metacritic de taper le nom d'un jeu et on voit la moyenne qu'il a eu sur tous les sites, tous les magazines etc...
4303400	4304400	Ça pour les films aussi...
4304400	4309400	Voilà et les éditeurs se reposent énormément là-dessus par exemple pour donner des bonus même à certains studios de développement...
4309400	4319400	Si par exemple un jeu n'atteint pas on va dire 85% de résultats sur 100 et bah ils ont pas de bonus financiers derrière parce que le jeu n'a pas été assez bien on était sur Metacritic donc ça fausse complètement...
4319400	4325400	La donne et il y a eu des très très bons, des excellents jeux comme on parlait tout à l'heure de Fallout New Vegas...
4325400	4334400	Il y a eu 84% seulement entre Metacritic et s'ils avaient eu 85% ils auraient eu un bonus financier de la part de leur éditeur et du coup aujourd'hui bah le studio qui a développé le jeu est dans la merde financièrement...
4334400	4337400	C'est pour ça que c'est bizarre que vous ayez pas de pot de vin quoi...
4337400	4339400	Tiens si tu mets un petit 90% ça me remonte...
4339400	4347400	Non je pense pas parce que si c'était le cas déjà je pense que 90% de la profession refuserait et en plus ça fausserait complètement la donne...
4347400	4349400	On veut le nom des 10% restants !
4349400	4351400	Moi je pense que 10 il a reçu des pots de vin...
4351400	4352400	Ouais...
4352400	4354400	Ah mais 10 lui c'est une bitch...
4354400	4357400	Alors moi j'ai une interrogation quand même parce que...
4357400	4359400	On l'appelle la caisse enregistreuse...
4359400	4360400	Tu peux si tu veux...
4360400	4361400	Voilà...
4361400	4362400	Sois nous...
4362400	4365400	Vas-y toi toi toi tu me soutiens le contraire j'avoue je me suis assez peu penché sur la question...
4365400	4373400	Mais il me semblait que les sites français enfin les sites qui n'étaient pas anglo-saxons à l'exception peut-être d'un ou deux et je dis sites aussi magazines n'étaient pas...
4373400	4375400	Rentraient pas dans la moyenne de métacritique...
4375400	4379400	Il y a quand même quelques sites enfin plus des sites web d'ailleurs plus que des magazines qui sont encore là dessus...
4379400	4382400	Mais le fait est que les éditeurs même en France se reposent énormément sur les notes...
4382400	4383400	Oui bien sûr...
4383400	4385400	Pour après faire leur reporting aux US aux Etats-Unis par exemple...
4385400	4394400	Non mais clairement en fait la note c'est une des preuves de l'immaturité encore du média parce que voilà il y a une dictature de la note nous enfin je pense que là nous trois autour de la table...
4394400	4396400	Moi c'est ce que je disais à mes profs quand j'étais plus jeune...
4396400	4401400	Mais c'est exactement ça parce qu'en plus c'est la note sur 20 c'est vraiment je trouve que c'est vraiment un but très scolaire en fait...
