start	end	text
0	100	...
100	19380	Salut Clou !
19380	20980	C'est artificiel parce qu'on parlait déjà avant.
21140	21300	Ouais.
21880	22360	Ah ouais ?
22360	24500	Et donc on se dit tu et tout.
24680	27420	Bah oui, on fait comme d'habitude, les faux trucs.
27420	32840	Et bah bienvenue dans le 7 fois 12ème épisode de Fuck the Movies.
32960	34500	Ouais, ça mérite des applaux.
34580	35140	Ah oui, bravo.
35580	36060	Magnifique.
36400	36700	Bravo.
37760	39060	Avec cette fois un invité.
40220	40780	Incroyable.
41160	42660	C'est qui l'invité ?
42660	43660	C'est Nicolas Bernot.
43940	45560	Oh !
45560	46620	Déception au parti.
48160	50180	On avait prévu Woody Allen.
50180	51400	C'est génial, c'est brutage.
51960	54100	Et c'est un autre prédateur sexuel.
54680	57140	En fait, sur la liste des prédateurs sexuels.
57140	58960	T'es classé quand même, t'es dans les top 50.
59420	59940	C'est vachement bien.
59980	61900	Ouais, mais j'ai arrêté les tournois et tout, donc j'ai dû baisser.
62440	63280	C'est normal après.
63620	67000	Si t'es pas vraiment, vraiment précis toute l'année, on t'oublie vite.
67100	67620	Bah ouais, c'est ça.
68000	70900	Bah écoute, non, bah attends, t'as fait ton petit taf quand même.
71040	73740	C'est pas forcément ta fille parce que t'en avais pas, mais c'est quand même d'autres
73740	73940	filles.
74060	74960	T'as géré, je trouve.
75800	79760	J'ai pas le droit de répondre parce que mon avocat file sur le canapé, là.
79760	82460	Alors c'est quand même un peu drôle finalement qu'on dise ça.
82500	83980	La pédophilie, évidemment, c'est hilarant.
83980	86600	Non, mais qu'on fasse des blagues sur les prédateurs sexuels parce que c'est notre deuxième
86600	88000	invité et que le premier, c'était Seb Melia.
88140	88960	Ah bah voilà, tu vois.
89140	89840	Oh la vache.
90120	91860	Je te souviens dans la même carrière du coup.
92040	94640	Contrairement à Seb Melia, moi je suis un personnage.
95280	96420	Un personnage fictif.
96480	101240	Non mais non, à l'époque, c'est bon, on savait pas.
101440	102300	Donc on t'est peut-être tombé.
102640	106060	Attention, en tout cas, 100% des invités qu'on fait sur le podcast sont tombés pour agression
106060	106420	sexuelle.
106560	110280	De toute façon, moi je dis toujours aux gens, ne soyez pas fan absolu de qui que ce soit.
110280	110900	Ah oui, c'est ça.
110900	112880	Ouais, j'aime bien pour le moment, c'est pas mal.
112960	113760	Ouais, ouais, le fameux...
113760	115840	Jusqu'à preuve du contraire, c'est plutôt cool ce qu'il fait.
115860	116900	Donc il est toujours pas...
116900	118800	C'est bon, il a 99 ans, il n'y a rien qui est sorti.
118800	119680	Ah ouais, mais on ne sait jamais.
120380	121760	C'est jamais dans le dernier souffle à dire.
121840	122100	C'est ça.
122540	124920	Il y a Ken Urives à 89 ans, quel homme incroyable.
124920	126640	Alors par contre, moi j'en suis effectivement...
126640	131980	Quand les gens sont trop hypés sur internet en mode Ken Urives, c'est sûr qu'il fait
131980	132280	tout bien.
132380	133700	J'espère qu'il a fait une saloperie.
133700	134420	Ah mais non !
134420	135940	Pourquoi ? Parce que toi, ça te rassurerait.
135940	136860	Non mais je n'en peux plus.
137240	138040	Pour l'équilibre.
138180	138480	Je te jaloux.
138640	141540	Tous les jours, il y a un nouveau truc sur Reddit et il a filé de l'argent à un
141540	144600	clochard et il a filé 15 montres à tous les mecs du film.
144760	146500	Mais calmez-vous, il n'est pas...
146500	148300	Personne n'a besoin autant de savoir-leur.
148360	150380	Quand d'être gros, déjà, personne...
150380	154380	15 montres à tous les mecs du film, ça veut dire chaque personne qui a travaillé
154380	156980	sur le film, 15 montres, ça fait dans les 2 millions de montres.
157200	158360	Au bout d'un moment, c'est vulgaire.
158460	158900	C'est faux.
159100	161440	C'est vulgaire en plus, ça veut dire qu'il a un plan.
161440	163360	Eh bien, il y a des gens bien encore sur cette Terre.
163900	166660	Et ils ont une bonne nature capillaire, on est sauvés d'avance.
166760	171460	Eh bien, quand Dave Grohl, il a bien trompé sa femme et que du coup, tout le monde était
171460	172540	dégoûté, ça m'a un peu fait plaisir.
172880	176580	Ce qui est drôle, c'est que les gens l'aimaient tellement que tromper sa femme, c'était
176580	177860	pareil que Weinstein pour eux.
178000	178980	C'est n'importe quoi.
179100	180520	Ça, c'est le problème société à l'accueil.
180540	181160	C'était n'importe quoi.
181260	182040	J'ai halluciné.
182240	184560	C'est triste pour sa femme, c'est triste pour leur couple, mais bon, il faut se calmer.
184560	187420	Il a violé personne jusqu'à après le montrère.
187720	188460	C'est pas un délit, quoi.
188460	191900	C'était si drôle parce que, oh non, pas lui.
192000	194240	Mais c'était un rockstar millionnaire depuis 30 ans.
194380	195700	Il y avait assez peu de chances.
195960	197940	Il y avait une possibilité, en tout cas, que ça ait pu arriver.
198020	200520	En fait, ce qui était drôle, c'était qu'il n'y avait beaucoup de...
200520	202780	Enfin, c'était que des meufs qui avaient l'air déçus et tous les mecs étaient là.
203660	205320	Oui, évidemment.
207380	209300	En tout cas, c'était pas si grave.
209720	212080	Mais on est très content de t'avoir, Nico.
212080	216380	Je suis très content, sachant que je me suis invité de force et ça a marché.
216540	216880	Donc, merci.
217420	217900	Ah oui, c'est vrai.
217900	221780	On avait dit qu'on allait faire des épisodes et vous m'invitez jamais.
222840	228720	J'avais cette voix, la même voix que tes connards qui te parlent des dents de la mer comme des temps pas dans le top 5 de Spielberg, ce qui est faux.
229060	229360	Merci.
229940	231300	C'est vraiment un invité de qualité.
232260	234400	Non, mais j'ai eu plein de gens qui m'ont dit...
234400	234880	De débiles.
235080	235740	Oui, c'était débiles.
236280	237860	Je vois ce que tu veux dire.
237880	238660	C'était ma théorie aussi.
238660	239120	C'est vrai.
239280	243880	Entre geeks du cinéma, on cite les dents de la mer, quoi qu'il arrive, même avec John Williams.
244180	250660	Maintenant, là où je suis d'accord avec toi, c'est qu'il y a une telle liste de hits chez Spielberg que c'est possible que...
251220	252440	Moi, j'aimerais juste faire des messages.
252480	254060	Pardon, je relance un débat d'une autre émission.
254280	254740	Je mininuance.
255000	257200	T'as reçu trois personnes qui t'ont dit ça.
257200	258020	Ça reste peu.
258100	258980	Ouais, c'est plus cinq.
259000	261360	T'as combien ? T'as 19 millions d'abonnés sur...
261360	262000	19 millions, ouais.
262100	265400	19 millions d'abonnés et quatre personnes qui disent « moi, je suis d'accord avec toi ».
265400	268360	Attends, depuis que j'ai annoncé que je fais un épisode avec Nico...
268360	269060	T'as combien ?
269060	269720	25 millions de gens.
269720	271100	T'en as perdu, 25 millions d'abonnés.
271380	272100	Je suis à moins six.
272280	273400	Eh ouais, bien sûr.
273600	275120	Eh ben, ça prouve que c'est plutôt ta place.
275680	276040	C'est bien.
276160	277540	On est revenu à quelque chose de cohérent.
277700	278860	On va pas refaire ce débat.
279020	279160	Non, pardon.
279160	285760	Moi, je pense que les dents de la mer n'ont pas la hype critique qu'il a aux Etats-Unis, en France.
285760	289100	Ne serait-ce que par le nom et parce que ça passait sur RTL 9.
289260	290140	Et j'ai eu la confirmation.
290140	294200	Pourtant, il est dans beaucoup de top 100 des films de tous les temps, même sur des sites français.
294400	294920	Mais bien sûr.
295500	296540	Moi, je suis pas d'accord avec toi.
296640	297860	Alors, si tu dis top 5, je suis d'accord.
298120	299020	Peut-être qu'il est out.
299140	300860	Mais dans un top 100, tu le retrouves régulièrement.
301080	302500	Oui, un top 100 de Spielberg, oui.
302880	303580	Non, pas de Spielberg.
306280	307360	Moi, j'aurais aimé que tu disais...
307360	311480	J'aurais aimé que tu disais dans un top 100 de Spielberg.
311540	312740	C'est sûr, y a pas les dents de la mer.
312740	313560	Vous êtes fous.
313560	314920	Non, il y a les épisodes de Columbo.
315040	315500	Bien sûr.
315760	316260	Bien sûr.
316660	317320	Et il y a...
317320	317660	Duel.
317940	318760	Et Duel, oui, bien sûr.
318780	319540	Duel, il est vraiment bien.
319800	320620	Mais Duel, c'est génial.
320820	321860	C'est les dents de la mer avec un camion.
323240	325000	En tout cas, merci d'être là.
325160	325580	Mais je t'en prie.
325580	328040	Et cette fois, le film, c'est Festen.
328120	329400	Ouais !
329400	332300	Parce qu'on vient de voir nos familles ou pas.
332440	335460	Mais en tout cas, beaucoup de gens se sont vus en famille pendant les fêtes.
336160	339380	Et moi, pourquoi j'ai repensé à Festen il n'y a pas longtemps ?
339380	340960	Parce que t'adores la fête, déjà.
340960	341220	C'est ça.
341680	343540	Chercher des films de Noël.
343540	347880	Et elle est tombée sur une mauvaise liste qui devait être les films de famille, qui
347880	348980	était déjà une liste cocasse.
348980	350160	Ah, j'adore !
350160	351540	Elle m'a dit, t'as entendu parler de ce film d'Anon ?
351540	354480	J'ai dit, oui, mais ce n'est clairement pas un Christmas movie.
354540	355420	Mais moi, je trouve ça génial.
355500	357160	C'est un Christmas movie au Danemark, en tout cas.
357320	357700	C'est sûr.
357700	360960	En tout cas, ce n'est pas un Christmas movie, certes, mais ça reste un feel good movie
360960	361720	et c'est ça qui compte.
361820	362460	Oui, c'est ça.
362640	364000	On se sent bien mieux après.
364020	364940	C'est un buddy movie, même.
365060	367960	En fait, quand tu vois leurs problèmes, tu te dis, mais en fait, moi, j'ai juste un
367960	368500	ongle incarné.
368620	369220	C'est cathartique.
369680	370560	Et bien sûr, je suis d'accord avec toi.
370620	372440	Moi, je suis sûr que c'est un Pixar au Danemark pour eux.
372600	373920	Je pense qu'ils ont plus un oncle incarné.
374080	375260	Oh là là !
375260	376100	Yes, putain !
376100	378400	Je suis très content d'être là, même si je ne peux pas faire ça.
378400	380260	Et moi, ce qui est bien, c'est qu'en préambule, il m'a dit, les jeux de mots,
380260	380620	c'est non.
380840	382040	Bien sûr, mais il le fait pour emmerder.
382140	387200	Sauf que j'ai envie de dire, tu m'accorderas que si le jeu de mots est pédophile, ça
387200	389080	colle plus au truc.
389080	390620	C'est vrai, c'est vrai, mais attention.
390860	392500	On a le droit au jeu de mots pédophile quand même.
392520	396460	D'accord, mais le problème étant que si jamais on ouvre un peu la porte, on sait comment
396460	396700	ça...
396700	397500	On les connaît, les jeux de mots.
397600	399260	Quand il y en a un, au début, il y en a un.
399440	401040	Après, ils arrivent tous avec leur famille.
401460	403400	Donc, ces jeux de mots-là, tu leur laisses un peu la porte.
403600	404540	Non, non, mais je suis désolé.
404640	407060	La France n'a pas vocation à accueillir tous les jeux de mots du monde.
407340	407640	Merci, merci.
407640	414440	La seule extrême droite valable, c'est pour les jeux de mots.
414580	416200	C'est l'extrême droite du vocabulaire.
416600	416900	C'est tout.
416900	418720	Et là, après, il fait du montage, il fait ce qu'il veut.
420020	423480	Et celles qui redressent le pays petit à petit, malgré ce que veulent dire, les gauches...
423480	424940	Oulà !
424940	427500	Et les gars, vous n'avez pas compris ?
427500	428260	T'es bien cette chorale.
428520	430280	Le statut d'intermittent, ça va sauter.
430400	431620	Les gens sont droites, il faut qu'on arrête.
432040	432860	Il va falloir qu'on vrille.
433060	433300	Très vite.
434600	436020	C'est comme dans les prisons.
436200	437620	Il faut choisir les white supremacistes.
437640	439260	Tous les latino-américains.
439280	440400	On est trois hommes blancs.
440500	442260	C'est encore le moment de faire notre vie.
442780	445700	D'essayer de changer de crèmerie au bon moment.
446060	446700	Trois hommes blancs.
446780	447980	Notre seul invité, c'était Seb Melléa.
448040	448780	Pour l'instant, on est dans les clous.
448800	449340	Pour l'instant, on est bien.
449900	450640	Au contraire, même.
450700	452580	Je pense que notre podcast, il va exploser d'ici peu, du coup.
452960	454900	Que des mecs, dont un agresseur sexuel.
454980	455180	Super.
455520	456040	On est pas mal.
456220	456640	Ouais, on est bien.
456820	457360	Sur mon dos.
457440	458480	On n'a pas encore les...
458480	459620	Ah non, mais arrête là, maintenant.
459940	461020	Ça commence à me gêner, vraiment.
461020	464100	Il faudra qu'on invite des meufs aussi.
464180	465020	Taous, je t'en avais parlé.
465100	466060	Je pense qu'on aurait envie de venir.
466060	467060	Mais oui, bien sûr.
467220	468200	Mais tu croyais que tu lui avais demandé.
468520	468940	Je lui avais demandé.
469080	472000	Mais après, juste, comme nous tous un peu, elle a un emploi du temps un peu chargé.
472060	472400	Mais on va trouver.
472460	473080	Moi, j'ai rien à prendre.
473100	475020	Mais elle répond avec des corbeaux voyageurs, toujours, ou pas ?
475020	475320	Ouais, ouais.
475320	475580	Ok.
475880	477260	Ça met un peu de temps, forcément.
477260	480020	En tout cas, c'est Festen.
480680	484580	Est-ce que, vu que vous êtes des très vieilles personnes, vous l'avez vu à l'époque ?
484580	484740	Ouais.
485060	485180	Non.
485920	486780	98, ouais.
487160	487800	Ah, c'était pas avant ?
487800	488760	C'est 98 ou 99 ?
488760	489400	Non, c'est 90.
489540	489860	98.
490180	490500	98.
490860	493100	Ah oui, parce que le dogme y date d'avant et après, ils ont changé le truc.
493260	496460	Chez Tha, je me suis dit, attends, est-ce que pour équilibrer après la Coupe du Monde et tout,
496520	498420	est-ce qu'on se regarderait pas un bon film d'Hanois pédophile ?
498420	499280	Bien vu, bien vu.
499280	499880	Sur la pédophilie.
499880	501020	Vous avez vu encore en salle sur Canal ?
501020	503460	Je l'ai vu sur Canal, ouais.
503460	505660	Parce qu'il y avait une petite hype, il a eu un prix à Cannes.
505800	506540	Ouais, ouais, ouais.
507080	510040	Et en plus, j'étais jeune théâtreux, donc ça en parlait beaucoup.
510900	512200	Et je l'ai pas vu au cinéma, non.
512380	517280	Mais je l'ai vu, oui, dès que ça a été diffusé chez mon père qui avait l'abonnement Canal.
517960	518820	Et énorme claque.
519200	520680	On n'a jamais été aussi silencieux de voir ce film.
520680	521920	Ah, je crois que c'était ton père qui t'avait giflé.
521920	522440	Énorme claque.
522680	523940	Mon père me giflait et disait, t'as vu ?
523940	524540	T'as vu ça ?
524540	524780	Et après, tu te plains.
525060	525740	Et après, tu te plains.
525820	526500	Ça m'a fait clair.
526680	527520	Qu'une fois, moi, je l'ai fait.
527520	530760	T'aimes ça, les films d'Annois ?
530760	531480	Ouais, voilà, ouais.
531620	532440	Non, non, mais c'était...
532440	537560	Oui, et d'ailleurs, de revoir le film et d'avoir en charge le résumé d'une partie,
538060	539280	ça m'a oppressé au possible.
539400	540600	Ça m'a remis dans un état.
541140	542580	Ce film est très puissant, quand même.
542580	547080	Mais c'est pour ça que tu me disais, parce que quand tu t'es auto-invité dans ce podcast,
547080	549220	j'ai dit, écoute, si tu veux, mardi, on fait Feston.
549300	550560	Et pour une fois, c'était un bon film.
550680	551520	T'as vu un bon film.
551700	552060	Non, non, non.
552100	552880	Et pour une fois, mec.
553460	554780	Non, vous avez fait d'autres bons films.
554800	555100	La grande bouffe.
555100	556240	On a fait des tonnes de trucs très bons.
556240	557640	On a déjà eu le même...
557640	559740	Je pense que tu es amnésique, parce qu'on a eu le débat la semaine dernière.
559880	562180	Et on s'est rendu compte que le seul vrai chef-d'oeuvre qu'on avait fait,
562420	564560	c'était ce substance et la grande bouffe.
564620	565560	Il y a une différence, déjà.
566240	568020	Attenuons les mots, chef-d'oeuvre, tout ça.
568080	569300	Ne les mettons pas tous au même endroit.
569440	571020	Tu l'as mis dans le top 20 des films d'horreur.
571060	571280	Je sais.
571280	571920	Je sais.
572160	573740	Et entre temps, je peux redescendre aussi.
573940	574820	C'est super.
575000	576040	Ça a été enregistré.
576340	578360	Mais à l'époque, il était malade.
578420	579020	Mais j'étais chaud.
579140	580820	Mais parce que je shortais de l'avoir vu.
580820	581800	Et ça reste toujours très, très bien.
581860	582000	Non, non.
582060	582820	Mais j'étais...
583540	583940	T'as raison.
584360	585320	L'enregistrement est là.
585500	587400	Je me souviens t'avoir calmé en mode...
587400	587700	Et je l'assume.
587700	589040	Pour moi, c'est le film de l'année, mais...
589040	589420	Ah ouais, ouais.
589420	590900	Mais j'ai un film d'horreur, tu vas t'en mordre les doigts.
590920	594740	C'est important, justement, de pouvoir s'enflammer encore sur des films à la sortie.
594980	595120	C'est sûr.
595120	595760	Je suis d'accord.
595960	596220	Je suis d'accord.
596580	598820	Mais effectivement, la grande bouffe...
598820	601700	Mais il y a d'autres trucs dans le tas qui sont bien dans ce qu'on a fait.
601780	604400	Moi, quand j'ai vu Festent, j'ai dit que c'est le meilleur film pédophile de tous les temps.
604500	605700	Moi, je l'ai mis dans mon top 10.
605860	606640	Ah ouais ?
606640	606980	Ouais, ouais.
607420	608480	Moi, c'est des...
608480	609540	Après, c'est que je compte...
609540	610760	Il y a des livrances ?
610760	613720	Non, je compte les docu, puis les vidéos que tu m'envoyais.
614020	615280	Ah oui, non, mais ça...
615280	616340	C'est pas pédo, des livrances.
616340	616440	C'est pas pédo.
616440	616900	C'est pour ton anniversaire.
616900	617800	Il y a un viol, mais c'est pas pédo.
617820	618600	Non, c'est vrai, c'est vrai.
618780	619640	Bon, ça y est, je suis gêné.
619660	620200	On m'en enche pas.
620540	623020	Je suis gêné qu'on en parle si facilement.
623420	624640	Ah non, non, non, là, je suis pas d'accord.
624880	626360	Attendez, les classements, c'est pas pour ça.
626740	627940	C'est souvent des trucs...
627940	629180	La traque, là, c'était pas mal.
629780	630620	Enfin, je sais pas si c'est pédophile.
630860	633500	Oui, alors c'est soupçon de pédophilie, effectivement.
633580	634220	Ah, c'est pas pareil.
634420	634980	C'est pas pareil.
635640	636620	Mais c'était encore des Danois.
637280	639600	Bah oui, c'est Mad Mikkelsen et tout.
639600	640340	C'est toute la bande à...
640340	641040	C'est son petit problème.
641080	642300	La bande à Madot.
642380	645360	Là-bas, il fait pas très beau, il fait froid, donc on est obligé de rester à la maison.
645740	646260	Moi, je comprends.
646340	647340	C'est ce que je vous disais en roche.
647340	650980	Enfin, mon avis, en fait, eux, ils font un film pédote pour les 10 ans.
651180	652720	Et là, il y a Cannes qui dit...
652720	654740	C'est juste un film d'époque.
654900	656200	Venez, on va l'exporter celui-là.
656320	658300	Non, mais arrêtez, tout le monde va croire qu'on fait que des films pédote.
659060	659940	Non, mais c'est super.
659940	665420	Non, pour le coup, du même réalisateur que j'avais pu voir, je vais me la péter, au Festival des Arcs.
665760	666560	La communauté.
667360	667780	La communauté.
668020	669000	Il n'y a rien de glauque dedans.
669180	676000	C'est juste une fresque d'une communauté hippie qui décide de vivre ensemble dans un grand appartement, une maison.
676160	676660	C'est vrai, c'est vrai.
676660	678140	Et on les suit sur 20 piges.
678220	679160	Et c'est vachement beau.
679280	680060	C'est hyper intéressant.
680200	682620	Après, Winterberg, il a fait effectivement un peu...
682620	684500	La chasse, c'est pas très joyeux.
684680	687140	Ah, mais quand t'as dit la traque, j'ai compris la chasse, moi.
687180	687680	C'est la chasse.
687740	688620	Et c'est le même ?
688620	689120	C'est le même gars ?
689120	690620	Attends, mais non, la chasse, c'est pas du tout ça.
691260	691800	Non, attends, attends.
691860	693560	La chasse, c'est pas le prof qui est soupçonné.
693780	694500	Bah voilà, c'est ça.
694500	696180	Oui, mais toi, tu parlais de la communauté, du coup.
696460	697940	Oui, non, mais avant, on a parlé...
697940	698760	Mais t'as dit la traque, toi.
698760	699660	Mais du coup, c'est la chasse.
706660	707420	Ah, vous avez fait ça ?
707420	708160	La chasse, il a rien fait.
708180	709340	Il y a plein des histoires pédophiles, j'en ai plein.
709400	710740	J'ai spoilé la chasse, oubliez ce que j'ai dit.
710980	711780	Ah, t'as spoilé, ouais.
712040	713320	En fait, il l'a pas fait, c'est nul.
713440	714440	Il a fait drunk aussi.
714480	717880	Quand on promet un film pédophile et qu'en fait, il est pas pédo, le gars, ça m'énerve.
718340	719520	Oh, je suis venu pour un film pédo, là.
719560	721740	Et le dernier, je crois que c'est le dernier qu'il ait fait, c'est drunk.
721980	723620	Pareil avec Matthew Nicholson, c'est vachement bien.
723620	726000	Et ça, pour le coup, c'est très positif, même dans le négatif.
726060	728460	Mais en fait, moi, je suis con, parce que c'est peut-être un de mes réels préférés.
728600	729660	Oui, oui, oui, clairement.
729960	731880	Moi, je le mets devant Lars von Trier.
732020	733200	Je sais que je vais faire bondir des gens.
733200	733580	Moi, non.
734060	736200	Mais dans les réalisateurs du dogme, c'est celui...
736200	738240	En fait, c'est un peu comme Truffaut par rapport à Godard.
738880	739400	Lars von Trier...
739400	740700	Qu'est-ce que le dogme ?
740700	741880	Oui, parlons-en tout de suite, effectivement.
742120	744000	Le dogme, en gros, c'est un...
744000	744520	Un manifeste.
744520	749560	Un manifeste, voilà, qui a été co-signé par lui et par Lars von Trier.
749720	751340	Et je crois qu'il y a encore deux ou trois autres...
751340	751660	Je sais plus.
751660	753420	Au départ, ils étaient deux, puis ça s'est un peu...
753420	753680	Voilà.
754020	759440	Et en gros, c'est une sorte de cahier des charges que doit remplir un film sur lumière.
759440	759600	Pérophilie.
759860	764040	Non, mais lumière non artificielle, à part si t'as un plafonnier dans la maison ou quoi,
764120	766420	tu l'utilises, mais t'as pas le droit de rajouter des projos.
766560	768400	Ouais, les projos, tout doit être fait en lumière naturelle.
768420	768900	C'est ça, voilà.
769080	770160	Le son doit être pris sur...
770160	772500	En gros, c'est l'équivalent de la nouvelle vague, mais au Danemark.
772540	773640	Et caméra épaule tout le temps, je crois.
773640	774040	Ouais, ouais.
774480	778440	T'es obligé d'être sur le lieu, t'as pas le droit de faire du montage, en gros,
778440	781100	en disant, là, t'es dans une situation, tu dois rester sur...
781100	783080	Moi, j'ai un problème avec le dogme, on en parlera après.
783080	785740	Moi, j'ai un problème avec le dogme, si c'est juste l'exercice de style.
785900	790020	Or, là, dans Festen, tu l'oublies complètement, et ça sert le propos, je trouve, parce qu'on
790020	792440	a l'impression de voir, surtout là, maintenant qu'il a pris un coup de vieux...
792440	793960	Ouais, un mec au caméscope, correctement.
793960	794820	Ouais, mais c'est le problème.
795300	798900	Moi, j'aurais aimé qu'on ait justement ce prétexte de dire, il y a quelqu'un presque
798900	801180	qui filme la célébration.
801400	802320	Sauf que c'est pas le cas.
802360	802980	C'est pas assumé.
802980	806780	Tu sens vraiment que la caméra est présente, et du coup, il y a une dichotomie très
806780	807220	étrange.
807300	807780	Ah, tu trouves ?
807780	808420	Moi, je trouve, ouais.
808820	813720	Moi, j'ai des gros problèmes avec le dogme, et de toute façon, en revoyant Festen, j'ai
813720	817080	eu des problèmes avec le film en soi à cause de ça, mais ça m'est personnel.
817460	817480	Ah ouais ?
817480	818640	Non, mais après, je peux comprendre.
818640	819360	La forme me rend fou, moi.
819540	822340	Mais moi, la forme me fait rentrer dans l'intimité...
822340	822880	Non, mais je comprends.
823140	825600	...d'une manière que j'accepte que pour ce film.
826260	829080	Parce que souvent, comme tu dis, je vois le procédé, je dis, ah, c'est pas tranquille.
829080	834000	Après, il y a eu un peu de triche par rapport au dogme, c'est que normalement, ils sont
834000	835640	obligés de tourner en 35.
836360	836720	Ah !
836720	837460	Sauf que...
837460	838700	Là, il est en DT, là, il est en...
838700	839340	Ils ont tourné en vidéo.
839500	839900	Ouais, ça c'est.
840120	840720	Il est en numérique.
841180	842560	Normalement, ils n'ont pas le droit de citer le réel.
842680	843620	Je crois qu'il est quand même...
843620	845160	Non, il est peut-être pas notifié dans le générique de fin.
845320	845680	Je crois pas.
845740	848180	Mais ils ont continué longtemps, ça ?
848180	849340	Ouais, ouais, ça a raison du budget.
849460	850540	Non, mais ça a duré un long.
850540	851120	Ça a duré longtemps.
851260	852280	En tout cas, il y a au moins...
852280	852880	15, 20 pifs.
852900	853840	Au moins 6...
853840	855420	Au moins 5-6 films du dogme...
855420	856240	Il y en a 50, mec !
856240	859760	J'imagine bien les étudiants qui signent un truc à la vie, à la mort.
859900	860860	Il y a un Américain qui dit...
860860	861820	Regardez le million !
861820	862280	Eh !
862280	863940	Il dit que ça merde et fonce le mérite !
863940	866120	Eh, les règles, c'est fait pour être renversé, non ?
866120	867240	Mais ouais, non, c'est sûr.
867480	867840	D'accord.
868060	868780	Moi, pour le coup, ouais.
868840	870180	Eh bah, il y a 50 films, très exactement.
870200	871080	Ah bah voilà, tu vois.
