start	end	text
1010000	1012000	Les visiteurs, c'est genre...
1013000	1017000	90% des comédies en France, c'est un gars qui n'a rien à faire dans un milieu.
1017000	1018000	Donc les tuches, c'est des beaufs.
1018000	1020000	On les met à Monaco, c'est des riches.
1020000	1021000	On les met à Président, voilà.
1021000	1022000	On les met en Angleterre.
1022000	1023000	Donc, c'est toujours le même principe.
1023000	1025000	Donc, ils sont là en Angleterre.
1025000	1026000	Donc...
1026000	1027000	Oui, on met des beaufs là où ils n'iraient jamais.
1027000	1028000	Voilà.
1028000	1033000	Donc, maintenant qu'on vous a tout dit, si vraiment vous pensez aller voir les tuches et que ça vous embête qu'on spoile toutes les blagues,
1033000	1035000	je vais spoiler toutes les blagues, l'intégralité des blagues.
1035000	1037000	Donc, à partir de maintenant, c'est fini.
1037000	1041000	Si on doit juste dire, avant, si les gens veulent couper, par rapport, toi, t'avais vu le premier.
1041000	1043000	En vrai, t'es presque un peu client.
1043000	1045000	Si c'était pas mal, t'aurais pu.
1045000	1046000	C'est pas bon, on est d'accord.
1046000	1047000	Ah non, il se passe rien.
1047000	1049000	Moi, j'en ai vu.
1049000	1050000	J'ai dit que j'en avais vu.
1050000	1052000	J'ai dit que j'en avais vu deux sur trois.
1052000	1053000	J'en ai vu deux.
1053000	1056000	Ce que j'ai retenu des deux que j'ai vus,
1056000	1058000	donc, il y a des enchaînements de phrases.
1058000	1060000	Et à un moment donné, il dit, t'es là, t'es pas là.
1060000	1061000	T'es là, t'es pas là.
1061000	1062000	Donc, bon, voilà.
1062000	1063000	Mais d'habitude, ça te fait rire ou pas ?
1063000	1064000	C'est léger quand même.
1064000	1065000	Non, mais...
1065000	1067000	En fait, c'est juste...
1067000	1071000	Ce qui est drôle dans le film, c'est que quand Jeff parle avec son accent,
1071000	1074000	et des fois, il va dire un truc, je te dis, à un moment donné, il a perdu une carte,
1074000	1077000	et il va faire un running gag où il dit, tu peux perdre une carte.
1077000	1079000	Tu peux pas perdre deux, car.
1079000	1080000	Et il va le faire 15 fois.
1080000	1082000	Il va me faire les 15.
1082000	1085000	Bon, ça te déclenche un sourire quand même.
1085000	1087000	Mais donc, il y a un film où il y a ça, c'est tout.
1087000	1089000	Et il y en a un autre film où il dit, t'es là, t'es pas là.
1089000	1090000	Bon, tu rigoles.
1090000	1092000	Tu souris et c'est tout.
1092000	1093000	Donc, tu partais pas conquis déjà ?
1093000	1094000	C'est pas tes comédies préférées ?
1094000	1095000	Non, je savais que ça allait être nul.
1095000	1101000	Mais par contre, la semaine dernière, quand j'ai vu que c'était ça la semaine après,
1101000	1102000	j'ai dit, hop, j'étais content.
1102000	1105000	Je sais pas pourquoi, j'étais comme un enfant qui va voir une comédie,
1105000	1107000	putain, ça va être les tuches et tout, ça va être cool.
1107000	1109000	Même si je savais que les autres étaient nuls,
1109000	1112000	et ben, ça te met ce truc de bonne humeur, t'es content,
1112000	1114000	le film familial, ça va te faire du bien.
1114000	1115000	Ça va te faire du bien, malgré tout.
1115000	1116000	Et ça t'a fait du bien ?
1116000	1118000	Ben non, je me suis fait chier comme un ramard.
1118000	1120000	J'ai dormi les dernières minutes.
1120000	1121000	Ah ouais, j'ai vu.
1121000	1123000	Et d'habitude, je te réveille tout le temps,
1123000	1125000	parce que ça m'agace au plus haut point les gens qui dorment.
1125000	1130000	Je ne supporte pas d'avoir ma petite amie.
1130000	1134000	Si ma petite amie, je la force à regarder un film à côté de moi,
1134000	1137000	c'est simple, je vais lui ouvrir les paupières pour pas qu'elle s'endorme.
1137000	1139000	Je ne supporte pas que les gens s'endorment.
1139000	1141000	Pourtant, je voudrais t'apprécier qu'elle dorme comme ça,
1141000	1143000	c'est le moment où vous faites la mort souvent.
1143000	1145000	Allez, blague de violeur, ça allait être pour moi.
1145000	1147000	Ça allait être pour moi, je la couperais pas.
1147000	1149000	C'est une blague, vous apprécierez.
1150000	1152000	Je suis contre le viole, c'est une blague.
1152000	1154000	Il me dit je ronflais, excuse-moi.
1154000	1155000	Excuse-moi.
1155000	1156000	On arrête, on arrête.
1156000	1157000	Je coupe, je coupe.
1157000	1159000	Vous ne connaissez pas les limites de l'humour.
1159000	1161000	Non, c'est moi qui l'ai lancé.
1161000	1163000	Écoutez, faut bien faire des blagues scandaleuses de temps en temps.
1163000	1165000	Qu'est-ce que je voulais dire ?
1165000	1167000	Ouais, donc t'es pas client à la base, et là c'était pas...
1167000	1168000	Oui, ça nous a pas fait du bien.
1168000	1170000	Alors j'ai oublié de te dire un truc.
1170000	1171000	Oui.
1171000	1173000	J'ai déjà vu un film aujourd'hui.
1173000	1176000	Bah oui, comme tu regardes toujours un film avec ta meuf l'après-midi.
1176000	1179000	Ouais, ouais, mais j'ai jamais fait deux ciné d'affilée.
1179000	1180000	Ah non, là, t'étais au ciné.
1180000	1181000	J'étais au ciné.
1181000	1182000	Avec ta petite amie.
1182000	1185000	J'ai vu le film brésilien sur la dictature au Brésil, là.
1185000	1186000	Qu'est-ce que c'est ça ?
1186000	1187000	Qui était hyper triste et qui était vachement...
1187000	1188000	Qu'est-ce que c'est ça ?
1188000	1189000	Qui était plutôt bien.
1189000	1191000	Un film brésilien sur la dictature.
1191000	1192000	Ouais, je ferais...
1192000	1194000	Ça va pas du tout au Brésil, on veut voir du foot, la samba.
1194000	1196000	Il y a eu un peu de foot, il y a eu un peu de foot.
1196000	1201000	Des petits pions, des petits pions, des petits pions, des petits pions, des petits pions,
1201000	1206000	Attention, il a saison, attention, il a saison, attention, il a saison.
1206000	1210000	Et il a une petite tope qui dépasse, attention, il a fait refaire.
1212000	1217000	Donc, j'ai vu un super film qui s'appelle, je sais plus le nom, le seul film brésilien au cinéma du coup.
1217000	1218000	Ok, donc un truc du genre...
1218000	1224000	Comme un âne de Che Guevara, assis, me gusta la playa.
1224000	1227000	C'était un film, c'était dans les années 70 au Brésil.
1227000	1231000	Il y a un ancien député de gauche, il a juste oublié sa finie.
1231000	1233000	Alors ça, c'est le Cuba.
1233000	1234000	C'est pareil !
1234000	1236000	Oui, c'est des pays fantaisistes.
1236000	1237000	C'est des pays fantaisistes.
1237000	1239000	Ah quoique, si t'as le Brésil dans ta poule, c'est chaud.
1239000	1240000	Ah quoique, ils sont nuls maintenant.
1240000	1241000	Le Brésil, ça va.
1241000	1242000	Bah ouais, on les a jamais en poule, le Brésil.
1242000	1243000	Oui, c'est vrai.
1243000	1248000	Et donc, j'avais vu un bon film, donc j'étais là, j'étais prêt pour une merde, j'avais vu un bon film.
1248000	1249000	Ok.
1249000	1250000	J'étais bien.
1250000	1255000	Ça m'a quand même attrapé à quel point c'était nul.
1255000	1260000	Alors, je vais vous parler, vous connaissez mon aversion pour les jeux de mots, je les ai tous notés.
1260000	1262000	C'est vrai que t'as noté beaucoup de trucs aujourd'hui.
1262000	1265000	Un bout d'un moment, j'ai dit, je note tous les jeux de mots du film.
1265000	1267000	Donc, je vais vous les compter.
1267000	1268000	C'est pas très compliqué.
1268000	1270000	Donc, il y a trois registres d'humour dans le film.
1270000	1273000	L'humour absurde canal, mais qui a mal vieilli, qui a un peu mal fait.
1273000	1275000	Et qui n'a surtout rien à voir avec le ton du film.
1275000	1276000	C'est un des gros problèmes du film.
1276000	1277000	Il a plusieurs tons d'humour.
1277000	1279000	Et ça, c'est un gros problème.
1279000	1287000	Je le sais, parce que quand j'essaie d'écrire des choses, et c'est souvent le problème, c'est pas forcément de trouver des blagues.
1287000	1290000	C'est de trouver un registre de blagues et de s'y tenir.
1290000	1293000	On peut pas, dans un film, faire de l'absurde, faire du vulgaire.
1293000	1295000	À un moment, il faut se tenir à un film.
1295000	1298000	Ce que je comprends pas, c'est qu'ils avaient quand même des moyens.
1298000	1301000	Visiblement, s'ils en ont fait quatre, c'est que ces films-là, ils marchent.
1301000	1303000	Donc, ils ont de l'argent pour les faire.
1303000	1305000	Donc, ils ont de l'argent pour payer deux auteurs.
1305000	1308000	Donc, s'il y a vraiment zéro vannes dans le film, moi, je pense...
1308000	1310000	Il y en a, mais les gens aiment les jeux de mots.
1310000	1313000	Moi, je pense qu'en fait, c'est fait exprès que ça soit pas des bonnes vannes.
1313000	1315000	Parce qu'il faut que...
1315000	1316000	Le complot à chaque fois.
1316000	1317000	Non, non, non, non.
1317000	1319000	Non, non, non, là, c'est pas complot.
1319000	1321000	Si c'est fait exprès que ça soit nul...
1321000	1325000	Ouais, non, ils se disent, non, non, le bof, il va pas comprendre cette vanne.
1325000	1327000	Donc, on lui met pas de cette vanne-là.
1327000	1328000	On lui met vraiment de là.
1328000	1329000	Mais non !
1329000	1330000	Le bof, il faut lui mettre de la phrase.
1330000	1331000	Tu vois, c'est là où ça compte pas.
1331000	1334000	Il faut lui mettre de la vanne niveau zéro de la vanne.
1334000	1338000	Moi, je suis pas d'accord, parce qu'il a quand même instauré son humour cool d'avant qu'on aimait,
1338000	1341000	absurde, dans le film, qui n'a rien à voir.
1341000	1344000	C'est-à-dire, les trucs un peu à la chabas, ça aurait pu me faire rire, mais ça n'a rien à voir dans le film.
1344000	1346000	En plus du bof à l'ancienne comme ça, il y en a...
1346000	1348000	Enfin, je sais pas, pour moi, il y en a plus trop.
1348000	1349000	Oui, il y en a plus.
1349000	1351000	Les villes se sont toutes un peu gentrifiées.
1351000	1355000	Tu vois, ce genre de famille un peu de gros jacouillers, les frites, les machins.
1355000	1357000	Ok, ça pouvait exister éventuellement.
1357000	1365000	Années 80, 90, tu vas au fin fond du Limousin ou du Schnorr à côté de Lens.
1365000	1369000	Oui, tu pouvais avoir de la famille comme ça, mais maintenant, ça n'existe plus.
1369000	1371000	Mais non, mais c'est pour ça que ça fait marrer les gens.
1371000	1374000	Oui, ok, c'est de la nostalgie, c'est de la bof nostalgie.
1374000	1375000	Un peu.
1375000	1377000	Alors, vas-y, envoie un peu ce que tu as noté.
1377000	1383000	Je compte 1, 2, 3, 4, 5, 6, 7, 8, 9, 10, 11, 12, 13, 14, 15, sachant que je me suis endormi un quart d'heure.
1383000	1386000	Donc, il y a un jeu de mots toutes les 3 minutes, en gros.
1386000	1387000	Ok.
1387000	1388000	Il y a quand même 5 minutes.
1388000	1391000	Alors, vas-y, rebalance-les, on va voir si on se remarque.
1391000	1394000	Bah non, mais je rigole à aucun jeu de mots.
1394000	1396000	Mais je vais vous dire si les gens ont rigolé.
1396000	1402000	Donc, il y a un moment, Jean-Paul Roub, il est avec un gars qui regarde le petit gamin qui joue au foot.
1402000	1404000	Et l'anglais dit, ah, il est agile.
1404000	1406000	Il n'est pas agile, il est à je ne sais pas qui.
1406000	1407000	Donc, il y a un jeu de mots.
1407000	1408000	Oui, il n'est pas agile.
1408000	1409000	Son père s'appelle Jean.
1409000	1410000	Rire dans la salle.
1410000	1411000	Ouais.
1411000	1414000	Il y a un fuck you à la place de thank you.
1414000	1416000	Énorme rire dans la salle.
1416000	1417000	Énorme rire dans la salle.
1417000	1418000	Là, j'étais affligé.
1418000	1419000	Ouais, ouais, c'était dur.
1419000	1422000	À un moment, il y a...
1422000	1424000	Alors, explique-moi.
1424000	1428000	Parce qu'il y a carrément deux personnages dont le running gag, je ne comprends pas.
1428000	1433000	Le personnage de Claire Nadeau de La Vieille, où dès qu'elle parle, c'est Kenny en fait, dès qu'elle parle, elle dit des salutés.
1433000	1434000	Ah oui, ça, tu ne savais pas ça.
1434000	1435000	Ah oui, ça, tu ne savais pas.
1435000	1436000	Moi, j'étais habitué, je ne fais même plus attention à ça.
1436000	1437000	Horrible.
1437000	1438000	Ah oui, je ne fais même plus attention.
1438000	1439000	Notamment à un moment...
1439000	1440000	Ah oui, c'est Mamie Suze.
1440000	1441000	Ça va, Mamie Suze ?
1441000	1442000	Elle vient toujours avec eux.
1442000	1444000	Et donc, Mamie Suze, elle parle...
1444000	1446000	Et c'est traduit.
1446000	1447000	Et c'est traduit.
1447000	1449000	Et donc, c'est de l'humour un peu...
1449000	1450000	L'humour écrit.
1450000	1451000	Et il y a...
1451000	1452000	C'est affligeant.
1452000	1453000	Ça, c'est affligeant.
1453000	1454000	C'est dur, ça.
1454000	1455000	C'est glaçant, ça.
1455000	1456000	Mais moi, j'étais chabé, ça, qu'il y avait ça.
1456000	1458000	Mais ça, ça glace le sang tellement ce n'était pas marrant.
1458000	1459000	Tu ne savais pas, ça.
1459000	1460000	Très grave.
1460000	1461000	Ça, c'est grave.
1461000	1462000	Ah oui.
1462000	1463000	T'étais congelé, quoi.
1463000	1465000	Comme quand tu manges un Mr. Freeze, tu sais que tu as la tête...
1465000	1466000	Ouh !
1466000	1469000	Non, ça, au niveau de l'humour, c'est très grave.
1469000	1471000	Je n'avais pas vu ça depuis longtemps.
1471000	1476000	Et notamment à un moment où, genre, ils lui mettent du métal, des pentagrammes, là,
1476000	1477000	c'était...
1477000	1478000	Mais là, j'étais...
1478000	1479000	Le cringe était...
1479000	1480000	Waouh !
1480000	1481000	Très grave.
1481000	1483000	Et alors, ça, c'est le deuxième Pierre Persaud et le Pierre Persaud.
1483000	1486000	Et lui, pourtant, c'est un gars hyper talentueux que j'ai vu dans plein de trucs.
1486000	1487000	Pierre Lottin.
1487000	1489000	Le perso de je fais n'importe quoi.
1489000	1490000	Mais c'est fou.
1490000	1494000	Et bien, ma belle-mère m'en a parlé ce week-end parce qu'elle me dit, tiens, j'ai vu le film En fanfare.
1494000	1495000	Non, mais lui, c'est un tueur.
1495000	1496000	J'ai adoré.
1496000	1497000	Les acteurs étaient exceptionnels.
1497000	1499000	Elle ne connaît pas les tuches.
1499000	1501000	Donc, ma belle-mère, elle est polonaise.
1501000	1504000	Elle n'a pas du tout les rêves des films de bof, machin, tu vois.
1504000	1506000	Donc, elle ne sait pas ce que c'est les tuches.
1506000	1507000	Et j'ai dit, ouais.
1507000	1508000	Et donc, du coup, je...
1508000	1509000	Mais c'est vrai que lui...
1509000	1511000	En plus, En fanfare, je voulais qu'on allait le voir.
1511000	1513000	On a été voir cette bouse de Roy Rim dessin animé.
1513000	1514000	On n'ira plus jamais voir dessin animé.
1520000	1521000	Je n'ai pas dit qu'il n'était pas bien.
1521000	1527000	Mais alors, lui, lui, lui, toutes ses vannes, elles sont tellement forcées.
1527000	1528000	Et que sa voix...
1528000	1529000	Enfin, c'est horrible.
1529000	1530000	Ah non, mais c'est...
1530000	1532000	Quand il fait une vanne, lui, c'est terrible.
1532000	1533000	Mais ce n'est pas de sa faute.
1533000	1535000	Il est enfermé dans ce perçu depuis 4 films.
1535000	1536000	Ouais, ouais, ouais.
1536000	1537000	Non, mais il n'a pas de vanne, lui.
1537000	1539000	Lui, il a une blague qui est je ne suis pas comme eux.
1539000	1541000	Donc, il a juste le straight mail.
1541000	1545000	Lui, le pauvre, il n'a jamais de vanne dans les 3 films que j'ai vus.
1545000	1548000	Mais parce que sa blague, il ne sert à rien à air.
1548000	1550000	Si, sa blague, c'est d'être normal.
1550000	1553000	Tu vois, à un moment, il a un gros rire parce qu'il dit je vais faire un test ADN.
1553000	1557000	Ouais, mais au début, dans le 1, tu ne l'as pas vu, mais dans le 1, c'est un peu comme dans Malcol, Ligne de Middle.
1557000	1558000	En gros, c'est pareil.
1558000	1561000	C'est la famille comme dans Malcol, mais lui, c'est le seul intello.
1561000	1566000	Et du coup, c'est lui qui brise le quatrième mur et qui s'adresse au public.
1566000	1568000	C'était un peu son seul rôle dans le 1.
1568000	1570000	Ça aussi, c'est un autre truc connu de comédie.
1570000	1574000	Il faut toujours, quand il y a des oufs, un clown blanc, un gars normal.
1574000	1576000	Ouais, ouais.
1576000	1583000	Mais c'est normal parce que si tu n'as que des fous dans le comédie et que tu n'as pas un gars pour faire le parallèle de Ils sont oufs, tu ne rigoles pas.
1583000	1588000	Parce que souvent en comédie, tu rigoles du gars qui fait une tête bizarre quand quelqu'un fait de la merde.
1588000	1590000	C'est compliqué. En fait, le rire, c'est compliqué.
1590000	1598000	C'est dur parce que regarde, ce week-end, pareil, on essaie de se regarder une comédie.
1598000	1600000	On regarde s'il y a des comédies.
1600000	1604000	Mais la comédie, le rire, ce n'est pas si dur, mais la comédie en film, c'est extrêmement dur.
1604000	1610000	J'étais là, j'étais sur le PTV, je fais basculer, je regarde dans la catégorie comédie, je regarde un peu tout ce qu'il y a.
1610000	1619000	Et en fait, je me suis rendu compte qu'il n'y a pas eu un seul film drôle depuis la fin des années 90 en France.
1619000	1623000	Il n'y a quasiment plus d'humour en France. L'humour est mort, en tout cas dans le cinéma.
1623000	1624000	Au cinéma, oui.
1624000	1630000	Depuis toujours. Avant, on avait quand même du Didier, la vérité Sijeman, je les ai revus il n'y a pas longtemps.
1630000	1632000	C'est excellent la vérité Sijeman.
1632000	1635000	Les visiteurs, exceptionnels.
1635000	1638000	Les inconnus, les trois frères, exceptionnels.
1638000	1639000	Le Paris.
1639000	1640000	Le Paris, exceptionnel.
1640000	1642000	Même un truc qui est considéré comme une bouse.
1642000	1645000	Et franchement, tu le regardes aujourd'hui par rapport au film d'aujourd'hui, il fera un carton.
1645000	1646000	Les Rois Majes.
1646000	1647000	Je sais que tu défends les Rois Majes.
1647000	1648000	Il y a quelques scènes dans les Rois Majes.
1648000	1650000	Je te le laisse parce que je défends les Anges Gardiens.
1650000	1651000	Je te le laisse.
1651000	1653000	Franchement, il y a quelques scènes dans les Rois Majes qui sont dingos.
1653000	1656000	Il n'y a pas eu d'énormes comédies.
1656000	1657000	Je peux t'en citer plein.
1657000	1658000	Il y a plein d'autres comédies.
1658000	1662000	Et après, on a basculé dans des trucs où c'est par exemple Bienvenue chez les Ch'tis.
1662000	1665000	Bienvenue chez les Ch'tis, c'est un enchaînement de phrases.
1665000	1668000	Et Danny Boon qui fait l'accent du gars du Nord.
1668000	1669000	Et voilà, Bilou, ton rigole.
1669000	1670000	Mais il n'y a rien dans les...
1670000	1673000	Après, tu parles de comédies populaires parce qu'il y a quand même au moins...
1673000	1675000	Non mais ça, ça a fait quand même des millions d'entrées.
1675000	1677000	Il n'y a aucune vanne dans Bienvenue chez les Ch'tis.
1677000	1678000	Il y a zéro vanne.
1678000	1681000	Si, il y a le passage de Galabru, c'est tout.
1681000	1684000	Le Nord, le Nord...
1684000	1685000	Ça, c'est drôle.
1685000	1687000	Galabru, ok.
1687000	1688000	Mais sinon...
1688000	1691000	Il faut voir que les comédies aussi à la française,
1691000	1692000	c'est pas forcément...
1692000	1693000	C'est pas de jeu d'appato.
1693000	1695000	C'est pas forcément du rire, du rire, du rire.
1695000	1697000	Si l'histoire, elle est déjà un peu sympa, ça va en fait.
1697000	1698000	Mais oui.
1698000	1699000	Bien sûr.
1699000	1701000	Non mais je pense aussi qu'à l'époque, les gens avaient du talent aussi.
1701000	1705000	C'était pas forcément que les mecs qui font le film en soi a du talent.
1705000	1707000	De réalisateurs, de réels...
1707000	1708000	On s'en branle de ça.
1708000	1711000	C'est qu'à l'époque, les auteurs avaient du talent,
1711000	1712000	les acteurs avaient du talent.
1712000	1716000	Aujourd'hui, le talent malheureusement a disparu.
1716000	1717000	C'est dilué en fait.
1717000	1719000	C'est dilué dans la soupe dans laquelle on vit aujourd'hui.
1719000	1720000	C'est-à-dire que...
1720000	1721000	Moi je pense qu'il y a des gens...
1721000	1723000	Vu que les gens savent que tu peux plus vraiment faire de vanne,
1723000	1725000	que t'es là, que tu gnais gnais,
1725000	1726000	attention à Disney,
1726000	1728000	bah du coup, ça tue l'humour tout simplement.
1728000	1729000	L'humour est mort.
1729000	1731000	Pour moi, l'humour est définitivement mort.
1731000	1732000	J'espère qu'il va renaître.
1732000	1734000	Mais en fait, il faudrait qu'on ait une bonne guerre.
1734000	1739000	Et après cette guerre, on renaît de nos sangs.
1739000	1740000	Et là, on peut refaire des vannes.
1740000	1743000	Parce que les gens qui ne veulent plus qu'on en fasse sont tous décédés.
1743000	1745000	Parce que je serais tapis dans l'ombre.
1745000	1748000	C'est vrai qu'entre nous, et là je vous donne un point,
1748000	1750000	c'est pas souvent les plus costauds.
1750000	1751000	Mais il est plus courageux.
1751000	1753000	Mais il est plus courageux.
1753000	1754000	Mais évidemment.
1754000	1755000	Allez, faites vos tweets.
1755000	1758000	Mais en vrai, ça tu parles de l'humour au ciné.
1758000	1760000	Parce qu'en vrai, en termes d'humour,
1760000	1763000	de combien de contenu humoristique produit en France ?
1763000	1765000	Entre les gars qui sont dans le podcast,
1765000	1767000	les gars qui sont sur Twitch, les gars qui sont sur Twitch.
1767000	1768000	L'humour au ciné est mort.
1768000	1770000	Mais par contre, l'humour sur internet,
1770000	1771000	il n'est pas mort du tout.
1771000	1772000	Il n'est pas mort du tout.
1772000	1774000	Parce que maintenant, tout le monde est devenu sa propre star.
1774000	1777000	Donc dans le lot, vu que le kidam,
1777000	1780000	l'intégralité de l'humanité en France,
1780000	1781000	ou même dans le monde,
1781000	1784000	prend son téléphone pour essayer de faire une vanne.
1784000	1786000	Parce qu'ils ont vu qu'on pouvait devenir millionnaire sur TikTok.
1786000	1788000	Donc les gens, ils ne sont pas cons.
1788000	1790000	Au lieu d'aller se bosser, se faire chier,
1790000	1792000	casser le cul, se lever à 6h du matin tous les jours.
1792000	1794000	Il y a des gens qui se font casser le cul sur internet,
1794000	1795000	mais ça s'appelle OnlyFans.
1795000	1796000	Ça n'a rien à voir.
1796000	1798000	C'est vrai, moi je comprends les gens.
1798000	1800000	Tu te dis, il y a quand même un coluche,
1800000	1801000	il a fait...
1801000	1806000	Il est devenu multimilliardaire sur TikTok.
1806000	1808000	Et les darons, ils voient ça,
1808000	1810000	et ils se disent, non mais attends, c'est une blague.
1810000	1811000	Moi ça fait 15 ans que je bosse à l'usine,
1811000	1814000	tous les jours, pour ramener 1600 euros par mois.
1814000	1817000	Et mon connard de fils qui a chié dans une poubelle,
1817000	1819000	il est millionnaire sur TikTok.
1819000	1821000	Alors, t'as Cathy, Cathy,
1821000	1823000	va me chercher mon téléphone un peu.
1823000	1825000	On va aller sur TikTok.
1825000	1826000	Je suis d'accord avec toi.
1826000	1827000	On va aller sur TikTok, moi Cathy.
1827000	1829000	Moi je suis d'accord avec toi, mon Thibaut.
1829000	1831000	Mais là, t'as quand même cité les deux bons,
1831000	1833000	parce que qui coup, pico, est-ce que tu es chiant dans une poubelle ?
1833000	1834000	C'est deux génies.
1834000	1835000	Mais après ça, il y a des cons.
1835000	1836000	C'est vrai.
1836000	1837000	Non, non, il y a des très bons.
1837000	1839000	Alors moi, c'est vrai que je suis pas trop sur TikTok.
1839000	1840000	J'arrive pas à l'algo...
1840000	1842000	Enfin, je sais pas, c'est pas ma génération, j'arrive pas.
1842000	1844000	Pourtant, on m'a dit, TikTok, va pas sur TikTok,
1844000	1845000	fais des vidéos sur TikTok,
1845000	1846000	met tes vidéos sur TikTok,
1846000	1847000	met tes blagues sur TikTok.
1847000	1848000	J'ai essayé un peu,
1848000	1850000	mais vu que moi-même, je ne regarde pas TikTok,
1850000	1851000	j'ai du mal.
1851000	1852000	Il faudrait que je m'y mette.
1852000	1853000	Il y en a un qui me fait rire.
1853000	1854000	Je sais pas si tu connais.
1854000	1856000	C'est Jason Caravan.
1856000	1857000	Ouais, je le connais.
1857000	1858000	Ah, lui, il me fait rire.
1858000	1860000	J'aime bien si tu moues, tu vois.
1860000	1861000	Moi, il me fait moyen...
1861000	1862000	Je le respecte.
1862000	1863000	Il me fait rire parfois.
1863000	1865000	Je comprends exactement pourquoi ça marche.
1865000	1866000	Mais pour moi, je trouve...
1866000	1868000	Ouais, toi, t'es trop bobo parisien, toi.
1868000	1869000	T'es trop suceur de couilles, toi.
1869000	1870000	Mais non, parce que...
1870000	1871000	Oui, bah en humour, je suis plus suceur de couilles.
1871000	1873000	Parce que si, c'est de l'humour de gars du Sud,
1873000	1874000	c'est de l'humour du terroir,
1874000	1875000	c'est de l'humour du gars du rugby,
1875000	1878000	il fait des personnages du Sud et tout.
1878000	1880000	Franchement, lui, il me fait beaucoup rire.
1880000	1882000	Dans ce genre-là, Ragnar est plus fort, je trouve.
1882000	1884000	Ragnar, il me fait beaucoup rire aussi.
1884000	1886000	Ragnar, il fait plus rire dans ce genre-là.
1886000	1887000	Mais Ragnar, il fait pas le...
1887000	1888000	Dans ce genre-là, Marty, il y en a d'autres.
1888000	1892000	Ragnar, lui, son style, c'est un peu le blanc costaud,
1892000	1894000	le blanc pas fragile, tu sais.
1894000	1896000	Le blanc qui a le droit de faire des blagues sur les Arabes
1896000	1898000	parce qu'il traîne avec eux et tout.
1898000	1899000	Il a inventé un créneau.
1899000	1901000	Il est bon, Ragnar, j'adore.
1901000	1902000	Mais Jason, il me fait rire des fois.
1902000	1905000	D'ailleurs, j'ai regardé la bouse de Michael Youn avec Jean-Claude Van Damme
1905000	1908000	qui est sortie directement sur les...
1908000	1910000	Après, tu te demandes pourquoi ils sont faits, les films à Ragnar,
