start	end	text
1910000	1912000	tu les vois sur IPTV en même temps.
1912000	1914000	Ah bah oui, moi j'ai IPTV, évidemment.
1914000	1917000	Et d'ailleurs, on tient à dire que tout est nul,
1917000	1919000	encourage le piratage.
1919000	1921000	On est le seul podcast de cinéma
1921000	1923000	à ne payer jamais pour des films.
1923000	1924000	Mais je suis un plan, je suis content que t'es mon DM.
1924000	1926000	50 euros par an, tu as tous les films du monde.
1926000	1927000	Oui, non, non, non.
1927000	1929000	On ne paye jamais pour des films.
1929000	1930000	D'ailleurs, on ne paye jamais pour quoi que ce soit,
1930000	1931000	voler dans les magasins.
1931000	1932000	Rien !
1932000	1934000	Moi, la seule chose que je paye, c'est l'alcool.
1934000	1935000	Ah, et les femmes.
1935000	1937000	Voilà, pour faire l'amour, je paye.
1937000	1938000	Ah non, alors ça...
1938000	1939000	Ah si, moi je paye.
1939000	1940000	Autant je sais que tu as voulu faire une blague,
1940000	1943000	mais là, on touche à l'intouchable.
1943000	1944000	On touche à l'intouchable.
1944000	1946000	Jamais je ne te paierai pas.
1946000	1947000	Moi je te paie.
1947000	1950000	Alors évidemment, si je pars dans un pays fantaisiste,
1950000	1953000	et qu'il se trouve que je me balade à Soï 4,
1953000	1954000	pour ceux qui connaissent,
1954000	1956000	ou à Consand Road,
1956000	1958000	évidemment que...
1958000	1959000	Pour quelqu'un qui dit par hasard,
1959000	1961000	j'ai l'impression que vous connaissez les petites adresses.
1961000	1962000	Ah bah non, mais...
1962000	1963000	Vous connaissez les petites adresses.
1963000	1965000	Bah quand t'es à Bangkok, c'est évident que...
1965000	1967000	Tu te balades, tu vois une jeune fille,
1967000	1969000	bon tu regardes si elle fait pas du 42,
1969000	1971000	et puis si elle fait pas, si elle fait un 38,
1971000	1973000	et qu'elle a pas de gros spormes dedans, bon bah...
1973000	1976000	Bah Brigitte, qu'est-ce que tu fais là ?
1976000	1978000	C'est un running gag.
1978000	1980000	Non mais attends, ça n'a rien à voir.
1980000	1981000	Moi je te parle, on est en France ici,
1981000	1983000	on aime le beau jeu ici, ça joue ici.
1983000	1985000	On a pas payé en France, payé !
1985000	1986000	T'es malade.
1986000	1987000	Et pourquoi pas ?
1987000	1988000	Ah non, pas en France.
1988000	1989000	Mais ça, on gagne du temps.
1989000	1990000	Nos femmes sont superbes.
1990000	1995000	Elles se donnent tellement de mal pour...
1995000	1996000	pour...
1996000	1998000	refuser nos avances.
1998000	2001000	Qu'on est obligé de développer des stratégies de chinage
2001000	2004000	qui nous ont fait devenir des virtuoses du football,
2004000	2006000	pour qu'on aille se faire chier à payer.
2006000	2007000	Essayer de la concurrence aussi.
2007000	2009000	Mais nous ce qu'on aime, c'est le plaisir du chinage.
2009000	2010000	C'est pas payer...
2010000	2012000	Ah, pour moi c'est une abomination ça.
2012000	2014000	Payer pour des femmes, ça devrait être interdit.
2014000	2015000	Je ne paye...
2015000	2017000	D'ailleurs tu ne payes que pour des hommes.
2017000	2019000	Rires
2020000	2021000	Ça par contre...
2021000	2023000	Ah bah ça, on va pas se faire chier.
2023000	2025000	Écoute, il y a eu des petits séjours
2025000	2031000	au pays du fromage troué et des horloges.
2031000	2032000	Pour ceux qui auront la référence.
2032000	2035000	Rires
2035000	2042000	Alors, j'en étais dans ma liste de jeux de mots.
2042000	2043000	Non mais vous allez voir, c'est affligeant.
2043000	2045000	J'en ai fait que trois là.
2045000	2048000	Donc, fuck fuck, ça tue les gens.
2048000	2051000	Appareil jetable, c'est jetable, elles le jettent
2051000	2053000	et donc elles ne gardent pas les photos.
2053000	2054000	Oui.
2054000	2055000	Hilarant.
2055000	2056000	Il y a des gens qui rient.
2056000	2057000	Continue.
2057000	2061000	La télé qui dit, oui, le livre s'est craché.
2061000	2065000	Là, il y a le gamin qui dit, ils ont perdu que des livres,
2065000	2066000	ils n'ont pas perdu de l'argent.
2066000	2067000	Hilarant.
2067000	2068000	Oui.
2068000	2069000	Tube.
2069000	2071000	Un pub, ça se prononce pub.
2071000	2072000	Ah ouais, bah moi, ma tub.
2072000	2073000	Voilà.
2073000	2074000	Ma tube.
2074000	2075000	Voilà, ma tube.
2075000	2077000	C'est le jeu de mots que Lya, ma meuf, avait vu dans le trailer.
2077000	2078000	Elle n'avait pas compris.
2078000	2080000	Bah si, elle avait compris le jeu de mots.
2080000	2081000	Elle avait compris le jeu de mots.
2081000	2082000	Ah oui, oui, ok.
2082000	2085000	Oui, parce que ta petite amie parle enfin français au bout de 15 ans.
2085000	2087000	Chapeau melon, grosse tête, j'ai même plus le jeu de mots là.
2087000	2089000	Fish and sheep, ça sent le poisson.
2089000	2092000	Parce qu'ils ont cru que c'était leurs chips, elles sentent le poisson.
2092000	2097000	Alors, le nom des guests quand ils arrivent à Windsor ou je sais pas quoi,
2097000	2101000	Sgt Pepper, Lady Madonna, donc que des références aux Beatles.
2101000	2104000	Illico Espresso, Little Bit Bit.
2104000	2109000	La date de naissance, ma date de naissance, c'est le jour de mon anniv.
2109000	2115000	Le Parfum, Pomme de terre numéro 5, Chanel numéro 5.
2115000	2117000	Élémentaire Michael Jackson.
2117000	2119000	Il y a d'élémentaire mon cher Watson.
2119000	2121000	Ah oui, elle dit élémentaire Michael Jackson.
2121000	2122000	Et là, j'en note 15.
2122000	2124000	Mais tu te rends compte la qualité.
2124000	2126000	Déjà, un jeu de mots, c'est interdit dans un film.
2126000	2127000	15.
2127000	2128000	15.
2128000	2131000	Mais je vous jure, la France est malade du jeu de mots.
2131000	2134000	Écoutez un vieux sketch sur Rire et Chanson et calculez.
2134000	2136000	Et ça, c'est un truc important à faire en humour.
2136000	2140000	Essayez à chaque fois qu'il y a un rire du public de voir pourquoi.
2140000	2142000	Et comptez le nombre de fois que c'est un jeu de mots.
2142000	2144000	Vous allez voir qu'on est malade, malade mentaux.
2144000	2147000	Est-ce que ça te faisait rire Raymond De Vos ?
2147000	2149000	Non, je déteste Raymond De Vos.
2149000	2150000	Ok.
2150000	2152000	Ça me faisait pas rire, je trouvais pas ça poétique.
2152000	2154000	Et je suis contre le jeu de mots.
2154000	2156000	Ouais mais, ouais mais, t'admets quand même que le gars est bon.
2156000	2159000	Il est excellent mais pour moi c'est de la poésie.
2159000	2160000	Ah voilà, mais quand même.
2160000	2163000	Parce que même, ça veut dire que toi tu n'aimes pas ce style d'humour.
2163000	2170000	Mais lui, c'est le goût du jeu de mots.
2170000	2172000	Il a énormément de talent.
2172000	2174000	Il manie extrêmement bien la langue française.
2174000	2175000	Oui.
2175000	2176000	Mais là, on en est pas à ce niveau là.
2176000	2178000	Là, on en est vraiment à...
2178000	2180000	Je dis voilà, Marie Jettam et Jettam.
2180000	2181000	C'est très dur ce qu'ils font.
2181000	2183000	Et moi, je pense que c'est fait exprès.
2183000	2186000	Toi, tu veux pas croire ça mais moi je pense que c'est fait exprès.
2186000	2189000	Il faut pas qu'on fasse des vannes trop pointues.
2189000	2192000	Alors, il y a deux types d'humour que je déteste.
2192000	2194000	C'est les jeux de mots et les gags visuels.
2194000	2195000	Je trouve ça insupportable.
2195000	2197000	Pour moi, c'est enfantin.
2197000	2202000	Là, le plus gros rire du film, c'est quand Jean-Paul Roux joue au croquet.
2202000	2205000	Ah oui, c'est là où les gens ont le plus rigolé.
2205000	2208000	Et tient la balle dans la gueule de la reine.
2208000	2210000	C'est un truc quand t'as 8 ans, tu rigoles pas.
2210000	2213000	Là, on a des gens qui payent leurs impôts, qui votent et tout.
2213000	2214000	Morts de rire.
2214000	2215000	Moi, j'arrête.
2215000	2217000	Moi, j'arrête l'humour en vrai.
2217000	2218000	Là, je vais m'énerver.
2218000	2220000	D'où on rigole à ça ?
2220000	2222000	Ça donne envie de fracasser toute la salle.
2222000	2226000	Autant rigoler à un jeu de mots déplorable,
2226000	2230000	t'as envie de massacrer les gens à coups de battes.
2230000	2232000	T'as envie de leur dire comment c'est possible de rire à ça.
2232000	2236000	Mais par contre, l'humour visuel, ça a toujours existé.
2236000	2240000	Paf, ping, pou, quelqu'un qui tombe, qui se pète la gueule.
2240000	2242000	Ça, tu peux pas reprocher aux gens de rigoler à ça.
2242000	2246000	Mais attends, une bonne chute, si elle est vraie, un enfant qui tombe,
2246000	2248000	y a pas de problème.
2248000	2250000	Mais une vraie chute.
2250000	2252000	Là, tu parles de choses hilarantes, évidemment.
2252000	2257000	Qui n'a jamais poussé une grand-mère sur l'esquiette d'arbelle.
2257000	2261000	Je sais pas si t'as vu une de mes vidéos d'Internet préférées.
2261000	2265000	C'était genre la caption, c'était « The best job in the world ».
2265000	2267000	Et c'est un Canadien qui est sur la glace.
2267000	2269000	Les petits apprennent à faire du hockey sur glace.
2269000	2271000	Lui, il a une espèce de médecine-ball géant.
2271000	2275000	Il leur met des grands coups de pied dans la balle et il les fait tous tomber.
2275000	2277000	C'est très drôle.
2277000	2278000	C'est très drôle.
2278000	2280000	Ça se pissait dessus.
2281000	2284000	Dans les films, ça me fait pas rire parce qu'on le voit venir.
2284000	2287000	Là, on voit la balle arriver, il y a une espèce de bruit genre « uuuuh ».
2287000	2289000	C'est hyper ringard.
2289000	2293000	D'où les gens adultes, vaccinés, ils rigolent à ça.
2293000	2295000	C'est ouf quand même.
2295000	2301000	Parce que toi, tu découvres que les gens sont vraiment très bons publics.
2301000	2303000	Les gens sont bons publics.
2303000	2304000	À ce stade, quand même.
2304000	2306000	C'est le plus gros rire du film.
2306000	2308000	Je vais te citer les bonnes blagues du film.
2308000	2309000	Après, les gens sont bons publics.
2309000	2312000	Il n'y a quasiment pas eu de rire quand même.
2313000	2315000	Il y avait très peu de gens dans la salle aussi.
2315000	2317000	Oui, mais il y avait quand même des gens.
2317000	2318000	Parce que la salle était immense.
2318000	2322000	Mais si on avait été dans la salle de la semaine dernière avec toute pour une...
2322000	2323000	Il y avait 200 personnes.
2323000	2324000	Voilà.
2324000	2331000	Sur 200 personnes, on a noté à un moment donné qu'il y a peut-être 5-6 personnes qui ont ri de temps en temps à des trucs.
2331000	2333000	Et on était affligés qu'ils rigolent.
2333000	2336000	Mais sinon, personne n'a rigolé.
2336000	2338000	Il y a rigueur du sourire, mais personne n'a rigolé.
2338000	2340000	Je vais te citer les 2-3 fois que j'ai trouvé ça marrant.
2340000	2341000	Ok.
2341000	2349000	Et puis, au début du film, quand il va dans le camp d'entraînement, il y a un gamin qui se met à lui parler aigu pour aucune raison.
2349000	2351000	Très très drôle.
2351000	2353000	Et il lui fait, ça va toi ?
2353000	2354000	Ça va toi ?
2354000	2357000	Il lui fait, t'as acheté ta planche à, il lui fait, ouais, tu vas te faire des gamin.
2357000	2358000	Ça n'a aucun sens.
2358000	2359000	Ça n'a aucun sens.
2359000	2360000	C'est très drôle.
2360000	2362000	Et d'ailleurs, c'est le tout début du film.
2362000	2366000	Et je me suis dit, ah, ça part bien.
2366000	2371000	Surtout que juste après, il va voir un serveur, aussi un enfant, qui a une voix extrêmement grave.
2371000	2376000	Oui, mais alors attends, on insulte des gens parce qu'ils rigolent à des trucs affligeants.
2376000	2380000	Et nous, on se marre parce qu'il y a un gars qui fait, hé, ça va toi ?
2380000	2381000	C'est nul.
2381000	2384000	Mais du coup, ça nous fait rire parce que nous, on est débiles aussi.
2384000	2385000	On aime les trucs débiles.
2385000	2386000	Bien sûr.
2386000	2387000	Mais il y a un côté absurde qui est rigolo.
2387000	2388000	Oui.
2388000	2391000	Depuis, et ça, là, c'est l'humour Shabab bien fait.
2391000	2394000	C'est un peu comme, hé, mon pâté dans le Astérix et O.B.
2394000	2397000	Donc tu veux dire que nous, en fait, on rigole parce qu'on est l'élite de l'humour, c'est ça ?
2397000	2398000	Non, mais...
2398000	2402000	Ça nous fait rire parce qu'on est la crème de la crème du Go Bird Balls.
2402000	2404000	Je suis d'accord.
2404000	2405000	D'accord.
2405000	2408000	D'ailleurs, en plus, chez le suceur de couilles, il y a aussi...
2408000	2413000	Parce que je vous ferai les 10 trucs qui font rigoler le bof.
2413000	2414000	Il n'y a pas de problème.
2414000	2415000	Oui.
2415000	2416000	Je vous fais la liste.
2416000	2419000	Il y a aussi la liste des 10 trucs qui font rire tous les suceurs de couilles et la blague, à chaque fois.
2419000	2424000	Par exemple, je ne peux plus voir un film où un gars fait semblant d'appeler quelqu'un par un prénom, mais ce n'est pas le bon prénom.
2424000	2426000	C'est-à-dire que cette blague, elle est éculée.
2426000	2427000	Oui, oui.
2427000	2428000	Elle est dans tous les films pseudo-intelligents.
2428000	2431000	Mais bon, oui, un gamin qui parle avec une voix aiguë, c'est un peu absurde.
2431000	2432000	Et celle qui faisait tout le temps aussi.
2432000	2433000	Et elle me fait rire aussi.
2433000	2434000	Ah, j'adore.
2434000	2435000	J'adore Madrid.
2435000	2436000	J'adore le Portugal.
2436000	2437000	Voilà.
2437000	2439000	Celle-là, elle me fait toujours rire.
2439000	2441000	Ça, c'est ton côté, Elise Semoun.
2441000	2442000	Ça, c'est mon côté.
2442000	2443000	Moi, celle-là, j'ai décidé de l'enlever.
2443000	2449000	Donc, le moment qui nous a fait rire tous les deux, le gamin normal annonce qu'il parle anglais.
2449000	2452000	Et là, les deux parents sont tristes comme s'il était gay.
2452000	2453000	Ouais, ouais.
2453000	2454000	Ils font tout de suite une réaction comme s'il était gay.
2454000	2455000	Il faut une scène comme-même.
2455000	2456000	T'aurais pu nous le dire.
2456000	2458000	T'aurais pu nous le dire, mon coin, quoi.
2458000	2460000	Bon, on t'accepte comme tu es, mais bon, c'est pas évident.
2460000	2461000	Surtout le regard des autres.
2461000	2462000	Donc, c'était marrant.
2462000	2463000	Donc, ça, c'était drôle.
2463000	2467000	Mais parce que oui, ils ont fait un petit côté franchouillard, machin.
2467000	2472000	Donc, en fait, c'est comme s'ils disaient, tiens, petit point sociologie.
2472000	2478000	On a le droit d'être chauvin si c'est contre les Anglais.
2478000	2479000	Et ça, on l'a toujours fait.
2479000	2481000	Ça, c'est la règle du racisme en France.
2481000	2482000	Ça fait partie.
2482000	2484000	Contre les Allemands et les Anglais et les Italiens, on a le droit.
2484000	2486000	On a le droit d'être chauvin si c'est avec les Anglais.
2486000	2487000	Et oui, bien sûr.
2488000	2489000	Intéressant à noter.
2489000	2490000	C'est tout.
2490000	2491000	Je voulais le noter.
2491000	2495000	Moi, qui me fait rire, mais qui me fait un peu rire quand même, parce que gag visuel aussi,
2495000	2496000	mais un peu drôle.
2496000	2498000	Il boit la Guinness, c'est pas bon.
2498000	2499000	Il la boit en entier.
2499000	2500000	Oui, il boit un cuquix.
2500000	2501000	Il se met un cuquix.
2501000	2502000	Donc, on fait pas de l'alcoolisme.
2502000	2503000	Et il dit, j'aime pas.
2503000	2507000	Il fait quand même rire parce que cela fait en entier.
2507000	2508000	J'aime pas.
2508000	2510000	Donc, j'ai un peu rire.
2510000	2514000	C'est vrai qu'effectivement, il y a les deux vans qui nous font rire.
2514000	2518000	Donc, la van chauvinisme et la van alcoolisme.
2518000	2519000	Et la blague absurde, en fait.
2519000	2522000	La blague tout à même absurde avec un gamin qui parle aigu pour pas de raison.
2522000	2527000	Et puis, c'est le running gag qui arrive dans tous les films d'Etuches.
2527000	2530000	Jean-Paul Rouve part dans des explications hyper longues.
2530000	2531000	Et au bout d'un moment, c'est marrant.
2531000	2533000	Là, à un moment, il explique la guerre de son temps.
2533000	2534000	Oui.
2534000	2535000	Et au bout de trois minutes, on a rigolé.
2535000	2536000	Bah oui.
2536000	2537000	Il est marrant, quoi.
2537000	2539000	Oui, parce que la voix est bien faite.
2539000	2542000	Et quand il enchaîne, quand il enchaîne en fait les mots, quand il enchaîne les phrases,
2542000	2544000	il tient tellement bien son accent.
2544000	2549000	Et puis, de toute façon, ce film s'est tellement créé autour de cet accent qu'il faut le dire
2549000	2550000	est exceptionnel.
2550000	2551000	Oui, non, mais c'est bien.
2551000	2555000	Il arrive à tenir quatre films et à faire bouffer combien de familles grâce à cet accent,
2555000	2556000	quand même.
2556000	2557000	Parce que là, ils prennent des sous quand même, tous les acteurs.
2557000	2559000	Ah non, non, mais ça fera un million en vrai.
2559000	2560000	C'est au moins un million en cela.
2560000	2561000	Donc, tout le monde prend des sous.
2561000	2565000	Non, mais c'est quand même beau d'avoir réussi à nous pondre quatre bouses sans vannes
2565000	2567000	avec des auteurs horribles.
2567000	2568000	Je te jure, après…
2568000	2572000	Juste à tenir quatre films sur un accent à la con du Nord qui n'existe même pas.
2572000	2574000	En plus, il l'a totalement créé.
2574000	2575000	Enfin, c'est beau.
2575000	2576000	Je te jure qu'après le 4…
2576000	2577000	Bien joué Jean-Paul, quoi.
2577000	2578000	Je reverrai le 1.
2578000	2579000	Tu vas te racheter un appart, quoi.
2579000	2581000	Je suis sûr que le 1, je suis sûr que c'est un vrai film.
2581000	2585000	Avec des blagues de merde et tout, mais par rapport à ça, je suis sûr que c'est un vrai film.
2585000	2586000	Tu peux pas non plus lancer une franchise…
2586000	2593000	Dans le sens où le 1, c'est le moment où c'est vraiment les bofs pauvres dont…
2593000	2598000	Jeff, il dit toujours « Nous, on est chômeux de père en fils. »
2598000	2600000	Il est hors de question qu'on travaille.
2600000	2604000	Et en fait, il gagne au loto et du coup, ils partent vivre à Monaco.
2604000	2606000	Donc là, c'est le 1, c'est basé là-dessus, si tu veux.
2606000	2608000	Mais même dans le 1, il n'y avait pas de vannes.
2608000	2611000	Je t'assure, il y a zéro vannes.
2611000	2613000	Putain, le bâton d'Yoda, il bouge.
2613000	2616000	Ah oui, si tu le touches… Ah oui, il tourne.
2616000	2617000	Ah oui, non, mais c'est qu'il est cassé.
2617000	2620000	Il est cassé parce que tu l'as cassé.
2620000	2622000	J'avais oublié un jeu de mots.
2622000	2625000	Elle lit un bouquin sur Gilles Boulot qui s'appelle « Métro Boulot Dodo ».
2625000	2627000	Et les gens ont rire.
2627000	2628000	Ah oui, incroyable.
2628000	2629000	Bon, voilà.
2629000	2636000	Et alors, toute petite vannes, je la note parce qu'Isabelle Nanty m'a peu fait rire, mais j'ai quand même un peu rigolé.
2636000	2639000	Parce que bon, moi, c'est la vulgarité qui me fait rire.
2639000	2646000	Elle lui explique comment cracher sur les carreaux et à un moment, elle dit « Viens faire dans les coins où c'est qu'elle chie les petites salopes ».
2646000	2647000	Elle s'énerve d'un coup.
2647000	2648000	Elle dit ça ?
2648000	2649000	Ou c'est qu'elle chie bien les petites salopes.
2649000	2650000	J'ai rigolé.
2650000	2651000	Voilà.
2651000	2652000	C'était vraiment pour être sympa.
2652000	2654000	Donc, les 1000 registres d'humour.
2654000	2657000	Et alors, il y a trois trucs qui m'énervent en humour.
2657000	2664000	J'ai dit les jeux de mots, les gags visuels et les références à des trucs connus américains pour zéro raison.
2664000	2667000	Combien de fois dans les films, on a « Je suis tombé » ou ce genre de conneries.
2667000	2669000	Là, ils nous sortent « E.T. » pour pas de raison.
2669000	2671000	« Harry Potter » pour pas de raison.
2671000	2674000	Ah oui, il y a eu « Harry Potter » parce que Jeff Tuch s'habille en « Harry Potter » pour aller voir le roi.
2674000	2677000	« E.T. » quand il lui balance les frites un moment et…
2677000	2678000	Ah oui, ouais, ouais, ok.
2678000	2681000	« Harry Potter », on voit « Paddington » dans les chiottes.
2681000	2682000	On voit « Paddington » dans les chiottes.
2682000	2684000	Ça, les gens, ça en France, pareil.
2684000	2687000	Humour qui marchera toujours sur le beauf.
2687000	2690000	D'un coup, il y a une référence à un truc qu'il connaît, qui est méga connu.
2690000	2692000	« Hilarité générale ».
2692000	2695000	« Ah, il a fait une référence au Seigneur des Anneaux ».
2695000	2697000	Ça, je déteste.
2697000	2699000	Là, c'est mon côté suceur de couille.
2699000	2700000	Tu n'aimes pas beaucoup les gens, j'ai l'impression.
2700000	2702000	Tu ne les apprécies pas.
2702000	2703000	Non, pas du tout.
2703000	2706000	Et donc, voilà.
2706000	2708000	Ils ont dédicacé le film à Michel Blanc.
2708000	2711000	C'est vrai que c'est un très grand pote de Jean-Paul qu'encore une fois, j'adore.
2711000	2712000	Ah oui, c'est vrai.
2712000	2714000	Ils ont dédicacé le film à…
2714000	2716000	Mais quand ? On a vu à la fin dans le générique ?
2716000	2718000	Il y avait juste marqué « dédicace à Michel Blanc. »
2718000	2720000	Mais c'est vrai que là, je ne rigole pas parce que j'adore Jean-Paul.
2720000	2722000	Il adore Michel au premier degré.
2722000	2723000	On adore Michel.
2723000	2728000	Je ne sais pas s'il aurait apprécié, mais c'est mignon.
2728000	2729000	Il s'en fout.
2729000	2732000	Il ne t'inquiète pas que Jean-Paul Rouve, il fait ça pour les thunes.
2732000	2735000	Il sait qu'il a sa petite franchise qui fait manger tout le monde.
2735000	2737000	Et puis derrière, il fait d'autres films.
2737000	2738000	Il s'en fout.
2738000	2739000	Il a invité Élise.
2739000	2741000	Il a invité Chabat qui fait une voix off.
2741000	2743000	Il a mis quelques petits trucs marrants dedans.
2743000	2746000	Mais voilà, trop de registres d'humour.
2746000	2751000	Mais je n'aime pas dire du mal de la comédie parce que, comme tu l'as dit, c'est très dur la comédie.
2751000	2752000	C'est très dur.
2752000	2754000	J'aime pas dire du mal.
2754000	2755000	Non, mais c'est vrai.
2755000	2758000	Je me suis remis quelques habitations de Laurent Gérard.
2758000	2759000	Eh oui, je suis vieux.
2759000	2766000	Je me mets sur YouTube des vieux Laurent Gérard à Vivement Dimanche avec Drucker qui date de 2013.
2766000	2769000	Je suis une personne âgée et je suis hilare.
2769000	2770000	Je suis hilare.
2770000	2772000	Je ne bande pas, mais je rigole.
2772000	2775000	Laurent Gérard, c'est hilarant.
2775000	2780000	Laurent Gérard, un des premiers humoristes de droite à assumer avec Thierry Le Luron et Gaspard Proust.
2780000	2782000	Laurent Gérard, c'est de droite.
2782000	2783000	Mais c'est un imitateur.
2783000	2785000	Assumé, c'est assumé.
2785000	2786000	Il l'a toujours dit.
2786000	2787000	Ah ouais, il a toujours dit.
2787000	2788000	Jamais fait attention à ça.
2788000	2792000	Il me faisait rire à un moment.
2792000	2793000	Moi, maintenant.
2793000	2795000	Mais je serais toujours chaud de boire du vin avec lui.
2795000	2798000	Ah mais alors, tu vois, pour le coup, moi qui ne suis pas dans la politique,
2798000	2801000	je ne sais même pas qui vous considérez comme de droite ou de gauche.
2801000	2805000	Mais Laurent Gérard, moi j'ai toujours connu Laurent Gérard à imiter.
2805000	2807000	Ah mais c'est bien, ça va faire un jeu.
2807000	2808000	Il imite des gens.
2808000	2810000	Ah, on fait le jeu de qui est de droite, qui est de droite ?
2810000	2811000	Ah, ça je veux bien parce que moi je ne connais pas.
2811000	2812000	Sardot.
2812000	2815000	Ah oui, alors aussi Michel Sardot, il est de droite.
2815000	2816000	Parce que lui, il fait…
2816000	2817000	C'est bien.
2817000	2818000	C'est bien, on est au vent.
2818000	2819000	C'est bien, on est au vent.
2819000	2820000	Afrique, adieu.
2820000	2824000	Belle Afrique, où vont les sombres ?
2824000	2825000	Renaud, Renaud, Renaud.
2825000	2826000	Renaud…
2826000	2832000	Un tadadant, un tadadant, un tadadant, un rodé migré.
2832000	2833000	Non, c'est de gauche Renaud.
2833000	2834000	Ah bah oui, c'est de gauche Renaud.
2834000	2836000	Ok, blouson noir.
2836000	2837000	Thierry Le Luron.
2837000	2838000	Thierry Le Luron.
2838000	2839000	Thierry Le Luron…
2839000	2843000	Ah oui, c'est la rose de l'emmerdant.
2843000	2845000	Alors il se moquait de Mitterrand.
2845000	2846000	Et c'était le seul.
2846000	2847000	Et alors c'était le seul.
2847000	2852000	Mais bon, Mitterrand qui a fait exprès de faire monter Le Pen pour du coup être élu.
2852000	2853000	Est-ce qu'il ne serait pas un peu de droite ?
2853000	2854000	Le Luron de droite.
2854000	2855000	Ok, donc le Luron de droite.
2855000	2856000	Ok, le Luron de droite.
2856000	2857000	Ok, c'est bien.
2857000	2858000	Des proches.
2858000	2859000	Des proches…
2859000	2861000	Je sais que des juifs…
2861000	2864000	On m'a dit que des juifs étaient cachés dans la salle.
2864000	2867000	C'est tout ce que je sais de lui.
2867000	2868000	Et il est de droite.
2868000	2869000	Ah ouais ?
2869000	2870000	Anar mais plus de droite.
2870000	2872000	Anarchiste de droite.
2872000	2873000	Plus de droite.
2873000	2875000	Mais qui fixe les…
2875000	2878000	Alors maintenant si tu me regardes dans les yeux, ça va être très compliqué pour toi.
2878000	2880000	Qui fixe les règles ?
2880000	2882000	Qui dit c'est de gauche ou de droite ?
2882000	2883000	Là quand tu dis de droite…
2883000	2884000	Ah bah on sait quoi.
2884000	2885000	C'est votre team quoi.
2885000	2886000	C'est votre team qui décrète ça.
2886000	2887000	C'est nous qui décidons.
2887000	2888000	Ah c'est vous qui décidons.
2888000	2889000	C'est bon ça.
2889000	2891000	Je pourrais venir un peu une fois dans votre…
