start	end	text
0	2000	Oh la vache mais c'est nul !
2000	4000	Nul, nul, nul !
4000	6000	Tu sais pas jouer Jack ?
6000	8000	T'es mauvais !
8000	10000	Mais dehors les romanos !
10000	12000	Je suis...
12000	14000	Je suis l'EUMA !
14000	16000	CINÉMAAAAAAA !
16000	18000	CINÉMAAAAAAA !
18000	20000	Qu'est-ce que c'est que cette matière ?
20000	22000	C'est de la merde !
22000	24000	Et bonsoir, bonsoir !
24000	26000	Comment ça mon hu-opin ?
26000	28000	Je suis pas au phélaxe hein !
28000	30000	T'as fait plaisir ce qu'on a été voir !
30000	32000	Je vais mal le faire pendant une heure !
32000	34000	C'est pas grave !
34000	36000	C'est pas grave mon hu-opin !
36000	38000	On a de la bière !
38000	40000	Et tu sais mon hu-opin, moi je vais te dire...
40000	42000	Dis-moi !
42000	44000	Même si ton accent est pas très bien
44000	46000	Il fait un peu comme un indien et c'est pas mal aussi !
46000	48000	C'est pas mal !
48000	50000	Tu peux t'améliorer pendant que tu fais !
50000	52000	Tu sais là ça fait 30 secondes on parle !
52000	54000	C'est moyen marrant !
54000	56000	C'est plus marrant que le film !
56000	58000	Il t'a pas fait rire ?
58000	60000	Il m'a fait rire 4 fois j'ai tout noté !
60000	62000	Tout noté !
62000	64000	Oui j'ai vu que tu notais quand ça te faisait rire !
64000	66000	Mais 4 fois ça m'a fait rire !
66000	68000	De toute façon tu peux rire !
68000	69000	C'est pas beaucoup !
69000	70000	Tu peux rire une fois !
70000	72000	Mais tu peux pas rire deux fois !
72000	74000	Enfin... bah...
74000	75000	A la rigue !
75000	77000	Tu peux rire deux fois !
77000	78000	Mais trois tu peux pas !
78000	80000	Tu peux pas rire trois fois !
80000	81000	Bonjour !
81000	82000	Bienvenue à Tout est Nul !
82000	83000	Admettons !
83000	84000	Tu peux rire trois fois !
84000	86000	Pardon !
86000	87000	Faut que j'arrête !
87000	88000	Ça va être très dur de pas faire cet accent !
88000	90000	Ouais ça va être très dur de pas le faire !
90000	91000	Euh...
91000	92000	Bah y'a que ça en fait !
92000	93000	Bon !
93000	94000	Donc on est allé voir les tuches !
94000	95000	God Save de Tuches !
95000	96000	Et déjà...
96000	97000	Trincon !
97000	98000	Déjà !
98000	99000	Oui !
99000	100000	Santé !
100000	101000	Santé !
101000	103000	Merci au dernier bar de la fin du monde !
103000	104000	Déjà de nous accueillir !
104000	105000	Ah ouais !
105000	106000	Quel beau bar !
106000	108000	De nous donner notre place près du Yoda !
108000	109000	C'est un très beau bar !
109000	110000	Voilà !
110000	111000	Exactement !
111000	112000	C'est vrai que c'est un très beau bar !
112000	113000	Comment tu dis qui ça appelle déjà ?
113000	114000	Le dernier bar avant la fin du monde !
114000	115000	Le dernier bar avant la fin du monde !
115000	117000	Et bah tu sais je recommande !
117000	120000	On a toujours notre place vers l'Yoda au fond !
120000	121000	J'adore !
122000	123000	Euh...
123000	124000	Et bah voilà !
124000	125000	On est allé voir God Save de Tuches !
125000	126000	Parce que bon !
126000	127000	On a fait Enosphère à tout !
127000	128000	On a fait...
128000	129000	Y'a pas de...
129000	130000	On avait jamais fait de comédie !
131000	134000	Alors je sais pas si on peut faire des blagues sur des blagues !
134000	137000	Mais en même temps ce qui nous arrange c'est qu'il y a pas trop de blagues !
137000	139000	On avait jamais fait de comédie !
139000	141000	Euh...
141000	143000	Je sais pas par où commencer !
143000	146000	Alors je vais guider parce que bon y'a plusieurs trucs !
146000	147000	Un !
147000	148000	Il faut savoir !
148000	150000	Donc c'est le quatrième opus des Tuches c'est ça ?
150000	151000	C'est le quatrième opus des Tuches !
151000	153000	Moi j'avais vu...
153000	154000	J'avais vu celui...
154000	155000	Bah j'ai vu le 1 !
155000	158000	J'ai vu celui où il devient président !
158000	160000	Et je crois que j'ai pas vu le dernier !
160000	162000	Où il y a...
162000	163000	Cad et Olivier !
163000	164000	Olivier !
164000	165000	D'accord !
165000	166000	Donc...
166000	168000	C'est le quatrième !
168000	169000	Tu as pas vu trop !
169000	170000	Ça marche les Tuches !
170000	171000	Et le 1, le 2 et le 1 !
171000	172000	Moi j'en avais vu aucun !
172000	174000	Il faut savoir qu'à la base...
174000	175000	À la base de base !
175000	176000	Mon humour, moi...
176000	180000	Un de mes trucs les plus importants c'était les Robins des Bois quand j'étais ado !
180000	181000	C'est à dire que j'étais ultra fan !
181000	183000	Ça a construit ma vie !
183000	184000	Donc...
184000	185000	C'est ce que je voulais dire !
185000	186000	Je voulais commencer par là !
186000	187000	Je voulais faire un point historique !
187000	188000	Voilà !
188000	189000	D'où ça vient les Tuches ?
189000	190000	Pensez qu'ils connaissent !
190000	192000	Déjà il faut être né dans les années...
193000	194000	Fin des années 80 !
194000	197000	Il faut avoir plus de 35 ans pour connaître !
197000	208000	Tout part des Robins des Bois parce que le duo de base c'est Jean-Paul Roum, figure créatrice des Robins des Bois et Isabelle Nanty qui est leur prof de théâtre à tous !
208000	209000	Ah ouais ?
209000	210000	C'était leur prof de théâtre ?
210000	211000	Ah je savais pas ça !
211000	214000	C'est celle qui a mis en scène leur première pièce de théâtre qui les a lancées !
214000	217000	C'est à dire qu'elle est à la base de la troupe des Robins des Bois Isabelle Nanty !
217000	221000	Avec Sophie Pétoncule, Marina Foyce, Pierre-François-Martin Laval...
221000	222000	Les Robins des Bois !
222000	225000	C'est un humour qui n'existe plus en France !
225000	231000	Une partie très bizarre de l'humour français où les sketchs n'avaient pas de sens en fait !
231000	233000	Alors moi je crois que j'en avais parlé l'autre fois !
233000	235000	Il n'y avait pas de thématique, c'était des personnages...
235000	237000	Il n'y a plus aucun humour comme ça en France !
237000	238000	C'était fou !
238000	243000	En vrai maintenant je trouve 20 ans après ils n'ont aucun équivalent les Robins des Bois !
243000	246000	J'en ai parlé je crois l'autre fois et...
246000	253000	J'étais allé voir Re avec mon père quand j'étais jeune...
253000	254000	J'aime cette anecdote !
254000	260000	Il a quitté la salle au bout de 1,25h 20 minutes de film je crois qu'à un moment donné quand il dit ça va être tout noir...
260000	262000	Ta gueule !
262000	264000	Et mon père il me dit on s'en va !
264000	266000	Et moi j'étais petit j'étais dégoûté !
266000	267000	Moi j'adorais !
267000	269000	C'était hilarant pour moi tout !
269000	272000	Parce que j'avais 15 ans quoi !
272000	273000	16 ans je sais pas !
273000	274000	En plus Re c'est toujours marrant !
274000	276000	Et mon père n'a pas pu supporter !
276000	278000	Pareil mon père de détester les Robins des Bois !
278000	280000	Il adorait les nuls !
280000	282000	Il était affligé par ce qu'il regardait !
282000	285000	Il ne comprenait pas pourquoi Faroujia et Alain Chabab faisaient des trucs !
285000	291000	Après je me souviens qu'il avait commencé à apprécier et à respecter Jean-Paul Rouve quand il avait vu Podium en disant
291000	293000	Ah ok ! Il ressemble à Michel Polnareff et il est marrant !
293000	296000	Et après il avait aimé un peu Marina Foyce !
296000	298000	Après malheureusement il est décédé !
298000	299000	Et ça bien sûr...
299000	300000	Pas de chat !
300000	302000	On voit moins de films d'un coup !
302000	303000	Bah !
303000	304000	Ah t'es pas ! T'en sais rien !
304000	306000	Il y a peut-être des salles de Sinoche !
306000	308000	Il y a peut-être un coin Sinoche au Paradise !
308000	309000	Ah c'est possible !
309000	311000	Parce que ça serait chiant qu'il n'y en ait pas un d'ailleurs !
311000	312000	J'espère qu'il est au Paradise !
312000	314000	Il doit y avoir des harpes, des lyres...
314000	315000	S'il est en enfer !
315000	316000	Des anges !
316000	318000	Tu vois des codes de 3 coins !
318000	322000	Il y a un ciné mais il passe en permanence toutes pour une !
322000	324000	Il n'y a qu'un film en boucle !
324000	326000	Il n'y a qu'un seul film en boucle !
326000	328000	Donc voilà !
328000	330000	Donc moi à la base j'adore les Robin des Bois !
330000	332000	Radio Bière Foot ça me faisait hurler de rire !
332000	334000	Radio de la biais et du fou !
334000	336000	La voix de Jean-Paul Rouve ça part de ce sketch !
336000	342000	Il a créé cet accent sur Radio Bière Foot avec donc c'était Jean-Paul Rouve et Maurice Barthélémy dans la grosse émission
342000	344000	Et à la fin sur Comédie !
344000	348000	Toujours Pef qui arrivait en tant que maire du village un peu de...
348000	350000	Qui les prenait pour des péquenots !
350000	352000	Et le running gag c'est qu'ils disaient toujours
352000	354000	Bon on va pas se faire emmerder par des enculeurs de poules !
354000	356000	Et dès qu'ils disaient enculeurs de poules ça les énervait !
356000	358000	Et ils l'enculaient !
358000	359000	C'était l'humour de l'époque !
359000	362000	Et puis ils écrivaient leur sketch 10 minutes avant de rentrer !
362000	363000	Et d'ailleurs comme quoi regarde !
363000	365000	A cette époque là ils avaient quoi ? 27-30 ans ?
365000	372000	Imagine une connerie qu'ils ont écrite 5 minutes avant de faire un sketch dans la grosse émission !
372000	374000	Avec un accent !
374000	382000	Et derrière tu passes à la caisse à 45-50 ans avec un film qui fait des millions d'entrées
382000	387000	Et qui devient l'ode des beaufs !
387000	389000	Et qui devient leur film favori !
389000	391000	Et tu passes à la caisse !
391000	393000	Comme quoi faut persévérer !
393000	395000	Une petite connerie écrite quand t'as 30 ans ça peut !
395000	399000	Donc à la base normalement c'est Olivier de Cadet Olivier qui réalise les films !
399000	402000	Et là au bout de 4 je pense qu'il avait fait assez d'argent et il voulait plus !
402000	407000	Et donc là c'est Jean-Paul Rouve qui réalise le film et ça a son importance par rapport à ce qu'on va parler !
407000	410000	Parce que le film est fait n'importe comment !
410000	411000	Moi je peux te monter !
411000	413000	Moi je monte ton son ?
413000	415000	Oui pour que je t'entende mieux !
415000	416000	D'accord !
416000	417000	Et le...
417000	419000	Donc ça a son importance !
419000	422000	Je sais pas s'il avait réalisé le 3 mais en tout cas il a réalisé le 4 !
422000	424000	Et bon on va voir que c'est compliqué !
424000	427000	Alors avant toute chose moi je suis emmerdé parce que j'adore Jean-Paul Rouve !
427000	431000	Je n'ai pas envie de faire de film français parce que je suis toujours à un gars que je connais
431000	433000	que je connais !
433000	436000	D'ailleurs il y a une personne que je connais dans le film !
436000	437000	Mais bon je vais essayer d'être honnête !
437000	439000	Ça va il a 3 phrases celui que tu connais !
439000	440000	Oui oui mais même !
440000	442000	D'ailleurs il a 3 phrases dans tous les films !
442000	443000	Jean-Paul je l'adore !
443000	445000	Je vais devoir dire du mal du film !
445000	446000	Ca m'embête !
446000	447000	Parce que j'adore !
447000	448000	C'est pas grave ça !
448000	449000	Moi aussi je l'adore Jean-Paul Rouve !
449000	450000	On s'en fout !
450000	452000	Et lui même il s'en fout !
452000	453000	C'est pas grave !
453000	454000	Mais alors !
454000	456000	Je suis toujours embêté mais voilà je préviens c'est tout !
456000	458000	Alors maintenant on peut y aller !
458000	460000	Qu'est-ce que tu as des trucs à dire avant qu'on parle du film ?
460000	463000	Oui je voudrais faire juste un petit point sociologique !
463000	464000	Ah bah oui !
464000	465000	Sur ce film !
465000	469000	Parce que déjà quand on est arrivé dans la salle moi je pensais que ça allait être plein !
469000	474000	Et donc c'était un peu vide alors qu'ils avaient réservé la grande grande salle principale du cinéma !
474000	475000	Qu'est-ce que je te dis ?
475000	478000	Et tu m'as dit mais c'est normal on est à Paris !
478000	481000	C'est pas la team bof à Paris !
481000	483000	C'est la team bobo suceur de couilles !
483000	484000	Donc ils n'aiment pas cet humour de bof !
484000	485000	Pas du tout !
485000	486000	Et moi je pensais pas !
486000	487000	Je me suis dit bon !
487000	488000	Pas parce qu'on est à Paris !
488000	490000	Qu'il y a aussi du Blair à Paris !
490000	493000	Et il y en a un nombre d'ailleurs inimaginable !
493000	498000	Mais le Blair de Paris ne veut pas se moquer des trucs de Blair !
498000	500000	Parce qu'il se considère pas comme un Blair !
500000	503000	Il se considère comme supérieur au Blair !
503000	505000	Il sait lui-même qu'il est un suceur de couilles !
505000	507000	Donc il ne veut pas rire au truc de bof !
507000	512000	Chaque gars qui va à Paris, si tu veux, c'est comme...
512000	514000	Il faut être le meilleur suceur de couilles de ta ville !
514000	516000	Pour après arriver à Paris !
516000	517000	Et après tu descends !
517000	520000	Parce que par Paris, le meilleur suceur de couilles de Clermont, ça reste un mauvais suceur de couilles !
520000	521000	Bah oui !
521000	523000	Mais par rapport aux autres gens !
523000	525000	Et du coup il y a un truc qui est bizarre ça aussi !
525000	527000	C'est un truc très sociologique en France !
527000	532000	Le bobo trouve que se moquer du bof c'est pas bien !
532000	534000	Alors qu'en fait ça plait au bof !
534000	536000	Et on a exactement le même problème avec les blagues racistes !
536000	539000	Ou dès qu'on fait un peu des blagues sur les communautés, les gens disent « Oh c'est raciste ! »
539000	542000	Alors qu'en fait c'est les blancs qui disent ça !
542000	544000	Et les gens des communautés adorent ces blagues !
544000	546000	Les gens des communautés adorent le racisme !
546000	548000	Mais du coup...
548000	550000	Pareil !
550000	553000	Ce sont quand même des acteurs qui sont...
553000	556000	Maintenant qui sont riches depuis un certain temps !
556000	561000	Isabelle Nanty, Jean-Paul Rouve, ils ont bien réussi leur vie !
561000	564000	C'est des gens qui vivent dans des beaux quartiers à Paris, qui sont des acteurs !
564000	565000	Ce sont des bobos !
565000	568000	C'est le haut de la pyramide du bobo !
568000	573000	Et donc eux vont interpréter des personnages de méga bofs !
573000	575000	Donc en fait ce sont des bobos qui se moquent des bofs !
575000	576000	Mais ça plait au bof !
576000	578000	Et les bobos n'aiment pas !
578000	579000	Et les bobos n'aiment pas !
579000	580000	C'est fou !
580000	581000	C'est fou !
581000	585000	Parce qu'en plus c'est clair que normalement il y aurait pu y avoir un monde où les bofs disent
585000	587000	Vous nous traitez d'analphabètes !
587000	588000	Oui oui !
588000	589000	De débiles profonds !
589000	590000	Et les gens adorent dans le Nord !
590000	591000	Les gens adorent !
591000	592000	Ils se sentent représentés !
592000	593000	Oui oui !
593000	594000	Les frites !
594000	595000	Les frites !
595000	600000	Je me souviens à la sortie du dernier, ils étaient arrivés en tuche carrément à l'avant-première !
600000	601000	Et c'était Disney !
601000	602000	Les gens étaient fous !
602000	606000	Il faut à croire qu'il y a quand même des gens très cons qui pensent que les persos existent !
606000	608000	Parce que là ils étaient comme des malades !
608000	610000	Mais alors du coup en fait le bof c'est quoi ?
610000	614000	C'est ce qui va différencier vraiment le bof du suceur de couilles finalement !
614000	615000	C'est quoi ?
615000	617000	C'est les connaissances !
617000	618000	C'est deux trois bières !
618000	619000	Non mais c'est quoi ?
619000	621000	C'est la culture, c'est la connaissance, c'est les références !
621000	626000	C'est parce que là du coup ce qu'on a vu, et on va spoiler tout de suite, je vais pas raconter l'histoire,
626000	630000	mais c'est le niveau zéro de l'humour !
630000	635000	C'est à dire que c'est même pas des vannes, ce sont des enchaînements de phrases !
635000	639000	Il y a Jeff Tu qui dit des phrases !
639000	640000	Hein Makati ?
640000	643000	Hein Bouzol ? On est bien à Bouzol Makati !
643000	647000	Et là les gens mordent de rire parce qu'il a dit Makati Bouzol,
647000	649000	mais en fait il dit juste une phrase !
649000	651000	Il y a pas une vanne derrière !
651000	654000	Et ce que je comprends pas, c'est qu'il y a bien des gars qui écrivent le film,
654000	657000	donc il y a des auteurs et tout, ils auraient pu faire des vannes,
657000	658000	mais est-ce qu'ils se disent exprès,
658000	660000	oula attends on va pas faire des vannes non plus trop pointues,
660000	662000	parce que ça reste un public de Blair,
662000	664000	faut vraiment qu'on soit au rat des pâquerettes !
664000	666000	J'ai pas vu les autres, donc tu peux pas comparer aux autres !
666000	669000	Non mais les autres c'est pareil, en fait les autres c'est juste que les situations
669000	671000	dans lesquelles les tuches se trouvent, c'est d'autres situations !
671000	673000	Mais dans les autres il y a une histoire quand même !
673000	674000	Non mais en fait il y a jamais une histoire,
674000	676000	c'est que là on les a mis en Angleterre,
676000	678000	il y en a un où ils vont à Monaco,
678000	680000	ils deviennent riches d'un coup, ils vont à Monaco,
680000	682000	et il y en a un où ils sont présidents, et il y en a un que j'ai pas vu,
682000	685000	ça doit être je crois un repas de famille où le gars est un peu de droite je crois !
685000	686000	Donc voilà !
686000	688000	Donc en fait ils les mettent dans des situations différentes,
688000	690000	mais à chaque fois les films sont les mêmes,
690000	692000	ce sont des enchaînements de phrases,
692000	694000	donc la fille va dire une phrase,
694000	696000	le fils va dire une phrase,
696000	698000	il va dire des trucs rapides là,
698000	700000	son humour c'est de dire des trucs rapides !
700000	702000	Ils ont un running gag chacun !
702000	704000	Mais c'est des running phrases,
704000	706000	c'est pas des gags, c'est des phrases !
706000	708000	Alors il y a aussi des...
708000	710000	Allons-y tout de suite, on a même pas besoin de...
710000	712000	Donc le film comment j'ai trouvé, j'ai trouvé affligeant !
712000	714000	Bah on a pas rigolé une seule fois !
714000	716000	Moi j'ai noté, j'ai rigolé 4 fois !
716000	717000	Oui mais en fait déjà on rigolait,
717000	719000	mais on rigolait pas parce que c'était vraiment drôle,
719000	721000	on rigolait parce que c'était tellement nul,
721000	723000	qu'à un moment donné ça nous a déclenché un rire de...
723000	727000	Ah non moi, les 4 fois que j'ai noté que je vous dirais où j'ai ri,
727000	728000	après quand on parle de ce que l'on...
728000	730000	C'est vrai que c'est bien que t'aies noté parce que comme ça...
730000	731000	J'ai noté, et j'ai aussi...
731000	733000	T'as noté quoi mon...
733000	737000	J'ai noté plusieurs trucs, j'ai noté les 4 fois et ça m'a fait rire,
737000	740000	j'ai noté tous les registres d'humour abordés,
740000	742000	parce que moi c'est ça le gros problème,
742000	744000	je pense que Jean-Paul Roux il s'est pas réalisé de film,
744000	746000	c'est un peu comme quand Alexandre Assy...
746000	747000	Ah mais c'est lui qui fait le film !
747000	748000	Ah oui oui, il est pas réalisateur en fait !
748000	750000	Parce qu'en fait le premier, moi j'en avais quand même vu le début,
750000	753000	ça reste un vrai film, là c'est pas un vrai film !
753000	754000	Là c'est clairement...
754000	756000	Je me souviens il y a pas longtemps je suis allé voir
756000	759000	Moi, Moche et Méchant 4, et ça ressemble à...
759000	763000	Tu sais quand les films il y a trop de suites, c'est plus un film, c'est un grand téléfilm quoi !
763000	765000	C'est à dire qu'il y a plus d'histoire, c'est comme dans les sitcoms,
765000	767000	il y a une histoire A, une histoire B, d'un coup on saute...
767000	769000	Oui, on te remet des persos que les gens aiment bien...
769000	770000	C'est plus un film quoi !
770000	773000	Et bien là, j'ai eu exactement ce sentiment avec ce film là !
773000	776000	Et surtout, vu que Jean-Paul maintenant réalise,
776000	780000	il y a plusieurs strates d'humour qui ne collent pas du tout ensemble,
780000	782000	c'est à dire qu'on a les tuches normales,
782000	787000	il a aussi rajouté des petites doses d'humour canal, tu sais, avec Alain Chabat qui fait une voix...
787000	789000	Ah ouais, c'était dur ça !
789000	793000	Quand ils ont voulu faire un petit clin d'œil à Astérix...
793000	795000	À l'humour des nuls en fait !
795000	797000	Ouais mais c'était pas bon !
797000	799000	Donc en fait, il y a plusieurs trucs comme ça,
799000	802000	il y a aussi de l'humour de base de jeu de mots,
802000	804000	et il y a de l'humour totalement absurde,
804000	807000	et de l'humour de gag visuel.
807000	811000	Et en fait, il a mélangé quatre styles d'humour qui ne collent pas du tout ensemble,
811000	813000	et du coup, le film c'est...
813000	815000	Il y a un humour chauvin, qui m'a un peu ferré.
815000	817000	Mais il y a des trucs...
817000	819000	Est-ce que tu te rappelles le moment dont je parle ?
819000	820000	Ouais, il y a deux, trois...
820000	821000	Le moment où celui que tu aimes bien,
821000	827000	ton pote, qui joue le seul fils qui est intelligent de la famille,
827000	829000	qui n'est pas un bof,
829000	833000	il annonce à ses parents, Cathy et Jeff,
833000	835000	qu'ils parlent anglais.
835000	836000	Ah oui !
836000	837000	Il est dans mes quatre moments...
837000	840000	Attends, ça sera dans les spoilers, mais c'est dans mes quatre moments drôles.
840000	841000	C'est très très drôle.
841000	843000	Ça, c'était vraiment marrant.
843000	844000	Ça, c'était marrant.
844000	846000	Donc, on peut y aller, on va...
846000	848000	On vous fait le pitch très vite fait,
848000	850000	toi t'es fort en pitch, j'y raconte l'histoire, mais très vite fait.
850000	852000	Comme si tu racontes tout le film en trois minutes.
852000	853000	Ouais, ouais, ok.
853000	855000	Tu coupes à la moitié, et après c'est les spoilers.
855000	857000	Je fais avec l'accent ou pas ?
857000	858000	Et non mais c'est juste...
858000	859000	Après, on fera...
859000	861000	J'ai énormément envie de le faire.
861000	862000	Allez, allez.
862000	863000	Alors, très bien.
863000	865000	C'est un exercice de style, c'est un exercice de style.
865000	869000	Tu vas le raconter du début au premier tiers du film,
869000	871000	sans tomber dans les détails, juste l'histoire,
871000	873000	comme si tu l'as raconté à un gamin avec la voix de Jeff.
875000	877000	Alors, ce qu'il se passe, mon public, je vais vous expliquer.
877000	878000	D'accord.
879000	882000	On arrive à Bouzol, on retrouve la famille Ituch.
882000	883000	Cher Bouzol.
883000	884000	Cher Bouzol.
884000	885000	Il est plus président.
885000	886000	Et ce qu'il se passe, c'est que...
886000	887000	Il est encore plein de tulle.
887000	892000	Il y a Cathy Ituch, son rêve, c'est de rencontrer la reine d'Angleterre.
892000	893000	Et...
893000	897000	Au moment où elle avait une invitation, parce que Jeff était l'ancien président,
897000	901000	elle avait enfin eu une invitation pour le couronnement du Roi-Charles.
901000	905000	Et mon Jeff Ituch, il a fait exprès de ne pas donner l'invitation,
905000	908000	parce qu'il y avait l'équipe de Bouzol qui jouait ce week-end-là.
908000	909000	Il l'avait caché dans la banane.
909000	910000	Il l'avait caché dans la banane.
910000	912000	Et à un moment donné, Cathy, elle lui lave sa banane.
912000	913000	Et là, elle se rend en con.
913000	918000	Et là, elle lui a pas pardonné pendant un an.
918000	923000	Et donc à un moment donné, parce qu'il y a le fils de la fille qui est métisse.
923000	925000	Ah oui, ils ont mis ce petit côté du métissage.
925000	929000	Et donc, il va être recruté par Arsenal.
929000	932000	Et donc, ils vont avoir le droit de partir en Angleterre.
932000	936000	Et là, mon Jeff et ma Cathy, ils vont partir en Angleterre.
936000	938000	Et là, ils vont rencontrer les Anglais.
938000	939000	Les Anglais.
939000	940000	Alors ça, c'est le piche du début.
940000	941000	C'est le piche du film.
941000	942000	C'est ça, c'est juste ça le film.
942000	943000	Donc c'est bien.
943000	945000	Tu as pas mal l'accent, on peut le dire.
945000	946000	J'ai pas mal, c'est vrai, j'ai pas mal.
946000	947000	J'ai applaudi, mais un petit peu.
947000	948000	Ouais.
948000	950000	Et donc, c'est ça le film.
950000	957000	Et du coup, effectivement, c'est un processus de comédie assez connu,
957000	960000	qu'il y a depuis Chaplin, ce qu'on appelle Fish out of the water.
960000	962000	Vous connaissez un fish...
962000	963000	Non, je connais pas c'est quoi ça.
963000	964000	Un poisson dans l'eau.
964000	965000	Un poisson hors de l'eau.
965000	966000	Un poisson hors de l'eau.
966000	967000	Par exemple...
967000	968000	Ah oui, fish under the water.
968000	969000	Fish out of the water.
969000	970000	Ah oui, out of the water.
970000	971000	Je ne suis plus dans l'eau.
971000	972000	J'ai perdu mon angle.
972000	973000	Je ne suis plus dans l'eau.
973000	975000	C'est-à-dire, Fish out of the water, c'est...
975000	979000	Par exemple, les visiteurs filment que la populace apprécie.
979000	981000	Moi, je n'ai pas jamais apprécié ce film.
981000	982000	Enfin, voilà.
982000	984000	Non mais c'est le personnage, c'est le personnage.
984000	985000	Ah oui, d'accord.
985000	987000	Un peu pédant, un peu gros.
987000	988000	Ah oui, oui.
988000	989000	Un peu pédant, un peu pédot.
989000	993000	On embrasse tous les journalistes de France.
995000	996000	Et les anciens ministres.
1000000	1001000	On pense...
1001000	1003000	Ah oui, on pense à Jack Lang.
1003000	1006000	Il sait tout.
1006000	1010000	Et donc, fish out of the water, c'est...
