start	end	text
2891000	2892000	Dans la réue ?
2892000	2893000	Ouais.
2893000	2894000	Si t'es de gauche ?
2894000	2895000	Bah oui.
2895000	2896000	Tu feras semblant.
2896000	2897000	Ouais ouais, non mais je le suis, je suis de gauche.
2897000	2898000	Tu peux hein, je suis de gauche.
2898000	2899000	On te mettra un café.
2899000	2901000	Ça devrait pas te déranger.
2901000	2902000	Euh…
2902000	2904000	Je suis racisé donc automatiquement dans votre bande.
2904000	2905000	Ah oui, mais ça c'est la carte.
2905000	2906000	Quand t'es racisé c'est la carte gauche de toute façon.
2906000	2907000	Mais c'est bien joué, tu es obligé.
2907000	2908000	Je suis obligé.
2908000	2909000	Ou alors ?
2909000	2912000	Attends, j'ai des origines ivoiriennes mais je ressemble à un arabe.
2912000	2913000	Donc déjà j'ai double carte.
2913000	2914000	Bien sûr.
2914000	2915000	J'ai carte Rabzouaz, carte Renoir.
2915000	2916000	Ou alors il faut en faire plus.
2916000	2917000	C'est excellent ça.
2917000	2921000	C'est-à-dire que tu peux être considéré de droite mais il faut vraiment que t'envoie le paquet.
2921000	2922000	Ouais.
2922000	2923000	C'est-à-dire que là…
2923000	2924000	Ce que je fais.
2924000	2925000	T'es pas loin, t'es pas loin, je te cache pas.
2925000	2926000	Alors t'es prêt ?
2926000	2927000	Et encore j'en ai sous le…
2927000	2928000	Ça va être un petit peu dur.
2928000	2930000	Hitler, je coupe ton micro.
2930000	2938000	Car la catégorie hommes censés n'est pas ni de gauche ni de droite pour toi.
2938000	2940000	Je sais que t'aurais dit une bêtise comme ça.
2940000	2941000	Je coupe ton micro.
2941000	2942000	C'est assez simple pour moi.
2942000	2943000	Non, c'est moi qui t'ai lancé.
2943000	2944000	Ok, pardon.
2944000	2947000	Bon alors on note ce film tout simplement.
2947000	2948000	On arrive au cinquanté.
2948000	2949000	Un socialiste.
2949000	2950000	On note ce film.
2950000	2952000	Bah écoute…
2953000	2959000	Sur 20, sur 20, sur 20…
2959000	2961000	Tu mets un bon…
2961000	2962000	Tu mets un…
2962000	2963000	Tu mets un…
2963000	2964000	Tu mets un…
2964000	2965000	Tu mets un 9 quoi.
2965000	2966000	Ah je mets…
2966000	2967000	Je mets…
2967000	2968000	Je mets…
2968000	2969000	Je mets 6 hein.
2969000	2970000	Tu mets 6 sur 20 ?
2970000	2971000	Ouais je mets 6 sur 20.
2971000	2972000	Ok.
2972000	2973000	Moi je mets 9…
2973000	2974000	Je suis sûr que le premier a 11 mais…
2974000	2977000	Moi je mets 9 juste parce que…
2978000	2980000	C'est pas non plus…
2980000	2981000	Désagréable.
2981000	2982000	Ah non je…
2982000	2986000	C'est pas désagréable d'écouter l'accent de Jeff Tu…
2987000	2988000	Pendant une…
2988000	2989000	C'est quand même pas un film quoi.
2989000	2990000	C'est vraiment un téléfilm.
2990000	2991000	C'est vraiment…
2991000	2994000	Pour le coup il n'y a pas de fil conducteur jamais quoi.
2994000	2995000	Non mais genre je me suis…
2995000	2996000	Je me suis…
2996000	2997000	Je me suis…
2997000	2998000	J'ai pas rigolé.
2998000	2999000	J'ai pas rigolé.
2999000	3003000	Mais c'était pas désagréable non plus tu vois.
3003000	3004000	Genre…
3004000	3005000	C'était pas comme Better Man.
3005000	3007000	Better Man c'était désagréable.
3007000	3009000	Je m'ennuyais, j'en avais marre.
3009000	3010000	J'avais envie de partir.
3010000	3011000	Là…
3012000	3013000	Je…
3013000	3014000	Je…
3014000	3016000	Je voyais s'enchaîner des phrases…
3016000	3018000	Oui mais c'est parce que c'est français aussi.
3018000	3019000	Ouais voilà.
3019000	3021000	C'est des gens quand même que je trouve sympathiques.
3021000	3022000	Non mais moi aussi.
3022000	3023000	Moi aussi.
3023000	3024000	Ça m'embête que…
3024000	3025000	J'aurais pu être mieux quoi.
3025000	3026000	J'aurais pas envie de sortir de la salle quoi.
3026000	3029000	Mais c'est vrai que j'aurais eu envie au moins de rire un peu quoi.
3029000	3030000	Tu vois.
3030000	3031000	J'ai vraiment moi juste ri au début.
3031000	3032000	Regarde qui parle comme ça.
3032000	3033000	J'ai juste ri à celle-là.
3033000	3034000	Ouais ouais.
3034000	3035000	Et après c'est tout quoi.
3035000	3036000	Ouais bah ouais.
3036000	3037000	Non non moi si ça.
3037000	3039000	Mais bon je te dis j'aime pas…
3039000	3040000	J'aime pas dire du mal de la comédie.
3040000	3042000	C'est dur de faire des blagues.
3042000	3043000	Écoute c'est comme ça.
3043000	3046000	Ça empêche pas qu'il y a des gens dans ce film qu'on adore.
3046000	3048000	On leur souhaite énormément d'argent.
3049000	3051000	On vous souhaite…
3052000	3054000	Bah écoute on ne vous conseille pas d'aller le voir.
3054000	3056000	Bah non mais bon après…
3056000	3057000	En attendant qu'il sorte…
3057000	3059000	C'est un film que tu te mets pendant les vacances.
3059000	3061000	C'est un film que tu te mets en famille pendant les vacances.
3061000	3062000	Non justement.
3062000	3064000	Tu te mets le premier justement.
3064000	3066000	Parce que franchement là on va dire vrai.
3066000	3068000	Moi je connais des gens vraiment fans des tuches et tout.
3068000	3070000	Ils vont pas aimer.
3070000	3072000	C'est à dire que là c'est les tuches mais vraiment mal fait.
3072000	3073000	C'est vraiment cheap.
3073000	3074000	C'est une vraie suite nulle.
3074000	3076000	En vrai il va moyen marché.
3076000	3079000	Et les gens ils vont dire ouais c'est nul.
3079000	3080000	Parce que quand même c'est nul.
3080000	3083000	C'est pas genre une suite réussie et on n'est pas la cam.
3083000	3084000	C'est un mauvais film faut le dire.
3084000	3087000	Donc je pense qu'ils vont pas aimer les gens.
3087000	3088000	Même les gens qui aiment les tuches ils vont pas aimer.
3088000	3089000	Ouais c'est nul.
3089000	3090000	Je pense que ça sera peut-être le dernier quoi.
3090000	3091000	Ah bah là oui je pense.
3091000	3093000	Parce que c'est celui qui marchera le moins.
3094000	3097000	Et j'ai mal pour les anglais qui vont voir ce film.
3097000	3099000	Et qui croient que c'est ça l'humour français aussi quoi.
3099000	3100000	Non mais ils vont pas regarder ça.
3100000	3101000	Ah bah si ça c'est des coproductions.
3101000	3103000	Quand ça va sortir.
3105000	3107000	Qu'est-ce que je te dis dis-moi.
3107000	3108000	Je sais pas quoi te dire.
3108000	3109000	Non mais voilà.
3109000	3110000	Honnêtement je sais pas quoi te dire.
3110000	3113000	En même temps il n'y a aucune comédie qui fait un 4 qui est bien.
3113000	3115000	Mais qu'est-ce qui te fait rire toi ?
3115000	3117000	Qu'est-ce qui te fait rire toi ?
3117000	3119000	Les gens qui meurent.
3119000	3120000	Les gens qui meurent.
3120000	3121000	Les gens qui meurent.
3121000	3122000	Hilarant.
3122000	3123000	C'est hilarant.
3123000	3124000	C'est tellement drôle.
3124000	3125000	Les gens qui meurent, les gens qui pleurent.
3125000	3126000	Les gros.
3126000	3127000	Les gros.
3127000	3128000	Les gros.
3128000	3131000	Bah les gens qui pleurent parce qu'ils sont gros et qu'ils vont bientôt mourir.
3131000	3132000	Et jeter de la nourriture à des gros.
3132000	3134000	Hilarant ça.
3134000	3138000	Ou jeter des gros sur la nourriture.
3138000	3140000	Jeter des gros dans de la nourriture.
3140000	3144000	Et c'est pas très compliqué ils sont souvent pas très loin.
3144000	3145000	Non mais attends.
3145000	3151000	Oui genre comme si j'imagine une grande piscine avec plein de frites et de hamburgers dedans.
3151000	3155000	Et toi tu passes en vélo à côté et tu mets le coup de pied dans le gros qui tombe dans le truc.
3155000	3156000	Ce serait drôle ça.
3156000	3157000	Ouais ouais c'est hilarant.
3157000	3158000	C'est bon ça.
3158000	3159000	Pour l'instant c'est bon.
3159000	3160000	Je le note c'est noté.
3160000	3163000	Attends il y a quoi comme truc hyper drôle là ?
3163000	3165000	Tout ce qui peut vraiment être vraiment très drôle.
3165000	3168000	Il y a des personnes de petite taille.
3168000	3169000	Ouais.
3169000	3170000	Ouais.
3170000	3171000	Ouais effectivement.
3171000	3172000	Ils en ont mis une d'ailleurs.
3172000	3173000	Ils ont mis un pause partout.
3173000	3174000	Ah oui alors.
3174000	3175000	Ils ont fait une référence à 4Wire aussi.
3175000	3178000	J'en ai jamais parlé publiquement.
3178000	3180000	Ah non mais t'es attiré.
3180000	3181000	Je vais faire mon coming out.
3181000	3182000	J'en ai déjà parlé moi.
3182000	3183000	Moi j'en ai déjà parlé.
3183000	3186000	Je suis attiré par les Nenbonnes.
3186000	3187000	Ouais.
3187000	3189000	Et donc j'ai un kink.
3189000	3194000	J'envoie très régulièrement à Urban sur Instagram.
3194000	3195000	Oui je sais.
3195000	3196000	Des réels de Nenbonnes.
3196000	3198000	Et il y a des Nenbonnes de grande qualité.
3198000	3199000	Bah je sais.
3199000	3201000	Notamment la basilienne que j'ai tant moi.
3201000	3202000	Tout le temps qui me rend absolument marre.
3202000	3203000	Moi mon gars.
3203000	3205000	Les gens qui suivent mes podcasts le savent.
3205000	3207000	Moi j'en ai déjà vu une en vrai.
3207000	3208000	Hyper beau.
3208000	3209000	Elle est Nen.
3209000	3210000	Et hyper bonne.
3210000	3211000	Et hyper bonne.
3211000	3212000	C'est une personne comme ça.
3212000	3217000	Est-ce que vous pouvez me faire des retours si vous aussi vous avez des kinks ?
3217000	3218000	Oui oui.
3218000	3219000	Si vous avez des kinks bizarres n'hésitez pas.
3219000	3224000	Et alors surtout si vraiment vous êtes une personne de petite taille attirée par Thibaut
3224000	3225000	ou par moi.
3225000	3226000	Il faut le dire.
3226000	3227000	On va pas mourir con quand même.
3227000	3228000	Ah mais moi il est en négation.
3228000	3229000	Là tu serais.
3229000	3232000	Que je me fasse par l'amour à une personne naine.
3232000	3233000	Alors on se.
3233000	3234000	Tu serais prêt à payer là quand même ?
3234000	3235000	Non non.
3235000	3236000	Je voudrais quand même qu'il y ait.
3236000	3237000	Non moi je paye pas.
3237000	3238000	Je te dis moi aussi.
3238000	3239000	Moi je veux chiner.
3239000	3240000	Je veux chiner.
3240000	3241000	Même une naine.
3241000	3242000	Même une naine.
3242000	3243000	Mais non.
3243000	3244000	Mais justement moi.
3244000	3245000	Attends.
3245000	3246000	Tu cannes une naine.
3246000	3247000	Mais imagine le date.
3247000	3248000	C'est génial le date.
3248000	3249000	Date avec une naine.
3249000	3250000	Tu chines une naine.
3250000	3252000	Et là trois apéricules elle a bouffé.
3252000	3253000	Ah ah ah ah ah.
3253000	3255000	Ça te fait marrer ça.
3255000	3256000	Ça te fait marrer ça.
3256000	3257000	Ça me fait marrer.
3257000	3260000	Utiliser de la vanne de nourriture mais sur la naine.
3260000	3264000	Du coup en inversant le processus humoristique de dire que les gros mangent beaucoup mais
3264000	3266000	que là c'est une naine alors elle mange pas beaucoup.
3266000	3267000	C'est très drôle.
3267000	3268000	Qu'est-ce que c'est drôle.
3268000	3269000	C'est hilarôle.
3269000	3270000	Enfin.
3270000	3272000	Et dans le bar tout le monde se marre.
3272000	3273000	Attends.
3273000	3274000	Il y a un autre truc qui est drôle je crois.
3274000	3275000	C'est quand il.
3275000	3277000	J'avais vu une phrase sur internet qui disait.
3277000	3280000	Est-ce que vous avez déjà vu un noir trisomique ?
3280000	3281000	Elle fait couper.
3281000	3282000	Ouais.
3282000	3283000	Ouais.
3283000	3284000	Ouais.
3284000	3285000	Ça m'a fait énormément rire.
3285000	3287000	On ne voit jamais de noir trisomique.
3287000	3288000	Et peut-être.
3288000	3290000	Il y avait cet humour à la fois sur le racisme.
3290000	3293000	Et aussi sur les handicapés.
3293000	3296000	Et là moi le combo des deux moi j'aime beaucoup.
3296000	3297000	Et en même temps peut-être l'inverse du racisme.
3297000	3300000	C'est peut-être un gars de gauche qui dit leurs gènes sont supérieurs.
3300000	3301000	Ils n'ont pas de trisomique.
3301000	3304000	Oh je ne pense pas que c'était pour ça qu'il a.
3304000	3306000	Excuse moi mais je ne pense.
3306000	3307000	J'essayais de trouver une façon sympa de le dire.
3307000	3308000	Non non je ne pense pas.
3308000	3309000	Non je ne pense pas.
3309000	3313000	Ecoute si vous êtes une personne de couleur trisomique ça nous intéresse aussi.
3313000	3314000	Ah mais totalement.
3314000	3315000	Tous les kinks.
3315000	3317000	Tous les kinks.
3317000	3318000	Oui oui.
3318000	3321000	Celle avec le fessier gigantesque là.
3321000	3322000	Qui est au Brésil.
3322000	3323000	Ah ta mère.
3323000	3324000	Oh.
3324000	3325000	Allez.
3325000	3328000	C'est dingue ça.
3328000	3330000	Mais c'est CM2 quoi.
3330000	3332000	L'humour encore sur les mers quoi.
3332000	3337000	Ta mère elle est tellement grosse que quand elle va se coucher elle est tchouche des deux côtés.
3337000	3339000	Tchouche des deux côtés.
3339000	3341000	Tchouche des deux côtés.
3341000	3343000	C'est pas possible ça.
3343000	3345000	Les vannes sur les mers.
3345000	3347000	Ça me fait marrer que ça te choque.
3347000	3348000	L'autre il est là.
3348000	3349000	Ça me choque moi.
3349000	3351000	Il dit Hitler à tout bout de champ.
3351000	3353000	Une blague sur les mamans il n'y a plus personne.
3353000	3355000	En plus je dis Hitler à tout bout de champ.
3355000	3358000	C'est tout le temps toi qui cite le guide.
3358000	3359000	Moi je ne le cite jamais.
3359000	3362000	Je ne sais pas pourquoi tu m'emmerdes avec ça.
3362000	3364000	Ecoutez.
3364000	3366000	Tchouche et petit cul à tous.
3366000	3368000	Tchouche et petit cul.
3368000	3371000	On a eu des nouveaux commentaires.
3371000	3372000	On va les lire quand même.
3372000	3374000	Il y en a eu des nouveaux parce que.
3374000	3376000	Ah oui on peut lire les commentaires c'est toujours sympa.
3376000	3378000	Si on veut encourager les gens à le faire.
3378000	3381000	Il faut leur dire chaque nouveau commentaire sera cité dans l'émission.
3381000	3383000	On va citer les meilleurs commentaires à chaque fois.
3383000	3385000	Les meilleurs on va tous les citer.
3385000	3387000	Il y en a quatre.
3387000	3390000	Mais il y en a un que j'ai beaucoup apprécié.
3390000	3392000	Donc merci vraiment.
3392000	3396000	En vrai je sais que ce n'est pas forcément une émission dont on a envie de dire.
3396000	3399000	Il faut le partager à des gens proches quoi.
3399000	3401000	Des gens de confiance.
3401000	3402000	D'accord.
3402000	3403000	Alors encore un podcast d'Urbain.
3403000	3404000	Ben oui alors il fait ce qu'il veut.
3404000	3406000	On est dans un pays libre.
3406000	3409000	Bref la bonne bise voilà machin.
3409000	3411000	Ce podcast est nul donc 5 étoiles.
3411000	3414000	Vraiment bon concept comme dit dans Fucked Up Movies.
3414000	3416000	Donc ça c'était les trucs de podcast addicts.
3416000	3417000	Sympa.
3417000	3421000	Mais alors c'est sur Apple Podcasts où là on a les vrais de vrais.
3421000	3423000	Qui sont venus nous dire des trucs.
3423000	3427000	Notamment un commentaire qu'on va citer qui dit tchouche et petit cul tout simplement.
3427000	3431000	Apple tout est nul voilà je les ai.
3431000	3434000	Alors qu'est ce qu'on nous dit.
3434000	3436000	Les tchouche et les petits culs voilà.
3436000	3438000	C'est Punisher 54.
3438000	3439000	Voilà.
3439000	3440000	Avec un emoji rire.
3440000	3441000	Ouais.
3441000	3443000	Alors il y a celui là que j'ai pas compris.
3443000	3444000	Je pense que c'est quelqu'un de ta team.
3444000	3445000	J'ai pas tout compris.
3445000	3446000	Ouais.
3446000	3447000	Analyse de votre émission.
3447000	3450000	J'aime beaucoup l'idée de fusionner un bêtisier avec le talk show lui-même.
3450000	3455000	La connotation anti-système est également très efficace et permet au bon français de se sentir enfin respecté.
3455000	3456000	C'est très grave.
3456000	3457000	Excellent.
3457000	3458000	C'est vraiment un public que je déteste.
3458000	3459000	Excellent.
3459000	3461000	Mais je pense qu'il rigole en vrai.
3461000	3462000	Excellent commentaire.
3462000	3463000	La présence de sections entières.
3463000	3465000	Nareo chantir l'émission vers l'euro.
3465000	3466000	Une question subsiste.
3466000	3468000	Pourquoi avoir choisi le cinéma comme prétexte ?
3468000	3471000	Lui il voudrait qu'on aille dans l'actu dur quoi.
3471000	3472000	Ah mais lui il est excellent lui je l'adore.
3472000	3473000	Comment tu dis qu'il s'appelle ?
3473000	3477000	Il s'appelle toi-même c'est toi-même.
3477000	3479000	J'ai pas le nom.
3479000	3482000	J'essaierai de mener à bien cette analyse lors du prochain numéro.
3482000	3483000	Attendu comme chaque fois avec gourmandise.
3483000	3485000	Il s'appelle Reduc.
3485000	3486000	Coquin.
3486000	3487000	Comme Reducu.
3487000	3489000	Merveilleux.
3489000	3491000	Ça c'est Abdel.
3491000	3492000	Comme quoi.
3492000	3493000	Ah bah voilà.
3493000	3494000	C'est Toutes les France.
3494000	3496000	T'as vu je te ramène un peu un public.
3496000	3499000	Abdel est quelqu'un qui écoute aussi Airball depuis.
3499000	3500000	Ah d'accord.
3500000	3501000	Je parle à Toutes les France depuis longtemps.
3501000	3502000	Putain c'est que tu connais toutes tes...
3502000	3504000	Non mais lui je connais.
3504000	3505000	Ok.
3505000	3506000	Mais quelle merveille.
3506000	3509000	La dynamique de ce duo complètement déjanté est à la hauteur des envolées lyriques.
3509000	3512000	La review Nosferatu est juste prodigieuse.
3512000	3517000	Le passage de la minute 37 à 44 est juste all time pompique.
3517000	3519000	Bambi bambi bambi bambi bambi bambi bambi bambi.
3519000	3521000	Et ça vous fait rire ça le pompique.
3521000	3522000	Bah déjanté.
3522000	3524000	Je ne vois pas pourquoi il dit ça déjanté.
3524000	3525000	Comme si on...
3525000	3527000	Qui est déjanté ?
3527000	3528000	Personne.
3528000	3529000	Ecoutez.
3529000	3530000	Et bien voilà c'est tout.
3530000	3532000	On a passé un bon moment.
3532000	3535000	De toute façon l'important c'est de parler avec des copains.
3535000	3536000	Et oui.
3536000	3537000	De se marrer.
3537000	3540000	De se dire que tout ça c'est des débats.
3540000	3545000	Et il y a des amis de droite, des amis de gauche, des amis de centre, des amis qui vont aller en prison.
3545000	3549000	Le principal de toute façon c'est qu'on est tous socialistes.
3549000	3550000	Après...
3550000	3551000	Allez.
3551000	3552000	Il y a plusieurs nuances.
3552000	3553000	Il y a plusieurs nuances.
3553000	3554000	C'est très rigolo.
3554000	3555000	C'est hilarant.
3555000	3556000	C'est hilarant.
3556000	3558000	Écoutez à la semaine prochaine on va aller voir le Marvel.
3558000	3559000	Pour ne pas aller voir Bridget Jones.
3559000	3560000	Voilà.
3560000	3561000	Oui.
3561000	3562000	Oui parce que si on va voir le Bridget Jones on va encore...
3562000	3563000	Encore dire les saloprées.
3563000	3564000	Sois disant que je t'en ai proposé à la petite bret.
3564000	3565000	Oui.
3565000	3566000	Ce análisateur soit dit que tu l'as vraiment honte.
3566000	3575000	Oumaster dit que c'est quoi τ'aimerais les 누� coolerales.
3575000	3576000	C'est très fier.
3576000	3577000	Disons que je t'en ai proposé.
3577000	3578000	Ah ah ah 자.
3578000	3579940	Enfin on a eu un sondage de la part de toutes les femmes
3579940	3582240	Il reste plus qu'à attendre qu'elles savent lire
3582240	3583580	Pour avoir le sondage
3583580	3585980	Elle te fait marrer ça
3585980	3586500	T'as vu ?
3586500	3587100	Elle te fait marrer
3587100	3589080	On lui met une merde
3589080	3590680	À la Olivier de Benoit
3590680	3592540	Il m'a tendu un piège
3592540	3594640	Moi je fonce dedans
3594640	3596880	Il est contre blague et ça le fait marrer
3596880	3598140	Qui est con
3598140	3601060	Alors oui tu vas bien gueuler la semaine prochaine
3601060	3602640	Il vaut bien te foutre une femme en super héros
3602640	3603600	Ça va t'insupporter
3603600	3605700	Qu'est-ce qu'on va pouvoir dire sur ce Marvel ?
3605700	3607380	On va voir c'est bien il y a un nouveau Marvel
3607380	3608820	Marvel s'écroule c'est marrant
3608820	3610340	On va finir à pile une heure tu vois
3610340	3611240	Il me reste 10 secondes
3611240	3611940	Qu'est-ce que t'as à faire ?
3611940	3613820	Je te laisse une libre antenne pendant 10 secondes
3613820	3615580	C'est faux j'ai coupé ton micro
3615580	3619640	Allez 3, 2, 1
3619640	3620680	C'est terminé au revoir Max
