start	end	text
1740080	1741620	Moi, je te parle de l'interprétation live.
1742140	1743420	Ah oui, voilà, les spectacles vivants.
1743700	1743880	Voilà.
1744000	1744700	Les spectacles vivants, ouais, d'accord.
1745160	1746320	Ça, c'est...
1746320	1746900	Ça va être compliqué.
1746960	1748680	Moi, je te parle, est-ce que genre, je sais pas, dans 2 ans,
1748760	1751760	tu dis à l'IA, fais-moi Gladiator 3,
1752760	1754600	et le gars, en une heure, il te sort un film.
1754720	1755360	Ouais, potentiellement.
1755920	1756440	Ça, c'est possible.
1756840	1758120	Potentiellement, mais il y a quand même des trucs,
1758380	1762020	je reste dubitatif sur les émotions
1762020	1764260	qu'ils peuvent transmettre un humain versus un robot.
1764680	1765860	Il y a des choses qu'on n'arrive pas à expliquer,
1765980	1768580	que même, finalement, l'intelligence artificielle
1768580	1769800	va pas réussir à le capter.
1770200	1770900	Tout ce qui est...
1770900	1773600	Nous, on est des gens de la scène,
1774080	1775960	on sent qu'il y a une sorte de vibe avec le public,
1776040	1776880	on n'arrive pas à l'expliquer,
1777220	1778580	ou une transmission, ou une connexion,
1778580	1781180	et tu te dis, mais on n'arrive pas, tu vois,
1782020	1783400	à le déceler ou à l'expliquer.
1783700	1784280	Comment tu veux ?
1784280	1785700	Cette ville, pourquoi, par exemple, à Limoges,
1785760	1787000	c'est toujours des cons ?
1787000	1787640	Pourquoi ?
1787640	1787760	Ouais.
1788260	1791940	Pourquoi Clermont-Ferrand, tu remplis pas ?
1791940	1793760	Je parle pour moi.
1793840	1794620	Pour toi, plein de villes.
1796460	1797180	Non, mais oui, je sais pas,
1797240	1798740	il y a des trucs...
1798740	1800000	Ouais, non, je pense que nous, l'IA,
1800140	1801120	on n'en a pas déjà parlé ?
1801120	1801740	Bon, de toute façon,
1801840	1802900	on va en retourner en...
1802900	1803560	On en parlera forcément.
1803620	1804400	Je trouve que là, c'est un peu lent,
1804740	1805780	mais c'est peut-être parce que les transformations,
1805920	1806580	on les voit pas encore.
1806580	1808560	Je pense qu'il se passe des trucs de malade mental.
1808660	1810760	Moi, je suis juste abonné à un truc sur l'IA,
1810960	1812360	qui parle sur Instagram,
1812360	1813720	qui montre les nouvelles applis et tout.
1813980	1815260	Et j'avoue que c'est que ça me saoule vite.
1815560	1816060	Mais je regarde,
1816140	1816880	ma meuf, je regarde un peu.
1817540	1818620	Genre, il y a des trucs de fou, quoi.
1818740	1819080	Des trucs...
1819080	1819900	Ah ouais, tiens, ça, ça existe.
1820040	1820820	OK, paf.
1822040	1822160	Si...
1822160	1823540	Je peux même pas t'expliquer, tu vois,
1823600	1824520	mais des trucs, vraiment,
1824920	1825740	j'en ai pas en tête.
1826300	1827520	Et tu dis, ah ouais, ça...
1827520	1828760	Et là, je pense à tel métier,
1829060	1830740	telle entreprise qui va sauter à cause de ça.
1830880	1831620	Ah ouais, c'est ça.
1831940	1834600	C'est ouf, notre capacité à avoir tout de suite une technologie
1834600	1837340	et au bout de 25 minutes qu'on l'utilise,
1837400	1838960	la trouver absolument normale.
1839380	1840460	Et tu vois, le côté...
1840460	1841860	Oh putain, c'est un truc de ouf !
1841860	1843180	Dure pas si longtemps, je trouve.
1843980	1844760	Tu sais, on est là ?
1844760	1848000	Il y a quand même un côté waouh qui dure sur l'IA, quand même.
1848320	1849520	C'est désormais, tu vas-tu faire...
1850140	1850840	Moi, c'est la VR.
1851000	1851820	Ça marche encore sur moi.
1851900	1853520	Alors que ça, des graphistes de PlayStation 1.
1853520	1857460	À chaque fois que je tente le truc, je dis, mais c'est incroyable !
1857460	1859200	Mais si tu l'avais chez toi, au bout d'un mois,
1859240	1860000	t'en aurais plus rien à foutre.
1860160	1860680	Ouais, faut pas que je m'achète.
1860700	1862100	Non, mais t'en aurais plus rien à foutre au bout d'un mois.
1862160	1862760	Mais c'est ça, ouais.
1863840	1865460	Ça, c'est une technologie, je pense,
1865720	1867220	je n'arrive même pas à comprendre.
1867320	1868580	Je pense que même les gens qui la foncent disent,
1868620	1869540	mais pourquoi ?
1869540	1873100	Ça marche pas à un point futuriste bizarre
1873100	1874040	où tout le monde en a un...
1874040	1876140	Tu sais, tu parles des Google Chrome, je sais pas quoi, là.
1876320	1876920	Oculus, là.
1876960	1877620	Google Oculus, là.
1877640	1878760	Même des trucs pour voir les films,
1878760	1879680	enfin, le dessus d'Apple,
1879680	1880920	enfin, absolument, je le teste, là.
1881200	1883160	Ouais, moi, j'y croyais pas, le métaverse.
1884080	1885700	Il y avait une sorte de mode et tout.
1885800	1886980	Je me dis, mais c'est trop chiant, en fait,
1887060	1888360	d'avoir son casque et tout.
1888460	1889480	C'est pas...
1889480	1890460	C'est mal, tu vois ?
1890460	1892480	Maintenant, ils essaient de faire un truc entre les deux, quoi.
1892580	1893400	C'est-à-dire que ton casque,
1893420	1894500	il te présente la réalité,
1894640	1895680	mais avec des icônes partout.
1896060	1896300	Ouais.
1896620	1898700	Ça, ça risque de prendre.
1898840	1899980	C'est un peu ce que tu vois qui est le...
1899980	1901840	Mais ça reste contraignant d'avoir ce truc-là, quoi.
1902300	1902620	Enfin, tu vois.
1902620	1904000	Ah, mais je pense qu'ils vont réussir à créer un truc
1904000	1904900	des lunettes hyper légères.
1904900	1905540	Parce qu'en fait, le casque,
1905600	1906320	c'est en ce moment, quand tu le mets,
1906440	1907420	où normalement, t'as mal au cou et tout.
1907460	1907700	Eh ouais.
1907940	1909080	Mais là, bientôt, je pense qu'ils vont arriver
1909080	1910880	à des lunettes, un masque,
1910920	1911880	comme coutumé pour dormir.
1912380	1913000	Et là, c'est la fête, quoi.
1913280	1914300	Oui, en fait, il y aura des gens
1914300	1915620	qui auront des icônes plein les yeux
1915620	1916320	et d'autres pas.
1916640	1917220	Et ça va être...
1917220	1917560	Trop de bruit.
1917560	1918500	Ou des lentilles, peut-être.
1918600	1919920	On verra comment ça tourne.
1920120	1920520	Des lentilles.
1920760	1922360	Alors, on a des épisodes qui vont mal vieillir.
1922480	1923600	Mais alors, celui-là ?
1923600	1925480	Celui-là, à peine dans deux ans,
1925520	1926100	tout le monde va dire...
1926100	1928920	Les prédictions sur la technologie du futur.
1929040	1929880	Mais ça me fait trop rire.
1930080	1930700	Ça me fait trop rire.
1930760	1933020	Moi, j'adore regarder des gens parler...
1933020	1934400	Enfin, du passé, parler du futur.
1934580	1936140	Parce que tu dis forcément de la merde.
1936320	1937560	Tu vois les trucs sur l'INA,
1937800	1939020	les gamins dans les années 70.
1939020	1942240	Est-ce que le bitcoin va faire 1,5 million ?
1942240	1944620	En 2030.
1945380	1947020	Ah, il y a des prédictions qui disent ça ?
1947020	1950200	Un bitcoin ferait 1,5 million ?
1950200	1951060	Putain, mais arrête.
1952100	1955020	Mais j'en veux un, mais...
1955020	1955860	Voilà.
1956120	1957940	C'est des gars qui ont beaucoup de bitcoin,
1958080	1958900	qui ont lancé cette rumeur,
1958940	1959260	et ça marche.
1959400	1959840	Ben oui.
1960240	1962380	Parce que j'étais là à 30 000, 40 000.
1962520	1963340	Allez, c'est bon, on arrête.
1963620	1964580	Mais si, si, un jour,
1964640	1965620	ça vaut vraiment 1,5 million.
1965880	1966860	Ça va être extrêmement agaçant.
1966920	1967600	Ça va être agaçant.
1968020	1968560	Parce que tu te dis...
1968560	1970500	Merde, je suis passé à côté de quelque chose, là.
1970760	1971740	Ouais, ben toi, c'est ton truc.
1972020	1973580	Et alors, toi, qu'est-ce qui te fait peur de...
1973580	1974520	Bon, la vieillesse ?
1974520	1975220	La vieillesse ?
1975220	1975660	Ben, j'en parlais.
1975780	1976880	Non, mais je dis, moi...
1976880	1978420	Je suis un peu dans le déni, tu vois.
1978420	1979540	Je suis un peu dans le déni,
1979620	1981680	mais c'est vrai qu'il y a un côté,
1981880	1982200	tu te dis,
1982280	1983160	ah, putain, ça va vite,
1983400	1984440	et tu y penses de plus en plus.
1985780	1986920	Et jeûne encore.
1987000	1988120	J'ai pas envie de...
1988120	1989260	Moi, en vrai, ce qui me terrorise,
1989320	1990220	mais c'est vraiment triste,
1990760	1991360	mais c'est qu'en fait,
1992120	1993340	soit tu crèves avant tout le monde,
1993480	1994480	soit tu vois tout le monde mourir.
1994580	1995840	Y'a pas le choix.
1996300	1997220	Et ce qui fait chier, à un moment,
1997300	1997640	c'est de connaître...
1997640	1998260	Pas mourir entre les deux.
1998680	1999480	En fait, ce qui est chiant,
1999620	2000420	c'est de...
2001460	2002120	C'est d'un moment,
2002220	2003260	c'est de connaître personne, quoi.
2003720	2003920	Ouais.
2004000	2004880	Il faudrait limite se faire potes
2008420	2010460	pour un jour, à 85 pis,
2010500	2011280	j'ai pas le seul con
2011280	2012160	qui a plus de potes, quoi.
2012380	2012860	C'est surtout que moi.
2012860	2013880	La technique, c'est que les gens,
2013920	2014720	ils font des enfants pour ça.
2015100	2016980	Mais oui, mais c'est pas tes potes,
2017000	2017360	les enfants.
2017520	2018200	Moi, je veux des potes.
2018280	2019040	Mais y'en a qui sont potes
2019040	2019560	avec leurs enfants.
2019660	2020360	Ah oui, y'en a.
2020440	2021140	C'est ridicule.
2021540	2023240	Ma mère, c'est ma meilleure amie,
2023340	2023920	mais crève.
2025100	2025780	Ah, mais tu vois.
2026040	2026220	Voilà.
2026620	2027540	Nazi, fermé d'esprit.
2027920	2028040	C'est important.
2028180	2030000	C'est vrai qu'on va l'appeler
2030000	2030840	Urbain, la vérité.
2031340	2033440	C'est vrai que c'est pas la vérité.
2033520	2034420	Mais pourquoi les gens me disent ça
2038420	2040300	que je dis le truc
2040300	2040980	comme si c'était une vérité.
2041080	2042100	Je dis mais crève.
2042400	2044180	Moi, je pense que c'est ridicule
2044180	2045320	si ta mère, c'est ta meilleure amie.
2045480	2046160	Fais ce que tu veux.
2046500	2047080	J'ai quand même le...
2047080	2048680	Non, t'es intimement convaincu
2048680	2050860	que les gens qui pensent pas comme toi
2050860	2052420	sont des énormes débiles
2052420	2054120	qui devraient être passés sous un tank.
2054440	2056500	Mais pas passer sous un tank.
2056800	2057480	Mais je veux dire, moi,
2058380	2059880	je comprends pas pourquoi ça vous agace
2059880	2061600	que je puisse passer un truc dur comme...
2061600	2062280	Non, mais c'est mon génère.
2062280	2062920	Dans les commentaires,
2063240	2064760	il dit, ah, il pense qu'il dit la vérité.
2064840	2066000	Ah, c'est les commentaires qui te dérèrent.
2066020	2066820	C'est-à-dire que tu parles
2066820	2068820	comme Michel Sardou
2068820	2069780	en interview aujourd'hui
2069780	2070400	alors que c'est normal,
2070480	2071300	il a 78 ans.
2071820	2072760	Il a le droit de le dire.
2073200	2074180	J'ai cette époque.
2074280	2074660	J'y crois.
2074860	2076440	Il était là, on fumait, on baisait.
2076960	2077980	Évidemment, il est vieux.
2078880	2080200	Et il était dans les zéros.
2080300	2082280	Il était dans l'époque du showbiz
2082280	2083900	où t'étais genre le boss
2083900	2085700	de la planète ultime
2085700	2086880	quand t'étais dans le showbiz à cette époque.
2087540	2089020	Évidemment qu'il regrette avant.
2089160	2090020	Moi, quand je l'entends dire ça,
2090080	2090780	je me dis pas quel con.
2090860	2092380	Je me dis, bah, je le crois.
2093440	2094400	Évidemment que pour lui,
2094500	2095840	c'est bien plus nul maintenant.
2095840	2097240	Ah ouais, tu lui parles pas
2097240	2098500	d'Oculus mes couilles.
2098820	2099500	Mais alors par contre,
2099600	2100240	voilà, ça c'est un truc
2100240	2101180	où je suis à peu près convaincu
2101180	2101720	dans la vieillesse
2101720	2102440	que quand tu dis
2102440	2103360	c'était mieux avant,
2103520	2104300	tu dis c'était mieux,
2104380	2104860	j'étais jeune.
2105440	2105720	Oui.
2105760	2107340	Tu dis pas objectivement
2107340	2107860	c'était mieux avant
2107860	2108600	puisque tout le monde
2108600	2109440	de toutes les époques,
2109520	2111540	on dirait qu'ils ont préféré avant.
2112000	2112960	Donc il n'est forcément content.
2112960	2113280	C'est un grand classique.
2113520	2114240	Mais il y a quelques gens
2114240	2114860	qui s'ont ouvert d'esprit
2114860	2115200	qui disaient,
2115280	2117780	je préfère que maintenant.
2118380	2119640	Même moi, avec le recul,
2119760	2120320	je suis pas si vieux,
2120780	2121860	je préfère maintenant à avant.
2122900	2123600	Ah bah moi, c'est sûr.
2125840	2127840	C'est vrai ?
2128580	2130440	Alors, à Poitiers,
2130520	2131800	il y avait un truc de sushi,
2131880	2132060	je crois,
2132100	2132920	mais c'était un événement,
2133000	2133140	je crois.
2133220	2133840	Il y a 20 ans ?
2133840	2134480	20 ans, il y en avait.
2134900	2136060	Ça a commencé avec l'or,
2136100	2136740	il y a peut-être 20 ans,
2136840	2138260	mais il y a 25 ans,
2138260	2138740	il n'y avait pas de sushi.
2138760	2139400	Ok, je vais être très honnête,
2139440	2140840	il y avait un traiteur vietnamien.
2140960	2141420	Mais je ne sais pas
2141420	2142000	si il y avait sushi.
2142000	2142360	Ouais, mais les sushis, mec.
2144880	2147000	Comme quoi le progrès ?
2147000	2147660	Ah non, mais le truc,
2147780	2148420	c'était mieux avant,
2148520	2149720	ça c'est vraiment une phrase de...
2149720	2150480	Oui, c'était mieux avant
2150480	2151800	parce que ton genou,
2151880	2152460	il est pété maintenant.
2152580	2153060	C'est juste pour ça
2153060	2153560	que c'était mieux avant.
2153840	2154660	Il n'y a pas que ça,
2154780	2155060	il y a les gens
2155060	2156520	qui sont réfractaires à la nouveauté
2156520	2157520	parce que le changement,
2157840	2158760	il y a toujours une courbe du changement,
2159060	2160220	les études qui le montrent,
2160460	2161620	il y a « Ah, t'es pas content ? »
2161620	2162280	Ensuite, le deuil,
2162360	2163600	et ensuite, « Ah, bah c'est mieux maintenant. »
2163600	2163840	Ah oui.
2163900	2164940	Et donc, il y en a qui ne sortent jamais
2164940	2165800	parce qu'ils n'ont pas le temps
2165800	2167540	de faire tout le processus,
2167620	2168300	donc ils sont encore
2168300	2169100	en train de se plaindre.
2169180	2169960	C'est pour ça que les réformes
2169960	2170520	et la nouveauté
2170520	2173340	ne passent pas chez les vieux
2173340	2174100	parce que plus t'es vieux
2174100	2175240	et plus t'es conservateur
2175240	2176700	et plus t'es donc réfractaire
2176700	2177120	au changement.
2177360	2177880	C'est pour ça que les vieux
2177880	2178480	sont plus à droite.
2179260	2181060	Mais je suis tout à fait d'accord.
2182700	2183800	Comme quoi je peux être d'accord.
2184500	2185400	Donc, tu es un peu à droite quand même.
2185520	2187060	Mais est-ce que...
2188160	2189380	Ne serait-ce que pour les changements
2189380	2190480	qui vont arriver dans la médecine,
2190580	2191940	tu ne peux pas regretter le futur.
2192560	2193060	À mon avis.
2193420	2195040	À part que notre petite carte vitale,
2195120	2195720	ils vont l'enlever
2195720	2196640	et qu'il faudra être riche.
2196680	2197360	Elle va rembourser
2197360	2198020	de moins en moins, celle-là.
2198040	2199240	Voilà, mais je pense...
2199240	2199720	J'ai l'impression.
2200520	2201260	Ça a déjà commencé.
2201680	2202180	C'est pratique.
2202700	2204620	Je vois des vues à la pharmacie.
2204620	2206260	Je vais une fois de temps en temps
2206260	2207060	acheter du Doliprane
2207060	2208740	quand je veux mettre une race, tu vois.
2209600	2211260	Et tu vois, les gens un peu âgés,
2211940	2212840	quand...
2212840	2213960	Pas tous, mais c'est souvent
2213960	2214640	des personnes âgées.
2214760	2215880	Genre, la personne, elle dit oui.
2216060	2216900	Alors, la carte vitale prend ça.
2217220	2218640	Là, il faut rajouter 4 euros.
2219060	2219920	Elle me fait...
2219920	2221480	Quoi ?
2221480	2221860	Tu sais, genre,
2221900	2222500	les gars, ils ont connu
2222500	2223680	le tout gratuit, quoi.
2224120	2225100	Les gens, ça les choque un peu
2225100	2226440	de devoir poser un billet en plus, quoi.
2226980	2227200	Ouais.
2227600	2229040	Et surtout, nos petits vieux
2229040	2230240	qui ont de moins en moins de thunes, quoi.
2230480	2231220	Ouais, ça, c'est technique.
2231880	2232560	Parce que mine de rien,
2232640	2233800	la retraite n'est pas capée
2233800	2234440	sur l'inflation.
2234700	2235480	Ils ont eu dans le Chine
2235480	2235980	de plus en plus.
2236120	2237680	Ça, ça me terrorise.
2238240	2239160	Être vieux
2239160	2240380	et du coup,
2240680	2241540	pas du tout subvenir
2241540	2242140	à mes besoins.
2242460	2243020	Et vu que nous,
2243100	2243880	la retraite...
2243880	2244160	Enfin, voilà,
2244280	2244800	moi, en fait,
2244880	2245880	là, j'y pense...
2245880	2247360	Mais tu mets beaucoup
2247360	2247960	d'argent de côté
2247960	2249600	avec tes salaires remplis
2249600	2250080	au premier.
2252300	2252740	Stade,
2252840	2253560	j'ai rien mis de côté,
2253660	2254020	c'est terrible.
2254500	2255140	Et en vrai...
2255140	2256120	Toi, tu pars au Japon
2256120	2256800	alors que tu crois
2256800	2258140	que t'es connu.
2258280	2258660	Tu pars au Japon.
2258780	2259020	À ta place,
2259140	2259420	je suis en train
2259420	2260300	de travailler à la petite loge.
2261340	2262880	Ben, j'avoue,
2262880	2263560	j'ai un peu du mal
2263560	2264140	à mettre de côté.
2264660	2265560	Et c'est vrai
2265560	2266180	qu'à mon âge,
2266240	2266720	c'est débile
2266720	2267780	parce qu'en fait,
2267900	2268800	il reste 25 ans
2268800	2269220	avant la retraite.
2269360	2269720	Donc en fait,
2269920	2270320	un an,
2270420	2271620	c'est un 25ème de...
2271620	2272460	25 ans,
2272500	2272840	25 ans,
2272880	2273200	tu t'emballes.
2273300	2273740	Je pense que nous,
2273800	2274660	on ira continuer
2274660	2275840	un petit moment après.
2276340	2276800	Mais ça,
2276860	2277360	c'est un beau sujet,
2277540	2278860	la gestion de l'oseille.
2278920	2279240	Qu'est-ce que tu te vois
2279240	2280340	en retraite, toi ?
2280340	2280720	J'en sais rien.
2280780	2281220	Je pense que nous,
2281300	2281840	on fera peut-être
2281840	2283200	du stand-up,
2283280	2283820	des pauses.
2283820	2284540	On reviendra,
2284720	2285480	on fera d'autres trucs.
2285480	2286620	Moi, je fais une pause
2286620	2287800	après le premier spectacle.
2288460	2289260	Premier genou qui pète,
2289320	2290060	je fais une petite dépression
2290060	2290480	de trois mois,
2290600	2291300	après je reviendrai.
2291540	2292320	Moi, j'aimerais passer
2292320	2293720	acteur.
2294220	2294900	On sera tous les deux
2294900	2295240	en dépression.
2295460	2296160	On fera du Andy Paddle.
2296360	2297220	Mon rêve,
2297300	2297820	ce serait d'avoir
2297820	2299940	un gig à la...
2299940	2301160	Louis Labroquante.
2301320	2301400	Alors,
2301460	2302440	qu'est-ce que c'est un gig ?
2302440	2304120	Un boulot,
2304260	2304980	un job,
2306060	2306940	un rôle.
2306940	2307800	Oui, un gig.
2308000	2308820	Ah, d'être acteur.
2308840	2309380	Tu compiens de tes vieux.
2309660	2311020	Tu veux être acteur ?
2311020	2312100	C'est de l'américain.
2312120	2312460	La vieillesse,
2312540	2313080	c'est quand tu dis gig,
2313140	2313520	non ?
2313520	2314260	C'est de l'américain.
2314400	2315240	Alors, c'est pas un vieux mot,
2315300	2315880	c'est pas un gig,
2316000	2318280	c'est un mot anglais en fait.
2318380	2319260	Ah, pardon, excuse-moi,
2319340	2320740	c'est moi qui suis pas à jour.
2320820	2322140	C'est quoi un gig en vieux français,
2322280	2322900	ça se dit à Moulin ?
2322900	2323800	Je pensais que c'était un gig en vieux français.
2323800	2323900	Un gig,
2323960	2324940	il y a des trucs qui ressemblent
2324940	2325540	à un gig,
2325600	2326060	un gigot,
2326120	2326500	un gigot.
2326520	2327500	Ah, regarde-moi l'onde,
2327580	2327940	un gig.
2328940	2329100	Non.
2329220	2329820	Tu vois que tu voudrais
2329820	2331060	prendre un autre métier ?
2331060	2331260	Non,
2331440	2332300	ce qui serait bien
2332300	2333580	pour la vieillesse...
2333580	2334040	Il serait temps
2334040	2335120	de prendre un autre métier.
2338360	2338720	Attends,
2338720	2340740	tu vas vendre des antiquaires.
2340880	2341560	Tu es antiquaire ?
2341560	2341820	Non,
2341960	2343120	on va te confondre
2343120	2344520	avec le matériel.
2345800	2347220	Pas vraiment faire des brocantes
2347220	2347880	dans du cul.
2348080	2349120	Je voudrais l'acheter, lui.
2350700	2352200	Pas vraiment faire des brocantes,
2352560	2353720	avoir un truc
2353720	2356420	d'être le petit vieux acteur
2356420	2357680	dans un téléfilm de merde.
2358100	2358700	D'être,
2358880	2359060	voilà,
2359180	2359860	Victor Lanoue,
2360080	2360400	il faisait,
2360460	2360560	oui,
2360600	2361080	la brocante,
2361160	2361680	il devait travailler
2361680	2362520	un mois par an,
2362640	2363320	tout le monde le connaissait,
2363380	2364140	il avait plein de thunes.
2364500	2365280	Dans notre métier,
2365360	2365820	je trouve ce qu'il y a
2365820	2366200	de plus cool,
2366260	2367420	tu fais acteur un mois
2367420	2368440	dans une série de merde
2368440	2369980	qui dure des années.
2370580	2370860	Non.
2372300	2372620	Ça,
2372720	2373160	je pense que c'est
2373160	2374200	le meilleur rapport,
2374480	2375260	rien branler,
2375500	2376000	argent,
2376600	2377740	les gens t'aiment bien,
2378600	2379920	bon côté de la célébrité.
2380280	2380580	Mais toi,
2380780	2381540	tu es déjà à l'âge
2381540	2382600	où tu veux rien foutre.
2382700	2382800	Moi,
2382860	2383980	j'avoue que j'ai un peu
2383980	2385560	encore ce truc de...
2385560	2388180	J'ai besoin de faire des choses,
2388460	2388960	pour moi,
2389020	2390080	mais même faire des choses.
2390840	2391720	J'ai pas dit maintenant.
2391740	2392520	Il y a deux manières de réussir.
2392620	2393180	Il y a comme Urbain,
2393480	2394380	tu en fais le moins possible
2394380	2395160	et tu es libre.
2395440	2396820	Ou alors tu niques tout
2396820	2397800	et tu es libre après.
2398020	2399180	Ou alors parce que tu te réalises.
2399480	2399620	Ouais,
2399680	2400720	mais pas niquer tout,
2400840	2401440	parce qu'après,
2401600	2403060	niquer tout et prendre de l'argent,
2403260	2403480	après,
2403640	2403840	les gars,
2403880	2404320	ils en veulent plus.
2404800	2405520	C'est très rare,
2405600	2406260	les gars qui s'arrêtent.
2406520	2407040	Et à Franjo,
2407080	2407680	il pourrait s'arrêter.
2407960	2409540	Il a 15 millions sur le compte.
2410180	2410600	Mais il se dit,
2410700	2412140	il m'en faut 50.
2412280	2413000	J'ai pas un flèche.
2413080	2413740	Je t'ai pas dit maintenant.
2413740	2415000	Et c'est la faute à Pépère.
2415360	2416900	J'ai encore la dalle.
2417040	2417400	À mon avis,
2417560	2418240	mais j'ai encore la dalle.
2418340	2419160	Mais dans 20 ans,
2419520	2420560	j'avoue que...
2420560	2421400	Ils te le disent,
2421500	2421920	les comiques,
2422020	2422880	ils commencent à faire acteur.
2423000	2423180	Ils disent,
2423500	2423860	ça va.
2424140	2425040	Par rapport...
2425040	2425840	Il y en a très peu
2425840	2425900	qui...
2425900	2426380	On me rend l'un peu.
2426380	2428340	Et surtout,
2428500	2429360	si t'as un truc genre
2429360	2430860	une petite série télé Pépère,
2431680	2431960	ça va.
2432880	2433260	Tu vois,
2433300	2434500	une journée type de tournage,
2434600	2435260	quand on me la décrit,
2435360	2435680	il y a des gens,
2435740	2436320	ça les fait kiffer.
2436860	2437680	Mais t'es posé,
2437800	2438040	de toute façon,
2438200	2439180	t'as juste 2, 3 sets,
2439300	2439920	sinon t'es tranquille,
2439980	2440900	t'es posé en loge et tout,
2440940	2441260	tu traînes.
2441380	2441660	Mais moi,
2441740	2442380	ça, je peux pas.
2442860	2443460	Je peux pas, ouais.
2443720	2443940	En fait,
2444020	2444920	je me rends compte
2444920	2446400	que j'ai besoin de créer,
2446540	2447340	de travailler vraiment.
2447420	2448140	Faut bouger, quoi.
2448300	2448520	Ah oui.
2448580	2450300	J'aime pas rien faire.
2450300	2451140	J'avoue qu'on se fait chier
2451140	2451660	sur un tournage.
2451660	2453080	Et que c'est dur
2453080	2453760	d'être chaud.
2453980	2454720	Maintenant, c'est maintenant.
2455320	2455540	Allez,
2455840	2456360	saute en rôle maintenant.
2456560	2457300	Les tournages YouTube
2457300	2458040	qu'on a fait ensemble,
2458120	2458520	on se fait pas chier
2458520	2459420	parce que tout va très vite.
2459620	2459880	Bah oui,
2459960	2460120	mais nous,
2460140	2460700	on est dans l'urgence.
2460720	2461580	C'est toi qui réalises,
2461700	2462900	donc ça s'arrête jamais.
2463080	2463440	Mais effectivement,
2463600	2463940	on fait tout.
2464280	2464920	Et c'est vrai qu'à la fin,
2465000	2465280	t'es rincé.
2465500	2467520	Quand t'as écrit,
2467800	2468700	que t'essaies de mettre en scène
2468700	2469000	le truc,
2469060	2470060	que tu joues toi-même dans les trucs,
2470160	2470760	que tu fais une tournage
2470760	2471520	de 8 heures.
2471680	2471980	C'est hardcore.
2472140	2472780	Alors que pour le coup,
2473080	2474400	acteur dans un petit téléfilm de merde,
2474400	2475220	quand t'es juste acteur,
2475300	2475980	t'as rien à faire,
2476160	2477080	tu viens quand...
2477080	2478120	C'est beau, quoi.
2478300	2479240	Et même mon court-métrage,
2479420	2480620	j'ai délégué,
2480640	2481340	bah du coup,
2481400	2482000	à 30 personnes,
2482100	2483320	ce que je fais d'habitude tout seul.
2483580	2483820	Ouais.
2484060	2484580	Je me fais chier.
2484860	2485220	T'es là, les gars,
2485300	2486000	est-ce que je peux faire un truc,
2486080	2486700	je peux faire le ménage,
2486820	2487100	tout de suite ?
2487100	2488500	On t'appelle après.
2488700	2489740	Ce qu'il disait de Maxime
2489740	2490320	dans le live,
2490400	2490980	où il disait qu'à un moment,
