start	end	text
6119600	6121440	Non mais il donnait des infos.
6121620	6123520	Mais il donnait des adresses et des ou de policiers.
6123680	6125580	Donc le ministère de l'Intérieur s'est un petit peu énervé.
6126680	6128600	Alors moi j'étais sur Twitter déjà depuis un an.
6128640	6130020	Ça s'est passé vers 2010-2011.
6130480	6133480	Ils ont fait une procédure en disant qu'ils avaient pas trouvé le détenteur de EU.org.
6134380	6135040	C'est bizarre.
6135500	6136700	Je suis dans le WIS.
6137780	6140000	Mais c'est encore les jeux de cons de juriste.
6140000	6144580	Pour essayer de convaincre le juge qu'il faut utiliser une action.
6145080	6146720	Et j'étais allé au procès.
6146940	6149380	Mais pour voir un peu ce qu'il se disait.
6150560	6153820	Mais j'ai quand même pas osé me lever pendant l'audience pour dire coucou je suis là.
6154000	6154280	C'est moi.
6154380	6155560	Je préférais fermer ma gueule quand même.
6158060	6158880	Donc voilà.
6159000	6160880	A la fin il y a eu...
6160880	6161600	J'ai quand même...
6162160	6165440	Le seul cas où j'ai enlevé un nom de domaine.
6165540	6168540	C'est que les fournisseurs menaçaient de bloquer toute EU.org.
6171320	6173640	Pour des raisons X ou Y.
6174720	6178040	Soi disant parce qu'il n'était pas possible de bloquer plus fin que EU.org.
6178040	6179740	Je ne sais pas si c'était vrai mais c'est ce qu'ils ont dit.
6180940	6181260	Bref.
6181660	6182500	Et donc voilà.
6182700	6186460	Tout ça pour dire le but c'était...
6186460	6187820	Et c'est encore de montrer que...
6187820	6191380	Parce que le nom de domaine c'est le truc qui nous rattache souvent à notre fournisseur.
6191500	6192600	C'était le but initial.
6193000	6194440	Or contournement.fr.
6194920	6197680	C'était aussi de dire que si on a son propre nom.
6197840	6199240	On devient indépendant.
6199680	6200680	Donc on n'a pas d'adresse.
6200680	6204480	Des adresses plombiers en wanadou.fr ou autre qui traîne encore sur les camionnettes.
6204640	6208200	On se retrouve bloqué chez des fournisseurs parce qu'on a distribué des cartes de visite dans tous les sens.
6208380	6213280	Donc pour moi si on veut dégoogliser ou défacebook easy ou quoi que ce soit.
6213280	6218160	C'est utile au moins de se prévoir un nom à soi.
6218920	6221660	Quitte à le renvoyer sur un gros fournisseur.
6221800	6223780	Mais ça permet au moins de faciliter la migration.
6224080	6225500	C'est comme une redirection web en fait.
6225900	6229100	Ça donne un niveau d'indirection de souplesse supplémentaire.
6229280	6231060	Et à l'époque je me rappelle on était...
6231060	6232400	Il y en avait d'autres qui faisaient ça.
6232480	6234660	Il y avait fr.st rappelons-nous dans les années 95.
6234920	6235280	Ah oui on avait ça.
6235380	6236600	95 jusqu'à 2000.
6236740	6238260	Fr.st c'était très utilisé ça.
6238400	6239020	C'est ça que je te plus ça.
6239060	6239500	Ouais je me souviens.
6239660	6241340	Ouais ouais il y en avait quelques-uns.
6241340	6243440	Mais toi ça fait 25 ans quand même ça dure un bout de temps.
6243700	6245540	Et en 2002 je crois que c'est en 2002.
6245720	6246900	Tu crées Gandhi.
6247400	6248340	En 99 on l'a créé.
6248560	6249700	Ah c'est en 99 que tu l'as créé.
6249780	6250020	D'accord.
6250720	6252520	On l'a créé la boîte en mai 99.
6253380	6256020	Et en fait parce qu'en fait ce qui s'est passé c'est qu'il y avait...
6256020	6257200	A l'époque il y avait eu le...
6257200	6260660	Juste avant il y avait eu le procès entre L.Altern et Estelle Hallyday.
6261540	6262300	Ah ouais ?
6262300	6263320	Ouais il y avait...
6263320	6264220	Entre qui et qui disons ?
6264220	6265900	Bah Altern donc Valentin Lacambre.
6266660	6267200	Ce qui s'était passé...
6267200	6267740	Altern.org.
6268020	6268700	Ouais Altern.org.
6268700	6271200	En fait il y avait un gars, un utilisateur d'Altern.
6271340	6272980	Qui avait scanné des photos de...
6272980	6275480	Je sais pas quel canard de Estelle Hallyday.
6276140	6277520	Seins nu sur une plage.
6277740	6279280	Qui les avait mises sur internet.
6279400	6279900	Sur sa page.
6280320	6282360	Et Valentin ou Alter...
6282360	6282960	Enfin Alterne plutôt.
6283060	6284500	S'était retrouvé assigné en justice.
6284820	6286940	Pour violation de la vie privée.
6287120	6288120	Alors qu'il était juste hébergeur.
6288400	6289340	Il était juste hébergeur oui.
6289460	6291760	Donc c'est là que...
6291760	6293500	Bah à l'époque que...
6293500	6294060	Alors c'était...
6294060	6296040	Je sais plus si c'était mort à l'époque ou pas encore.
6296120	6298360	On avait créé la UI avec Laurent Chemla et d'autres.
6298680	6300560	Donc l'association des utilisateurs internet.
6300560	6303960	C'était un peu une préfiguration de la quadrature.
6304260	6304400	Voilà.
6304540	6305260	C'était...
6305260	6307540	C'était un peu le même style de combat en fait.
6307620	6308820	Défendre les libertés sur internet.
6310120	6311560	Et en fait...
6311560	6316060	Laurent Chemla qui connaissait bien le sujet.
6317060	6317580	Défendu...
6317580	6318080	A aidé...
6318080	6319540	A participer à la défense de Valentin.
6319700	6320700	Pour...
6320700	6324120	Défendre quelque chose qui est encore à défendre aujourd'hui.
6324120	6326380	C'est l'indépendance des intermédiaires.
6327180	6328820	Donc le...
6328820	6334780	Que les intermédiaires techniques ne soient pas tenus responsables des contenus.
6334960	6335700	Et qu'ils puissent...
6335700	6335840	Voilà.
6335960	6337300	Qu'ils puissent faire leur travail.
6337460	6339120	Qu'ils n'aient pas besoin de censurer par...
6339880	6340080	Voilà.
6340460	6341240	Ce qui est super important.
6341320	6344140	Parce qu'effectivement si l'hébergeur est tenu responsable du contenu.
6344440	6347120	Ça veut dire qu'il fait de la censure littéralement pré...
6347120	6348740	C'est ça.
6349180	6350120	Avant même...
6350120	6354120	Dans ces cas-là ce qu'on observe c'est qu'il y a une interprétation.
6354760	6357000	Ça se passe par les conditions générales d'utilisation.
6357700	6362020	L'hébergeur va interpréter la loi au plus large pour se couvrir au maximum.
6362140	6363640	Les juristes vont blinder le contrat.
6363920	6364640	Et puis donc il va dire.
6364880	6367040	Désolé oui je sais que la loi en théorie autorise.
6367100	6368120	Mais moi j'ai pas envie de...
6368120	6369740	J'ai autre chose à faire que de réfléchir à ça.
6369860	6370940	Donc je vous coupe et puis c'est tout.
6371640	6372960	Donc en fait il y a eu ce procès-là.
6372960	6376380	Et à l'époque il était question de libérer...
6376380	6377820	Enfin libéraliser l'ICAN.
6378000	6379940	Donc l'ICAN c'est le truc qui gérait ComOrgnet.
6380520	6387000	Parce que vers 96 suite au .fr ComOrgnet sont devenus payants.
6387500	6388400	Orgnet ?
6388400	6388720	Ouais.
6389260	6390300	.com.org.net
6390300	6392900	Donc c'est la distribution des noms de domaine des...
6392900	6394300	Les noms de domaine de...
6394300	6395620	Enfin international.
6395820	6396800	Ce qu'on appelle les GTLD.
6397020	6397280	Global.
6398060	6400560	C'est pas US en théorie.
6400720	6402360	En pratique c'est plutôt de la législation US.
6402360	6404680	Mais c'est pas un nom attaché à un pays.
6404680	6406640	Parce qu'il y avait le point 1000, le point édu qui était...
6406640	6407640	Enfin le point édu était...
6407640	6409840	A l'origine l'ICAN était une émanation du gouvernement US.
6409940	6411700	Et je crois qu'après il s'est devenu autonome.
6411900	6412360	Je dis des bêtises.
6412360	6412820	Alors ouais.
6412880	6414040	Alors là je sais plus les détails.
6414160	6414220	Ouais.
6414240	6415020	Il y a eu des...
6415020	6415700	Tout un tas de...
6415700	6415920	Ouais ouais.
6415980	6416660	Il y a eu tout un tas de...
6416660	6418260	Je sais pas si ça a vraiment été changé.
6419400	6420680	Mais donc l'ICAN...
6421220	6421940	Enfin...
6421940	6424600	Ce qui se passait c'est qu'à l'époque il y avait une boîte qui s'appelait NSI.
6424720	6427320	Qui était en fait en position de monopole.
6427320	6429820	C'était un contrat avec le CNRS américain.
6429980	6433100	Le National Science Foundation.
6433780	6434140	NSF.
6434620	6436160	Qui gérait une partie...
6436160	6437140	Enfin sa partie d'internet.
6438260	6439320	Et bah...
6440220	6441320	NSI étant...
6441860	6443200	A envie de faire de l'argent en plus.
6443380	6444320	Et étant probablement...
6445200	6447140	En ayant peut-être la permission par son contrat.
6447240	6448380	A décidé de facturer les noms de domaine.
6448480	6448940	Assez cher.
6449040	6450060	C'était 45 dollars par an.
6450620	6450780	Oui.
6450840	6451380	Ce qui...
6451380	6451800	Oui.
6451840	6452740	Ce qui aujourd'hui est cher.
6452800	6453220	Mais à l'époque...
6453220	6453520	Je sais pas.
6453560	6455080	Je me rappelle plus exactement ce que...
6455080	6455940	Bah à l'époque c'était...
6455940	6456380	Oui c'était gratuit.
6456600	6457140	Pour les premiers en fait.
6457240	6457400	Ouais.
6457560	6457900	A le faire.
6458140	6459940	Et ce qui a permis d'écluser le retard.
6460060	6463380	Mais donc ça provoquait pas mal de...
6463380	6464560	De dissensions.
6464820	6468020	Et les américains ont décidé de mettre ce truc là en concurrence.
6468080	6470840	Parce qu'ils étaient en position littéralement de monopole à cette époque là.
6471420	6473800	Et donc on a découpé NSI en deux.
6473800	6476800	La partie qui ne peut pas être...
6476800	6477700	Comment dire ?
6477700	6479360	Qui est de fait en position monopole.
6479440	6479800	Enfin en position sans...
6480060	6482580	Une autorité centrale qui doit administrer les serveurs.
6482760	6483300	Les serveurs DNS.
6483500	6484160	On va pas faire ça à plusieurs.
6484300	6490080	Il faut qu'il y ait une autorité centrale qui diffuse la version de la zone qui fait autorité.
6490600	6491360	La version de référence.
6492340	6493060	Et...
6493060	6497720	Et a décidé d'attribuer en fait des licences aux boîtes qui le souhaitaient.
6498340	6499880	Donc en fait...
6499880	6501600	Donc Valentin a entendu parler du truc.
6501680	6502280	Valentin Lacambre.
6502780	6503780	Il en a parlé à Laurent.
6503780	6505220	Et qu'il connaissait EU.org.
6505380	6506780	Puisqu'il l'avait d'ailleurs hébergé...
6507580	6508860	Bah pas loin d'ici d'ailleurs.
6509040	6509740	Dans le 12ème.
6510060	6511580	Vous étiez pas du côté de la nation ?
6511580	6512280	Vers...
6512280	6513380	Bah non c'était vers la place d'Alligre.
6513760	6514340	Ah oui d'accord.
6514460	6514520	Ok.
6514760	6517320	Alors c'était un verleur sur une petite liaison 64 kilobits à l'époque.
6517520	6519900	Ça me paraît ridicule aujourd'hui.
6520460	6521000	Le numérisme.
6521120	6521580	C'était du...
6521580	6523020	Quasi du très haut débit de l'époque.
6523260	6523400	Ah ouais.
6523400	6525760	Et donc voilà.
6525960	6528420	Donc Laurent m'a proposé de fonder la boîte avec eux.
6528620	6530600	Et on a fait un petit dossier Ican.
6530960	6531920	Donc on se disait voilà.
6532020	6532460	Nous on était trois.
6532720	6534220	Vous étiez les premiers à faire ça non ?
6534220	6536520	Alors on n'était pas strictement les premiers.
6536760	6537120	Il y avait des personnes...
6537120	6537440	En France.
6537680	6540720	Ouais en France il y avait les gens d'Oléans notamment qui avaient déposé un dossier.
6540840	6543220	Ils étaient dans le truc de test en fait.
6543340	6544620	Ils étaient en amont.
6544740	6545080	En bêta.
6545360	6545540	Ouais.
6545540	6549320	Ils ont participé au test du système.
6550400	6551600	Nous on est arrivés dans la phase 2.
6552100	6554360	Mais Oléans c'était pas dans le but de vendre des domaines pas chers.
6554460	6558200	C'était dans le but d'arrondir leurs frais pour leurs clients habituels.
6559020	6559500	Ils ont...
6559500	6560840	C'était juste...
6560840	6561760	C'était pas là où ils avaient du biais.
6562060	6562420	Non non.
6562520	6563960	Ils n'ont pas cherché à vendre ça.
6564500	6565680	Je crois qu'il y avait Worldnet.
6566120	6568920	Donc qui était une des boîtes fondées par Xavier Agniel.
6568980	6570440	Je crois qu'ils voulaient lancer un truc aussi.
6570600	6570720	Ouais.
6570880	6572060	Mais ils ne l'ont jamais fait en fait.
6572180	6573060	On a lancé avant eux.
6573780	6575280	Et donc nous on a déposé un dossier.
6575280	6577720	Alors à l'époque je ne savais même pas me servir de Word.
6578180	6582720	On avait un truc écrit sur imprimante matricielle par Valentin.
6582920	6584200	On avait rempli ça au BIC.
6584660	6586520	Et après je crois qu'il a fait un truc plus propre.
6586760	6589200	On a envoyé les contrats à l'ICAN.
6589220	6590620	Enfin la soumission à l'ICAN.
6590640	6592540	On se disait non mais ils vont nous prendre pour des guignols.
6593060	6593940	Et en fait on a été pris.
6594160	6595420	Ils prenaient pratiquement tout le monde.
6596200	6601280	Mais pour expliquer le niveau d'ouverture.
6602340	6603420	Mais de bordel aussi.
6603420	6607120	Quand on a eu la validation.
6607360	6609640	On s'est retrouvé inscrit sur les listes internes techniques.
6610020	6612120	Et là il y avait des gars qui carrément venaient d'avoir la licence.
6612280	6613520	Et qui disaient écoutez nous on n'y connait rien.
6613700	6614920	On rachète le...
6614920	6618340	Si vous avez quelqu'un qui a fait l'oliciel en Java pour être registraire.
6618460	6619260	On est prêt à racheter quoi.
6619700	6621640	Parce qu'en fait vous n'aviez aucune infrastructure.
6621640	6625240	On avait accès à l'infrastructure de Valentin.
6625380	6627860	Il pouvait nous soulouer de l'espace dans ses racks.
6627860	6630900	A l'époque ça coûtait assez cher d'avoir des machines dédiées sur internet.
6631160	6631800	C'était pas...
6631800	6632620	Oui c'était pas comme aujourd'hui.
6632840	6634160	Un rack c'était 5000 euros par mois je crois.
6634240	6634600	Un truc comme ça.
6634720	6635300	Ah !
6635300	6636240	Ouais c'était ultra cher.
6636560	6637500	Bah t'avais ton rack par contre.
6637720	6638280	C'était voilà.
6638620	6638960	Après tu...
6638960	6641460	T'avais une connexion et puis tu mettais tes machines dedans comme tu voulais.
6641660	6641760	Ouais ouais.
6641860	6643980	Il avait des racks à Nanterre je crois.
6644560	6648000	Parce que je me souviens quand Gandhi.net a vraiment ouvert et ça devait être du coup
6648000	6648940	c'était encore en 2000 ?
6648940	6650720	C'était en février 2000.
6651360	6652020	Ouais c'est ça ouais.
6652060	6653200	En fait à quelques jours près.
6653740	6654800	Mais ça on l'a su qu'après.
6654800	6655480	C'était...
6655480	6658720	Si tu regardes les courbes de crash.com c'est le jour où...
6658720	6662140	A deux jours près c'est le jour où le crash.com a commencé.
6662360	6664120	Ah la fameuse bulle des années 2000.
6664600	6668020	Et ça on a pu le constater qu'après parce qu'on savait pas si la baisse était...
6668020	6668180	Ouais.
6668180	6670320	Et nous en fait on a mis des mois...
6670320	6671160	En fait on avait...
6671160	6674220	On était tout prêt fin décembre 99.
6674680	6676560	J'avais passé la validation avec Verisign.
6676960	6678280	Enfin Verisign NSI à l'époque.
6679100	6680900	La validation technique.
6681180	6681800	Et les mecs pour...
6681800	6683240	Je me souviens il faisait nuit.
6683240	6685500	Moi il était minuit et demi à Paris avant le gros 10 soirs.
6686980	6688280	Et j'avais passé...
6688280	6689240	Et les mecs de Verisign...
6689920	6690980	Enfin de NSI merde.
6692320	6693980	Que j'avais eu au téléphone après la validation.
6694120	6695840	Mais il est quelle heure à Paris là ?
6695840	6696680	Parce qu'il était 6h...
6696680	6697720	18h30 chez eux quoi.
6698180	6700320	J'ai dit bah minuit et demi pourquoi ?
6700320	6701400	Et donc voilà.
6701480	6702620	Ils ont déjà vu qu'on était des fous.
6703320	6705260	Et après en fait on avait tout prêt.
6705500	6707920	Mais il nous manquait 100 000 dollars de caution.
6708500	6709140	100 000 dollars ?
6709140	6709300	Ouais.
6709560	6710420	Et on les avait pas en fait.
6710480	6712000	On avait fondé la boîte avec 7500 euros.
6712960	6713840	Et on les avait pas.
6713920	6714600	Donc on a dû emprunter.
6714680	6715160	Enfin on a fait...
6715160	6716800	On a fait le tour des banques.
6716980	6718260	Alors les banques je peux vous parler des banques.
6719060	6721140	100 000 dollars pour faire monsieur ?
6721140	6722980	Surtout qu'elle devait rien comprendre.
6723100	6723500	Elle est pas facile.
6723580	6724140	Bah non non ouais.
6724220	6728300	On avait entendu parler de ce qu'ils appelaient la BDPME.
6728420	6729960	C'était le premier nom de la BPI.
6730720	6732160	C'était la banque de développement des PME.
6732380	6735600	Et les banques pouvaient nous assister pour faire un dossier de demande d'aide.
6735720	6738980	Mais les banques disaient ouais écoutez ouais internet ouais bon ça a l'air intéressant.
6738980	6741160	Mais ça nous fait chier.
6741320	6741960	On a pas le temps quoi.
6742040	6742600	Ça nous fait chier.
6742760	6743700	Donc allez voir ailleurs.
6743920	6748080	Et puis bon à la fin on a pris des prêts.
6748440	6750020	Le genre de prêts à la conso perso.
6750260	6750980	C'était l'aime.
6751420	6751780	Ouais ouais ouais.
6751980	6753440	Moi j'ai pris dans ma banque normale.
6753600	6754180	Ouais ouais bien sûr.
6754260	6756740	En fait on a réuni 100 000 dollars entre nous.
6757580	6759200	Enfin on a pris le risque nous-mêmes.
6759700	6761480	Oui parce que c'est quand même une grosse somme surtout à l'époque.
6761940	6762320	Bah ouais.
6763060	6765400	En même temps moi j'ai le souvenir que quand Gandhi...
6765400	6767520	Enfin j'ai acheté mon premier nom de domaine chez Gandhi.
6767520	6769220	Et qu'à l'époque c'était super simple.
6769300	6771280	Alors que partout ailleurs où tu allais c'était compliqué.
6771560	6773460	Vous aviez fait une interface quand même qui permettait d'avoir un nom de domaine.
6773560	6774760	Assez simplement pour l'époque quoi.
6774980	6775580	Et c'était pas cher.
6776160	6777300	Oui bah on avait...
6777300	6777520	On avait pris...
6777520	6778140	On avait pris...
6778140	6779240	On voulait le...
6779240	6781660	On vendait en fait à 50% de marge brute.
6781800	6783520	C'est-à-dire on voulait que...
6784080	6786200	Vous aviez encore 50% de marge sur le truc qui était vendu.
6786200	6786800	Ouais parce que le truc il était...
6786800	6787520	On l'achetait 6 dollars.
6787760	6787900	Ouais.
6788340	6789640	Et on le vendait à 12 euros.
6789640	6790520	Par an.
6790660	6791220	Ce qui vraiment...
6791220	6792540	Parce que quand Thales j'ai d'autres registrats.
6792540	6794720	C'était genre 100, 200 balles par an.
6794720	6796560	C'était fou quoi.
6796940	6798600	Et j'ai ce souvenir là si tu veux.
6798660	6800640	Du fait que ça a vraiment démocratisé l'achat de nom de domaine.
6800940	6803080	Et du coup il y a plein de gens qui avant voulaient faire leur site.
6803160	6805340	Mais qui utilisaient justement des redirections, des fr.st etc.
6805800	6807220	Et qui grâce à Gandhi avaient...
6807220	6809580	On pu prendre un vrai nom de domaine.
6809680	6811180	Et du coup lancer de...
6811180	6811540	Ouais c'était le...
6812080	6812480	Ouais.
6812760	6814680	Et vous avez vu beaucoup de clients tout de suite ?
6814680	6815540	Ah bah oui parce que...
6815540	6818000	Ce qui s'est passé c'est...
6818000	6819540	On avait tablé...
6820240	6822460	Enfin on avait calculé qu'à la louche si on voulait...
6822460	6823540	Le but c'est le premier...
6824400	6826180	Enfin c'était de ne pas perdre d'argent.
6826340	6827200	C'était la jouer un peu.
6827220	6828420	De rembourser les 100 000 dollars déjà.
6828800	6829920	Ouais de rembourser.
6830040	6831800	En fait on a pu les rembourser assez vite du coup.
6832340	6836640	Mais on avait calculé qu'il fallait qu'on ait à peu près 5 000 euros de chiffre.
6836740	6837780	Non 5 000 euros ouais.
6837780	6840480	Quelque chose comme ça de chiffre d'affaires par mois.
6841260	6842840	Ce qui n'était pas grand chose.
6843000	6844200	Ouais parce qu'on avait vraiment tiré...
6844200	6845040	Enfin on avait...
6845040	6846760	On faisait ça sur notre temps libre.
6846900	6847660	Enfin on n'avait pas...
6847660	6848200	Ah oui vous n'étiez pas...
6848200	6848840	Vous n'étiez pas...
6848840	6850600	Non on n'était pas salarié du tout.
6850720	6850920	D'accord.
6850940	6851420	On n'avait rien du tout.
6851880	6854120	Donc en fait ce qui coûtait c'était les moyens techniques.
6854360	6856480	Donc c'était cher mais c'était pas non plus hors de prix.
6857180	6860960	Et donc en fait le premier jour d'ouverture on a dû vendre 100 domaines.
6861160	6862060	Donc voilà.
6862780	6863220	C'est pas mal.
6863340	6864800	Donc ça faisait quoi ?
6864800	6866860	1200 euros de chiffre d'affaires.
6866860	6869340	Donc on a vu qu'on n'en serait pas de notre poche.
6869740	6871100	Et après ça a monté.
6871240	6874100	Ce qui s'est passé c'est qu'assez rapidement on a fait du buzz effectivement.
6875200	6879960	Il y a eu un article dans Le Monde avec le papier de Laurent.
6880280	6882040	Ouais c'est le fameux papier Je suis un voleur.
6882160	6882880	Ouais c'est ça.
6883020	6883620	Je m'en souviens.
6883640	6884480	Entre une du monde.
6884940	6888300	Où il expliquait qu'en fait il vendait du vent parce que les noms de domaine au final c'était rien.
6888640	6889940	Il avait fait...
6889940	6892160	Je ne sais pas si c'était pas un article c'était plutôt une tribune.
6892660	6893740	C'était une tribune ouais c'est ça.
6894080	6894680	Une tribune ouais.
6895340	6897940	Et du coup ça a eu l'effet que tout le monde s'est précipité chez vous.
6898220	6900680	Ouais ça a fait monter les ventes significativement.
6900680	6902740	Ce qui est marrant parce qu'en fait c'est un peu le...
6902740	6904180	Enfin tu vois je n'aurais pu penser que ça n'allait pas forcément.
6904180	6906160	En fait la boîte n'était pas citée même dans Le Monde.
6906240	6907060	Ah ouais ok d'accord.
6907280	6908080	Ça s'est su.
6908300	6909020	Voilà on a...
6909020	6910240	Ouais on est monté...
6910240	6912400	En fait en septembre on avait...
6912400	6914320	Donc on a ouvert en février.
6914460	6916000	En mois de septembre on avait 100 000 noms.
6916000	6917480	Putain 100 000 noms c'est...
6917480	6918920	Donc en six mois.
6918940	6919180	Ah ouais.
6919900	6920060	Ouais.
6921120	6924700	Donc en fait en septembre on avait le volume d'activité du point FR en gros.
6925380	6925720	Ah ouais d'accord.
6925720	6928960	Parce qu'à l'époque le point FR il avait 100 000, 120 000 noms.
6929940	6934240	Donc ce qui s'est passé après c'est que le point FR...
6934240	6938120	Alors pas que à cause de ça bien sûr mais vu qu'il y avait de la croissance dans tous les sens.
6938340	6940680	Enfin il y avait le point DE qui montait à toute allure aussi.
6940680	6942680	Le point FR a fini par...
6943500	6943960	Par ouvrir.
6944540	6944740	Voilà.
6944900	6947100	Devant l'obligation de changer ses règles quoi.
6947220	6947880	Parce que ça...
6947880	6948960	Ouais la pression était trop forte.
6950120	6950680	Et euh...
6951200	6955580	Ça représente combien aujourd'hui Gandhi en nom de domaine par jour ?
6955580	6956960	Alors ça je sais pas j'y suis plus.
6958320	6961600	Ils ont publié des chiffres récemment je crois qu'ils ont quelques millions de noms de domaine là.
6962100	6964140	C'est un des principaux registreurs en France encore.
6964380	6964860	Ouais ouais ouais.
6965280	6967180	Et ça a commencé dans le 12ème à côté d'ici.
6968080	6968360	Comme quoi.
6968360	6968860	Alors ça...
6968860	6969740	Ouais enfin le...
6969740	6970320	Gandhi non.
6970460	6970740	Oui.
6971140	6972740	Gandhi on avait commencé...
6972740	6977060	Enfin enfin sinon ça a commencé à la fois dans le bureau de Laurent qui était dans le 12ème.
6977180	6978600	Le mien qui était dans le 13ème.
6978680	6980100	Enfin le bureau chez moi.
6982080	6985260	Et après on s'est installé rue Notre-Dame de Nazareth vers République.
6985480	6985780	D'accord.
6986040	6989200	Parce qu'il y avait David en fait notre troisième...
6989200	6991120	Notre quatrième pardon associé David Namias.
6992260	6996800	C'était quelqu'un que Laurent et Valentin connaissaient indépendamment et ils savaient qu'ils pouvaient s'occuper d'aspect...
6996800	6998680	J'ai quelques chiffres Captain Webb.
6998680	6999680	Oui.
6999680	7000720	From Wikipédia bien entendu.
7001360	7003720	Il y aurait 156 salariés aujourd'hui chez Gandhi.
7004240	7006600	Dixit Wikipédia.
7007120	7013260	Et le chiffre d'affaires en 2019 aurait été de 40 millions d'euros pour un résultat net de 4,8 millions d'euros.
7013720	7016040	Donc une marge d'un peu plus de 10%.
7016040	7018040	Mais c'est pas ça le nombre de...
7018040	7019040	Ah oui tu mets le nombre de...
7019040	7020080	Ah oui le nombre de...
7020080	7020140	Ah oui le nombre de...
7020140	7021600	C'est ça qui a fait ça.
7022280	7023500	Est-ce que ça baisse ou pas ?
7023500	7023860	Bah oui.
7024320	7026260	Je crois que c'est à peu près stable.
7026460	7027020	C'est stable.
7027260	7030040	Enfin ça se développe parce qu'il y a tout le temps de nouvelles extensions mais...
7030040	7031040	Oui il y a ça aussi.
7031040	7032640	Mais le marché est quand même relativement saturé.
7032740	7034180	Parce qu'au début vous aviez quoi comme extension ?
7034180	7035360	Vous aviez le .com ?
7035360	7035680	Comme Orgnet.
7036240	7036500	Comme...
7036500	7036980	Ouais ok d'accord.
7037040	7038460	Parce qu'en fait ce qu'on avait...
7038460	7040040	On avait estimé...
7040040	7043220	On avait fait des hypothèses conservatrices disons.
7043360	7047540	On avait calculé ce qui se passait si on récupérait...
