start	end	text
8867900	8871380	C'est les décollages chez Ryanair qui sont très verticaux pour économiser justement.
8871780	8872220	Ah c'est vrai ?
8872220	8873100	Sérieusement.
8873240	8874100	Quel enfer.
8874540	8875260	Moi qui déteste l'avion.
8875800	8878380	Alors on va peut-être parler du parti pirate ?
8878380	8878780	Pardon.
8878980	8879320	Quand même.
8879600	8880400	Alors dis-nous déjà.
8880420	8881180	Je crois qu'on n'est pas politique ici.
8881180	8881780	De quoi ?
8881780	8882260	Non mais c'est différent.
8882440	8883220	C'est technologique.
8883380	8883960	C'est le parti pirate.
8884120	8884420	C'est le template.
8884740	8884940	Bon ben oui.
8885180	8886220	Alors vas-y explique-nous.
8886420	8887880	Explique-nous ce qu'est le parti pirate.
8888100	8889800	Quels sont vos objectifs peut-être.
8889880	8892120	Fais-nous un petit pitch dessus.
8892220	8894620	Est-ce que c'est vrai que je pense qu'il n'y a pas de gens qui ne connaissent pas le parti pirate.
8894880	8895220	D'accord.
8895620	8896780	Le parti pirate est né.
8896920	8898200	Alors c'est des histoires d'ayant droit encore.
8899140	8899840	Sans surprise.
8900280	8901760	Il est né en 2006 en Suède.
8902640	8903180	Suite au...
8903700	8906580	C'est en liaison avec The Pirate Bay et les choses comme ça.
8906600	8907740	C'est bien ce qu'il me semblait effectivement.
8908020	8909020	Je crois me souvenir de ça.
8909020	8912740	Parce que le Pirate Bay est un gros site de partage de père à père.
8912880	8913300	C'est légal.
8913420	8913720	Précisons.
8913920	8915060	De vidéos d'un coup.
8915140	8915380	Oui.
8916700	8918740	La légalité qu'on peut questionner.
8919000	8920920	Dans un certain univers c'est légal.
8921020	8922700	C'est ce que j'ai expliqué à Adopi.
8922820	8923000	Oui.
8923500	8924120	C'est ça.
8924320	8924840	Et en fait...
8924840	8927720	Non parce qu'en fait il y a eu deux choses.
8927820	8928800	Il y a plusieurs choses qui se sont créées.
8928920	8929960	Il y a le bureau pirate.
8930100	8932000	Alors je ne sais plus exactement les détails.
8932460	8933960	Et il y a eu l'église pirate.
8934360	8934520	Ah.
8934520	8940420	C'est-à-dire parce qu'en Suède comme dans pas mal de pays les croyances religieuses sont protégées.
8940960	8946700	Et donc des gens ont créé l'église pirate en disant nous notre religion c'est de partager des contenus sur internet.
8947520	8948240	Et là les ailleurs droits étaient...
8948240	8951880	Et là on demande que notre croyance soit protégée.
8952040	8953860	C'est exactement ce qu'a dit là ton père.
8953860	8956160	Il a rajouté le mot mineur dedans mais...
8956160	8957820	Oh !
8957820	8958120	Ah bon.
8958800	8959480	Mon Dieu, au secours.
8960780	8961900	Donc au parti pirate...
8961900	8963360	Donc là ils ont...
8963360	8966680	Le parti pirate a démarré en Suède sur des choses comme ça.
8966820	8969920	Lorsqu'il y a eu les premières lois contre le piratage en Suède.
8970500	8972200	Et ça a sémé un peu dans toute l'Europe.
8972380	8974140	Et puis ça s'est élargi sur...
8974140	8976940	Donc surtout au départ les droits en ligne.
8977220	8980060	Donc les libertés contre la surveillance etc.
8980060	8982060	Enfin tout ce qui...
8982060	8985460	Sur l'idée que le numérique devenant le plus important dans nos vies.
8985600	8988440	Il fallait être en avance pour...
8988440	8990180	Enfin il fallait en protéger maintenant les libertés.
8990200	8992100	Défendre le réseau de la liberté.
8992260	8993320	La neutralité du réseau aussi.
8993440	8994040	Vous avez aussi...
8994040	8994500	Ah oui bien sûr.
8994660	8995900	Il n'y a pas de doute là-dessus.
8995960	8998480	Parce qu'on n'a pas parlé mais la neutralité du réseau c'est aussi un thème important.
8998760	9000880	C'est-à-dire qu'elle revient en cause maintenant.
9001020	9003040	Parce qu'il commence à y avoir des gens qui disent...
9003040	9004520	Vu les volumes de données.
9005080	9007560	Il y a des volumes de données qui sont plus ou moins légitimes.
9007560	9012460	Donc en fait on voit par les défenseurs de l'environnement.
9012560	9013920	C'est un certain défenseur de l'environnement.
9014540	9018060	L'idée que tes conneries de vidéos de chat ou ton porno t'es bien gentil.
9018100	9020880	Mais c'est moins important qu'une vidéo politique sur les éoliennes.
9021640	9022760	Que Greta Thunberg.
9023060	9023900	Par exemple oui.
9024240	9026680	Donc en fait on voit commencer à apparaître des jugements de valeur.
9026920	9027540	Pour dire voilà.
9027680	9032680	Donc il est important de réaffirmer que l'impact n'est pas...
9032680	9033640	Enfin c'est pas franchement l'endroit où...
9033640	9035140	Oui c'est pour détruire l'argument en fait.
9035740	9036420	Bah non pas que.
9036420	9041580	Il y a vraiment réellement l'impact du visionnage est vraiment exagéré.
9041700	9042540	Et du mail également.
9043000	9045840	Sur le mail il y avait une étude ADEME il y a une dizaine d'années.
9045980	9047580	Qui était un peu tirée par les cheveux.
9047680	9050440	Les auteurs eux-mêmes sont revenus dessus en fait.
9050640	9051420	Mais après c'est le...
9051960	9053460	Oui le message est resté quoi.
9053640	9054460	Le message est resté.
9054520	9055280	Il continue à se diffuser.
9055440	9058280	L'ADEME ne fait manifestement pas grand chose pour contrer le truc.
9058400	9059080	Parce que je ne sais pas.
9059140	9060620	Ils s'en foutent un peu manifestement.
9060620	9062620	Et...
9062620	9066100	Ouais donc parce que dans cette étude...
9066100	9069340	Enfin il y avait une étude liée où il t'expliquait qu'au bout de 17 pages.
9070120	9072580	Tu avais intérêt à imprimer ton document plutôt que de regarder le PDF.
9072740	9073320	Sérieusement ?
9073320	9073620	Ouais ouais.
9074620	9075780	Ça me paraît douteux quand même.
9075780	9078200	Déjà c'est basé sur les données de 2010.
9078380	9079820	En plus c'est fondé sur le fait que...
9079820	9082140	C'est fondé sur la consommation de ton ordinateur et de ton écran.
9083440	9084020	Enfin c'était...
9084020	9084100	Ouais.
9084220	9087180	Les auteurs eux-mêmes ont dit qu'ils avaient un petit peu poussé le bouchon.
9087420	9087560	Ouais.
9087620	9088560	En même temps moi je suis pas l'impression.
9089500	9089880	C'est vrai.
9090060	9090320	C'est vrai.
9091160	9092100	Toi t'es un voleur.
9093160	9093780	C'est que ce mec...
9093780	9094480	20 centimes de page.
9094600	9097560	Au prix où tu fais payer la page c'est quand même moins cher de consommer.
9097860	9099540	Le papier a beaucoup augmenté.
9099800	9102700	S'il y a bien un mec responsable de la mort des bébés valennes c'est toi.
9102700	9103080	C'est vrai.
9103080	9104220	Alors faut savoir qu'il est capté le web...
9104220	9104680	C'est clair.
9105240	9106040	Assassin !
9106040	9106900	Tous les ans...
9106900	9109260	Rarement plus une demi-tonne de papier par mois.
9109660	9110700	Tous les ans il part en amasinant.
9110700	9111820	Pieur d'arbre !
9111820	9114040	Une demi-tonne ça remonte une voiture sans problème quand même.
9114280	9115140	Ouais c'est une grosse paie.
9115320	9115900	Ouais d'accord.
9116620	9117420	Ça pèse son poids.
9117700	9119140	Après il y a le problème des bulletins de vote.
9119460	9119820	Ah c'est vrai.
9119900	9121740	On pourra peut-être en parler.
9121820	9123360	Effectivement comme on parle du parti pirate.
9123460	9124440	Mais il continue et puis après on va pas.
9124440	9125060	Et donc voilà.
9125060	9127820	Donc le parti pirate s'est créé autour de ses idées.
9128080	9132840	De ses idées de défense des libertés du réseau notamment.
9133080	9134580	Et liberté sociétale en général.
9135160	9138540	Et puis après il a élargi un peu son spectre pour avoir un programme complet.
9138840	9141400	Donc c'est plutôt écolo au niveau...
9141400	9143140	Il y a un vrai programme complet ?
9143140	9144420	Écolo mais pro...
9144420	9148600	Tu peux voir sur partipirate.org le site français.
9149000	9150560	Je l'ai lu le programme.
9151640	9153400	Effectivement ça aborde tous les sujets.
9153720	9154160	Alors c'est marrant.
9154380	9155280	C'est intéressant.
9155460	9155880	Moi je suis assez appareil.
9155920	9158060	Vous êtes écolo mais pro-nucléaire.
9158800	9158940	Oui.
9159100	9160580	Alors un pro-nucléaire c'est pas le mot.
9160680	9161000	Enfin oui.
9161140	9162640	Parce qu'on se fait cogner dessus là-dessus.
9162900	9163760	Mais l'idée...
9163760	9165740	Les écolos commencent à revenir sur leur position.
9165740	9168660	Même en Allemagne ça commence à chauffer là-dessus.
9168800	9170580	Parce que c'est ce qui consomme le moins de CO2.
9171300	9172800	Parce que l'idée c'est que...
9172800	9175180	Alors déjà le parti pirate...
9175180	9176020	Enfin les partis pirates...
9176020	9177080	Il y a un programme européen.
9177260	9179240	Donc ça c'est aussi une chose qui est sympa.
9179340	9180920	C'est que le parti pirate est pan-européen.
9181100	9183560	Et enfin défend l'idée d'une Europe en fait.
9183940	9185880	Et pas souverainiste au sens nationaliste.
9185880	9188940	Donc il y a un programme européen commun.
9189080	9191980	Qui affirme l'importance de la prise en compte de la science.
9192100	9193200	Dans les décisions politiques.
9193380	9194740	La science ne doit pas prévaloir.
9194920	9196260	Mais elle doit être utilisée.
9196320	9198020	On ne doit pas prendre des décisions contraires.
9198640	9200440	Enfin niant un avis scientifique.
9200660	9203380	Ce qui peut se faire notamment sur le nucléaire.
9203440	9205260	Ces deux dernières années toi un petit peu...
9205260	9205480	Ouais.
9206400	9207540	On a un peu fait du mal là.
9207720	9209280	Ouais bah il y a les antillons, les machins.
9209580	9210920	Ouais ouais c'est compliqué.
9211160	9212100	Ouais il n'y a pas que les deux dernières années.
9212260	9213440	Mais effectivement en ce moment on voit...
9213440	9215540	Je veux dire en tout cas le public est au courant depuis deux ans.
9215540	9216100	Ouais ouais ouais.
9216560	9218580	Un avis scientifique n'est pas forcément un bon avis.
9219320	9219600	Oui.
9219720	9220580	Ah non mais oui tout à fait.
9220660	9221040	C'est ça que je veux dire.
9221060	9221940	Ah oui oui oui tout à fait.
9222100	9222480	Il faut...
9222480	9224340	Mais il faut quand même écouter le consensus.
9224980	9225780	Ouais bah oui oui.
9226120	9229480	Bah là aussi c'est le consensus qui se fait.
9229680	9231200	Parce qu'on était un peu dans un truc inconnu.
9231340	9232600	Donc il est normal qu'il y ait eu des...
9232600	9232700	Voilà.
9233240	9234800	Après sur les trucs comme le nucléaire.
9234900	9236540	L'idée c'est de dire...
9237060	9238100	C'est pas parfait mais...
9238100	9238680	C'est pas parfait.
9239080	9241320	Effectivement c'est un truc un peu dangereux et dégueulasse.
9241900	9242080	Voilà.
9242760	9245300	Mais dans la réalité activelle des choses c'est ce qu'on pense.
9245540	9246700	C'est de décarboner.
9247200	9248820	Si on trouve mieux que le nucléaire très bien allons-y quoi.
9249300	9252580	Pour l'instant on voit rien de vraiment crédible en masse.
9253100	9254880	Il y a les éoliennes et le solaire c'est sympa.
9255060	9257480	Mais c'est des petites quantités d'énergie.
9257720	9259760	Qui n'est pas en plus maîtrisable.
9260020	9260820	C'est intermittent.
9261160	9261860	Ouais c'est intermittent.
9262300	9262400	Voilà.
9262400	9267620	Donc en France en fait on se pose le problème de la transition énergétique.
9269020	9269920	Qui n'est pas vraiment...
9269920	9273480	Enfin avec le nucléaire on n'a pas vraiment besoin de décarboner l'électricité.
9273600	9275940	Je crois que la France c'est un des meilleurs élèves entre guillemets.
9276020	9279460	Mais le problème qu'on a c'est qu'on a un parc de centrale qui est très vieillissant.
9279460	9280060	Qui est très vieillissant.
9280360	9280380	Qui a 40 ans.
9280380	9281760	Qui dans un mois était fait pour durer 20 ans.
9282000	9282660	Qui a été...
9282660	9285400	Enfin c'était prévu pour durer au moins 40 ans.
9285400	9286980	Mais sachant que c'est...
9286980	9287760	Si ça fait plus...
9287760	9288820	Enfin c'est comme quand t'achètes une bagnole.
9288960	9290180	Tu penses la garde des 15 ans.
9290260	9291360	Si tu as la garde de 25 ans t'es content.
9291540	9291660	Ouais.
9291920	9293580	Enfin sauf qu'il peut y avoir des problèmes de sécurité.
9293880	9293960	Ouais.
9294180	9296800	Après t'as des visites décennales avec l'ASN.
9296880	9297800	L'autorité de santé nucléaire.
9297900	9297980	Voilà.
9298200	9300100	Et après t'as le problème du grand carénage.
9300200	9300720	Dont on parle.
9300780	9302100	Et en fait le gouvernement est en train...
9302100	9303300	Alors je suis pas spécialiste de la chose.
9303540	9304740	On avait reçu M. Z.
9304840	9306620	Qui lui est un spécialiste de la sécurité des centrales nucléaires.
9306640	9308100	Je crois que le grand débat aujourd'hui c'est de se dire.
9308260	9309500	Est-ce que...
9309500	9311120	On se lance dans le grand carénage.
9311200	9313100	Parce que c'est des quantités d'argent colossales.
9313620	9316280	Le démantèlement aussi a jamais vraiment été prévu.
9316680	9317120	On voit que c'est compliqué.
9317120	9319540	Ce que j'ai lu de gens qui...
9319540	9320380	Normalement connaissent.
9320640	9321620	Ne peuvent pas nommer.
9321720	9322460	Il y a Tristan Camin.
9322620	9323300	Notamment sur Twitter.
9323460	9325200	Qui parle de ces sujets.
9326140	9328000	Il y a 50 milliards pour le grand carénage.
9328220	9329660	Ou c'était peut-être Ledger aussi.
9329760	9330100	Je sais plus.
9330200	9332080	Les deux creusent ces sujets-là.
9332860	9334620	Le grand carénage c'est 50 milliards.
9334620	9336780	Je crois que c'est de 2014 à 2025.
9337980	9339440	Et puis année par année.
9339840	9344620	Et le grand carénage c'est appliquer les retours d'expérience de Fukushima.
9345080	9345920	Au niveau sécurité.
9346300	9347340	Sur les centrales françaises.
9348320	9350260	Et en fait on en a fait les trois quarts.
9350660	9352900	Donc il reste encore quelques milliards à dépenser là-dessus.
9353000	9353580	Mais c'est fait.
9353900	9356700	Après il y a la version 100 milliards.
9356960	9357920	C'est plus le grand carénage.
9358120	9360180	Je crois que c'est une évaluation de la cour des comptes.
9360220	9360820	De ce que j'ai compris.
9360820	9362500	Donc ça inclut le grand carénage.
9362640	9364060	Plus un certain nombre de dépenses.
9364220	9366080	De fonctionnement ou d'investissement.
9366600	9367960	Sur le nucléaire.
9367960	9369680	Et après il y a la version Mélenchon.
9369760	9370440	C'est 150 milliards.
9370540	9371340	Il a rajouté 50 milliards.
9371420	9372160	On ne sait pas d'où ils viennent en fait.
9372580	9373560	Enfin pas que Mélenchon.
9373740	9376360	Un certain nombre d'anti-nucléaires.
9376820	9378260	Gonflent l'addition à 150 milliards.
9378480	9379580	Mais ça ne correspond à rien.
9379860	9381440	Donc en fait le grand carénage.
9381560	9382600	Il est à peu près fait.
9382600	9384760	Après ce qu'il peut y avoir à faire.
9384860	9386620	C'est les visites décennales.
9386780	9387740	Qui permettent de dire.
9387860	9388420	Au bout de 40 ans.
9388580	9390540	Est-ce qu'on repousse.
9390680	9391020	On prolonge.
9391200	9392100	Au bout de 120 ans.
9392180	9392680	On peut y aller.
9393220	9395200	Et c'est aussi pour ça que c'est intéressant.
9395200	9395780	De voir.
9395940	9397420	De lancer des tranches d'EPR.
9398300	9399640	Et puis il y a la fameuse histoire.
9399640	9400980	Qu'a lancée Macron il n'y a pas longtemps.
9401120	9402020	Des mini réacteurs.
9402020	9402260	Des nouveaux.
9402520	9402740	Ah ouais.
9402800	9403240	Les SMR.
9403640	9404300	La Russie.
9404640	9405800	Ils sont en pointe.
9405940	9406660	Je ne vais pas dire en pointe.
9406720	9408060	Mais ils ont déjà commencé il y a un bout de temps.
9408140	9408760	Ils avaient leur centrale.
9408820	9409640	Il ne faut peut-être pas trop les suivre.
9409640	9411740	Non je ne dis pas ça comme un exemple.
9411820	9412960	Ils avaient leur fameuse centrale flottante.
9412960	9414600	C'est ce qu'ils avaient envoyé.
9414840	9416280	Pour alimenter certains villages.
9417060	9417920	Alors en ce moment on a des frontières.
9417940	9419500	Après les SMR c'est ce qu'il y a dans les sous-marins.
9419680	9420780	Ou les portes-avions je crois.
9421120	9421840	Donc c'est.
9422420	9423360	Ah ça fonctionne.
9423780	9424220	Ça fonctionne.
9424740	9425160	Alors je.
9425180	9425880	T'en mets un place d'aligre.
9426020	9426780	T'alimentes au moins.
9426960	9428580	Donc au parti pirate.
9428580	9430260	Vous avez quand même vraiment une position.
9430500	9432140	Enfin un avis aussi sur l'environnement.
9432860	9432960	Oui.
9433880	9433920	Ouais.
9434160	9435580	Bah la nécessité de décarboner ça.
9435640	9436140	Il n'y a pas de doute.
9436480	9437820	Et quel succès pour le parti pirate.
9437820	9439800	Vous avez réussi à remporter des grandes victoires.
9440000	9441200	Ou à pousser la législation.
9441420	9441440	Alors on a des élus.
9441440	9442580	On a des élus à Marseille.
9443500	9445040	Dans la majorité municipale.
9445140	9446680	Mais pas sur une liste pirate.
9448320	9448920	Et après.
9449080	9450320	Bah on s'est présenté en 2019.
9451180	9452220	Avec une liste à nous.
9452340	9453680	Mais on n'a pas obtenu d'élus.
9453920	9455740	Parce qu'il y a tout un tas d'effets de seuil.
9455740	9457100	Enfin tout le truc français.
9457440	9459040	Pour dépasser la masse critique.
9459240	9459360	C'est pas.
9459440	9459580	Ouais.
9460080	9460780	Il faut faire.
9461020	9461820	Il faut avoir 5%.
9462900	9463340	Pour avoir.
9463640	9464040	On ne va pas entendre.
9464080	9464340	Pour avoir.
9464380	9464500	Ouais.
9464640	9464860	En fait.
9465100	9466040	Comme c'est du proportionnel.
9466100	9466860	Une fois que tu as 5%.
9466860	9467600	Tu décroches 4.
9469000	9469280	4.
9469520	9469740	Ouais.
9470640	9471200	C'est 4 d'un coup.
9471600	9472120	Ouais 4 d'un coup.
9472180	9472560	En fait.
9472680	9473340	C'est proportionnel.
9473420	9473900	Mais par palier.
9474120	9474380	C'est ça.
9474700	9475340	C'est des paliers.
9475400	9476280	Qui ont été demandés par la France.
9476360	9476420	D'ailleurs.
9476540	9478220	Ils ont fait chier les Allemands.
9478500	9479420	Au niveau européen.
9479580	9479920	Pour que.
9480240	9481040	Parce que les Allemands avaient.
9481280	9482080	Un élu pirate.
9482200	9482900	C'était Julia Reda.
9483720	9484420	Je ne sais pas.
9484700	9485260	Où ça en est.
9485340	9485980	Mais les Français.
9486060	9486700	On tentait de faire monter.
9486820	9487420	Qui avaient été élus.
9487480	9488860	Avec quelque chose comme 1%.
9488860	9490940	Et les Français.
9491020	9492080	On tentait de faire monter la barre.
9492740	9493860	Pour changer les conditions.
9494220	9495020	Qui auraient abouti.
9495020	9495940	Est-ce qu'elles n'auraient pas été élues.
9495980	9496380	En 2014.
9496640	9496760	En fait.
9497700	9498620	Donc il y a tout un tas.
9498940	9499620	D'effets.
9499800	9500880	De seuils.
9500960	9501140	Comme ça.
9501220	9502100	Après il y a le financement.
9502100	9502720	Des bulletins.
9502960	9503040	Donc.
9504020	9504540	On est obligé.
9504600	9505380	Pour le bulletin unique.
9505560	9505640	Voilà.
9506020	9506160	Oui.
9506260	9506840	Ce qui ne serait pas con.
9506920	9507460	Ce qui se fait.
9507640	9508220	Dans d'autres pays.
9508360	9508540	D'ailleurs.
9509280	9510020	J'imagine que vous êtes.
9510300	9511280	Contre les machines à voter.
9512480	9512960	Plutôt contre.
9513020	9513120	Ouais.
9513200	9513520	Plutôt contre.
9513640	9514260	Même si ça.
9514320	9514480	En fait.
9514500	9515080	Ça nous arrange.
9515280	9516180	Parce que la machine à voter.
9516280	9516940	T'as pas besoin de.
9517460	9518300	C'est la municipalité.
9518300	9518960	Qui paye les machines.
9519100	9519420	Et t'as pas besoin.
9519460	9520100	D'apporter des bulletins.
9520200	9520340	Ouais.
9520420	9521280	Mais en termes de transparence.
9521300	9521900	Mais ouais.
9522100	9522780	Ça provoque.
9522900	9524080	Ça pose des gros problèmes.
9524080	9524860	De transparence.
9524940	9525520	De dépouillement.
9525660	9525960	Parce que.
9526080	9526600	Le truc est.
9527500	9527740	Enfin.
9527880	9528800	Tu peux frauder.
9528920	9529580	Sans laisser de traces.
9529960	9530240	Après.
9530440	9531220	Tu peux aussi frauder.
9531380	9531800	Sans laisser de traces.
9531920	9532140	En papier.
9532240	9533160	Mais c'est beaucoup plus compliqué.
9533280	9533880	Ça peut vous arranger.
9534620	9534780	Oui.
9534920	9535720	C'est plutôt vos clients.
9536080	9536800	Qui vont frauder.
9536880	9538020	On va réfléchir à la question.
9538120	9538940	Est-ce qu'on pourrait pas imaginer.
9538980	9539800	Plutôt une machine à voter.
9539880	9540940	Ceux qui impriment juste ton papier.
9541040	9541200	Comme ça.
9541200	9542340	T'as pas besoin d'en imprimer 10 000.
9542460	9543460	Et qu'ils partent comme ça.
9543660	9543960	À voter.
9544060	9544260	Alors.
9544580	9545380	Je sais pas s'il y en a pas.
9545420	9546560	Qui fonctionnent comme ça.
9546820	9546960	Mais.
9547140	9548300	C'est pas le genre de modèle.
9548520	9548800	Parce que.
9548800	9549740	L'intérêt de la machine à voter.
9549820	9550320	C'est surtout pour.
9550520	9550680	Oui.
9550760	9552020	Pour les dépouillements.
9552020	9552520	Donc en général.
9552660	9552800	Ouais.
9552880	9553180	En général.
9553500	9554100	Ça marche pas comme ça.
9554260	9554400	Ouais.
9555120	9555400	Mais.
9555940	9556180	Ouais.
9556220	9556960	Donc les machines à voter.
9557080	9558020	On est plutôt contre.
9558200	9558260	Ouais.
9558520	9558920	J'imagine.
9559680	9559920	Après.
9560120	9561100	Pour du vote électronique.
9561180	9561260	Nous.
9561320	9562320	On fait du vote électronique.
9562960	9563880	Au sein du parti.
9564380	9565300	Un de nos.
9565660	9567120	Un de nos éminents membres.
9571200	9572000	Mode de vote.
9572060	9573300	Donc vote majoritaire.
9573640	9573940	Etc.
9574160	9574720	En open source.
9575120	9575340	Oui.
9575400	9575940	C'est en open source.
9576060	9576780	Ça s'appelle Congressus.
9576920	9577080	Ça doit.
9577080	9578040	Il a dû le mettre sur GitHub.
9578200	9578440	Normalement.
9579960	9580440	Et donc.
9580520	9580960	On s'en sert.
9580960	9581920	Au jour le jour.
9582200	9583480	Pour prendre des décisions rapides.
9583980	9584140	Voilà.
9584220	9584940	On s'en est servi.
9585200	9585960	En 2019.
9586260	9587500	Pour savoir si on faisait une alliance.
9587500	9588340	Avec une autre liste.
9588420	9588540	En fait.
9588960	9589840	Il y avait une liste.
9589960	9590220	Il y avait.
9590620	9591540	Des personnes qui étaient.
9591640	9592080	Les corsaires.
9593000	9593360	Quasiment.
9593580	9593660	Ouais.
9593840	9594300	Des mousses.
9594420	9594780	Je sais pas.
9595760	9597420	Des personnes qui étaient sur une liste.
9597540	9598500	Lancée par un gilet jaune.
9598600	9600160	Qui a fait défection.
9600160	9601900	Pour se barrer chez Le Pen.
9602220	9602720	Oui d'accord.
9602840	9603060	Et donc.
9603100	9603940	Elles étaient un peu dégoûtées.
9604140	9604360	Donc.
9604480	9605560	Elles nous ont proposé de.
9605940	9606520	Elles nous ont demandé.
9606620	9607920	Si elles pouvaient venir sur notre liste.
9608000	9608080	Donc.
9608120	9608680	C'est le genre de truc.
9608860	9609240	Parce que.
9612520	9613440	Aux élections européennes.
9613560	9615960	Il faut 79 personnes sur la liste.
9616140	9617780	C'est encore un autre truc compliqué en France.
9617880	9618720	C'est que quand tu as une liste.
9619000	9619420	C'est quoi.
9619540	9620480	C'est par département.
9620620	9620820	C'est ça.
9621080	9621360	Non.
9621460	9621500	Non.
9621640	9622200	Sur les européennes.
9622200	9624200	C'était régional à une époque.
9624300	9624440	Maintenant.
9624560	9624940	C'est national.
9625060	9625340	C'est national.
9625600	9625760	Ouais.
9625940	9626200	Et donc.
9626280	9626400	En fait.
9626440	9627280	Il faut 79.
9630160	9632320	Et en fait.
9632340	9633980	Comment vous faites pour le numéro 1 père ?
9633980	9634040	Du coup.
9634580	9634780	Bah.
9634820	9635020	Oui.
9635100	9635240	C'est ça.
9635340	9636780	On avait mis Flory en tête de liste.
9636860	9636940	Donc.
9636980	9638480	Il nous fallait une femme de plus que 2.
9638480	9638580	C'est l'heure.
9638700	9639540	Parce qu'elle était en tête.
9640160	9640860	Et en fait.
9641200	9641420	Le.
9642340	9643200	Le problème de ça.
9643340	9644040	C'est qu'en France.
9644160	9645440	On est obligé de finir une liste complète.
9645560	9647760	Sachant qu'on n'aura jamais 79 élus.
9647860	9647940	Oui.
9648000	9648200	Évidemment.
9648460	9648980	Aucun parti.
9649100	9649940	Même majoritaire.
9650060	9650980	N'aura pas 79 élus.
9650980	9651440	Mais en France.
9651540	9653240	La règle est qu'il faut fournir une liste complète.
9653500	9653860	En Suède.
9653920	9655000	Ils peuvent fournir des listes incomplètes.
9655080	9655780	Ce qui leur simplifie la vie.
9656080	9656280	Et donc.
9656320	9656560	On a eu.
9657020	9658000	Beaucoup de difficultés.
9658100	9659380	A boucler la liste.
9659640	9660380	On l'a bouclé.
9660760	9661040	Je crois que.
9661120	9661840	La veille du.
9662300	9662500	Du.
9662580	9663040	La deadline.
9663180	9663880	Pour déposer les listes.
9663960	9664100	En fait.
9665160	9665440	Donc.
9665800	9666040	Évidemment.
9666180	9666640	Inutile de dire.
9666720	9667400	Qu'on n'avait pas eu le temps.
9667400	9668380	De préparer les bulletins non plus.
9668480	9669320	Puisqu'on n'était même pas sûr.
9669340	9669780	De se présenter.
9671160	9671440	Et.
9671980	9672260	Donc.
9672260	9672380	Voilà.
9672460	9673420	Ça c'est des obstacles.
9674320	9674700	Vous êtes.
