start	end	text
1110000	1111000	Non c'est pour sauver les gens.
1111000	1112000	C'est pour aider la meuf à l'ortholing.
1112000	1114000	Ils ont une masculinité pas du tout toxique.
1114000	1118000	Il y a des meufs qui ont une féminité qui n'est pas…
1118000	1122000	Comment on dit ? C'est quoi l'inverse de masculinité toxique ? C'est féminité connasse ?
1122000	1123000	Grosse pute je crois.
1123000	1124000	C'est grosse pute.
1124000	1125000	C'est grosse pute.
1125000	1126000	C'est le terme générique.
1126000	1127000	C'est le terme féministe.
1127000	1128000	C'est le terme féministe.
1128000	1129000	Genre de la féminité égale grosse pute.
1129000	1130000	Ouais ouais.
1130000	1132000	C'est la dernière fois que j'ai parlé à une, j'évite de leur parler.
1132000	1135000	Mais quand elle te parle, elles disent que c'est ça.
1135000	1136000	Je pense mais moi non plus j'y connais rien.
1136000	1137000	Je n'en ai jamais vu.
1137000	1138000	Je ne connais aucune femme.
1138000	1139000	J'en ai jamais touché une.
1139000	1141000	Si quelqu'un est prêt à ce que je la touche…
1141000	1142000	On ne comprend pas ce qu'elles disent.
1142000	1144000	Apparemment on écarte les gens dans le métro, c'est incompréhensible.
1144000	1146000	Si j'ai des bols, c'est que je garde les jambes.
1146000	1149000	Ça n'a pas de sens si je les coince et automatiquement le sang ne passe plus.
1149000	1150000	Bon bref.
1150000	1161000	On aurait tous des voix aiguës.
1161000	1163000	Ça n'aurait pas de sens.
1163000	1164000	On se réveille dans le métro.
1164000	1165000	Ah bah ça va tous.
1165000	1168000	Moi je m'arrête à en enfer Rocheron et toi tu t'es…
1168000	1171000	Mais je m'arrête plus parce que j'ai trop mal au couille en fait.
1171000	1172000	Je vais rester là toute sa journée.
1172000	1175000	Putain on était bien partis, c'est très grave là ce qu'on dit.
1175000	1179000	Et donc même les femmes ont une féminité, Stilax,
1179000	1182000	Stilax, les hommes ont une masculinité Stilax,
1182000	1183000	les Whites…
1183000	1184000	Non, ils sont horribles.
1184000	1186000	J'allais dire il y a des Whites Stilax…
1186000	1187000	Non, alors j'allais dire…
1187000	1188000	Mais ils sont stylés !
1188000	1189000	Mais en fait…
1189000	1190000	Ils sont stylés !
1190000	1191000	Mais tu sais pourquoi ? Parce que là…
1191000	1192000	Le méchant vampire…
1192000	1193000	En fait c'est ça…
1193000	1194000	Tu sais pourquoi c'est ça ?
1194000	1195000	Et tu sais pourquoi ?
1195000	1196000	Je me suis dit…
1196000	1197000	Bon là on est quand même…
1197000	1198000	Il est trop stylé !
1198000	1200000	On est quand même vraiment très méchants,
1200000	1203000	mais en même temps, du coup, on est le Joker.
1203000	1207000	C'est-à-dire que méchant, horrible, mais du coup cool en fait.
1207000	1211000	Il est tellement méchant que c'est sympa en fait.
1211000	1213000	Le méchant vampire est exceptionnel.
1213000	1214000	Il est génial.
1214000	1215000	Il est génial.
1215000	1216000	C'est Satan en fait.
1216000	1217000	Il est trop bien.
1217000	1220000	Il me fait penser à ce film au début…
1220000	1221000	Blade.
1221000	1223000	C'est un film que j'adore.
1223000	1224000	Ah oui, il y a du Blade aussi.
1224000	1226000	Le premier méchant dans Blade,
1226000	1228000	c'est un peu comme le méchant de ce film.
1228000	1229000	Ouais, ouais.
1229000	1230000	L'angle des vampires…
1230000	1232000	On va en parler quand on va commencer à raconter.
1232000	1233000	Ouais, ouais.
1233000	1234000	Mais on peut.
1234000	1235000	Mais bon voilà…
1235000	1238000	Alors, il est évident du coup qu'on conseille le film.
1238000	1240000	Et que là, maintenant, on va le spoiler.
1240000	1242000	Donc, bah écoutez, si vous voulez aller voir le film,
1242000	1243000	c'est avec un gros plaisir.
1243000	1245000	Si vous aimez tous les rêves dont on vous a parlé,
1245000	1247000	je pense que vous allez passer un bon moment.
1247000	1249000	Je le conseillera à peu près tout le monde.
1249000	1250000	Donc voilà.
1250000	1252000	Allez, c'est parti !
1252000	1254000	Tu nous expliques le film.
1254000	1255000	Tu fais assez…
1255000	1258000	On a déjà fait 20 minutes, mais tu nous laisses expliquer le film.
1258000	1260000	Tu peux juste aller dans tous les détails,
1260000	1261000	mais tu fais le déroulé du film quoi.
1261000	1262000	Ouais, ok.
1262000	1264000	Alors, le film démarre…
1264000	1266000	Non, plus vite, un peu plus…
1266000	1268000	Allez, ok, un peu plus petit, pardon.
1268000	1271000	Alors, au début, c'est du jumeau, ils sont bons.
1271000	1273000	Un peu moins, un peu moins.
1273000	1274000	Je vais trouver un…
1274000	1275000	Voix du métro, gars plus de couilles.
1275000	1276000	Ok.
1276000	1277000	Alors, alors…
1277000	1279000	Alors, on est pas, ça passe !
1279000	1280000	S'il te plait, arrête de me déconcentrer.
1280000	1281000	Je te déconcentre plus !
1281000	1282000	Ma gaffe.
1282000	1283000	Ma gaffe.
1283000	1284000	Ma gaffe, mon malin.
1284000	1285000	C'est trop malade.
1285000	1286000	Euh…
1286000	1287000	C'est l'histoire de deux jumeaux.
1287000	1288000	Je m'ennuie.
1288000	1289000	C'est l'histoire de deux jumeaux.
1289000	1290000	Allez, arrête, c'est chiant.
1290000	1291000	J'arrête !
1291000	1293000	C'est l'histoire de deux jumeaux, joué par Michael B. Jordan.
1293000	1294000	Et Michael B. Jordan ?
1294000	1295000	Ultra stylax.
1295000	1296000	Le gars est magnifique.
1296000	1299000	Honnêtement, un soir de blues, qu'est-ce que je fais ?
1299000	1300000	Tu le…
1300000	1301000	Pompix !
1301000	1302000	Voilà !
1302000	1306000	Il a les plus beaux biceps du cinéma récent.
1306000	1307000	Il est magnifique.
1307000	1312000	Et en plus moi, il me gonflait un peu dans tous les films d'avant, là, parce que je trouvais qu'il jouait un peu monocorde, un peu chiant.
1312000	1315000	Et là, j'aime bien, parce qu'en fait tout le monde joue un petit peu avec ses voix de…
1315000	1316000	C'est vrai !
1316000	1318000	Il a les plus beaux biceps du cinéma récent.
1318000	1320000	Il a les plus beaux biceps du cinéma récent.
1320000	1321000	Et là, il a les plus beaux biceps.
1321000	1322000	C'est vrai !
1322000	1323000	Tu sais ce que je disais ?
1323000	1326000	Oh, je sais ce que tu disais, mais…
1326000	1329000	Je veux te dire la vérité de blues, mon chien.
1329000	1330000	Ma boi !
1330000	1332000	Ma boi !
1332000	1334000	Donc, il le fait hyper bien.
1334000	1342000	Et donc, il joue deux jumeaux, un peu ghetto, qui arrivent à ramener de la tease, parce qu'ils sont de Dal Capone, de New York, pour le ramener un peu…
1342000	1343000	De Chicago.
1343000	1347000	De Chicago, pour ramener un petit peu tout ça, en arrangant un machin, on sait pas trop où ça se passe.
1347000	1348000	C'est plus la Louisiane, la Mississippi.
1348000	1349000	Ah oui, je suis con, voilà.
1349000	1350000	C'est la Mississippi.
1350000	1351000	Voilà.
1351000	1353000	Et ils sont trop stylés.
1353000	1355000	Ils ont trop le mojo, ils sont trop stylés.
1355000	1357000	Donc, le film commence pas du tout…
1358000	1359000	Pas du tout vampire, en fait.
1359000	1364000	Le film commence sur un film un peu de western, ou dans un univers de black.
1364000	1371000	Et ces mecs-là, ils vont juste aller en ville parce qu'ils veulent organiser une soirée, parce qu'ils vont se faire kiffer, parce qu'il y a de l'alcool nulle part.
1371000	1373000	Donc eux, ils ont réussi à avoir de l'alcool.
1373000	1375000	Et ils vont aller voir…
1375000	1384000	Ils retrouvent leur cousin qui est un peu jeune, qui est trop sympa, qui est un gars un peu de church, qui est un petit church boy, mais bon, qui kiffe ses grands cousins et qui a un peu envie de traîner avec eux et d'être hyper cool.
1384000	1385000	Il a envie de s'acoquiner.
1385000	1386000	Il a envie de s'acoquiner.
1386000	1392000	Le gars, il a jamais ken de meuf, c'est un gars de la church, tu vois, machin.
1392000	1394000	Et qu'est-ce qu'il sait faire de ses 10 doigts ?
1394000	1397000	Il joue un espèce de petit banjo, là.
1397000	1404000	Alors, c'est une vraie guitare, par contre.
1404000	1405000	Ouais, c'est une vraie guitare.
1405000	1407000	C'est juste qu'elle sonne un peu à l'ancienne, mais c'est une vraie guitare.
1407000	1408000	Elle sonne un peu à l'ancienne, mais voilà.
1408000	1409000	C'est une guitare stylée un peu banjo.
1409000	1411000	Moi, j'ai envie de dire banjo, je dis banjo.
1411000	1413000	Pourquoi tu dis… c'est banjo, c'est banjo ?
1413000	1417000	Alors, j'ai respecté ta culture, hein, tout ce qui était…
1417000	1421000	Et là, c'est ma culture, tout ce qui est la gratte, la sicorde.
1421000	1424000	C'est pas dans ce podcast que quelqu'un va dire du mal d'une sicorde.
1424000	1425000	Excuse-moi.
1425000	1426000	Petite anecdote.
1426000	1430000	Un jour, je vais me faire réparer une guitare, et c'est vraiment la première guitare.
1430000	1433000	C'est Epiphone, c'est la sous-marque de Fender, c'est vraiment des merdes.
1433000	1435000	C'est ce que tu achètes à 120 euros.
1435000	1437000	J'avais presque honte de ma guitare.
1437000	1438000	Ouais.
1438000	1441000	Et du coup, je vais dans un beau magasin de guitare pour me la faire réparer,
1441000	1444000	mais j'ai presque honte parce qu'elle est nulle, c'est vraiment le premier prix.
1444000	1448000	Et je dis au mec, je voudrais la faire mettre même si c'est une merde.
1448000	1451000	Et là, il me prend la main et il fait, dis jamais de mal d'une guitare.
1451000	1457000	Au premier degré, c'est là que moi, jeune con, je veux faire style,
1457000	1460000	ouais, t'es le gars de la guitare, donc mon truc c'est une chiotte.
1460000	1463000	Et il a dit, il n'y a pas de mauvaise guitare.
1463000	1465000	Il était hyper sérieux.
1465000	1468000	Ça m'a fait rire avec mon frère.
1468000	1470000	Et en fait, il me l'a mis dans la gueule.
1470000	1473000	Il m'a dit, tu respectes toutes les six cornes.
1473000	1474000	C'est trop férif.
1474000	1475000	J'adore ce mec.
1475000	1479000	C'est les mecs qui laissent leurs mégots dans le sandard au moins une semaine.
1479000	1482000	Ils ouvrent la fenêtre, mais ça ne jette pas les mégots.
1482000	1483000	J'aime bien ça.
1483000	1485000	Et s'il faut les manger, on les mangera.
1485000	1488000	Non, mais c'était le respect du...
1488000	1489000	Il était là, j'aime toutes les...
1489000	1492000	Tu vois là, tu lui emmènes une vieille bagnole pourrie, un garagiste.
1492000	1494000	Non, non, mais une caisse est une caisse.
1494000	1495000	Ah, mais j'aime bien cet esprit-là.
1495000	1498000	Et donc, ils ont que leurs cousins jouent de la guitare.
1498000	1500000	Il est jeune, il est hyper sympa.
1500000	1501000	Eux, ils sont ultra stylés.
1501000	1503000	Ils organisent donc leur soirée.
1503000	1507000	Donc on les voit, on les voit en ville, on les voit un peu mettre des pains,
1507000	1509000	on les voit un peu mettre des...
1509000	1511000	se tirer un peu sur des gens.
1511000	1513000	Tu sens que c'est un peu le boss de la ville ?
1513000	1514000	C'est le boss de la ville.
1514000	1515000	C'est les boss de la ville.
1515000	1519000	Les boss de la partie Renois, parce qu'évidemment, ils sont courants qu'il y a la ségrégation.
1519000	1523000	Mais beaucoup, on nous rabâche quand même souvent que c'est compliqué pour eux
1523000	1525000	parce que c'est quand même les white qui dominent.
1525000	1526000	Ah bah tu m'étonnes.
1526000	1531000	En fait, on est pile dans cet entre-deux où il y a encore des Renois qui bossent dans les champs de coton
1531000	1535000	et ces coups durs, ça a des petits coups de fouet.
1535000	1539000	Mais il y en a qui ont réussi à s'émanciper, à gagner de la thune et on est pile dans cet entre-deux.
1539000	1544000	Pile dans cet entre-deux de, je sais pas, c'est peut-être la fin des années...
1544000	1547000	Allez, 1900...
1547000	1550000	1915, 1940 quoi.
1550000	1551000	Ouais, 20-30, ouais, ouais.
1551000	1552000	Tu vois, voilà.
1552000	1554000	Comme aujourd'hui avec les femmes, un petit peu.
1554000	1557000	On sent qu'elles vont se libérer, mais c'est pas fait.
1557000	1559000	Je te laisse ces propos.
1559000	1562000	C'est une blague qui peut être vue comme misogyne ou extrêmement féministe.
1562000	1565000	Moi, j'ai décidé de totalement repositionner mon image vis-à-vis des femmes.
1565000	1566000	Mais c'était une blague féministe.
1566000	1568000	C'est peut-être qu'elles sont pas encore libérées.
1568000	1571000	Car je n'ai pas encore d'enfants et j'aimerais bien que une personne...
1571000	1573000	Tu as des enfants, mais tu n'es pas au courant.
1573000	1575000	Alors, ça c'est autre chose.
1575000	1576000	Ah bah c'est autre chose, oui.
1576000	1581000	J'ai certainement un enfant qui a aujourd'hui une vingtaine d'années et que je ne connais pas.
1581000	1584000	Je peux citer les pays, les maladies qu'il a.
1584000	1585000	Je peux tout citer.
1585000	1588000	Je vois des gens qui te ressemblent en permanence.
1588000	1589000	J'en peux plus.
1589000	1592000	Tu sais, il y a des villes, il y a des endroits, il y a des quartiers d'Abidjan.
1592000	1596000	Tu sais comme le film John Malkovich où ils ont tous la thémette John Malkovich.
1596000	1599000	J'ai envie de repositionner mon image, j'ai envie de changer, je ne suis plus de mes hommes.
1599000	1600000	Bien sûr, mais tu es un homme de famille maintenant.
1600000	1601000	Je ne suis plus de mes hommes aujourd'hui.
1601000	1602000	Tu cherches une femme ?
1602000	1603000	Je cherche une femme.
1603000	1604000	Sérieuse ?
1604000	1607000	Sérieuse, une femme sérieuse, qui ne se drogue pas.
1607000	1608000	Très important ça.
1608000	1609000	Mais qui sait droguer quand même.
1609000	1610000	Mais qui sait droguer avant.
1610000	1611000	Bien sûr.
1611000	1612000	Très important.
1612000	1613000	Oui, oui.
1613000	1614000	Qui a l'énergie de...
1614000	1615000	J'ai connu les trucs...
1615000	1616000	Il faudrait qu'elle ait arrêté hier.
1616000	1617000	Ouais, exact.
1617000	1619000	Mais alors, putain tu me connais bien.
1619000	1620000	Ah bah oui.
1620000	1621000	Putain tu me connais bien.
1621000	1622000	Bon alors, peu importe.
1622000	1623000	Allez, on dit n'importe quoi.
1623000	1624000	Pas du tout.
1624000	1627000	C'est excellent, c'est le meilleur podcast de France.
1627000	1628000	Bon, bon.
1628000	1629000	Non mais c'est un régal.
1629000	1630000	C'est un régal.
1630000	1631000	C'est un régal.
1631000	1634000	Parce qu'à la fois on parle du film et on me dit des trucs perso, les gens s'y retrouvent
1634000	1635000	à force.
1635000	1636000	C'est ça qui est beau.
1636000	1637000	Là par exemple, on ne dit rien.
1637000	1639000	Là, ce que je dis là, il y a un gars qui est en train de se donner.
1639000	1640000	Énorme.
1640000	1644000	Là, il y a plusieurs personnes qui sont en train de se donner.
1644000	1645000	Mais c'est exceptionnel.
1645000	1646000	Ils sont trop forts.
1646000	1647000	Tu te tais.
1647000	1649000	Et donc, à un moment donné.
1649000	1650000	C'est encore mon podcast.
1650000	1652000	Je fais encore ce que je veux.
1652000	1653000	Tu arrêtes de m'en faire.
1653000	1654000	Tu vois, je t'ai mis de bien.
1654000	1655000	Qui t'invite ?
1655000	1657000	Le bouquin.
1657000	1660000	Ils arrivent à organiser cette fucking soirée.
1660000	1662000	Mais moi, je ne vais pas le sévère.
1662000	1668000	Ils arrivent à organiser cette soirée incroyable dans une espèce de série, une
1668000	1672000	espèce de truc en bois qu'ils ont réussi à louer à un mec, à un espèce de gros
1672000	1674000	white, plus ou moins du Ku Klux Klan.
1674000	1675000	Mais on ne sait pas trop d'où il vient le gars.
1675000	1677000	Leur but, c'est de créer un club de blues.
1677000	1678000	Ouais, c'est de créer un club de blues en fait.
1678000	1681000	À eux, parce qu'en fait, ils se font exploiter par les blancs.
1681000	1684000	Ils disent, on va créer notre club avec nos musiciens.
1684000	1685000	Exactement.
1685000	1689000	Et là, arrive cette partie du film que j'adore, qui est typique des années 90.
1689000	1693000	J'appelle ça le Make a Team.
1693000	1695000	C'est quand on a besoin des...
1695000	1698000	Alors, ça existe depuis les 12 salopards, Armageddon...
1698000	1699000	Ah oui, ça j'aime bien le Team.
1699000	1700000	Voilà.
1700000	1704000	C'est genre, on a une mission et pendant 20 minutes, on va aller chercher chaque gars
1704000	1705000	de la mission.
1705000	1707000	C'est aussi dans Blues Brothers, c'est dans un million de films.
1707000	1709000	C'est un vrai trope de films qui est...
1709000	1711000	Bon, on a besoin...
1711000	1713000	On a aller chercher le petit cousin.
1713000	1715000	On a besoin du joueur d'Harmonica.
1715000	1717000	Le vieux, trop stylé, alcoolique.
1717000	1718000	C'est trop bien.
1718000	1719000	J'adore.
1719000	1720000	Oui, il est trop bien.
1720000	1722000	Tout le monde a rigolé à ses interventions.
1722000	1723000	Oui, oui.
1723000	1725000	On a besoin du garde du corps.
1725000	1728000	Donc, on va dans un champ de coton choper le gars.
1728000	1731000	Et donc, ces scènes-là, c'est un truc qu'on a vu mille fois dans les films, mais
1731000	1732000	ça marche toujours.
1732000	1735000	C'est trop bien quand tu constitues la team qui tue.
1735000	1736000	Ouais, c'est trop bien.
1736000	1738000	Tu as toujours un gars qui revient sur les terres de son enfance et il dit,
1738000	1740000	non mais moi j'ai les 10 gars qui font.
1740000	1742000	C'est un des moments très très bien des films.
1742000	1744000	C'est limite mieux que le combat final.
1744000	1745000	C'est la constitution de l'équipe.
1745000	1746000	Exact.
1746000	1748000	Et là, l'équipe est trop stylée.
1748000	1749000	On a une chinoise.
1749000	1753000	Alors, ce que j'ai trouvé intéressant aussi, et d'habitude j'aurais crié au scandale
1753000	1757000	walkie, c'est insupportable, tout est fait contre les blancs et tout est fait pour gober
1757000	1758000	les balls des minorités.
1758000	1765000	Mais en réalité, la façon dont l'angle a été pris de montrer à quel point la culture
1765000	1770000	chinoise des débuts des Etats-Unis, la culture noire des débuts des Etats-Unis, la
1770000	1773000	culture indienne du début des Etats-Unis est ultra stylage.
1773000	1775000	Et ce n'est pas des gens qui parlent en mode
1775000	1777000	et
1777000	1782000	tu vois, c'est des Renois et des Chinois qui parlent en mode
1782000	1792000	et c'est pour montrer aux Etats-Unis d'aujourd'hui qu'en fait, les Etats-Unis, ce n'était pas genre les White qui l'ont créé et ensuite les Renois et les Chintons qui sont arrivés.
1792000	1794000	Tout ça, c'est la construction.
1794000	1796000	Tout s'est créé en même temps.
1796000	1800000	Alors bon, malheureusement, il se trouve qu'une des couleurs a dominé les autres.
1800000	1804000	Parce qu'une des couleurs a paraîté plus intelligent.
1804000	1808000	J'ai pas pu m'empêcher.
1808000	1809000	Je rigole.
1809000	1810000	Je rigole.
1810000	1812000	Mais attends, alors explique-moi.
1812000	1815000	Parce que là, je viens de dire que tout le monde est arrivé en même temps.
1815000	1816000	Tout le monde est Stilax.
1816000	1817000	Mais non.
1817000	1820000	Oui, mais c'est vrai qu'effectivement, quand tu as des gens qui arrivent dans des bateaux en mode St-Ouble.
1820000	1821000	Oui, c'est pas la même chose.
1821000	1822000	Et c'est pas la même chose.
1822000	1825000	Parce qu'il y a des gens qui sont arrivés de leur plein gré, il y a des gens qu'on a fait venir de force.
1825000	1826000	Et oui, c'est ça.
1826000	1827000	Ah, c'est ça.
1827000	1828000	Je dois t'expliquer l'histoire de ton peuple, tu me dégoûtes.
1828000	1830000	Non mais c'est vrai que c'est ça.
1830000	1831000	Putain, je suis con.
1831000	1839000	Oui, donc c'est vrai que les Hollandais, les Irish et les machins, eux ils arrivaient, on t'a déjà mis, bon toi Jean-Jean, tu faisais quoi quand t'étais en Irlande ?
1839000	1841000	Boulangerie ? Tu seras président.
1841000	1843000	Alors que le Renoir…
1843000	1845000	Toi tu faisais quoi ? Médecin ?
1845000	1846000	Ouais.
1846000	1847000	T'aimes bien le coton ?
1847000	1848000	Ouais.
1848000	1850000	Alors j'espère que t'es pas allergique.
1850000	1854000	Parce que tu devrais en manipuler pendant les 40 prochaines années.
1854000	1857000	Oh t'inquiète pas, tes enfants feront pareil.
1857000	1860000	Alors pour moi, je m'excuse auprès de mes ancêtres.
1860000	1865000	Excusez-moi, c'est vrai que j'avais oublié ce concept que vous êtes venus pour uniquement faire du coton.
1865000	1871000	Alors sache que dans 4 générations par contre, s'il y en a un qui est bon au basket, il est possible qu'on l'exploite aussi.
1871000	1872000	Mais il fera du basket.
1872000	1875000	Et si y en a un qui sait un peu avoir le rythme au niveau de la musique, ça peut être sympa aussi.
1875000	1881000	Alors oui, je voudrais dire aussi, parce que toute la musique qui existe aujourd'hui, la musique moderne, qu'est-ce que c'est que la musique moderne ?
1881000	1888000	Si ce n'est un mélange des percussions d'Afrique avec la musique classique blanche européenne.
1888000	1889000	Ce n'est que ça.
1889000	1894000	Et même si on parle même du principe même de la techno, le principe même du rap...
1894000	1895000	Ah bah la techno c'est noir.
1895000	1897000	La techno c'est à Dénéa Détroit.
1897000	1904000	Voilà, les instru du rap issus de la musique classique avec des samples et des percussions.
1904000	1907000	En fait, toute la musique moderne, c'est un mélange de deux choses.
1907000	1917000	C'est les percussions des peuplades d'Afrique, de la forêt, de machin, on tape sur des trucs, c'est incroyable, on a le rythme.
1917000	1920000	Quoi qu'il arrive, un enfant noir né, il a immédiatement le rythme.
1920000	1928000	Et d'un autre côté, les blancs qui créent des notes, qui créent des partissons du Mozart, du Beethoven, c'est magnifique, ça te transporte.
1928000	1930000	C'est la musique classique, c'est extraordinaire.
1930000	1935000	Tu mélanges ces deux choses-là et ça te crée absolument l'intégralité de la musique d'aujourd'hui.
1935000	1942000	Donc force est de constater que quand nous nous y nissons, nous créons des choses magnifiques.
1942000	1943000	T'as enfin compris ?
1943000	1944000	Non mais...
1944000	1946000	Le ban de mie !
1946000	1947000	Le ban de mie !
1947000	1953000	Pas le ban de mie dit de manière raciste comme si j'y mettais le chien.
1953000	1954000	C'est quoi le ban de mie ?
1954000	1962000	C'est les délicieux plats vietnamiens qu'on met dans du pain parce qu'on les a colonisés et on fait les meilleurs sandwiches au monde, les sandwiches vietnamiens.
1962000	1964000	C'est la baguette française avec la...
1964000	1965000	J'adore ton image.
1965000	1971000	Pour montrer que les peuplades quand elles se mettent en train de créer des choses magnifiques, toi tu fais référence à du pain mélangé et des choses asiatiques.
1971000	1972000	Bien sûr.
1972000	1973000	C'est très bon ça.
1973000	1974000	Bien sûr.
1974000	1975000	Katsuni !
1975000	1976000	Oh putain !
1976000	1977000	Bien sûr !
1977000	1979000	Oh putain ça fait longtemps que je me suis pas mis un Katsu.
1979000	1980000	Eh ben !
1980000	1983000	Après ça tombe bien, je dois sortir ton gamin pour t'en tenir que je me...
1983000	1985000	On casse le frein sur du Katsu.
1985000	1987000	On va le faire tous les deux.
1989000	1991000	Et on est pas obligé de mettre un film ?
1991000	1992000	Ouais bah déjà...
1992000	1994000	C'est vrai qu'avec ton truc 3D, putain il me met un truc 3D ça.
1994000	1996000	Non mais juste peut-être que tu peux me renler devant toi.
1996000	1998000	Ton truc 3D c'est n'importe quoi.
1998000	1999000	Mais t'as même pas voulu toi !
1999000	2000000	Je suppose que t'as du truc il fait.
2000000	2001000	Non j'ai pas aimé.
2001000	2003000	Et c'est parce que t'as pas bien vu, c'était trop bien.
2003000	2004000	Non c'est bizarre.
2004000	2005000	Il m'a mis un truc là, tu sais tu...
2005000	2006000	C'est trop moderne ça pour moi.
2006000	2017000	Il me met un casque sur la tête, tu mets une casque sur la tête, tu vois une schnac qui a moins d'un millimètre de ton visage mais c'est une fois schnac parce que c'est pas une personne qui s'est enregistrée pour que la personne aille dans le casque et que tu vois la schnac à la fin du truc.
2017000	2019000	Sauf que tu bouges la tête tu vois la schnac.
2019000	2021000	Oui tu bouges la tête tu vois la schnac.
2021000	2023000	Si tu vois le bâche de la schnac, si tu montes où tu vois l'autre schnac.
2023000	2024000	C'est la schnac de la 3D.
2024000	2025000	C'est mis un.
2025000	2026000	La schnac au futur ou ce quoi ?
2026000	2027000	C'est mis un.
2027000	2028000	C'est mis un.
2028000	2029000	La schnac du futur.
2029000	2030000	C'est mis un.
2030000	2031000	Ah d'ailleurs il mettraient les odeurs.
2031000	2032000	Là je dis pas.
2032000	2033000	Ouais.
2033000	2035000	J'aime bien quand ça sent un peu mimi.
2035000	2038000	Ah non c'est étonnant ça.
2038000	2040000	Toujours un petit molle de pipi.
2040000	2041000	Un petit molle de pipi avant de dormir.
2041000	2044000	Oui d'ailleurs les femmes on voulait dire vous êtes mignonnes.
2044000	2046000	Vous vous nettoyez bien.
2046000	2047000	Vous êtes en mode c'est bon j'ai tout né.
2047000	2049000	Ça sent toujours le pipi.
2049000	2050000	Et on vous le dit pas.
2050000	2051000	Et pourquoi qu'on vous le dit pas ?
2051000	2053000	Parce qu'on aime bien.
2053000	2054000	Allez.
2054000	2056000	Allez j'en peux plus j'en étais où.
2056000	2058000	On continue à raconter le film.
2058000	2061000	Et là donc en fait c'est le moment où tout ce truc de trop stylé.
2061000	2064000	Les Renois commencent à se libérer de la ségrégation.
