start	end	text
2064000	2068000	A sortir des champs de coton et à faire leur propre soirée trop stylax.
2068000	2072000	Et bien il y a un white qui sort de nulle part.
2072000	2075000	Tu le vois il est en train de courir entre chien et ou.
2075000	2076000	Il est demi soleil.
2076000	2077000	Il fume un peu tu vois.
2077000	2078000	Il a la peau un peu pourrie.
2078000	2080000	Et puis il essaie de rentrer chez une personne.
2080000	2083000	Et là en fait ils ont retrouvé ce concept de en fait un vampire.
2083000	2085000	Avant toute chose c'est un séducteur.
2085000	2088000	Il peut pas rentrer dans une maison si tu n'y as pas invité.
2088000	2091000	Donc déjà il y a ce concept là de s'il arrive dans une maison.
2091000	2093000	Il doit dire putain tu me laisses rentrer je suis en Hesse.
2093000	2094000	Je suis en Hasra.
2094000	2095000	S'il te plaît laisse pas rentrer.
2095000	2098000	C'est vraiment les lois du vampire.
2098000	2100000	Il y en a que je trouve trop bien.
2100000	2101000	Le pieu dans le coeur.
2101000	2102000	L'ail.
2102000	2104000	Celle là elle est essentielle à ce film.
2104000	2105000	Il y a les classiques.
2105000	2106000	Et elle est essentielle.
2106000	2108000	Non mais bien sûr elles ont tout bien ça là dessus c'est orthodoxe.
2108000	2109000	Mais en général.
2109000	2111000	Je les trouve toutes trop bien.
2111000	2112000	Et j'accepte les règles.
2112000	2114000	Mais celle là elle est essentielle au film.
2114000	2115000	Mais elle me fera toujours rien.
2115000	2117000	Le mec il peut sauter à 3 mètres de haut.
2117000	2118000	Il peut tout faire.
2118000	2119000	Il peut te bouffer.
2119000	2120000	Il peut revivre.
2120000	2121000	Elle est trop bien celle là.
2121000	2123000	Mais quelque part il a une faiblesse.
2123000	2124000	C'est à dire qu'il faut que.
2124000	2126000	Il faut que tu lui dises.
2126000	2127000	Je t'invite officiellement.
2127000	2128000	Dans ma maison.
2128000	2129000	Pour qu'il puisse rentrer.
2129000	2130000	Sinon il y a un espèce de champ de force.
2130000	2131000	Qui l'empêche de rentrer.
2131000	2132000	Il l'avait fait dans Troublood.
2132000	2134000	C'est une série de vampires que j'avais adoré.
2134000	2135000	Ou ça n'a que Fouras.
2135000	2136000	Et il n'y a que des vampires bouddhoses.
2136000	2137000	J'adorerais Troublood.
2137000	2138000	Il n'y a aucun vampire méchant.
2138000	2139000	Mais c'est quand même trop bien.
2139000	2140000	Mais après ouais.
2140000	2141000	C'était parti en coup.
2141000	2142000	Il y avait des fées.
2142000	2143000	C'était parti en coup.
2143000	2144000	Mais les 2 ou 3 premières saisons sont énormes.
2144000	2145000	Et donc là ce concept là.
2145000	2146000	C'est que le vampire.
2146000	2147000	Pour qu'il puisse te bouffer.
2147000	2148000	Il faut qu'il puisse rentrer chez toi.
2148000	2149000	Et donc pour pouvoir rentrer chez toi.
2149000	2150000	Il faut que tu lui invites.
2150000	2152000	Et donc pour que tu lui invites.
2152000	2153000	Il doit te séduire.
2153000	2155000	Et moi ce que j'adore.
2155000	2157000	C'est ce concept du vampire séducteur.
2157000	2158000	Ouais.
2158000	2160000	Parce que sinon si tu fais qu'un vampire.
2160000	2161000	Qui est là.
2161000	2162000	Qui dort dans son jercueil.
2162000	2163000	Qui se réveille la nuit.
2163000	2164000	Qui te mange.
2164000	2165000	Tu meurs.
2165000	2167000	Et après il retourne dans son truc.
2167000	2168000	C'est chiant.
2168000	2169000	Alors que là tu fais un vampire qui doit.
2169000	2171000	Pour pouvoir te manger.
2171000	2172000	Et être cool.
2172000	2173000	Et être cool.
2173000	2174000	Et être stylax.
2174000	2175000	Et être stylax.
2175000	2176000	Et être stylax.
2176000	2178000	Plus tard dans le film.
2178000	2181000	Et un truc qui est vachement utilisé dans le film.
2181000	2183000	C'est que comme dans les films de zombies.
2183000	2185000	On doit tous se poser la question.
2185000	2186000	Que moi je ne me poserai jamais dans la vie vie.
2186000	2188000	Et je déteste les gens dans les films.
2188000	2189000	Quand ils font ça.
2189000	2190000	Euh.
2190000	2191000	C'est ce truc de.
2191000	2192000	Ah bah c'est un zombie.
2192000	2194000	Mais il ressemble quand même à ma mère.
2194000	2195000	Je veux pas le tuer.
2195000	2196000	Et là.
2196000	2197000	Pour jouer ce truc de.
2197000	2198000	Ah.
2198000	2199000	Maintenant il s'est transformé en vampire.
2199000	2200000	Attention il va te mordre.
2200000	2201680	il va te mordre, maintenant c'est plus ton pote,
2201760	2202180	il est fou.
2203560	2205940	D'habitude, ils sont nuls. C'est-à-dire qu'on
2205940	2207920	voit que c'est pas ta mère, parce qu'ils
2207920	2210220	disent n'importe quoi. Là, psychologiquement,
2210360	2211860	ils trouvent toujours le truc.
2212700	2213960	Ils jouent tellement, parce que là,
2214300	2216180	quand tu dis, ah, il lui ressemble pas,
2216300	2217960	à part qu'il a une balaf, il arrive
2217960	2220060	en fait à, c'est là le côté
2220060	2222000	séducteur, mais carrément pervers, narcissique, de trouver
2222000	2223560	pile le truc qu'il faut dire
2223560	2225740	pour que, tu sais, à chaque fois, ils hésitent en mode...
2225740	2227980	Super bien fait, et même à un moment donné, on se dit,
2227980	2230340	alors au début, il y a un vampire originel,
2230900	2232060	il y a un vampire originel
2232060	2234160	qui va rendre vampires les autres,
2234260	2235940	alors ça, ce que j'aime bien aussi, c'est que dans les trucs
2235940	2238040	de vampires, quand le vampire mange
2238040	2239880	quelqu'un, la personne, elle meurt.
2240360	2242120	Donc ça, c'est hyper chiant. Alors que
2242120	2243480	là... C'est chiant de mourir, en général.
2243740	2246040	Là, le vampire, ce qu'il veut, c'est pas vraiment sucer
2246040	2248060	ton sang ou te manger, il veut juste te transformer
2248060	2250300	en autre vampire pour que tu fasses partie de sa communauté.
2250460	2252000	C'est ça, ouais. Donc lui, il a juste envie de
2252000	2254000	kiffer, il a juste envie d'avoir des potes. C'est là où
2254000	2256180	j'ai pas encore réfléchi, mais il y a peut-être une lecture
2256180	2257680	au film sur l'intégration,
2257680	2259800	il y a totalement une lecture, et il y a totalement
2259800	2262360	un truc de... En fait, les vampires, c'est des blancs,
2262400	2263580	et donc les gens qui mordent
2263580	2265120	deviennent des racistes comme eux,
2265760	2267960	et si tu veux, en fait... Ils prennent leur culture, en fait.
2267960	2269700	Ils se mettent à danser leur vieille danse
2269700	2272200	de irlandais, et en faisant des claquettes.
2272220	2273820	Alors j'ai trouvé ça bien aussi qu'au début, les gens
2273820	2275640	qui vont pourchasser le vampire originel,
2276140	2278060	c'est les indiens. Pourquoi les indiens ?
2278060	2279360	Parce que les indiens connaissent
2279360	2281940	la légende des vampires depuis le début, et sont
2281940	2283880	les guerriers, la peuplade
2283880	2285820	résistante aux vampires, parce que eux, ils ont
2285820	2288100	encore le savoir ancestral d'avant,
2288380	2289220	le savoir du passé.
2289940	2291800	Moi j'adore cet angle qu'on prend sur
2291800	2293860	les indiens d'Amérique, c'est... Alors nous,
2293920	2296020	on a été civilisés, on a créé des choses, des bâtiments,
2296120	2298020	des trucs, mais les indiens, ok, ils sont restés en mode
2298020	2300240	« Ouh, on se tire des trucs et on fait des tipis,
2300240	2302500	mais par contre, on a encore tout capté, on sait
2302500	2304020	qu'il y a des extraterrestres, on sait qu'il y a des anunnaki,
2304140	2306520	on sait qu'il y a des trucs. » Donc ça, ça m'a beaucoup plu.
2307200	2308480	C'est vrai qu'ils ont réussi
2308480	2310740	à prendre tous les peuples qui ont chiés aux Etats-Unis,
2310920	2312400	les noirs, les asiatiques, les indiens,
2312400	2314580	et les mettre trop stylés, et les glorifier.
2315580	2316440	C'est vrai, et du coup,
2316880	2318820	pour une fois, au lieu de mettre tous ensemble dans l'équipe,
2318920	2319880	en mode, voilà, ils ont
2319880	2322360	réussi à parler à tout le monde sans être chiant.
2322680	2323640	Et même quelque part,
2324400	2326520	même quelque part, en rendant
2326520	2328980	le blanc méchant hyper stylé,
2329080	2330520	et en ayant quand même...
2331900	2333340	Parce qu'ils ont quand même
2333340	2334920	des chansons folk trop bien,
2335060	2336600	ils ont quand même des danses stylées,
2336700	2338580	c'est-à-dire que même les blancs, en étant méchants,
2338580	2340840	horrible, ils ont quand même rendu hommage
2340840	2342880	au folklore blanc, à la musique blanche.
2343140	2344620	Le vampire blanc méchant
2344620	2346920	originel fait une danse de claquettes irlandaise,
2347540	2348460	parce qu'à un moment donné,
2348520	2349840	il arrive à bouffer pas mal de gens,
2349960	2351580	donc il crée une belle team, quand même.
2352220	2353120	Et cette team-là
2353120	2355480	va taper soirée.
2355480	2357020	En fait, c'est comme des guédraux
2357020	2358980	qui se prennent un peu de la MD,
2359480	2360820	parce qu'ils sont vampires,
2360940	2362060	donc vas-y, nique sa mère la vie,
2362220	2363620	et bien, on fait que rigoler maintenant.
2364140	2365380	Et ça danse, et ça kiffe,
2365460	2366120	ça fait des claquettes,
2366200	2367240	ils sont ultra stylax.
2367500	2367900	Et à un moment donné,
2367960	2369760	tu te poses même la question...
2369760	2370880	Ça vaut pas le coup d'être vampire.
2371140	2372420	Ouais, et ça met même le doute
2372420	2373340	à certains personnages
2373340	2375000	qui sont restés encore du côté humain.
2375500	2376720	Ils se disent...
2376720	2377480	Putain, c'est...
2378020	2380360	Quelque part, c'est pas complètement con,
2380400	2380700	ce qu'il dit.
2380800	2381640	En vrai, si je deviens vampire,
2381740	2383080	je suis plus ou moins immortel,
2383080	2384200	on va se marrer,
2384400	2385460	on va faire partie d'une communauté,
2385680	2386360	c'est cool en fait.
2386500	2388080	Il dit ça à un des frères esclaves.
2388800	2389440	Alors bon, voilà.
2389660	2390040	Donc en gros,
2390140	2390860	ils sont dans la maison
2390860	2391720	et petit à petit,
2391800	2392780	ils se font bouffer par les vampires.
2392900	2393240	Et ils sont là,
2393280	2393880	bon, on se barricade,
2393940	2394340	on se barricade,
2394380	2394900	on se barricade.
2396120	2397160	On raconte pas tout le film,
2397240	2397680	mais en gros,
2398220	2398600	à un moment,
2398960	2399860	dans les deux jumeaux
2399860	2400760	de Michael B. Jordan,
2400900	2401500	il y en a un
2401500	2403780	qui devient vampire
2403780	2405840	et l'autre reste du côté clair.
2406500	2407580	Ils commencent à se parler
2407580	2408160	l'un à l'autre.
2409500	2409720	Il dit,
2409780	2410960	on en a chié toute notre vie,
2411460	2412620	est-ce que tu serais pas plus libre
2412620	2413640	en étant vampire comme moi ?
2413640	2415240	Parce qu'on a une mortelle.
2415380	2416440	Et celui qui est devenu vampire,
2416620	2417920	il a encore toute sa tête quelque part.
2417940	2418200	C'est ça,
2418260	2418860	mais c'est là où c'est trop bien fait.
2418860	2419100	En fait,
2419180	2419800	c'est pour ça qu'on voit
2419800	2421380	que c'est comme des drogués.
2421840	2422420	C'est-à-dire que t'as encore
2422420	2423060	toute ta tête,
2423360	2424660	c'est juste que t'es en soirée
2424660	2425560	et que t'es fifou.
2425780	2426420	T'es une tête chelou.
2426440	2427740	Donc t'as ton âme un peu diabolique.
2428160	2429140	T'as ton âme diabolique.
2429660	2430380	Tu peux pas vivre
2430380	2431040	toute ta vie comme ça
2431040	2431440	parce qu'en vrai,
2431520	2431820	c'est chiant
2431820	2432920	si on passait toute notre vie
2432920	2433360	sous extra.
2434120	2436160	Mais dans l'espace d'une soirée,
2436640	2437200	en vrai de vrai,
2437280	2438220	tu peux te faire convaincre.
2438400	2438820	C'est vrai qu'il y a
2438820	2439400	un vrai beau rapport
2439400	2439740	avec la drogue
2439740	2440760	parce que comme les vampires,
2441140	2442500	il faut qu'ils survivent la nuit
2442500	2443680	parce que dès le lever du jour,
2443740	2444300	ils vont se faire baiser
2444300	2444740	de toute façon.
2444880	2445700	Donc ça se barricade.
2445860	2445920	Voilà.
2446060	2446360	Donc c'est vrai
2446360	2447380	qu'il y a le côté soirée.
2447420	2447740	Il y a une métaphore de malade.
2447740	2447920	Et le côté,
2448000	2448840	ça va pas durer tout le temps.
2448840	2449780	Il y a une métaphore de malade
2449780	2450340	au niveau soirée.
2452000	2453900	Et cet angle-là
2453900	2455000	est super bien pris.
2456000	2456260	Et alors,
2456560	2457680	je voulais parler de la scène
2457680	2458120	qui, moi,
2458160	2458900	m'a mis les frissons.
2459280	2459760	Mais alors là,
2459800	2460380	il y a une scène,
2460500	2460660	les gars,
2461100	2462140	c'est extraordinaire.
2462480	2462880	C'est marrant,
2462940	2463500	je sais même pas laquelle
2463500	2463940	tu vas dire.
2464080	2464440	Alors moi,
2464460	2465100	je vais te dire tout de suite.
2465800	2466840	On est en plein milieu
2466840	2467440	de la soirée
2467440	2470060	avant que les vampires arrivent.
2470820	2471100	Au début,
2471100	2472660	le vampire originel
2472660	2473100	va bouffer
2473740	2475500	un couple du Ku Klux Klan
2475500	2476880	pour les transformer en vampires.
2477040	2477360	Donc ils vont être
2477360	2477840	trois vampires.
2478060	2478520	Une meuf
2478520	2479860	et deux mecs blancs.
2479920	2481140	Ça fait trois blancs.
2481240	2481960	Et ils veulent s'incruster
2481960	2482920	dans la soirée de Renoir.
2483400	2484400	Soirée qui bat son plein,
2484780	2485500	qui est trop stylée.
2485880	2486480	Il y a de la musique.
2486880	2487540	Et on a justement
2487540	2488320	ce petit jeune
2488320	2490080	qui est de Church Boy,
2490360	2491300	le petit mec d'église
2491300	2492480	qui joue hyper bien
2492480	2492980	de la guitare.
2493280	2493840	Et ce mec-là,
2493920	2494620	il est tellement pur
2494620	2495380	qu'il a un pouvoir.
2496300	2496980	C'est que quand il joue
2496980	2497440	de la musique,
2497980	2499180	il joue du truc Kentucky.
2503180	2504780	Il joue tellement bien
2504780	2507080	que la voix narrative
2507080	2507700	nous explique
2507700	2510040	qu'il arrive à raviver
2510040	2511720	les esprits du passé,
2512260	2513800	les esprits du futur
2513800	2515860	et les esprits du présent
2515860	2516660	au même moment.
2517060	2517240	Et là,
2517300	2517980	on a cette scène
2517980	2519700	avec un travelling de caméra,
2520660	2521860	avec une musique de fond
2521860	2522700	incroyable
2522700	2524760	qui passe du hip-hop récent.
2525580	2526580	On voit un DJ,
2527140	2527760	on voit le mec
2527760	2528460	qui joue du piano,
2529000	2530380	on voit des tribus africaines
2530380	2531540	qui refont du tam-tam.
2531880	2532160	Et en fait,
2532220	2533280	ils ont fait un espèce de truc
2533280	2534320	où il y a un espèce de travelling
2534320	2534780	qui se balade
2534780	2536160	dans toute la soirée.
2536600	2536940	Et on voit
2536940	2538200	toutes les époques
2538200	2539980	des Renois
2539980	2541620	qui partent vraiment
2541620	2542780	des tam-tam d'Afrique
2542780	2543660	avec les tribus,
2544100	2544600	les plumes,
2544700	2545180	les machins,
2545500	2546200	les maquillages.
2546780	2547720	Le temps d'où on est,
2547820	2548960	c'est-à-dire ségrégation.
2548960	2552120	Et maintenant,
2552200	2553360	les DJ des meufs qui twerquent
2553360	2554640	avec des gars du hip-hop,
2554700	2555220	genre Snoop Dogg
2555220	2556420	qui fait la danse gangsta et tout.
2556600	2556780	Et là,
2556860	2557320	ce truc-là,
2557880	2559160	le mec qui a fait le sable
2559160	2559640	de la musique
2559640	2560580	où toutes les musiques
2560580	2561120	sont mélangées,
2561220	2562860	où ça passe du tribut
2562860	2563440	au récent,
2563540	2563820	au truc,
2564140	2564340	moi,
2564420	2565040	ça m'a mis les frissons.
2565200	2566580	C'était incroyable.
2567460	2567900	C'était...
2567900	2568160	Et ça,
2568220	2568560	c'est bonheur,
2568640	2569180	on l'a jamais vu.
2569340	2569460	Ah,
2569500	2571460	mais c'était incroyable.
2572380	2572480	Là,
2572580	2572920	franchement,
2573040	2573540	tu...
2573540	2574000	Enfin,
2574480	2575480	que tu sois black ou pas,
2575600	2575880	mais déjà,
2576260	2577960	tu es un noir américain
2578960	2579780	à l'heure actuelle,
2580040	2580540	tu vois ça,
2580660	2581220	tu as les larmes aux yeux.
2581700	2581960	Tu chiales.
2583040	2583400	Tu te dis,
2583500	2583660	putain,
2583760	2583900	voilà,
2584000	2584280	c'est ça,
2584440	2585260	pour une fois que ma culture
2585260	2586780	est aussi bien représentée.
2587100	2587240	Moi,
2587300	2589140	je ne suis pas un noir américain,
2589440	2590560	j'ai un carton de France,
2590660	2591040	un machin,
2591160	2591820	une voix amiglée.
2592380	2593660	Ça m'a mis les frissons.
2593740	2593860	Oui,
2593980	2594220	mais je comprends que...
2594220	2594460	Je me suis dit,
2594520	2595000	je m'y voyais,
2595120	2596080	j'étais au Kentucky,
2596160	2596960	j'ai envie de nous mettre un KFC.
2597900	2599820	Et c'était unbelievable,
2600420	2600760	cette scène.
2601240	2602240	C'est pour ça que ma...
2602240	2604000	Et j'ai envie de retrouver la...
2604000	2605240	Je veux absolument m'écouter
2605240	2606460	la bande originale du film
2606460	2607860	pour me retrouver la musique
2607860	2608940	qu'ils ont mis pendant cette scène.
2609220	2610700	Parce qu'elle était incroyable.
2610960	2611900	Ma musique préférée,
2612600	2614360	le seul style de musique récent
2614360	2616320	depuis 2000,
2616980	2617520	c'est ce qu'on appelle
2617520	2619540	la Neo Soul depuis 2010.
2620240	2621400	C'est les meilleurs albums
2621400	2622180	de Kanye West,
2622420	2623360	c'est Solange,
2623560	2624700	c'est Kendrick Lamar,
2625320	2626860	c'est certains trucs,
2627100	2627240	c'est...
2628600	2628980	Ah bon,
2629060	2630240	mon gars sûr,
2630240	2631680	j'ai plus son nom là.
2632020	2632520	Mais en gros,
2632940	2635300	c'est ce rap,
2635680	2635940	pop
2635940	2637380	qui mélange
2637380	2639400	jazz,
2639760	2640320	funk,
2640680	2641200	blues,
2641320	2642440	sur du rap,
2642640	2643500	mais où vraiment,
2643740	2644620	dans Kendrick Lamar,
2644700	2645600	pourquoi c'est génial ?
2645600	2647040	C'est parce qu'il y a vraiment
2647040	2648840	150 ans de musique
2648840	2649620	noire américaine
2649620	2650400	tout mélangé.
2650540	2651540	C'est-à-dire qu'ils ne sont pas là.
2651900	2652960	Ah, il y a le jazz,
2653060	2653800	il y a le blues,
2653900	2654640	il y a le funk,
2654760	2655540	il y a le hip-hop,
2655620	2656120	il y a la techno,
2656240	2656700	non, il y a tout.
2656940	2658160	Et tu peux tout mettre en même temps.
2658300	2658960	Et la soul,
2658960	2660500	et quand tu mets tout en même temps,
2660640	2662620	c'est magique effectivement.
2662780	2663580	Tu sens vraiment
2663580	2664180	tout le poids
2664180	2665420	d'une histoire musicale.
2665520	2666320	Et ce qui est fou,
2666900	2667520	c'est la façon
2667520	2668320	d'avoir amené
2668320	2669520	ce twist-là.
2669700	2670720	Parce que franchement,
2671140	2672160	et j'aurais été le premier
2672160	2674320	à chier sur ce truc-là
2674320	2675800	si ça avait été amené
2675800	2676720	de façon gratuite,
2677020	2678200	insupportable.
2678720	2679560	Qu'est-ce qu'on va nous mettre
2679560	2680960	des meufs qui twerquent ?
2680960	2681640	Qu'est-ce qu'on va nous mettre
2681640	2683520	un DJ dans un film d'époque ?
2683520	2684180	Mais sauf que là,
2684680	2685380	c'est amené du fait
2685380	2686440	que ce petit personnage
2686440	2687260	de Church Boy,
2687260	2690040	il a un pouvoir mystique
2690040	2690820	et du coup,
2690900	2691560	ça devient un truc
2691560	2692360	ésotérique.
2692880	2693380	Et ça devient
2693380	2695100	un truc incroyable
2695100	2695900	qui fait que
2695900	2697340	si on a un peu
2697340	2697960	des croyances,
2698080	2698860	si on a un peu des trucs,
2699080	2699620	moi je sais que
2699620	2700700	je crois beaucoup aux énergies,
2700840	2701360	je crois aux croyances.
2701460	2702440	Je me suis tellement drogué
2702440	2702940	que forcément,
2703040	2703600	j'ai vu des choses
2703600	2704520	incroyables.
2705200	2705780	Et pour moi,
2705860	2706860	c'est totalement la vérité
2706860	2707680	parce que je les ai vus,
2707800	2708820	que j'ai fait les voyages astrales,
2708880	2709220	je les ai faits,
2709260	2709680	je les ai faits.
2709680	2712320	Je peux payer mon billet,
2712520	2713060	j'étais en première.
2713060	2714720	j'ai fait des sorties encore,
2714780	2715140	j'ai tout fait.
2716100	2716380	Donc,
2716440	2717240	je peux t'assurer
2717240	2717620	que là,
2717700	2718720	ce qui se passe à ce moment-là
2718720	2719820	et la façon dont c'est amené,
2721440	2723580	ça peut être totalement plausible
2723580	2725300	parce que si on considère
2725300	2726460	que la vie n'est qu'une boucle,
2726540	2727420	on peut totalement vivre
2727420	2728420	dans un espace-temps
2728420	2729260	où le passé,
2729380	2730060	le présent et le futur
2730060	2731780	vivent sur une même fréquence.
2732460	2733520	Tu vois ?
2733520	2733760	Non,
2733840	2733940	là,
2733980	2734520	je ne vois plus du tout
2734520	2735220	mais je vous laisse faire votre...
2735220	2735240	Si,
2735240	2735960	tu vois totalement,
2736220	2737760	ne dis pas que ça m'agace.
2738380	2738820	Ne dites pas,
2738880	2739300	c'est pas ça.
2739800	2740260	Ne dites pas,
2740280	2740720	c'est pas ça.
2741180	2741760	Je ne vois rien.
2742460	2743380	Je suis en train de t'expliquer
2743380	2744260	un truc scientifique
2744260	2745880	très important.
2746740	2746820	Non,
2746900	2747000	non,
2747360	2747860	honnêtement,
2748140	2749200	la façon dont c'est amené...
2749200	2750100	Faites vos vaccins,
2750460	2751280	faites-les à l'heure,
2751820	2752900	arrêtez de dormir chez moi,
2752980	2753840	ça me fait six mois maintenant,
2754460	2755260	mettez un froc
2755260	2755920	et on reparlera.
2757840	2759520	J'aime bien ces pantalons d'esclaves
2759520	2760000	qu'ils ont là,
2760040	2760180	tu sais,
2760420	2761220	qui montent très haut.
2761220	2761660	Non,
2761700	2762600	mais t'es qui montent très haut
2762600	2763300	au niveau des jambes,
2763380	2763440	là.
2763700	2763940	Tu sais,
2764000	2764300	j'adore,
2764380	2765100	en mode Mississippi.
2765300	2765460	Oui,
2765460	2765620	oui,
2765620	2767840	c'est parce que c'était trop petit.
2768680	2768820	Ah,
2768920	2769560	c'était pas...
2769560	2770560	Non,
2770640	2770740	non,
2770760	2771040	mais oui,
2771100	2771320	je vois,
2771380	2771580	je vois.
2771780	2772740	Tu vois ?
2772740	2773100	Oui,
2773280	2774980	les trucs noir et blanc d'Alton,
2775180	2775300	quoi.
2775680	2775820	Moi,
2775880	2776800	les trucs noir et blanc d'Alton,
2776880	2777040	en fait,
2777100	2777660	j'ai toujours kiffé.
2777920	2778260	Alors non,
2778280	2778660	c'était pas ça.
2778660	2779440	Si je pouvais porter ça,
2779440	2779760	je le ferais.
2779760	2780940	C'est vrai que les vêtements de bagnard
2780940	2782000	avec des gars qui tapent
2782000	2783160	sur des gros cailloux
2783160	2784080	avec des trucs
2784080	2784700	avec des pioches
2784700	2785980	habillés en mode Dalton,
2786120	2786220	ça,
2786340	2786860	c'est ultra stylé.
2787240	2787400	Moi,
2787460	2788180	c'était pas ça que je parlais,
2788260	2789460	c'était vraiment la tenue,
2790540	2790840	tu sais,
2791080	2791180	où,
2791280	2792100	visiblement,
2792180	2793360	c'est des pantacours.
2793620	2795160	L'esclave porte un pantacour
2795160	2796840	et il est pieds nus.
2797040	2797780	Ça doit être pour courir
2797780	2798920	peut-être dans les champs.
2799360	2799600	Ouais,
2799940	2801060	ou peut-être pour ne pas courir,
2801060	2801640	je sais pas.
2801880	2802280	Je sais pas,
2802360	2803080	ils veulent que les gars
2803080	2803740	ne s'échappent pas.
2803860	2804620	Ils sont peut-être aperçus
2804620	2806060	qu'ils étaient un petit peu rapides.
2806180	2806280	On va dire,
2806360	2807420	peut-être enlever les chaussures
2807420	2808240	parce qu'ils vont partir.
2809320	2809920	C'est drôle,
2809920	2810820	cet univers de l'esclave.
2812140	2812660	En tout cas,
2812720	2813480	ça fait des bons films.
2813760	2813960	Alors,
2814960	2815960	est-ce que je peux contrebalancer
2815960	2816700	en disant quelque chose
2816700	2819160	qui va contrebalancer
2819160	2820200	avec toute mon ode
2820200	2821860	à tout ça ?
2821860	2822860	Ce qui m'insupporte,
2823620	2824340	c'est que des gens
2824340	2825380	d'aujourd'hui,
2826400	2827320	je prends l'exemple
2827320	2829440	d'une noire américaine
2829440	2829900	obèse
2829900	2834220	qui est dans une école,
2834360	2835380	dans une université,
2836280	2838220	va hurler sur un petit blanc
2838220	2839420	qui est vendeur
2839420	2840560	à Micromania,
2841080	2843360	tu vois,
2844160	2844820	aux Etats-Unis
2844820	2846640	et qui va lui dire
2846640	2848240	non mais ferme-la,
2848360	2848800	de toute façon,
2849260	2850380	moi j'ai souffert
2850380	2850980	et donc toi,
2851260	2852460	tu fais de l'appropriation culturelle
2852460	2853260	et t'es qu'une grosse merde.
2853860	2854080	Donc ça,
2854160	2854760	ça m'insupporte.
2854920	2856700	Si notre peuplade
2856700	2857960	a souffert
2857960	2859440	il y a 500 ans,
2859560	2860340	c'est eux qui ont souffert,
2860420	2860880	c'est pas toi.
2861360	2861500	Toi,
2861560	2862180	la grosse obèse
2862180	2862940	qui vit aux Etats-Unis,
2863060	2863900	qui regarde Netflix
2863900	2864840	et qui a ton écran plat
2864840	2865520	et qui mange ta glace,
2865580	2866360	tu n'as jamais souffert.
2866740	2867420	Et ce petit blanc
