start	end	text
0	2000	Oh la vache mais c'est nul !
2000	4000	NUL, NUL, NUL !
4000	6000	Tu sais pas jouer Jack ?
6000	8000	T'ES MAUVAIS !
8000	10000	Mais dehors les Romano !
10000	13000	Je suis... Je suis l'EMA !
13000	15000	CINÉMAAAAAAA !
15000	17000	CINÉMAAAAAAA !
17000	19000	Qu'est-ce que c'est que cette matière ?
19000	20000	C'est de la merde !
20000	28000	Vous aimez le sud ?
28000	32000	Vous aimez le sud des Etats-Unis ?
32000	37000	Vous aimez le coton et l'absence de liberté ?
37000	38000	Vous aimez...
38000	40000	Vous aimez...
40000	42000	Vous vengez de toute cette saloperie !
42000	43000	Alors...
43000	51000	On a vu Sinners, un film qui pue le blues, les Etats-Unis des années 30-40.
51000	55000	Et là tes racines noires, elles t'ont parlé directement.
55000	59000	Tu as senti chez toi cette part d'esclave en toi ? Ou pas du tout ?
59000	62000	Parce que moi j'ai senti ma part d'esclavagiste.
62000	66000	Je me suis dit qu'est-ce que ça devait être bien d'avoir des gens.
66000	69000	Ça avait l'air bien mieux que de ne pas en avoir.
69000	75000	Ça faisait très très très longtemps que je ne m'essayais pas senti.
75000	76000	Aussi noir ?
76000	77000	Aussi noir.
77000	79000	En plus je dis ça mais il n'y a pas d'esclavage dans le film.
79000	82000	C'est plus la ségrégation, c'est la fin de l'esclavage.
82000	84000	C'est les années 30-40.
84000	85000	Chelle et l'armes aux yeux.
85000	86000	Ça t'a plu ?
86000	87000	Chelle et l'armes aux yeux.
87000	88000	Ouais on va pas se mentir, on va pas faire...
88000	89000	Voilà c'était un très bon film.
89000	90000	Chelle et l'armes aux yeux.
90000	91000	Autant...
91000	92000	Autant...
93000	100000	Je suis quelqu'un que j'aime pas quand tu me mets des trucs et que tu me forces à chialer.
100000	101000	Autant là.
101000	112000	Et en plus ce qu'il faut savoir c'est que les Noirs américains sont issus de la traite négrière transatlantique.
112000	114000	J'ai cru que t'allais dire mieux.
114000	115000	Ils sont mieux que les Noirs.
115000	118000	Ils sont issus de la traite négrière transatlantique.
118000	123000	Et donc sont essentiellement des Noirs d'Afrique de l'Ouest.
123000	124000	Comme toi.
124000	127000	Ils sont directement mes descendants.
127000	129000	Tu aurais pu être américain quelque part.
129000	133000	Non mais je veux dire là ça m'a touché en plein coeur.
133000	140000	Je suis un esclave du Kentucky qui est en train de ramasser du coton, en train de chanter et faire des blagues à ses amis.
140000	141000	Je suis cette personne.
141000	144000	Et là je me suis senti si tu veux emparé.
144000	145000	Et c'est dingue.
145000	149000	Par toute cette histoire de ce qu'on appelle la négritude.
149000	160000	de cette peuplade si particulière qui a réussi à mêler cet univers un petit peu du Texas.
160000	169000	On parle un petit peu comme ça avec l'épi de maïs, l'épi de paille sur le coin de la bouche avec le chapeau, le pantalon, pieds nus et tout.
169000	171000	C'est vrai qu'ils ont pris l'accent.
171000	178000	Et avec les tam-tam de l'Afrique, le rythme et tout ça, ça crée le blues, ça crée Eddie Mitchell.
178000	180000	C'est vrai quelque part ça crée Eddie Mitchell.
180000	182000	Non mais ça crée Eddie Mitchell à la fin.
182000	183000	C'est ça qui vaut.
183000	184000	La fin de la fin c'est Eddie Mitchell.
184000	188000	En fait des bateaux, des gens fouettés, des machins, des cicatrices dans le dos pour finir Eddie Mitchell.
188000	194000	Elle était maquillée comme une fille qui ramasse du coton.
194000	199000	Je vais pas prendre la souffrance mais juste l'argent des chansons.
199000	203000	Et vous pouvez garder le coton.
203000	209000	Tout ce qui est absence de liberté, je vais juste prendre les chansons.
209000	214000	Je vais me faire un paquet de pognon.
214000	224000	En reprenant vos chansons, sans la souffrance, ce sera bien mieux.
224000	234000	Non mais pour revenir sérieux deux minutes, cette peuplade noire des Etats-Unis a une histoire vraiment...
234000	238000	Où vous les classeriez par exemple dans votre classement des peuplades ?
238000	239000	Dans mon classement des peuplades ?
239000	240000	Que vous établissez depuis...
240000	242000	Non c'est une blague.
242000	244000	Non c'est une blague, j'étais vraiment en train de réfléchir.
244000	245000	Oui mais je sais, je sais.
245000	246000	C'est ça qui est beau.
246000	247000	Je sais que t'as un classement.
247000	249000	Non non, en vrai de vrai je pense pas qu'il y a un...
249000	251000	L'Inde est en dernier chez Thibault.
251000	256000	Il y a pas vraiment de classement des peuplades, je pense que toutes les peuplades du monde sont extraordinaires.
256000	257000	C'est vrai.
257000	262000	Il y a vraiment quelque chose de stylax chez toutes les peuplades du monde entier.
262000	264000	Et il y en a où il faut chercher plus longtemps.
264000	269000	C'est pas dans la porte d'entrée, c'est au grenier, c'est quelque part.
269000	271000	Ouais il peut y avoir un truc stylax.
271000	274000	Mais tu vois, même les Irlandais par exemple, sur le papier...
274000	276000	Même les Irlandais, mais bien sûr les Irlandais.
276000	279000	Mais tu sais, ça envoie des claquettes.
279000	282000	Tu vois, ça envoie de la claquette, ça envoie des trucs, c'est stylax.
282000	283000	Bien sûr.
283000	285000	L'Inuit.
285000	288000	Comme ça, tu te dis, vas-y c'est chiant, c'est dans la glace et tout.
288000	292000	Mais non, ça se badigeonne de graisse, de yague, pour pas choper des coups de soleil.
292000	293000	C'est stylax.
293000	294000	C'est stylax.
294000	296000	Tu sais pourquoi chaque peuplade est stylé forcément ?
296000	297000	Et que le racisme c'est de la merde ?
297000	299000	Parce que chaque peuplade a survécu quelque part.
299000	301000	Donc c'est forcément les meilleurs de leur environnement.
301000	302000	Oui.
302000	307000	Donc tu es forcément le best de ton environnement parce que tu as trouvé ce qu'il fallait faire pour survivre à cet endroit-là.
307000	312000	Même l'aborigène d'Australie, qui est une personne très fortement alcoolisée.
312000	314000	Plus que nous ?
314000	315000	Ah bah...
315000	316000	Ah mais ça n'a rien à voir.
316000	328000	Les policiers locaux ont à l'arrière de leur voiture des petites cellules de dégrisement en grillage qui fait office de coffre spécialement pour les aborigènes.
328000	330000	Non mais je n'ai jamais vu ça.
330000	335000	C'est-à-dire que ce ne sont pas des êtres humains.
335000	336000	Si.
336000	338000	Enfin, pour moi si.
338000	339000	Oui.
339000	340000	Enfin...
340000	341000	Oui.
341000	342000	Pour moi si.
342000	343000	Oui.
343000	345000	Mais pour les policiers blancs locaux...
345000	346000	Enfin moi...
346000	347000	Oui ils les mettent dans des cages.
347000	348000	Même si moi je suis...
348000	356000	Même si un angliche à la peau rose, ivre mort à 14h30, il se vomit dessus, il ne va jamais le mettre dans une cage.
356000	358000	C'est vrai, en général on ne met pas les humains dans des cages.
358000	360000	Un aborigène, c'est la cage.
360000	361000	C'est la cage.
361000	362000	Allez.
362000	363000	Parce qu'il n'y a que ça qui comprend aussi.
363000	366000	Il faut lui parler cage sinon c'est pas...
366000	367000	Tu vois ?
367000	368000	Je comprends.
368000	369000	C'est bien.
369000	370000	Est-ce que tu veux que je te dise ?
370000	371000	Non c'est bien.
371000	374000	Ce qui est à la fois chez toi dans ton mélange, fruit du non racisme.
374000	375000	Oui.
375000	377000	Un esclave qui a souffert.
377000	378000	Oui.
378000	379000	Et un nazi quoi.
379000	380000	Ah oui, il y a les deux quoi.
380000	382000	Ah mais moi, je suis Kenny West.
382000	383000	Tu es les deux.
383000	384000	Tu es les deux.
384000	386000	Non, non, non, non.
386000	387000	Mais là, pour revenir sur...
387000	388000	Non, bon allez, le film.
388000	389000	On va revenir sur ce film.
389000	390000	Sérieux, sérieux.
390000	391000	Sérieux.
391000	393000	Non les gars, ce film là...
393000	394000	C'est un bon film.
394000	395000	Non mais c'est exceptionnel.
395000	396000	Je me suis régalé.
396000	398000	C'est le meilleur film qu'on a vu depuis que j'ai vu.
398000	400000	Pour moi, c'est même au-dessus de Nosferatu.
400000	401000	Alors attends.
401000	402000	Est-ce que j'ai le bon...
402000	403000	J'ai le mélange parfait.
403000	405000	Je pense que c'est comme ça qu'ils l'ont pitché.
405000	407000	C'est entre Django et Get Out en fait.
407000	409000	Et bien sûr du vampire.
409000	410000	Et Une Nuit en Enfer.
410000	411000	Et Une Nuit en Enfer.
411000	412000	Oui.
412000	413000	C'est ça.
413000	415000	C'est Get Out, Django et Une Nuit en Enfer.
415000	416000	Il y a l'aspect vengeance.
416000	418000	Il y a l'aspect les blancs sont méchants
418000	420000	et les films d'horreur avec les blancs qui sont les méchants.
420000	424000	Et il y a l'aspect vampire, soirée, dans un lieu.
424000	425000	C'est vrai que c'est ces trois films là.
425000	427000	Ok boy.
427000	429000	Fun is over.
429000	432000	Je vais te dire des trucs qui font que nous on trouve les films stylés.
432000	433000	Come on out.
433000	438000	Je vais te dire des trucs qui font que pour nous, les gens bien, un film est stylé.
438000	439000	Et tu vas me dire check ou pas check.
439000	440000	T'es prêt ?
440000	442000	Acteur stylé.
442000	444000	Check.
444000	445000	Check.
445000	448000	Ah bah, de malades.
448000	450000	Des très beaux travails de caméra.
450000	451000	De malades.
451000	452000	Check.
454000	456000	Des bons seconds rôles marrants.
456000	457000	De malades.
457000	458000	De ouf.
458000	459000	C'est rare.
459000	460000	Du cul.
460000	461000	Oui.
461000	462000	Oui.
462000	463000	Ah, la leleuc la couille.
463000	465000	Avec le fion gigantesque là.
465000	466000	Oh.
466000	467000	Des trucs geekesque.
467000	468000	Oui.
468000	469000	Oui bah oui.
469000	470000	Geekesque.
470000	471000	Bien sûr.
471000	472000	Geekesque.
472000	473000	Qu'il faut connaître d'avant.
473000	474000	Geekesque.
474000	475000	Vraiment.
475000	476000	Des vraies références.
476000	477000	Tout à fait.
477000	478000	Euh.
478000	480000	Et qu'alors qu'alors qu'alors qu'alors.
480000	481000	La musique.
481000	482000	La musique est géniale.
482000	483000	Mais attends.
483000	484000	Mélanger le rock.
484000	485000	Non, non, non, non.
485000	486000	Mais attends, attends.
486000	487000	S'il te plaît.
487000	488000	Dis pas tout de suite.
488000	489000	Ouais.
489000	490000	Parce que ça.
490000	491000	La musique.
491000	492000	Ouais la musique.
492000	493000	C'est régaler le gosier.
493000	494000	La musique.
494000	495000	Bravo.
495000	498000	La musique en général, à savoir les chansons originales, les chansons qu'il chante et la
498000	501000	BO en soit juste de la musique sans paroles exceptionnelle.
501000	504000	Tout l'habillage sonore du film est génial.
504000	505000	Non mais déjà, déjà, déjà.
505000	514000	Ce film vraiment, et je vais y revenir, c'est une ode à la gloire des Noirs américains.
514000	518000	C'est montrer les origines de ce peuple.
518000	519000	Comment il s'est créé.
519000	520000	Comment s'est créé sa culture.
520000	526000	Montrer que les Etats-Unis, c'est un mélange de plusieurs peuplades qui viennent d'Europe,
526000	531000	des blancs, des Italiens, des Irlandais, des natives amérindiens.
531000	533000	Ouh, on en voit des flèches.
533000	534000	Les Asiatiques aussi, les Chinois.
534000	539000	Des Asiatiques, qui étaient dans le commerce, des machins, les Chinois avec les chapeaux
539000	540000	pointus.
540000	542000	Et des Noirs américains esclaves.
542000	545000	Et on montre tout ça et comment s'est créé les Etats-Unis.
545000	548000	Et là, pour le coup, l'angle qui est pris, c'est vraiment les Noirs parce que ça se passe
548000	549000	dans une communauté noire.
549000	553000	Et en fait, on voit à quel point ces gens-là étaient ultra stylax.
553000	556000	Tous les gens dans ce film sont ultra stylax.
556000	558000	Il n'y a rien, il n'y a pas de...
558000	563000	En plus, vous savez, moi ça m'agace toujours, alors que je fais partie de ce camp-là.
563000	567000	Mais ça m'agace quand même quand c'est mal fait.
567000	575000	Mais là, quand on nous représente bien que c'est stylax, je suis le premier à surlever
575000	581000	et à être tellement proud d'avoir des origines africaines et que limite, j'ai envie
581000	583000	de faire du blues.
583000	584000	Je suis blues.
584000	586000	Tu sais que, si tu veux me mettre...
586000	591000	Tu sais, moi, ma famille, c'était des blancs paysans.
591000	593000	Et je pense pas qu'ils ont eu des esclaves.
593000	596000	Mais si quelque part, à un moment, tu veux me mettre une tarte,
596000	600000	ça vache que j'appellerai la police immédiatement et qu'ils t'arrêteront.
600000	602000	Non mais...
602000	603000	Oui, c'est vrai.
603000	606000	Et d'ailleurs, on a senti comme d'hab que la représentation...
606000	608000	Oh, il s'étouffe totalement.
608000	610000	On a senti que la représentation...
610000	615000	La dernière fois que j'ai eu ça, c'était il y a dix ans à Châtelet, une salle avec,
615000	618000	on va dire, beaucoup de gens concernés par le propos.
618000	619000	Je l'avais eu avec Get Out.
619000	622000	J'avais fait la sortie de Get Out et j'avais compris en cinq secondes.
622000	624000	Ah oui, c'est un film important pour la communauté noire.
624000	630000	Et là, le film était plein et les gens se sont sentis représentés.
630000	634000	Autant je pense qu'ils avaient été un peu mal représentés, un peu cool par Black Panther.
634000	635000	Au temps là...
635000	636000	Et ça confirme ce qu'on dit...
636000	637000	Black Panther, c'est nul.
637000	639000	Parce que Black Panther, c'est vraiment insupportable.
639000	640000	C'est du...
640000	641000	Mais ça avait marché quand même.
641000	643000	Les Noirs, vous faites votre super héros.
643000	644000	Voilà.
644000	647000	Allez tous le voir parce que vous allez voir, on va vraiment faire votre Wakanda.
647000	650000	On va faire un pays d'imaginaire en Afrique qui est trop stylé.
650000	651000	Alors qu'en fait, on pille vos ressources et que vous aurez...
651000	652000	Enfin...
652000	653000	C'est malsain.
653000	654000	Alors que là, c'est basé sur un vrai truc.
654000	655000	C'est malsain.
655000	656000	C'est basé...
656000	657000	Je suis d'accord, c'est malsain.
657000	659000	Django, c'est trop bien.
659000	665000	Django Unchained, je trouve que le héros Black qui devient trop stylé, qui devient
665000	667000	Ballyard, c'est Stilax.
667000	669000	Il y a beaucoup de Django dans ce film.
669000	670000	Il y a beaucoup de Django.
670000	674000	Mais là, pour le coup, ça faisait longtemps que je n'avais pas vu un film où les Renois
674000	680000	sont aussi Stilax et où le traitement des Renois est aussi bien fait, où leur musique
680000	682000	est bien faite, leur façon de parler est bien faite.
682000	683000	Après, c'est Ryan Coogler.
683000	686000	On a vraiment envie d'être noir quand on a ce film.
686000	688000	Enfin, je sais pas, toi, t'as eu envie d'être noir ou pas ?
688000	689000	J'ai toujours envie d'être noir, moi.
689000	690000	Ouais, ouais.
690000	691000	Ça c'est que pour des raisons de pénis.
691000	692000	C'est évident.
692000	693000	Non, mais après, je te comprends.
693000	695000	Après, c'est pas évident tous les jours aussi.
695000	696000	Il peut y avoir des gènes.
696000	697000	Ah bah oui, des problèmes de genoux.
697000	698000	Non, c'est pas évident.
698000	702000	Bien sûr, des femmes qui hurlent, des femmes qui veulent encore.
702000	707000	Non, non, mais c'est pas mon problème parce que loin du cliché de la grosse bite.
707000	708000	J'ai une bite énorme.
710000	712000	Elle fait peur.
712000	713000	Elle fait peur aux gens.
713000	717000	Enfin, encore faut-il aller la chercher à travers tous ses plis.
717000	721000	Ah bah, ça se mérite quelque part.
721000	722000	C'est pas évident.
722000	723000	Quand on sait qu'on a...
723000	726000	Non, voilà, et ça prouve ce qu'on dit tout le temps.
726000	735000	Il vaut mieux faire des films par peuplades que de forcer un mélange débile
735000	740000	et au final déplait à tout le monde sous prétexte d'universalisme complètement idiot.
740000	746000	C'est là, au moins, je préfère ce film où ouvertement les méchants sont les blancs.
746000	749000	Mais c'est ouvert, mais au moins c'est historique quoi.
750000	751000	Rebranche.
751000	752000	Ah merde, pardon.
752000	753000	C'est bon ?
753000	754000	Oui, pardon.
754000	760000	Alors autant, c'est vrai que d'habitude, je suis le premier à hurler au communautarisme.
760000	761000	Au communautarisme.
761000	762000	Mais sauf que c'est jamais du communautarisme.
762000	764000	Le communautarisme, c'est ça, c'est raconter l'histoire.
764000	766000	Mais là, pour le coup, ils m'ont tellement mis dans le camp là.
766000	770000	Mais non, parce que le communautarisme, ce qu'on aime pas, c'est celui qui mélange tout.
770000	771000	Là, ça mélange pas tout.
771000	773000	Puis là, c'est basé sur des faits historiques.
773000	774000	Au moins, ça sert l'histoire.
774000	776000	Ce qu'on aime pas, c'est quand ça tombe sur ma cheveu, sur la soupe.
776000	777000	Mais là, ça sert l'histoire.
777000	780000	Non mais c'est vrai que quand même, je reprends un petit peu mon côté blanc,
780000	783000	parce que j'ai les deux casquettes.
783000	785000	Il ne faut pas non plus déconner.
785000	789000	Là, c'est vrai que les vampires, c'est que les blancs.
789000	790000	C'est que les blancs.
790000	793000	Les méchants, c'est les vampires qui sont des blancs.
793000	796000	Et Ku Klux Klan qui sont des blancs.
796000	798000	Et donc, du coup, tous les noirs sont les héros.
798000	799000	Moi, d'habitude, j'aurais crié au scandale.
799000	800000	C'est pas normal.
800000	808000	Mais là, ils ont tellement réussi à me renouer et à me faire me retrouver dans les plaines d'Abidjan.
808000	812000	Comme si j'étais sur un bateau en train de chialer qui m'avait fait une rapt.
812000	816000	Du coup, pour moi, j'ai envie de tuer tous les blancs après ce film là.
816000	817000	Vraiment.
817000	818000	J'adore quoi.
818000	819000	J'adore.
819000	820000	J'ai Ku Klux Black quoi.
820000	822000	On se fait nos chapeaux pointus.
822000	823000	Rauf qu'on les peint en noir.
823000	825000	On sort des arcs.
825000	826000	Il y a du mafé.
826000	830000	Là, je ne mange plus que du mafé pendant une semaine.
830000	832000	On vient s'enculer un saucisson.
832000	835000	J'ai l'impression que la partie blanche, ça reprend un petit peu le poids.
835000	837000	Il est sympa ce petit vin blanc.
837000	839000	Il est bien de ta main.
839000	840000	Ça vient d'Afrique.
840000	842000	J'ai des exploitations.
842000	844000	Ça me revient très peu cher.
844000	846000	Ils sont sympas.
846000	848000	Ils sont sympas.
848000	849000	Ils travaillent pour si peu.
849000	851000	Je t'en mets une petite lampe.
851000	853000	En plus, c'est du raisin.
853000	855000	Tu sais, c'est écrasé avec les pieds.
855000	858000	Je le sentais un petit peu.
858000	862000	T'avais vu Creed quand même ?
862000	863000	Non.
863000	864000	T'avais vu aucun Creed ?
864000	867000	Moi qui suis fan de la saga Rocky, le premier Creed, je l'adore.
867000	873000	Rian Kugler, le réalisateur de Creed et Michael B. Jordan, c'est cette team-là qui a fait Creed 1 super.
873000	874000	Creed 2, un peu nul.
874000	880000	Creed 3 qui a le meilleur méchant de l'histoire des films récents.
880000	883000	Donc tu as écrit, ça te plairait quand même.
883000	885000	Parenthèse, film de combat.
885000	892000	Étant un grand fan de MMA et donc de l'UFC et de…
892000	894000	Et des combats de rue.
894000	897000	C'est vrai que tu te bats souvent comme des vieilles, des chiens, des enfants.
897000	898000	Non mais j'aime le MMA.
898000	900000	J'aime pas la boxe mais j'aime le MMA.
900000	904000	Ça t'arrive d'être violent sur des personnes handicapées.
904000	905000	Ça t'arrive.
905000	906000	Ça t'arrive.
906000	907000	Ça n'a rien à voir.
907000	917000	Ça fait partie de la haine qui m'habite quotidiennement envers les personnes handicapées, des personnes obèses, des personnes qui ont de…
917000	918000	Tu vois, ça c'est normal.
918000	920000	Ça quelque part c'est une sélection naturelle.
920000	921000	Il faut qu'il y ait encore des gens comme moi…
921000	922000	Pour les tabasser.
922000	925000	Voilà, qu'ils soient violents avec des gens qui ne méritent pas de vivre.
925000	928000	Qui méritent qu'on finisse le taf quelque part.
928000	929000	Exactement.
929000	930000	C'est vrai.
930000	931000	De toute façon…
931000	932000	De toute façon…
932000	933000	De toute façon…
933000	934000	T'es finie.
934000	935000	Non, ce que je veux dire c'est que je trouve…
935000	936000	Autant…
936000	938000	Quand on était jeune, il y avait des combats Bruce Lee, Jackie Chan…
938000	941000	Il y avait du ong-bak à la rigueur jusqu'à ong-bak, je kiffe.
941000	942000	Mais après…
942000	944000	Ton Wick, t'aimes plus les bastons ?
944000	945000	Non, j'aime plus les bastons.
945000	946000	Non.
946000	947000	J'aime plus les bastons.
947000	948000	Et d'ailleurs j'avais peur que ce film là…
948000	949000	Bah j'aimais encore la baston.
949000	950000	J'ai vu ce film.
950000	951000	Je voulais pas aller le voir parce que je me suis dit…
951000	952000	Putain, j'ai l'impression que c'est un film de…
952000	953000	De bagarre.
953000	957000	C'est un film de bagarre où ça va se tirer dessus et je pensais que ça se passait dans le monde moderne.
957000	960000	Et hier tu me dis mais non, non, non, c'est incroyable, il y a des vampires.
960000	961000	Je me dis comment c'est les vampires ?
961000	963000	J'ai pas du tout compris ça moi sur le truc.
963000	964000	Ni si, si, il y a des vampires.
964000	965000	Donc je me dis ok, ça a l'air bien.
965000	971000	Et là on arrive dans le cinéma et là je me rends compte qu'en plus ça se passe à l'époque de la ségrégation.
971000	972000	Ouais.
972000	973000	Et là je fais…
973000	974000	Et dans ma tête je commence à faire un espèce de truc de…
974000	976000	Ouh là là, match-up.
976000	980000	Ségrégation, ambiance coton, Django, plus vampires…
980000	984000	Mash-up, parce que match-up c'est un match où c'est se battre contre quelqu'un d'autre.
984000	990000	Mash-up, vampire machin, là les connexions se font et là je me dis ouuuuh ça va être bien.
990000	991000	J'ai vu tout de suite que ça allait faire.
991000	992000	Ouuuuh ça va être bien.
992000	993000	Ça m'a plu dès la…
993000	994000	Première seconde.
994000	995000	Première seconde.
995000	997000	Ouais on l'a pas vu parce qu'on est arrivé 5 secondes en retard.
997000	998000	Et on a eu de la chance d'ailleurs.
998000	999000	Ça m'a plu direct.
999000	1001000	Ça aide aussi, ciné rempli.
1001000	1006000	Et Michael B. Jordan en plus qui joue son jumeau, enfin ils sont doubles dans le truc,
1006000	1009000	ils sont trop stylés les deux, hyper bien habillés.
1009000	1011000	Il y a un petit truc de jumeaux en ce moment, je crois qu'ils veulent plus payer les acteurs.
1011000	1015000	Parce qu'on s'est vu Robert Pattinson deux fois, il y a eu un bide avec Robert De Niro.
1015000	1016000	Et c'est le même studio à chaque fois.
1016000	1019000	J'ai vu un truc sur eux, ils sont en train de se planter sur tous les films.
1019000	1021000	Sinners va les rattraper parce que je pense qu'il fait un carton.
1021000	1022000	D'accord.
1022000	1023000	Mais euh…
1023000	1025000	Et du coup ils aiment bien les jumeaux.
1025000	1028000	Alors il y a aussi un autre truc qu'on peut applaudir, c'est que putain…
1028000	1033000	Bordel c'est basé sur rien, c'est basé sur l'histoire mais il n'y a pas…
1033000	1037000	Alors au moins que je sois perdu mais c'est pas un comics ou alors c'est pas…
1037000	1039000	Tu vois ce que je veux dire, c'est un film original.
1039000	1040000	Donc ça fait quand même du bien.
1040000	1042000	C'est tout ce qu'on demandait depuis très longtemps en fait.
1042000	1045000	Avec un budget faramineux, ils ont pris un risque énorme.
1045000	1047000	J'espère que les gens vont aller le voir.
1047000	1050000	Ça m'a énormément étonné parce que là en fait bon…
1050000	1055000	Depuis qu'on a lancé ce podcast, comme vous le savez, il y a 3 films bien qu'on a vus.
1055000	1057000	Enfin dont celui-là et le troisième.
1057000	1063000	Donc il y avait Nosferatu, Mickey 17 et là maintenant arrive ce troisième film.
1063000	1065000	Qui pour moi très franchement…
1065000	1069000	Enfin ça serait difficile de les classer top 1, top 2, top 3 parce que c'est vraiment 3 films avec des styles différents.
1069000	1072000	Mais là franchement il est vraiment vraiment bien.
1072000	1073000	En tout cas on va le revoir.
1073000	1074000	Voilà on va le revoir.
1074000	1081000	Et en tout cas moi là où je suis content c'est de me dire allier la modernité avec la qualité.
1081000	1082000	Ouais c'est ça.
1082000	1085000	Parce que quand t'allies la modernité des images, la modernité des bande-son…
1085000	1086000	De la réale.
1086000	1093000	La modernité de la réale avec un esprit à l'ancienne style Une Nuit en Enfer.
1093000	1096000	Ouais il y avait un vrai côté années 90 dans le film que j'adore aussi.
1096000	1097000	Mais c'est complètement Une Nuit en Enfer ce film.
1097000	1098000	C'est totalement ça.
1098000	1101000	Les vampires sont hyper loufoques.
1101000	1103000	Les héros sont incroyables.
1103000	1104000	Ils ont une masculinité…
1104000	1105000	L'humour aussi.
1105000	1106000	Pas toxique.
1106000	1107000	Ouais.
1107000	1108000	Voilà.
1108000	1110000	Parce que visiblement la grande mode en ce moment c'est masculinité toxique.
