start	end	text
0	440	...
440	4600	Captain Babe !
4600	6420	Il faut que vous venez avec moi !
6420	8340	Quoi ? Quoi ? Mais ça, Professeur Fiontus !
8340	10300	Mais vers le futur, imbécile !
10300	12920	Allez, montez ! Mais qu'est-ce que vous attendez ?
12920	14280	Oh non, non, mais je peux pas, là !
14280	15640	On a podcast avec les potes !
15640	18140	Mais imbéciles abrutis ! Ça les concerne aussi !
18140	19840	Mais qu'est-ce qui nous arrive dans le futur ?
19840	21720	On va devenir de vieux podcasteurs à la con !
21720	24180	Non, non, enfin, ça vous l'aide déjà !
24180	25820	Il s'agit de votre avenir !
25820	26940	Vous êtes toujours pauvres !
26940	28500	Oh, imbécile !
28500	29400	Oh, putain, non !
29400	32380	Ah, Professeur ! Je ne veux pas la pauvreté !
32380	34960	C'est pas pécé, vous voulez dire que mon projet de trapabousé n'a pas fonctionné ?
34960	37400	Aucun de vos projets de merde n'a fonctionné !
37400	38880	C'est la catastrophe !
38880	42180	En plus, Patrick Béja est devenu président de la République !
42180	43180	Ah, le sourire !
43180	43820	Oh, putain, non !
43820	44980	Le bon décor d'année !
44980	47480	Mais, professeur, vous avez votre caddie à voyager dans le temps ?
47480	48800	Il n'est pas trop tard !
48800	51540	Non, il n'est pas trop tôt !
51540	53460	Il faut repartir aux origines du podcast...
53460	54220	Du podcast...
54220	54980	... 12 ans...
54980	56320	... en arrière !
56320	58840	À la vitesse de la lumière !
58840	60820	Dans leur caddie interstellaire !
60820	62820	C'est l'atterrissage d'aux en ploutons !
62820	65800	Des 4 champions de l'apéro !
65800	66800	Parce que le temps...
66800	68800	... c'est de l'argent !
68800	73800	Problème de physique quantique pour pouvoir soutirer ton prix !
73800	76780	Il faut modifier le passé !
76780	78760	Et déformer la réalité !
78760	83760	Trouver ce qui a pu voir et peut-être changer de banquier !
83760	84760	Parce que ton temps...
84760	88740	C'est notre argent !
88740	92720	C'est notre argent !
92720	95700	Ils sont partis du présent !
95700	97680	Pour aller dans le passé !
97680	101680	Et changer leur destinée !
101680	104660	Et carré dans l'univers !
104660	106640	Au milieu d'un trou de verre !
106640	110640	Ils ont perdu leur tempère !
110640	113640	Ils ont traversé l'espace !
113640	115640	Ils ont traversé le temps !
115640	119640	Et tout ça n'a rien changé !
119640	123620	Vont-ils revenir bientôt ?
123620	129620	Car c'est l'heure de l'apéro !
129620	131620	Lorsque ton père, c'est la mauvaise saison !
131620	132620	Qu'est-ce qu'il se passe ?
132620	135620	On est retourné dans le passé, Castenweb !
135620	137620	C'est pas possible ! C'est pas le bon générique !
137620	139620	Yaya, les deux connards ! Ils sont encore là !
139620	141620	Je croyais qu'on s'en était débarrassés !
141620	143640	Aaaaaah !
143640	145620	Vas-y, t'as fait tes web médias !
145620	149620	Miser sur la crypto-monnaie !
149620	151620	Acheter des bitcoins par milliers !
151620	153620	Et envoyer les calendriers !
153620	156620	Jamais poster de 38p !
156620	159620	Car le passé, c'est notre avenir !
159620	161620	Doubler l'abonnement BIC !
161620	165620	Et refaire les chiottes du Web Café !
165620	167620	Imbécier dans un PMU !
167620	170620	Prendre l'argent des gens qu'ont trop pu !
170620	172620	Abandonner toute dignité !
172620	174620	Pour les bûter à volonté !
174620	178620	Car le futur, c'est notre avenir !
178620	183620	Et puis soudain, l'idée géniale d'ouvrir une cagnotte PayPal !
183620	186620	Ils sont partis du présent !
186620	188620	Pour aller dans le passé !
188620	192620	Et changer leur destinée !
192620	195620	Écarés dans l'univers !
195620	197620	Au milieu d'un trou de fer !
197620	201620	Ils ont perdu leur tempère !
201620	204620	Ils ont traversé l'espace !
204620	206620	Ils ont traversé le champ !
206620	210620	Et tout ça n'a rien changé !
210620	214620	Ils vont revenir bientôt !
214620	220620	Café lors de l'apéro !
220620	223620	Qu'est-ce que vous faites professeur avant chargé votre caddie ?
223620	224620	Mais non !
224620	225620	C'est juste que j'ai soif !
225620	226620	Connard !
226620	227620	Et oui bande de connards !
227620	228620	Nous revoilà !
228620	229620	Ça y est, c'est reparti !
229620	230620	Pour la 13ème saison !
230620	232620	La 13ème année !
232620	233620	Ça ne s'arrête plus !
233620	234620	Ça ne s'arrête jamais !
234620	236620	On en rappellerait quand on a vu la 3ème saison !
236620	238620	Que c'était la saison de pro !
238620	240620	C'était il y a 10 ans la saison de pro mon dieu !
240620	241620	On était encore jeunes !
241620	242620	Tu n'avais pas de l'univers !
242620	243620	On avait la vie devant nous !
243620	244620	Et voilà !
244620	246620	Et là on a vu que le passé devant nous !
246620	249620	C'est toujours la pomme !
250620	251620	Déjà on ne s'arrête jamais !
251620	252620	Alors euh...
252620	253620	Attendez que je retrouve le bon truc !
253620	255620	Parce que quand même j'ai perdu comme d'habitude !
255620	258620	Ah tu parles la saison sur les capandros !
258620	259620	Est-ce que tu fais ça là-bas aussi ?
259620	261620	Faites pas chier nous ça là-bas !
261620	262620	Est-ce que tu peux me faire un euh ?
262620	263620	Est-ce que tu peux faire un euh ?
263620	265620	Alors euh...
265620	266620	Pas mal !
266620	267620	Nous sommes donc de retour !
267620	269620	Nous sommes le 13 septembre 2021 !
269620	271620	13 septembre 13ème saison !
271620	272620	Exactement 13ème saison !
272620	273620	13ème heure non ?
273620	275620	On est 13h de retard !
275620	276620	Euh...
276620	277620	Nouvelle saison !
277620	278620	Voilà !
278620	279620	Quoi dire de plus ?
279620	280620	Bah voilà !
280620	281620	On continue hein !
281620	282620	De toute façon on ne va pas s'arrêter maintenant !
282620	283620	Mais pourquoi est-ce qu'on continue ?
283620	284620	Je ne sais pas !
284620	285620	Ah !
285620	287620	C'est pas aussi franc !
287620	288620	C'est pas aussi franc !
288620	289620	Ah c'est pas vrai !
289620	290620	Alors comme...
290620	292620	Comme chaque semaine les meilleurs sont autour de cette table !
292620	293620	Lors de ton père bien sûr !
293620	294620	Et oui !
294620	295620	Encore là !
295620	296620	De retour toujours !
296620	298620	Notre ami Quakos !
298620	299620	Ouais !
299620	300620	Le best !
300620	301620	Celui qui nous fait toutes les musiques !
301620	303620	Qui est en train de nous préparer un magnifique générique pour la prochaine saison !
303620	304620	Ouais !
304620	305620	Parce que vous n'avez pas été très inspiré quoi !
305620	306620	C'est vrai !
306620	307620	Ça va pas être la meilleure !
307620	309620	Il faut compenser avec d'autres techniques et euh...
309620	310620	C'est un peu long !
310620	311620	Ouais !
311620	313620	Et bien entendu notre avis Manox !
313620	314620	Qui est venu de Toulouse !
314620	315620	Attention !
315620	316620	Ouais !
316620	318620	Cet homme vient de l'autre bout de la France !
318620	319620	Exactement !
319620	320620	Pour vous parler dans le micro de la province !
320620	321620	De la province !
321620	323620	Et comme c'est vous qui payez les billets de train vous avez intérêt à devenir VIC !
323620	326620	Parce qu'on a repéré tous ceux qui sont des abonnés pendant l'été là !
326620	327620	Et il y en a beaucoup !
327620	330620	Et dis-moi alors ton père d'ailleurs je ne reconnais pas cette quatrième personne autour de cette table là !
330620	331620	Tu parles de qui ?
331620	333620	Avant il y avait Captain Veve ici maintenant !
333620	334620	Mais maintenant il y a Captain Star !
334620	335620	Captain Star !
335620	336620	On va en parler !
336620	337620	On va en parler !
337620	339620	Je sais pas il y a pas grand chose à dire !
339620	340620	Mais si !
340620	343620	Moi j'ai des news incroyables !
343620	344620	On va tout dire !
344620	345620	Est-ce qu'on va tout dire ?
345620	346620	Moi je vais tout dire !
346620	348620	Ah mais est-ce qu'on va tout dire ?
348620	349620	C'est ça la vraie question !
349620	350620	Restez !
350620	351620	Charles The Leader ! Restez ! Restez !
351620	354620	Parce que depuis des high tech j'ai des trucs incroyables à vous révéler !
354620	355620	Incrédible !
355620	357620	Je suis déjà fatigué !
357620	359620	C'est une rentrée de folie !
359620	363620	Il parait en plus que Manac c'était une nouvelle rubrique avec un nouveau jingle !
363620	366620	En réalité c'est pas une nouvelle rubrique parce qu'on a déjà eu 3 !
366620	370620	Mais sur la forme où il a été fait en 30 secondes !
370620	371620	Ok !
371620	372620	Mais sur la forme un peu !
372620	373620	D'accord !
373620	374620	Ah c'est le tour de table !
374620	375620	T'as fait le tour de table !
375620	376620	Oui alors c'est le tour de table !
376620	380620	Non avant le tour de table nous avons quelques news, alors une nouvelle saison, nouveau projet !
380620	381620	Mais nouveau projet !
381620	382620	On a des nouveaux projets ?
382620	383620	Oui bien sûr !
383620	384620	Mais si si !
384620	385620	Ah bon ?
385620	386620	Je sais plus lequel !
386620	387620	C'est quoi ?
387620	388620	On devait partir !
388620	389620	Ah ouais mais on attend !
389620	390620	On attend que tu vas repartir !
390620	391620	On a des vacances !
391620	392620	Ah non non !
392620	393620	On a du travail à faire !
393620	394620	Oui du travail !
394620	395620	On a du travail de prévu !
395620	396620	Assez loin !
396620	397620	À 10 000 km d'ici !
397620	398620	Une conférence !
398620	399620	Oui bien sûr !
399620	400620	Non c'est le festival !
400620	401620	Ah oui !
401620	402620	C'est un festival !
402620	403620	Ouais c'est un festival !
403620	404620	Tu vas ressortir de là si tu veux !
404620	405620	Tu seras un homme changé !
405620	406620	Ah oui carrément !
406620	407620	Mais avant !
407620	409620	Mais avant de vous taxer !
409620	410620	Franchement on est à des tatouilles qu'à te faire faire !
410620	412620	Avant de lancer la prochaine arnaque !
412620	414620	Je veux d'abord terminer la précédente !
414620	416620	Voilà exactement ! Alors on va vous parler du projet Ulule !
416620	417620	Rappelez-vous !
417620	419620	Mais c'est tout dans la pombard !
419620	420620	Ah non !
420620	421620	Tu t'es trompé !
421620	422620	Je t'es trompé !
422620	423620	Je t'es trompé de bouton Marnon !
423620	425620	Bravo je te félicite pas !
425620	430620	Donc il y a quelques mois de cela, il y a pas si longtemps en fait quelques semaines tout au plus !
430620	431620	Ouais !
431620	435620	Nous avons clôturé une badeste campagne Ulule où nous avons récupéré à peine de quoi...
435620	436620	A peine !
436620	437620	A peine !
437620	438620	De 3 000 euros !
438620	441620	De quoi payer cette fantastique idée les vinyles !
441620	442620	Ouh !
442620	444620	Il y a aussi des CD !
444620	445620	Les CD ils pourront être là !
445620	446620	Alors c'est des vinyles !
446620	447620	Plusieurs nouvelles !
447620	448620	Déjà je sais que vous êtes encore nombreux à Montvoyer !
448620	450620	C'est incroyable le nombre de mecs qui ont déménagé !
450620	451620	Vous avez tous déménagé quoi !
451620	452620	Les mecs ça y est !
452620	453620	On avait fini à campagne Ulule !
453620	454620	Les mecs ils sont dépêchés de déménager à l'autre bout de la France !
454620	455620	Ouais !
455620	457620	Donc vous pouvez continuer encore de m'envoyer...
457620	458620	Vous avez le temps de déménager !
458620	459620	Mais encore le temps !
459620	460620	Mais encore le temps !
460620	462620	C'est possible de me déménager deux fois d'ici !
462620	463620	Il s'il vous corrigeait le vinyles !
463620	464620	N'exagérons pas !
464620	467620	Donc vous pouvez encore si vous avez déménagé entre temps ou si vous voulez...
467620	469620	Eh regarde Manox il va déménager deux fois !
469620	470620	Ouais !
470620	472620	Un shirt qui n'est pas du XL par défaut !
472620	474620	Vous pouvez encore m'envoyer un mail !
474620	475620	Il n'est pas trop tard !
475620	476620	Non !
476620	477620	Il n'est pas trop tôt !
477620	478620	Objectif de la nouvelle campagne !
478620	479620	500 000 euros !
479620	480620	D'eau de l'opération !
480620	482620	Un pied-à-terre parisien pour Manox !
482620	483620	C'est jouable !
483620	484620	Ouais ! Un petit pied-à-terre !
484620	486620	Un petit pied-à-terre pour quand il vient une fois toutes les deux semaines !
486620	487620	Voilà !
487620	488620	Et puis pour...
488620	490620	500 000 euros j'aurais quand même une belle chambre de bonne !
490620	491620	Ouais ! Au moins !
491620	494620	500 000 euros t'as au moins un grand studio !
494620	496620	T'as un bon 35 mètres carrés quand même !
496620	497620	Ouais !
497620	498620	On fait ça qu'il y a un métachement ascenseur !
498620	499620	Mais en sous-sol !
499620	500620	En sous-sol !
500620	501620	Vous savez qu'il y a des gens qui sont en train de...
501620	502620	Un souplex !
502620	504620	Il y a des gens en province qui entendent ça et qui sont en train de se tirer !
504620	507620	La malédiction du souplex !
507620	509620	T'as vrai qu'il y a des gens qui ne savent pas ce que c'est qu'un souplex !
509620	511620	Est-ce que tu veux leur ton père expliquer ce qu'est un souplex ?
511620	512620	C'est un duplex inversé quoi !
512620	513620	Voilà !
513620	514620	Non c'est même pas un duplex inversé !
514620	515620	C'est un sous-sol quoi !
515620	517620	C'est un rez-de-chaussée avec une cave qui a été aménagée !
517620	518620	Ouais !
518620	520620	Généralement parfois il n'y a même pas de rez-de-chaussée !
520620	521620	Ouais c'est vrai !
521620	522620	Donc un souplex !
522620	525620	En tout cas ça pourrait faire un petit bais au drone pour notre ami de ton père !
525620	527620	Pour les vendredis soir !
527620	528620	Donc !
528620	530620	T-shirt nouvelle adresse !
530620	532620	Vous pouvez continuer à nous envoyer vos tailles et vos nouvelles adresses !
532620	534620	Oui mais le vignet capte de la bête !
534620	535620	Qu'est-ce qui s'est passé là ?
535620	536620	Explique-nous !
536620	539620	Les stickers sont envoyés en impression !
539620	540620	Rassurez-vous vous aurez vos stickers !
540620	541620	Ça va tout va bien !
541620	542620	Et les bagnettes !
542620	543620	Et les bagnettes !
543620	544620	Et les bagnettes !
544620	545620	Vous aurez vos magnettes !
545620	546620	T'as envoyé vos bagnettes !
546620	547620	Quoi ?
547620	548620	Tu l'as pas dit ? Tu l'as envoyé l'impression que c'est ça ?
548620	549620	Non pas encore, je vais le faire demain !
549620	550620	Ah !
550620	552620	Et les bagnettes !
552620	553620	Et les t-shirts !
553620	555620	Le temps qu'ils écoutent cet épisode de toute façon !
555620	556620	Et les bagnettes !
556620	559620	Les t-shirts, les casquettes, on attend un peu qu'on reçoive les vinyles !
559620	560620	Et les bagnettes !
560620	561620	Enfin quand les vinyles !
561620	562620	Alors !
562620	563620	Ça se fait peut-être pas plus mal de les commander maintenant !
563620	564620	Oui mais on va s'occuper de tout ça !
564620	565620	Et les bagnettes !
565620	566620	Et les bagnettes !
566620	567620	C'est pas que sur le vinyle que tu as présenté !
567620	568620	Et les bagnettes !
568620	569620	Et les bagnettes !
569620	571620	Parce qu'après ça va être réel dans un autre pot !
571620	572620	Il avait tout l'été !
572620	574620	Il a une raison pour ça !
574620	575620	Il a une raison pour ça !
575620	576620	Oh putain !
576620	577620	Il y a une raison pour ça !
577620	581620	La raison c'est que si on achète les t-shirts maintenant, déjà on a pas toutes les tailles !
581620	583620	Les auditeurs ont grossi !
583620	584620	C'est vrai, c'est possible !
584620	587620	Ils seront rentrés dans une dépression à faire se attendre devant leur boîte-être !
587620	588620	Donc ça c'est un vrai problème !
588620	589620	Ils ont rendu en plus surtout !
589620	591620	Ils ont tous pris une taille de t-shirt !
591620	594620	Tu as 600 t-shirts qui attendent devant un entrepôt !
594620	596620	Il faut payer tous les mois pour la location de l'entrepôt !
596620	597620	Relou !
597620	599620	Donc il y a tout l'intérêt de quand même !
599620	600620	Ok, les bagnettes !
600620	601620	Bon bref !
601620	602620	Et alors le vinyle !
602620	603620	Et les bagnettes !
603620	604620	Et les bagnettes !
604620	605620	Les vinyles !
605620	606620	Alors les vinyles, on a un petit souci !
606620	607620	On va pas vous le cacher !
607620	608620	C'est des choses qui arrivent !
608620	610620	Pourtant on avait tout préparé, on avait les devis et tout !
610620	613620	Manque de pot, les mecs au moment où on leur a dit
613620	615620	c'est bon pour le devis, vas-y on signe, c'est parti !
615620	617620	Voilà, les mecs ils ont plus jamais répondu en fait !
617620	622620	Il semblerait que nous ayons ouvert une sorte de porte interdimensionnelle
622620	626620	qui fait que toute la matière première a disparu sur Terre pour faire des vinyles !
626620	627620	C'est incroyable !
627620	628620	C'est l'enfer !
628620	629620	Peut-être que les auditeurs...
629620	633620	Alors toi auditeur, si tu presses des vinyles, contacte-nous !
633620	636620	Voilà, faut que les écoutes en direct parce que sinon ça sert à rien !
636620	637620	Sinon le temps que l'épisode sorte...
637620	640620	Pourquoi le temps que l'épisode sorte ? Tu insinues qu'il va sortir dans 5 mois ?
640620	644620	Non mais je pense qu'il faut lancer l'impression la semaine prochaine donc bon !
644620	646620	Alors la semaine prochaine ça va être un peu chaud !
646620	649620	Bon en tout cas on est en train de contacter de nouveaux fournisseurs !
649620	651620	Je t'en avais dit pas avant Noël !
651620	654620	Ça l'avait dit aux auditeurs pas avant Noël comme ça !
654620	655620	Ça peut être qu'une bonne nouvelle !
655620	659620	Alors Noël tu t'avances un peu je pense parce qu'on donnera une date qu'on sort !
659620	661620	Mais vous allez le recevoir ! Ne vous inquiétez pas !
661620	662620	Vous aurez votre vinyles !
662620	663620	C'est vrai que si parmi vous...
663620	665620	Regardez cet homme ! Est-ce qu'il a l'air en tête ?
665620	666620	Oui !
666620	667620	Je suis l'honnêteté même !
667620	671620	Si parmi vous ce soir en direct live vous connaissez des gens qui font ça,
671620	674620	qui produisent et qui créent des vinyles, n'hésitez pas à nous contacter !
674620	677620	Ça sert à rien ! J'ai déjà filé deux numéros, il les a pas appelés !
678620	681620	J'aime pas passer des coups de fil bordel !
682620	683620	Faites pas chier quoi !
683620	686620	Je le dis j'en connais un, c'est sûr ! Ils en produisent encore !
686620	687620	C'est en Mayenne !
687620	689620	J'ai envoyé des mails !
689620	691620	J'envoie des mails, il peut appeler !
691620	693620	J'ai t'apprendre un grand truc Captain Web !
693620	696620	Parfois dans le monde du travail, dans le monde professionnel,
696620	699620	il ne faut pas juste t'envoyer un mail, il faut décrocher son téléphone !
699620	701620	Il faut appeler les gens !
701620	702620	Ça sert à quelque chose !
702620	703620	Je vais t'envoyer les mails avec les coordonnées,
703620	706620	tu vas appeler demain les gens pour te renseigner !
707620	710620	Moi je veux bien m'appeler, il n'y a pas de problème !
710620	711620	Le problème c'est que je n'ai pas les datas !
711620	712620	J'y connais rien !
712620	713620	Ne bouge pas, je t'envoie le mail !
713620	714620	Attends j'arrive !
714620	715620	Non mais je n'y connais rien !
715620	717620	Le gars va me poser des questions !
717620	718620	Il faut rien comprendre !
718620	720620	Moi je veux bien les appeler !
720620	721620	Il n'y a pas de problème !
721620	723620	Ce que tu peux faire avec ton père, c'est passer ici demain,
723620	725620	vous donner un petit rendez-vous et vous appeler à ce moment-là !
725620	726620	Ah oui, on peut appeler ensemble si tu veux !
726620	727620	Ça peut être pas mal !
727620	728620	Je peux appeler tout seul !
728620	729620	Ah oui, on peut appeler ensemble !
729620	731620	Ça fait un mois que j'ai filé le numéro !
731620	732620	Ca c'est pas con !
732620	733620	Bon bref !
733620	734620	Ne vous inquiétez pas !
734620	735620	On est en train de s'enligner !
735620	737620	On a d'autres pistes, ça avance !
737620	739620	Mais bon, effectivement on va avoir un peu de retard !
739620	745620	Un peu de retard dans le sens entre deux mois et beaucoup plus !
745620	747620	Peut-être avant la présidentielle !
747620	748620	Avant Noël !
748620	749620	Quel Noël ? Je ne suis pas certain !
749620	750620	Mais ce sera avant Noël, c'est sûr !
750620	751620	Non mais effectivement !
751620	754620	Non mais ce qui est vrai, c'est là où on touche du doigt le délicat problème !
754620	757620	C'est qu'effectivement il y a une crise des matières premières pour fabriquer des vinyles !
757620	761620	Et qu'en plus il y a une sorte de regain à mort du vinyle en ce moment !
761620	763620	Non, c'est pas ça ! C'est Amazon !
763620	764620	Ah bon ?
764620	765620	Oui !
765620	767620	Pour des mecs high-tech la vache !
767620	770620	Amazon n'y lance une offre premium au vinyle !
770620	772620	Et donc ils ont bouffé toute la matière !
772620	773620	Ah ouais !
773620	774620	Tout le reste des matières premières !
774620	775620	D'accord !
775620	776620	Il y a plein de problèmes différents !
776620	777620	Mais en tout cas ça va arriver !
777620	778620	Ne vous inquiétez pas si vous avez investi !
778620	783620	Par contre sachez que j'ai cru comprendre que le master pour le vinyle était quasiment bouclé !
783620	785620	Il me manque le générique neuf que CaptainWeb devait m'envoyer !
785620	787620	Non je t'ai envoyé les fichiers !
787620	788620	Je ne les ai pas trouvés !
788620	791620	Il me dit j'ai envoyé les fichiers mais je ne les ai pas trouvés !
791620	792620	Non ok ok ok alors !
792620	793620	Je t'ai dit !
793620	794620	Alors !
794620	795620	Début août !
795620	796620	Regarde !
796620	797620	J'ai envoyé le mail !
797620	798620	Sur le Mac ici !
798620	799620	Oui !
799620	800620	Et je t'ai envoyé un mail !
800620	801620	Je suis à le générique neuf !
801620	805620	Je t'ai envoyé un mail avec des trucs en disant je pense que c'est pas ça ce que je les avais déjà donnés !
805620	806620	Donc tu vas pas filer le bon !
806620	807620	Il n'y est pas là-dessus !
807620	808620	Tu as trouvé ?
808620	809620	C'est celui de neuf il est là-dessus !
809620	810620	Le Mac on va depuis le neuf !
810620	811620	Tu l'as trouvé ?
815620	816620	Peut-être une bonne nouvelle !
816620	819620	Est-ce qu'on aurait le moyen de rajouter le prochain générique sur le Vini ?
819620	820620	Oula !
820620	821620	En timing je suis pas sûr mec !
821620	822620	Il y a peut-être un manque de place effectivement !
822620	823620	En timing ça va pas être bon !
823620	824620	Il va falloir qu'on voit ça !
824620	825620	Mais bon voilà !
825620	826620	Ne vous inquiétez pas !
826620	827620	Vous allez le recevoir !
827620	828620	Tout va bien !
828620	829620	On n'a pas claqué la thune !
829620	830620	Si c'est votre inquiétude !
830620	836620	Tu voulais faire un cadeau bonus ça pour le timing, pour le délai pour les auditeurs ?
836620	837620	Il faut voir si ça passe !
837620	838620	Je sais pas !
838620	839620	S'il y a de la place !
839620	840620	Mais on verra en tout cas !
840620	841620	Voilà !
841620	842620	Bon là-dessus c'est terminé !
842620	845620	Donc il est temps que tu fasses ton tour de table pendant que je prépare la rubrique
845620	846620	Cadeau !
846620	847620	Le tour de table !
847620	848620	Ça va être très long !
848620	853620	Captain Deb, tout d'abord toi et moi, ensemble, tel un être unique, une divinité à double face
853620	859620	comme Janus Jana le dieu à dieu tête, et bien nous allons faire la rubrique des news high-tech !
859620	860620	High-tech !
860620	861620	High-tech !
861620	862620	Excuse-moi !
862620	863620	T'oublies un détail !
863620	867620	T'oublies un détail c'est que maintenant l'être unique c'est plus que Captain Star !
867620	868620	On va en parler tout à l'heure !
868620	869620	C'est vrai !
869620	871620	C'est un petit peu le Watson quoi !
871620	872620	Surtout t'oublies une rubrique avant quoi !
872620	873620	C'est vrai !
873620	874620	C'est ça ! Bah je suis désolé !
874620	875620	C'est vrai !
875620	876620	C'est vrai !
876620	881620	En tout cas je vais tenter de m'aligner avec le Capitaine Deb pour faire les news high-tech !
881620	885620	Et d'ailleurs ça chez eux, avant même qu'on commence à s'y jouer, j'ai 4 breaking news !
885620	886620	4 !
886620	887620	Alors arrache !
887620	888620	Essaye pas de tirer la couverture vers toi !
888620	889620	C'est lui la star !
889620	892620	Alors précisons quelque chose quand même, Lord ton père, avant de t'exciter avec tes news high-tech,
892620	894620	c'est qu'avant il y avait quand même une autre rubrique !
894620	896620	Les sousous dans la pampax !
896620	898620	La renvoye des cadeaux !
898620	899620	Voilà !
899620	903620	Mais après ça, après ça j'ai cru qu'on prend de Malox ce soir, tu as noué de nouvelles rubriques !
903620	904620	Les sousous dans la pampax !
904620	906620	Les sousous dans la pampax !
906620	908620	La nouvelle rubrique de Malox !
908620	911620	Alors ça n'est pas vraiment une nouvelle rubrique parce qu'effectivement c'est son...
911620	913620	Non mais si ! Il dit que c'est une nouvelle rubrique !
913620	915620	Voilà ! Alors c'est une nouvelle rubrique en quelque sorte !
915620	917620	Disons que c'est une refonte !
917620	918620	D'accord !
918620	919620	C'est une 2.0 !
919620	920620	De quelle rubrique ?
920620	921620	3.0 !
921620	922620	De la rubrique !
922620	924620	Les sousous dans la pampax !
924620	927620	La rubrique des blagounettes de Dr Malox !
927620	930620	Volume 4 !
