start	end	text
2689620	2690620	Ah bon ?
2690620	2691620	Tout le monde le sait d'ailleurs !
2691620	2693620	Mais j'ai pas perdu espoir, je suis en train de réviser le code de la roue !
2693620	2694620	Oh mon dieu !
2694620	2695620	Cachez-vous !
2695620	2696620	Il n'y a que moi !
2696620	2702620	Vous vous êtes jamais battu avec des essuie-glaces qui étaient dégueulasses et qui te saluent plus le pare-bris !
2702620	2705620	Je pense que c'est une vraie révolution ce qu'il est en train de faire !
2705620	2708620	Alors en fait l'essuie-glaces laser, c'est pas immédiat immédiat tout de suite,
2708620	2711620	mais ça viendra en complément des essuie-glaces classiques !
2711620	2716620	C'est-à-dire qu'il y aura l'essuie-glaces pour l'eau, quand il pleut et que vous conduisez, il y aura toujours l'essuie-glaces !
2716620	2719620	Mais par contre pour toutes les petites saloperies, les petits...
2719620	2720620	Les moucherons et les insectes !
2720620	2722620	Le laser !
2722620	2724620	Les gens qui se brûlent sur ton pare, vous voyez...
2724620	2725620	Voilà !
2725620	2728620	Donc bientôt sur les Tesla, les essuie-glaces laser !
2728620	2729620	Pétain !
2729620	2730620	Et ça, ça claque !
2730620	2731620	Pétain !
2731620	2732620	C'est une sacrée claque !
2732620	2733620	C'est la claque !
2733620	2735620	C'était tout ?
2735620	2736620	Merci !
2736620	2737620	C'est déjà moi !
2737620	2741620	On continue sur les news de l'espace avec cette fois la Chine !
2741620	2743620	Vous le savez, la Chine a de grandes ambitions !
2743620	2746620	Est-ce que tu vas parler du vaisseau d'un kilomètre de l'eau ?
2746620	2747620	Ah putain, tu m'as piqué la news !
2747620	2748620	Alors putain !
2748620	2749620	Une news en moins !
2749620	2751620	On n'est pas arrivés, attention !
2751620	2753620	Mais on va en parler tous les deux avec leur ton père !
2753620	2754620	C'est juste un projet !
2754620	2758620	Pour l'instant, ils ont débloqué 2 millions de dollars juste pour étudier la possibilité de le faire !
2758620	2759620	L'idée, c'est...
2759620	2760620	Vous voyez la station spatiale ?
2760620	2761620	C'est de la merde !
2761620	2762620	C'est de faire un truc 10 fois plus gros !
2762620	2764620	Donc ça veut dire 1 kilomètre de long !
2764620	2766620	Alors ça en fait des...
2766620	2768620	Oui mais ce serait un vaisseau spatial !
2768620	2770620	C'est pas juste une station !
2770620	2771620	Ce serait un vaisseau spatial !
2771620	2772620	Non je suis pas sûr !
2772620	2774620	Je pense que c'est plus une station qu'un vaisseau !
2774620	2775620	Parce que pareil !
2775620	2777620	L'objectif n'est pas de partir au-delà du...
2777620	2778620	Au-delà de la terre !
2778620	2779620	Excuse-moi !
2779620	2780620	Je cite...
2780620	2781620	Vas-y !
2781620	2782620	C'est des citations !
2782620	2783620	Alors évidemment c'est traduit en français !
2783620	2788620	Ce vaisseau ultra large est pensé comme un équipement aérospatial stratégique majeur
2788620	2790620	pour l'utilisation future des ressources spatiales,
2790620	2793620	l'exploration des mystères de l'univers,
2793620	2795620	et le maintien en orbite à long terme !
2795620	2796620	Voilà !
2796620	2797620	C'est complètement que t'es de la plaque Capitaine !
2797620	2798620	Non moi j'ai un gros doute !
2798620	2800620	Je pense que c'est une station spatiale !
2800620	2801620	Et voilà !
2801620	2802620	Alors attends !
2802620	2803620	Si le Capitaine l'a dit...
2803620	2807620	Je te permets de te dire que c'est ce qu'a dit le chef des spatiaux chinois !
2807620	2808620	C'est sur quel site ?
2808620	2809620	C'est sur...
2809620	2810620	Chilspatial.com
2811620	2813620	Oui mais là tu parles la Capitaine Star !
2813620	2815620	Oui c'est sur Space, c'est Chine !
2815620	2816620	Je pense qu'il y en a un qui est plus calé que l'autre !
2816620	2817620	Moi j'ai un doute !
2817620	2818620	Mais cela dit !
2818620	2820620	Bon après tout pourquoi pas !
2820620	2824620	Mais ils en sont encore loin parce que ce truc là coûterait...
2824620	2826620	des centaines de milliards de dollars !
2826620	2830620	La station spatiale c'est à peu près 100 milliards de dollars en l'espace de 30 ans !
2830620	2833620	Imaginez un truc dix fois plus grand !
2833620	2835620	Une année de bénéfice Apple quoi !
2835620	2836620	De quoi ?
2836620	2837620	Oui mais Apple ils vont pas claquer l'ortume là dedans !
2837620	2839620	Sinon ils seraient déjà l'eau !
2839620	2840620	Dans les spars !
2840620	2841620	Tesla il va le faire !
2841620	2844620	Mais dans le style bullshit parce que moi j'aime beaucoup tout ce qui est bullshit !
2844620	2846620	Le bullshit c'est assez étonnant !
2846620	2847620	D'Elon Musk !
2847620	2848620	On avait pas remarqué !
2848620	2850620	Autant je crois que le spaceship...
2850620	2851620	Enfin le...
2851620	2852620	Non !
2852620	2853620	Comment t'appelles ça ?
2853620	2854620	Le starship !
2854620	2855620	Le starship !
2855620	2857620	Je pense que vraiment il y a un énorme potentiel là-dessus !
2857620	2858620	Quakos !
2858620	2859620	Quakos !
2859620	2860620	Quakos !
2860620	2861620	Quakos !
2861620	2862620	Quakos !
2862620	2863620	Quakos !
2863620	2864620	Quakos !
2864620	2865620	Quakos !
2865620	2866620	Quakos !
2866620	2867620	Quakos !
2867620	2868620	Quakos !
2868620	2869620	Vas-y Captain Vail !
2869620	2870620	Enchaîne !
2870620	2871620	Enchaîne !
2871620	2875620	Si vous nous écoutez, merci de vous expliquer pourquoi dans les commentaires de l'émission !
2875620	2876620	Je ne comprends pas !
2876620	2877620	Il n'y a pas de commentaires !
2877620	2878620	Oui effectivement !
2878620	2880620	Je les ouvrirai spécialement pour l'occasion !
2880620	2882620	Je me suis dit cette année, dès que vos rubriques sont un peu longues en news...
2882620	2883620	Tu as roté !
2883620	2884620	Je fais ça !
2884620	2885620	Oh putain on est mal barré !
2885620	2886620	C'est un signal !
2886620	2887620	D'accord !
2887620	2888620	Là...
2888620	2889620	Ça bon on a compris !
2889620	2890620	Ça y est le vaisseau spatial !
2890620	2891620	Laissez-moi !
2891620	2892620	C'est une station spatiale !
2892620	2893620	Vas-y Captain Vail !
2893620	2894620	J'aimerais juste vite fait...
2894620	2895620	J'ai un peu vos news avant de commencer !
2895620	2896620	C'est Captain Star !
2896620	2897620	J'aimerais...
2897620	2898620	Putain ça va être insupportable !
2898620	2902620	J'aimerais juste parler vite fait du Starship !
2902620	2908620	Donc le Starship a plusieurs versions de celle qui va juste aller en orbite pour ravitailler
2908620	2912620	d'autres vaisseaux à la version pour la Lune à la version pour Mars !
2912620	2914620	Mais il y a une version que j'apprécie tout particulièrement !
2914620	2916620	C'est la version de la Terre à la Terre !
2916620	2920620	C'est-à-dire que l'idée c'est de faire en une demi-heure de faire New York-Tokyo
2920620	2923620	tout simplement parce que tu vas sortir de l'atmosphère !
2923620	2924620	Ah oui !
2924620	2929620	Alors, Musk, à chaque fois qu'il en parle, il en parle de la main sur le cœur et tout
2929620	2931620	en disant ça va être génial, vous allez voir !
2931620	2935620	En dehors du fait que c'est comme l'équivalent de 150 000 voyages en avion !
2935620	2936620	Écologiquement, c'est un peu moyen !
2936620	2938620	Et puis je pense que c'est un peu plus risqué que de prendre l'avion !
2938620	2939620	Alors voilà, c'est ça !
2939620	2942620	Quand j'ai vu ça la première fois, ça m'a intrigué !
2942620	2946620	Je me suis dit ok, c'est cool, mais est-ce que le confort sera comme dans la 380 ?
2946620	2947620	Alors, la vérité, c'est pas vraiment...
2947620	2949620	Si vous aimez les montagnes russes, préparez-vous !
2949620	2956620	Parce que là, à côté, je crois que c'est l'équivalent de deux fois ce que tu te prends en G sur les pires montagnes russes du monde !
2956620	2957620	D'accord !
2957620	2959620	Oui, alors...
2959620	2961620	Vos gueules !
2961620	2963620	J'aurais égile au chat, monsieur Bukaki...
2963620	2965620	Non mais c'est quoi cette histoire ?
2965620	2966620	Donc...
2966620	2972620	Autant je peux comprendre le principe de se dire qu'on a très vite du matériel, par exemple, à transporter d'un point de la terre à un autre.
2972620	2975620	D'ailleurs, ils sont en train de signer un contrat a priori avec l'armée américaine.
2975620	2978620	Comme par exemple une cargaison complète de porcelaine !
2978620	2979620	Oui, voilà !
2979620	2980620	Ou de la matière première de vinyle !
2980620	2984620	Ou, je sais pas, 150 tonnes de mines en puissé personnel, ça peut avoir son but !
2984620	2986620	Ou 150 000 tonnes de bagnettes !
2986620	2988620	Voilà, exactement !
2988620	2989620	1500 vinyles, par exemple !
2989620	2992620	Effectivement, tu dis « j'en ai besoin tout de suite » et tout, ok !
2992620	2993620	D'accord !
2993620	2997620	Par contre, pour le transport de personnes, laissez-moi avoir un petit doute, parce que tu montes pas là-dedans comme tu montes dans un avion !
2997620	2998620	Ohhhh !
2998620	3000620	Tu vas pas transporter de la femme enceinte là-dedans !
3000620	3001620	C'est pas ce que vous êtes !
3001620	3003620	Après, il faudra tout nettoyer, il y en aura partout !
3003620	3006620	On t'a pas dit qu'on allait mettre toutes les femmes de leur ton père là-dedans !
3006620	3007620	Alors !
3007620	3008620	C'est bon !
3008620	3009620	Pas exagéré !
3009620	3013620	Tout ça pour dire que, Elon Musk, une fois sur deux, c'est un peu du bullshit, on pourra peut-être reparler plus tard !
3013620	3014620	Non mais il fait...
3014620	3016620	Attends, attends, attends !
3016620	3021620	Tu nous fais une news, ça fait quatre fois qu'on te dit, moi et les auditeurs, que c'est trop long !
3021620	3022620	Oui !
3022620	3025620	Pour nous dire à la fin, en fait tout ça c'est du bullshit !
3025620	3026620	Bah oui !
3026620	3027620	Tu te fous de nous !
3027620	3028620	C'est ça ! Tu te fous de ma gueule là !
3028620	3029620	On va en faire 20 minutes !
3029620	3030620	De news !
3030620	3031620	De fake news !
3031620	3032620	De fake news !
3032620	3033620	J'expose le sujet !
3033620	3034620	J'expose le sujet !
3034620	3035620	T'es un républicain toi !
3035620	3036620	Elon Trump !
3036620	3037620	J'essaye de vous expliquer !
3037620	3039620	Elon Trump !
3039620	3040620	C'est Captain Trump !
3040620	3041620	Captain Trump quoi !
3041620	3045620	Pour vous puis dire, je passe la main à son père qui va faire une news 10 minutes sur les trucs financiers !
3045620	3046620	Ah ouais c'est du bullshit quoi !
3046620	3047620	C'est du bullshit quoi !
3047620	3048620	Oh putain l'évec !
3048620	3049620	Allez on arrête !
3049620	3051620	Ah vous voulez une fake news, vous voulez une fake news !
3051620	3052620	Alors j'ai des...
3052620	3053620	J'ai des...
3053620	3054620	Euh...
3054620	3055620	Allez !
3055620	3056620	Petite breaking news !
3056620	3058620	Ah lui aussi ! Il vient zapper une news !
3058620	3059620	Qui sait que c'était des conneries !
3059620	3060620	Qui sait que c'était faux !
3060620	3061620	Ça ça y est, il n'y en a plus que de news !
3061620	3062620	Non c'est faux !
3062620	3063620	Il va marquer entre parenthèses fake news !
3063620	3068620	Alors est-ce que vous vous souvenez évidemment du combat épique entre Epic Games justement
3068620	3069620	et Apple ?
3069620	3070620	Ah bah oui !
3070620	3071620	Et Apple !
3071620	3072620	Non c'était avant l'été !
3072620	3073620	Ça s'est terminé sur Amshit !
3073620	3075620	Ça a démarré l'année dernière !
3075620	3076620	Oui mais ça a pris du temps !
3076620	3077620	Oui d'accord !
3077620	3079620	Mais le combat épique il a démarré l'année dernière !
3079620	3080620	Oui mais là il est en train de se clore !
3080620	3082620	J'ai la conclusion là devant moi !
3082620	3085620	Est-ce que tu sais ce qui s'est passé à la rentrée ?
3085620	3087620	Est-ce que tu sais ce qui s'est passé au moins de chaque fois ?
3087620	3089620	Rappelez-vous de la conclusion...
3089620	3091620	C'est exactement ce que je viens de dire !
3091620	3092620	Vous vous rappelez du combat épique ?
3092620	3093620	Bah oui c'est ce que je viens de dire !
3093620	3094620	Oui !
3094620	3095620	Des chevaux !
3095620	3096620	Tu viens de me faire perdre 3 minutes de news !
3096620	3097620	3 minutes de news !
3097620	3099620	Là je t'aurais roté tellement tu racontes des conneries !
3099620	3100620	Allez vas-y accouche !
3100620	3101620	Alors !
3101620	3102620	10 septembre !
3102620	3103620	Ce vendredi 10 septembre !
3103620	3104620	Qu'est-ce qu'on se passe ?
3104620	3107620	Yvonne Rogers a rendu son jugement !
3107620	3109620	Dans la Silicon Valley !
3109620	3113620	Elle a dit deux choses par rapport à IP Games et Apple !
3113620	3114620	La première chose c'est...
3114620	3117620	Alors elle a fait une décision tout en nuances !
3117620	3119620	Elle a jugé d'abord, premièrement,
3119620	3122620	que même si Apple a une part de marché importante,
3122620	3126620	donc qui est supérieure à 55% en matière d'App Store,
3126620	3128620	et qu'elle a des marges de profit, je cite,
3128620	3130620	extraordinairement élevées,
3130620	3133620	mais que ça n'est pas néanmoins une infraction au droit de la concurrence,
3133620	3136620	et qu'elle ajoute, le succès n'est pas illégal !
3136620	3137620	Oh là là là !
3137620	3138620	C'est beau hein !
3138620	3139620	C'est très très beau !
3139620	3140620	Donc il y a un point pour Apple !
3140620	3141620	Donc un point pour Apple,
3141620	3144620	et d'ailleurs Epic se voit condamné à des dommages et intérêts,
3144620	3147620	et Epic ne peut pas revenir sur l'App Store !
3147620	3149620	Donc là ils vont faire appel du jugement sur ce choix !
3149620	3152620	J'aimerais bien qu'on réécoute les épisodes de l'année dernière !
3152620	3154620	J'aimerais bien que les auditeurs fassent ça !
3154620	3155620	Je sais pas le chiffre exact, mais c'est pas 10 000 dollars !
3155620	3157620	Je crois que c'était ridicule la somme qu'ils ont été condamnés !
3157620	3162620	J'aimerais quand même bien que les auditeurs réécoutent les épisodes de l'année dernière qu'on en parlait !
3162620	3172620	Cependant, elle a jugé que le comportement d'Apple était anti-concurrentiel en ce qui concerne l'obligation de devoir payer sur la plateforme !
3172620	3174620	Qu'est-ce qu'il y a ?
3174620	3175620	Non rien, continue leur ton père !
3175620	3177620	C'est vrai que cette saison...
3177620	3179620	Continue leur ton père !
3179620	3183620	Te laisse pas déconcentrer par les gens qui disent que tu passes sur la radio courteuse !
3183620	3185620	Vraiment, c'est n'importe quoi !
3185620	3192620	Et par contre, elle a donné pour ordre à Apple de permettre à tous ceux qui ont des applications sur l'App Store
3192620	3199620	de renvoyer leurs clients sur un site web externe via un lien où ils peuvent payer, non pas sur le site d'App Store !
3199620	3203620	Ce qui veut dire qu'ils peuvent ne pas payer la commission de 30% à Apple !
3203620	3204620	Ce qui change tout !
3204620	3207620	Ça ne concerne pas le paiement inap !
3207620	3209620	Non, voilà ! Le paiement inap !
3209620	3211620	Je crois que c'est 29,9% un truc comme ça !
3211620	3212620	Non, c'est entre 15 et 30...
3212620	3214620	C'est 15 ou 30% en fonction !
3214620	3216620	En fonction de si t'es gros ou pas !
3216620	3217620	C'est gros ou pas !
3217620	3222620	Voilà ! Mais donc, ça ouvre une sacrée brèche dans la commission d'Apple !
3222620	3223620	C'est européenne !
3223620	3225620	Et par ailleurs, il faut savoir qu'il y avait aussi une procédure devant...
3225620	3228620	Et c'est la deuxième raison pour laquelle Apple a changé ses règles !
3228620	3233620	Il y avait une procédure d'anticoncurrence devant les autorités japonaises
3233620	3237620	qui ont également condamné et demandé à Apple de changer ses pratiques !
3237620	3239620	Et donc, tant au Japon qu'aux Etats-Unis,
3239620	3241620	Apple arrête de faire tes...
3241620	3244620	Je ne sais pas...
3244620	3245620	Oh la vache, t'as compris ?
3245620	3247620	Il a été violent avec toi !
3247620	3248620	Je comprends...
3248620	3249620	Voilà donc...
3250620	3251620	Donc ça...
3251620	3252620	On dirait un fuck sur le...
3252620	3254620	En train de mourir au soleil sur une nouvelle...
3254620	3256620	Les choses sont en train de changer...
3257620	3258620	Ah c'est ça qu'on t'en est ?
3258620	3259620	C'est lui qui veut se briser...
3259620	3260620	Il y a l'otarisme à moi !
3260620	3262620	Non, j'ai rien fait !
3262620	3263620	C'est bon ? C'est fini ?
3264620	3265620	Captain Star !
3265620	3266620	Captain Star !
3266620	3269620	On aurait quand même dit un mélange entre l'otarie et la chat-fondée quoi !
3269620	3271620	C'est vrai qu'il a réussi à faire le croisement !
3271620	3272620	Alors, des petites nouvelles des cryptos !
3272620	3274620	On fait un peu une mise à jour sur tout ce qui s'est passé cet été quand même !
3274620	3277620	Alors, les cryptos, ça n'allait pas fort en juillet ?
3277620	3278620	Ça avait perdu combien ?
3278620	3280620	Je crois qu'ils surveillent Manox ?
3280620	3281620	Beaucoup !
3281620	3283620	Mais après, c'était à monter en août !
3283620	3284620	En août, ça a bien remonté !
3284620	3286620	Nouveau bullrun en août !
3286620	3287620	Et là, maintenant, à nouveau, ça retombe !
3287620	3289620	Ouais, ouais, mais bon, il faut savoir vendre au bon moment !
3289620	3290620	Et puis, c'est la même chose !
3290620	3292620	Tu achètes et puis t'attends 10 ans !
3292620	3293620	Dans 10 ans, t'auras peut-être une surprise !
3293620	3294620	Tu as peut-être une surprise !
3294620	3298620	Tu as peut-être, éventuellement, une surprise dans 25 ans !
3298620	3299620	Voilà !
3299620	3300620	Mais ce n'est pas sûr !
3300620	3301620	Pour ta retraite !
3301620	3303620	Si l'effondrement n'a pas encore eu lieu !
3303620	3305620	Il y a eu deux news ces derniers jours !
3305620	3307620	La première, ça concerne encore une fois Elon Musk,
3307620	3310620	qui a désormais un nouveau chien !
3310620	3311620	C'est un Shiba !
3311620	3314620	Et évidemment, comme c'est des cryptos et que ça n'a absolument aucun sens !
3314620	3320620	Immédiatement, deux cryptomonnaies qui avaient le nom Shiba dans leur nom ont pris 200% !
3320620	3324620	Il y avait le Floki Inu et le Floki Shiba !
3324620	3325620	Et le SuperTam !
3325620	3328620	Le Floki Inu et où le nom Shiba dedans ?
3328620	3329620	Il n'y a pas le nom Shiba !
3329620	3331620	Alors, la Lita News, excuse-moi, je n'ai pas compris !
3331620	3335620	Non, non, non, mais après, j'ai suivi un petit peu quand même, mis en arrière !
3335620	3336620	Et à un moment, je n'ai pas compris !
3336620	3338620	C'est le même type de chien de merde, c'est pour ça !
3338620	3339620	Ça a pris, là !
3339620	3341620	Non, mais à mon avis, c'est...
3341620	3345620	Je n'ai pas compris, t'as dit, il y a deux cryptomonnaies dont le nom Shiba dedans !
3345620	3349620	Parce que Archiviste du cinéma, il a compris, Inu, ça veut dire chien en japonais !
3349620	3354620	C'est pas ça que t'as dit ! T'as dit deux cryptomonnaies dont le nom contenaient Shiba !
3354620	3355620	Oui bon bah...
3355620	3357620	Augmenté ! Et là, tu me dis InuCoin, je ne sais pas quoi !
3357620	3360620	Ok, ok, je signerai ça au site sur lequel j'ai fait un peu décoller !
3360620	3363620	Ouais, je vais lancer la nouvelle cryptomonnaie, ça s'appelle le Captain Star !
3363620	3364620	C'est un Captain Star !
3364620	3366620	Ma théorie, ce serait peut-être...
3366620	3370620	Parce qu'en fait, sur la chaîne Défi, là,
3370620	3372620	il y a en permanence une nouvelle cryptomonnaie !
3372620	3374620	Tous les jours, il y a une nouvelle cryptomonnaie !
3374620	3376620	C'est vraiment ça qu'il faut qu'on fasse cette année !
3376620	3378620	Voilà, la cryptomonnaie, il n'y a pas eu le Captain !
3378620	3379620	Le Captain Star !
3379620	3380620	Le Starcoin !
3380620	3381620	L'ADC Coin !
3381620	3382620	Alors ça existe déjà, Starcoin !
3382620	3383620	Starcoin, ça existe !
3383620	3384620	Oui, mais l'ADC Coin, non !
3384620	3385620	Captain Coin !
3385620	3387620	Captain Coin, ça doit exister aussi, je pense !
3387620	3390620	Bref, ce qui est dû se passer, c'est qu'au moment où cette monnaie a dû être créée,
3390620	3393620	où elle devait être dans les premières de la journée ou un truc comme ça,
3393620	3396620	le mec a dit sa connerie, ils ont vu une crypto avec un chien-chien,
3396620	3397620	ils ont acheté direct !
3397620	3399620	Le pire, c'est qu'Elon Musk n'a même pas dit,
3399620	3401620	n'a même pas fait un rapport avec la crypto,
3401620	3402620	il a simplement annoncé dans un tweet genre,
3402620	3404620	« Ah, j'ai un nouveau chien, c'est un chibar ! »
3404620	3405620	C'était tout !
3405620	3406620	Il n'y a aucun moment où il a parlé de crypto !
3406620	3409620	Oui, mais Elon Musk, maintenant, est associé à la cryptomonnaie !
3409620	3410620	Il le sait très bien !
3410620	3411620	Il est la cryptomonnaie !
3411620	3412620	C'est Mister Pump !
3412620	3416620	La seconde news, c'était hier ou aujourd'hui, je crois,
3416620	3418620	il y avait eu un faux communiqué de presse de Walmart
3418620	3420620	qui annonce qu'ils allaient accepter le Litecoin !
3420620	3424620	Donc le Litecoin, c'est quand même une des grosses cryptos en termes de capitalisation !
3426620	3428620	C'est pas une cryptomonnaie où il y a un Shiba ?
3428620	3429620	Non, du tout, ça n'a rien à voir !
3429620	3430620	Non, je te rassure !
3430620	3431620	C'est pour être sûr !
3431620	3433620	Il y a beaucoup de crypto-monnaies avec des chiants, tu peux poser l'accès !
3433620	3436620	Et Elon Musk, en l'espace d'une heure, je crois,
3436620	3440620	la valeur du Litecoin a bondi de 32 %,
3440620	3442620	ce qui a fait beaucoup de posion !
3442620	3445620	Evidemment, tout de suite, Walmart a dit « c'est n'importe quoi, c'est des conneries,
3445620	3447620	on ne va pas accepter le Litecoin dans nos magasins ! »
3447620	3449620	Et ça a évidemment tout de suite tout reperdu !
3449620	3450620	Voilà !
3450620	3451620	C'était intéressant !
3451620	3452620	Merci !
3452620	3455620	Je fais vite, j'ai quasiment terminé mes news !
3455620	3456620	C'est très bien !
3456620	3457620	Il faut une heure qu'on a commencé maintenant !
3457620	3458620	Je vais vous parler du...
3458620	3459620	Ah, du couille !
3459620	3460620	Du coucouille !
3460620	3461620	Du cuprum coin !
3461620	3462620	Du cuprum coin !
3462620	3464620	C'est encore une histoire de crypto-monnaie !
3464620	3465620	C'est encore une histoire de crypto-monnaie !
3465620	3466620	C'est quoi ton père ?
3466620	3467620	Couprum !
3467620	3468620	Couprum !
3468620	3469620	Couprum coin !
3469620	3471620	Alors qu'est-ce que c'est que le cuprum coin ?
3471620	3472620	Je ne sais pas !
3472620	3476620	Alors le cuprum coin, c'est quelqu'un qui a lancé sa propre crypto-monnaie !
3476620	3478620	Alors je ne sais pas si tu peux la trouver sur la liste des crypto-monnaies !
3478620	3479620	Couprum !
3479620	3480620	Sûrement !
3480620	3481620	Dis-moi comment ça s'appelle !
3481620	3483620	C-U-P-R-U-M !
3483620	3484620	C-U-P-R-U-M !
3484620	3485620	C'est quoi ?
3485620	3487620	C-U-P-R-U-M !
3487620	3488620	On dirait des personnes âgées !
3488620	3490620	C'est lui qui prononce l'importement !
3490620	3491620	C'est qui ? Quoi ? T'as dit quoi ?
3491620	3492620	Ah le US !
3492620	3493620	Non, attends, c'est pas ça !
3493620	3495620	Je tombe sur le cuprum metallicum !
3495620	3497620	Mais c'est un médicament à priori !
3497620	3498620	T'as perdu de ça !
3498620	3500620	60 milliards de dollars !
3501620	3502620	Ah !
3502620	3503620	Cuprum !
3503620	3505620	Je vais expliquer de quoi il s'agit !
3505620	3506620	Qu'est-ce que c'est donc ?
3506620	3509620	C'est un gars, il a fondé Cuprum coin, c'est une nouvelle crypto-monnaie !
3509620	3514620	Mais sauf que lui il s'est dit, le problème, le problème de la crypto-monnaie, c'est le sous-jacent !
3514620	3515620	C'est vrai !
3515620	3518620	Comment sécuriser la valeur de ma crypto-monnaie pour que les gens aient confiance ?
3518620	3522620	Tu sécurises de côté de l'or ou...
3522620	3523620	Exactement, Captain Feb !
3523620	3524620	De la même valeur !
3524620	3525620	Exactement !
3525620	3529620	On retourne un peu sur les accords de Bretton Woods, tu vois, le dollar-or, toutes ces choses-là !
3530620	3536620	Et il s'est dit, ben voilà, moi je vais adosser mon Cuprum coin avec de la poudre...
3536620	3538620	Voilà, c'est ça, c'est ça, c'est ça !
3538620	3539620	C'est Cuprum coin !
3539620	3541620	Avec de la poudre de perlin-pampa !
3541620	3542620	Exactement !
3542620	3544620	Non, ça n'est pas de la poudre de perlin-pampa !
3544620	3545620	Regarde, c'est toute élimination là !
3545620	3547620	C'est la poudre de cuivre ultra fine rare !
3547620	3548620	Ah, ok !
3548620	3549620	Et alors le concept, c'est quoi ?
3549620	3556620	Alors cette poudre de cuivre ultra fine, ça fait partie de ces matériaux les plus précieux au monde, il n'y en a pas beaucoup !
3556620	3557620	Non !
3557620	3559620	On en a énormément besoin, on en achète plein et on n'en trouve pas !
3559620	3562620	Donc le truc ne va pas perdre de la valeur, c'est comme l'or !
3562620	3563620	Voilà !
3563620	3564620	Et là, il a fait un deal...
3564620	3566620	Tu peux arrêter de faire tes bruits dégueulasses ?
3566620	3568620	Il a fait un deal avec...
3568620	3572620	Ah voilà, j'ai trouvé le nom du fondateur de Cuprum coin, c'est Mario Hurlich !
3572620	3573620	Ah oui, c'est Mario !
3573620	3574620	C'est Mario !
3574620	3575620	C'est un copain de maloc !
3575620	3576620	Oui, c'est...
