start	end	text
0	180	...
180	8000	Précédemment, dans la Grim Academy...
8000	12000	...
16600	17000	...
17000	18000	...
18000	19000	...
19000	20000	...
20000	21000	...
21000	22000	...
22000	23000	...
23000	24000	...
24000	25000	...
25000	26000	...
26000	28000	...
28000	50000	...
50000	51000	...
51000	53000	...
53000	56520	Elle absorbe mon pied !
56520	58000	J'étouffant !
58840	61380	Nous en sortirons-nous encore une fois ?
61380	65000	Mais enfin mon frère, tu ne peux pas nous laisser dans l'expectative !
65000	68000	Vous faites trop durer le suspense !
68000	72480	Ça, ils le font exprès pour qu'on prenne la version premium à 12,90€ !
72480	73700	Qu'elle dit ?
73700	75000	Ma maman !
75000	82780	La Grime Academy saison 7 est disponible dès aujourd'hui en entier et sans publicité au prix de 12,90€ hors taxes.
83000	86100	Pour la découvrir avant tout le monde, cliquez sur le lien dans la description.
113000	114860	Sinon, c'est la grosse grosse colère !
114860	117360	Marc Repair, pour le meilleur et pour le prix.
117560	121000	Modalité, magasin et drive participants sur www.e.leclerc.
121000	128000	FANTASQUE
128000	130880	Studio Fantasque est un label de podcast pour enfants.
131280	134340	Retrouvez toutes nos séries audio sur le site fantasque.studio
134340	140220	Rodolphe et Gala est le pirate de l'espace.
141260	146320	Il était une fois l'histoire de deux petits extraterrestres qui s'appelaient Rodolphe et Gala.
146320	152020	Installés sur la planète Alpha, ils possédaient un fabuleux trésor.
152840	154660	Leurs cailloux étaient en or.
155760	159060	Toute la journée, ils construisaient des tours spectaculaires.
159480	163900	Et quand venait la nuit, Rodolphe écoutait bien sagement les histoires de Gala.
165040	167820	Ainsi, il faisait toujours de beaux rêves.
168560	171940	Mais cette nuit-là, il fit un terrible cauchemar.
171940	178360	Oh non, oh non, oh non, oh non, oh non, oh non, oh non !
178360	180420	Rodolphe, qu'est-ce qui t'arrive ?
180420	182060	Il est à moi !
182060	183280	Rodolphe !
183280	187220	Réveille-toi, Rodolphe, tu fais un cauchemar !
187220	197680	Le lendemain matin, Rodolphe se réveilla de très mauvaise humeur.
198300	200340	Impossible d'oublier son affreux cauchemar.
200340	205020	Il était très inquiet et pour se rassurer, une idée lui vint.
206780	209340	Un, deux, trois...
210120	212040	Qu'est-ce que tu fais, Rodolphe ?
212040	213660	Chut, je compte mes cailloux.
214340	217760	Quatre, cinq, six...
217760	220640	Mais il y en a beaucoup trop. Fais-tu que je t'aide ?
220640	225260	Sept, huit, neuf, dix...
225260	229340	Ordinateur de bord, peux-tu me dire combien il y a de cailloux sur la planète ?
229340	232860	Il y a 827 935 cailloux.
233200	236840	Mais Gala, pourquoi tu m'as dit ? Je voulais les compter !
236840	240360	Tu ne sais compter que jusqu'à 30, Rodolphe. Tu n'aurais jamais réussi.
240800	243380	Ouais, mais je voulais faire tout seul !
243380	245240	Désolée, je voulais juste t'aider.
246020	247160	Personne ne peut m'aider.
248000	251800	Je ne comprends pas. À quoi cela te sert de compter tes cailloux ?
251800	253740	Je veux les protéger !
253740	256360	Les protéger ? Mais de quoi ?
256360	257480	Du voleur !
257480	258800	Un voleur !
258800	264880	Voyant Gala complètement perdu, Rodolphe se décida enfin à lui raconter son cauchemar.
265800	270720	Il avait rêvé qu'on lui volait tous ses cailloux et que son trésor était perdu à jamais.
271940	275040	Comprenant enfin le problème, Gala lui proposa.
275600	276260	J'ai une idée.
276260	282100	Si tu veux protéger tes cailloux, il ne faut pas les compter, mais les cacher. Ce serait plus malin.
282820	283260	Oh !
283260	287160	Gala se mit alors à bouger bizarrement.
287840	293440	Elle cligna des yeux, remua son nez et tout à coup, une antenne apparut au-dessus de sa tête.
294280	296260	Qu'est-ce que tu fais, Gala ?
296260	299200	J'active ma télécommande pour chercher une grotte.
299540	301820	Mais je ne veux pas jouer à casse-casse !
301820	307860	Ce n'est pas pour toi, Rodolphe, mais pour le trésor. Nous allons le cacher à l'intérieur et ton problème sera réglé.
307860	313420	Youpi ! Une grotte pour mes cailloux !
313420	320860	Gala survola la planète à toute vitesse et en quelques secondes, elle dénicha l'endroit idéal pour mettre les cailloux en or.
321980	327100	C'était une grotte sombre et profonde dont l'entrée était cachée par de grands feuillages.
327940	329040	Elle appela Rodolphe.
329480	334580	C'est bon, Rodolphe, j'ai trouvé une grotte sombre et profonde. Tu peux aller mettre tes cailloux dedans.
334580	337400	Je ne sais pas trop.
338240	340480	Qu'est-ce que tu ne sais pas, Rodolphe ?
340480	342560	C'est qu'il fait drôlement noir là-dedans.
343140	345780	C'est le but. Il ne faut pas qu'on puisse voir tes cailloux.
347200	352640	Au bout d'un moment, Gala finit par comprendre que Rodolphe avait peur d'aller à l'intérieur.
353380	357300	Tu préfères peut-être que j'y aille en première pour faire un petit repérage ?
357300	358940	Oui, c'est bien ça. Va repérer.
360100	363940	Je crois que tu as peur qu'il y ait un monstre féroce caché tout au fond.
364580	366420	Pas du tout, je n'ai pas la trouille.
368580	371960	Gala s'aventura donc seul dans la grotte sombre et profonde.
373000	376340	Pendant ce temps, Rodolphe l'attendait patiemment à l'entrée.
377460	380080	Soudain, il entendit un bruit au loin.
381180	385980	Il leva les yeux et découvrit un vaisseau pirate qui fonçait droit sur lui.
385980	393820	Au secours, Gala ! C'est une attaque ! Reviens vite !
393820	397340	Mais Gala était tout au fond de la grotte et elle ne pouvait pas l'entendre.
398220	404680	Le vaisseau se posa juste devant Rodolphe et un horrible pirate du nom de Barbe Brune en sortit.
404680	407800	Il avança vers lui, l'air menaçant.
408520	415720	Ha ha ha ! Quel magnifique trésor ! J'ai eu le nez fin en venant sur cette planète.
416360	419520	T'as pas intérêt à le toucher, c'est le mien !
420520	424200	Plus maintenant ! Allez, pousse-toi de mon chemin, sale vermine.
424580	425980	Sinon, tu auras affaire à moi.
425980	430140	Mais au lieu de s'éloigner et de se mettre à l'abri,
430720	435380	Rodolphe repensa à son terrible cauchemar et à son trésor perdu à jamais.
436180	439280	Alors, il se jeta sur ses cailloux pour les protéger.
440320	441980	Tant pis pour toi !
442620	446080	Et Barbe Brune sortit de sa poche son minus tractor,
446860	450500	un pistolet laser capable de rétrécir n'importe quoi.
451380	453620	Il tira sur Rodolphe et ses cailloux.
455980	458540	Mais qu'est-ce qu'il se passe ?
458540	460960	Ha ha ! Je t'avais prévenu.
461400	465860	Je vous ai rendu si petit qu'on dirait une fourmi sur un tas de sable.
467540	470800	D'une main, Barbe Brune captura le tout petit Rodolphe
470800	474080	et ses minuscules cailloux qu'il enferma dans un coffre.
475000	479460	Laisse-moi sortir ! Laisse-moi sortir !
479460	483020	Puis, il remonta à bord de son vaisseau pirate et s'envola.
485980	489060	Quand Gala sortit de la grotte, elle fut très surprise.
489780	492500	Tous les cailloux avaient disparu ainsi que Rodolphe.
493120	496960	Rodolphe ? Rodolphe ! Où es-tu ?
496960	502280	Inquiète, elle courut jusqu'à son vaisseau spatial et questionna son ordinateur de bord.
502820	506180	Ordinateur de bord, dis-moi combien il y a de cailloux sur la planète.
506180	509460	Il y a zéro cailloux sur la planète.
509660	513840	Oh non ! Ordinateur, dis-moi s'il y a Rodolphe sur la planète.
514900	517420	Il y a zéro Rodolphe sur la planète.
518280	522780	Gala se mit immédiatement à inspecter partout autour d'elle, à la recherche d'indices,
523300	527100	quand elle remarqua enfin une drôle de trace sur le sol.
527540	530480	C'est bien ce que je craignais. Je connais cette empreinte.
530800	532680	C'est celle de Barbe Brune.
532680	537860	Gala était furieuse. On pouvait bien lui voler tous ses cailloux,
538300	541320	mais personne n'avait le droit de lui voler son Rodolphe.
542220	544540	Elle prit place à son poste de commandement
544540	549000	et actionna les moteurs de son vaisseau spatial à pleine puissance.
549720	553080	Puis, elle s'élança à la poursuite du vaisseau pirate,
553660	555800	bien décidée à récupérer son Rodolphe.
556420	558680	Barbe Brune, me voilà !
562680	577220	C'était les aventures de Rodolphe et Gala.
577900	583160	Une histoire écrite, racontée et mise en musique par Cécilia et Gérald.
585040	587480	On vous dit à bientôt pour de nouvelles aventures.
587480	597480	Leclerc.
597480	598360	Leclerc.
598740	602060	La petite Martha dit, avec les couches, faut pas rigoler.
602800	606360	Moi, je veux de la douceur, du confort, de l'absorption et pas de fuite.
606800	607940	Et qu'on ne parle pas de prix.
608240	610920	Toute l'année, les couches mots d'enfants sont appris Leclerc.
611300	615400	Et en plus, jusqu'au 4 octobre, sur les packs de couches ultra-confort mots d'enfants de Marc Repair,
615400	618160	c'est 20% crédité en tickets Leclerc.
619160	620900	Sinon, c'est la grosse grosse colère.
621160	623680	Marc Repair, pour le meilleur et pour le prix.
623860	627400	Modalité, magasin et drive participants sur www.e.leclerc.
