start	end	text
0	5820	Et bienvenue à l'apéro du Capitaine Well !
5820	7000	Ah c'est l'apéro !
7520	11460	Ça t'écoiffe avec le Capitaine !
11460	12600	Salut c'est l'apéro là !
12600	15400	Et c'est parti pour le 15ème épisode de l'apéro du Capitaine
15400	17680	Le seul apéro qui se fait à minuit
17680	19520	Puisque là à l'heure où on commence le direct il est minuit
19520	22020	Nous sommes le combien ? On est le 8 aujourd'hui le 7 ?
22020	22680	Le 8, c'est le 8
22680	23520	Regarde l'écran c'est marqué
23520	24980	Ah oui c'est vrai c'est marqué sur l'écran, c'est con
24980	27480	Nous sommes donc le 8 décembre et c'est le 15ème épisode j'ai déjà dit
27480	29120	Un petit tour d'étape pour commencer ?
29120	31000	Bah écoute, vas-y leur ton père, crache le morceau
31000	32700	Coucou les amis, ravi de vous revoir
32700	36660	Vous qui êtes autour de la table et à tous nos auditeurs favoris qui nous sont fidèles
36660	37620	Vous êtes nombreux ce soir
37620	43940	Tout d'abord un premier coucou très rapide à notre ami Kissband
43940	46100	Qui tient un blog qui s'appelle Kissband World
46100	47620	Ah oui j'ai vu passer, tu m'en as pas récité
47620	50240	Kissband.fr slash blog slash
50240	53340	Qui a fait un petit article sympa et il parle notamment de nous
53340	56620	C'est-à-dire qu'il propose un podcast pour chaque jour de la semaine
56620	60280	Et le mardi bien sûr c'est le blog, le podcast du Cap-Tenweb
60280	61000	C'est le podcast de l'apéro
61000	62000	Et oui !
62000	62500	C'est le podcast de l'apéro
62500	63960	Donc on le remercie
63960	64420	Merci
64420	66540	J'ai d'autres remerciements à faire mais on les fera après
66540	66740	Ouais
66740	68120	Quoi cause ?
68120	69760	Euh rien de spécial à part
69760	72500	J'ai préparé un petit was-off en 10 minutes
72500	74780	Ce soir c'est de l'express was-off
74780	77100	On a tous court, donc en fait on a commencé en retard mais on va finir à la même heure
77100	77900	Parce qu'on a tous des trucs super courts
77900	81520	Je voudrais juste souhaiter un bon anniversaire à Ipatricia sur Twitter
81520	83320	Qui a la bonne idée d'être née le même jour que moi
83320	85620	C'est un signe de qualité et de goût
85620	87560	Bon anniversaire à toi quoi tous
87560	89460	Oui bon anniversaire quoi tous
89460	90160	Oui merci
90160	91600	Tu nous diras des nouvelles
91600	92780	23 ans c'est dur mais bon
92780	98180	Tu diras des nouvelles d'Irina qu'on t'a envoyé en privé hier soir
98180	99360	Elle s'est soufflé les bougies Irina
99360	99760	Oui
99760	100320	Madame
100320	103700	Alors bonsoir à tous et bonsoir à toutes
103700	107760	Ce soir et bien dans la rubrique les mystères de l'étrange
107760	111140	Un invité particulier puisqu'il s'agit de Jean-Jacques, 32 ans
111140	115140	Mais il lui est arrivé quelque chose d'un peu spécial
115140	117960	Figurez-vous qu'il a été envoûté l'esprit
117960	122440	Son esprit est possédé par l'esprit d'Alex Follet
122440	123860	Et oui souvenez-vous Alex Follet
123860	128540	Le personnage qu'incarnait Eddie Murphy dans The Flick de Beverly Hills
128540	130160	On a hâte d'entendre ça
130160	133680	Ça va être encore plus bizarre que d'habitude ou c'est juste la même chose
133680	137460	Ah non je pense que ça va être bien sauf que là on va avoir en plus une star internationale à l'autre côté
137460	138540	Oh waouh
138540	139380	C'est parfait quoi
139380	141960	Au fait PPI numéro 3 ça arrive quand quoi ?
141960	142800	Demain
142800	143780	Tout le monde demande
143780	144400	On attend
144400	145720	PPI
145720	149840	Il y a un petit peu de retard au niveau des rédacteurs n'est-ce pas ?
149840	152660	Et donc voilà quoi
152660	155360	Demain normalement si tout va bien vers midi
155360	156940	Ok bon bah on verra ça à midi demain alors
156940	160340	Comptez plutôt 16h le temps que j'écrive l'article qui va avec
160340	161520	Parce que ça prend du temps
161520	164520	Cette semaine juste on a le caméra Design
164520	166440	Alors attention Design est-ce que vous savez comment ça s'écrit ?
166440	166620	Ouais
166620	167160	En phonétique
167160	168100	Ah non
168100	169520	Tout de suite c'est moins facile
169520	171520	D-I-Z-A-J-N
171520	171620	Ouais
171620	172460	Pas mal
172460	173520	Euh
173520	174300	G-N-E
174300	175020	Non non non
175020	176780	Le A-I ça va être un
176780	179540	C'est pas un I avec les deux petits
179540	181240	Écoute moi il m'a pas mis ça à savoir
181240	182820	C'est D-I-Z-A-J-N
182820	184540	Je vous dis ça parce que c'est son pseudo sur Twitter
184540	188180	Et qui nous offre encore une douzaine d'invitations pour Google Wives
188180	188980	Si quelqu'un en a pas encore
188980	190580	Merci Design
190580	193140	Donc merci à lui vous pouvez le retrouver sur son site
193140	194440	Ou sur
194440	196520	Quel est ce bruit ?
196520	198440	Je crois que c'est le voisin qui perce
198440	199780	Je crois qu'il est en train de découper un corps
199780	201360	Qu'est-ce que c'est ?
201360	202860	What the fuck is this man ?
202860	204560	Je croyais au début que ça justait du ventre de l'ordre de ton père
204560	205320	Ah non écoutez
205320	207860	Ce soir l'apéro va être difficile
207860	209500	What the fuck ?
209500	212100	On a le grec d'à côté qui est en train de faire de la perceuse dans sa car
212100	212740	À minuit
212740	213340	C'est sympa
213340	214220	Mais j'en rêve
214220	214820	Il est turc
214820	215380	C'est horrible
215380	217820	Tu es peut-être en train de découper un corps les mecs
217820	218680	C'est possible
218680	219320	Oh putain
219320	220720	Ou le kebab pour demain
220720	223760	Il prépare la barbacue
223760	225920	Putain si on a des bruits de perceuse ça va être l'enfer quoi
225920	226980	Elle doit être dure la barbacue
226980	228720	J'espère qu'il découpe pas quoi que ce soit
228720	230000	Parce que si tu veux j'ai quand même bouffé chez lui
230000	232540	Si ça se trouve il fait un trou pour pouvoir écouter le podcast en direct
232540	233500	Oui peut-être pour nous tuer
233500	235060	Peut-être qu'il veut envoyer du gaz pour nous empoisonner
235060	236100	Oh j'aperçois sa vieille main
236100	239640	What the fuck ?
239640	240240	Ok bon
240240	242400	Donc juste pour dire
242400	244780	Donc design qui offre une douzaine de places
244780	245780	Vous pouvez le retrouver sur un site
245780	246540	Qui est pas encore en ligne
246540	249040	Qui s'appelle yo-architecte avec un s.com
249040	250300	Et donc je sais pas du tout ce que c'est
250300	251300	Puisque c'est pas encore en ligne
251300	252500	Je pense qu'il parlera pas de poney
252500	253260	Mais bon bref
253260	254620	Voilà voilà
254620	255900	Ensuite petit truc rapide
255900	257640	Bon bah écoutez faites nous de la pub comme d'hab
257640	258160	Sur iTunes
258160	258560	Ouais
258560	259680	On est plus dans la rubrique nouveau
259680	260320	Et remarquez
260320	260820	Non
260820	261740	Où on était depuis 3 mois
261740	262760	Ils nous ont passé dans la rubrique
262760	263940	Vieux
263940	264220	En vedette
264220	265380	Ah en vedette
265380	265580	Attention
265580	266820	Sauf qu'on est moins visible qu'avant
266820	268060	Donc vous savez comme d'habitude
268060	269180	Vous cliquez sur le bouton abonner
269180	270680	100 ou 150 fois par jour
270680	271640	On est plus dans le top là
271640	272720	Bah ouais parce que
272720	273680	Quand on est moins visible maintenant
273680	274820	Forcément les gens s'abonnent moins
274820	275500	Plus personne s'abonne
275500	276320	Le salaud
276320	277620	Mais vous pouvez truquer évidemment
277620	277980	Comme d'habitude
277980	279600	En cliquant 150 fois sur le bouton s'abonner
279600	281480	On va se faire bannir avec ton histoire
281480	283100	Ouais ils s'en foutent chez iTunes
283100	284120	Ils n'ont rien à battre quoi
284120	286000	Et enfin une dernière news
286000	286780	Avant de passer aux actus
286780	288300	On n'a pas de répondeur cette semaine
288300	289300	On en aura peut-être un la semaine prochaine
289300	290060	C'est pas mal ce que tu viens de dire
290060	290940	Une dernière news
290940	292000	Avant de passer aux actus quoi
292000	292720	Une dernière news
292720	293960	Hors actualité high tech
293960	295220	Et là je suis dans le truc
295220	297060	Juste pour dire que
297060	298160	Gonzague d'Ambricourt
298160	299800	Donc de Gonzague.me
299800	301480	Qui sera avec nous la semaine prochaine
301480	302260	Normalement
302260	302960	Je dis normalement
302960	303900	Parce qu'on sait jamais ce qui peut arriver
303900	305620	Je sais pas encore de quoi on va parler
305620	306200	Sûrement de blog
306200	306960	De trucs blablabla
306960	307280	Tout ça
307280	308620	Mais il nous accompagnera
308620	309340	Tout au long de l'apéro
309340	309760	Donc voilà
309760	311100	Super merci Gonzague
311100	312760	Avec news pré-high tech
312760	313860	Oh il viendra sûrement avec des bouteilles
313860	314300	Il est intérêt
314300	314840	Il est intérêt
314840	315740	Il est pas accepté de toute façon
315740	316280	Gonz
316280	317900	Voilà
317900	318780	Donc bah écoutez
318780	319500	On passe aux actus high tech
319500	320520	On a un jingle ou ça marche pas ?
320520	321180	Ah si un jingle
321180	324220	Débutes
324220	325040	Déponnez
325040	325860	Et internet
325860	327660	C'est l'actualité du web
327660	329600	Alors
329600	330200	Cette semaine
330200	331000	De quoi je vais vous parler ?
331000	331160	Bah écoutez
331160	332320	Il n'y a pas de grosses grosses news
332320	332680	Je l'ai trouvé
332680	333680	Mais j'ai trouvé plein de petits trucs
333680	334800	Tu nous dis ça toutes les semaines
334800	335100	Ouais
335100	336020	Donc quand je dis ça
336020	336440	C'est que j'en remen
336440	337560	Il y en a pour 45 minutes
337560	338000	Exactement
338000	338860	J'en ai trouvé plein de petites
338860	340460	Donc on va faire comme la semaine dernière
340460	341200	On en parle rapidement
341200	341780	Si ça vous plaît
341780	342320	Vous me le dites
342320	342840	Non
342840	343280	Pour agissez
343280	344060	Si ça vous plaît pas
344060	344700	Et bah on passe à la suite
344700	345760	Comme ça ça dure 5 minutes
345760	347340	Et je pourrais enfin passer à autre chose
347340	348120	Ah cool
348120	349300	Et tu pourras boire ta bière
349300	350080	Voilà exactement
350080	351920	Bah je vais commencer par vous parler d'un site
351920	353840	Enfin je vais plus particulièrement vous parler d'une nouvelle
353840	354500	Que j'ai trouvé sur un site
354500	355140	Que j'aime beaucoup
355140	355720	Qui s'appelle
355720	357600	C'est le site de Cédric Manara
357600	358560	Qui c'est qui le connait ?
358560	358860	Ah non
358860	360340	Le dessinateur ?
360340	360640	Non
360640	361040	Non
361040	362580	C'est Milo Manara
362580	363680	Ah Lord ça m'étonne pas
363680	365100	Que tu l'utilises ce genre de BD
365100	365680	Ah écoute
368860	370580	Et en l'occurrence j'ai lu un article de lui
370580	372160	Et il racontait quelque chose qui m'a surpris
372160	373420	C'est que vous savez que les noms de domaine
373420	374060	Géralement se revendent
374060	375280	Pour peu que vous ayez
375280	376040	Très bon
376040	376840	Un domaine qui ait de la valeur
376840	378380	Et qu'il y a une marque qui soit prête à vous le racheter
378380	379940	Si vous l'avez bien choisi
379940	380280	Ouais
380280	381260	Parce que vous savez que vous pouvez l'échanger
381260	382000	Ah bon ?
382000	382160	Ouais
382160	383140	Parce que ça se fait
383140	385060	Donc il expliquait qu'il y a eu quelques échanges
385060	385780	Comme ça qui se sont fait
385780	386320	Du genre
386320	388040	Donc par exemple je crois que c'était en 2001
388040	388980	Le site
388980	391220	Le nom de domaine air-france.com
391220	392720	Qui a été échangé donc à Air France
392720	393800	En échange de quoi ?
393800	395880	France air.com
395880	396060	Non
396060	397080	Non pas en échange d'un autre domaine
397080	397980	En échange de billets d'avion
397980	398840	Ah
398840	399740	Ah c'est pas mal
399740	400520	Ah d'accord
400520	401880	Tu fais du troc avec n'importe quoi
401880	402140	Ouais
402140	402700	Exactement
402700	402980	Mais attends
402980	403660	Il y a mieux que ça
403660	405080	Il y avait un nom qui s'appelait
405080	405980	The Berry Company
405980	406680	Alors je ne sais pas ce qu'ils font
406680	407660	Ah bah c'est la compagnie du Berry
407660	408460	Ouais sûrement
408460	409740	Donc c'est
409740	410580	Berry
410580	411660	Je ne suis pas sûr que ça griffe comme ça
411660	413560	Et donc eux ils ont échangé quand même
413560	415660	Contre 1000 dollars de publicité
415660	416260	Ah quand même
416260	416680	C'est pas mal non plus
416680	418080	Mais surtout attention
418080	420840	Le domaine polonais decathlon.pm
420840	421200	Non
421200	421740	PL
421740	423740	Contre quoi il a été échangé ?
423740	424380	Euh
424380	426420	GoSport.pm
426420	428380	Non pas contre un autre domaine
428380	429060	Toujours contre des choses
429060	429180	Mais non
429180	430200	Attention là c'était le top
430200	430820	Des haltères
430820	431360	Non
431360	432360	Enfin peut-être
432360	433300	Contre des tantes qu'est choix
433300	433640	Attention
433640	434960	Il a été échangé
434960	436600	Et là je vais vous laisser deviner
436600	437700	Ce que le mec a bien pu acheter avec
437700	438240	Je ne sais pas
438240	438780	Je n'ai pas la réponse
438780	439300	Des ponés
439300	441140	20 000 euros de bons d'achat
441140	442340	Ouh
442340	443560	Oh bah dis donc il s'est acheté beaucoup de
443560	445000	20 000 euros de bons d'achat chez Decathlon
445000	446080	Je ne sais pas si vous avez imaginé ce que ça fait
446080	446120	Il a acheté
446120	447340	Il doit avoir plusieurs vélos
447340	450220	Il doit avoir des trucs pour faire des sportivités
450220	451480	Il a racheté le magasin
451480	453960	Des yurtes on me dit sur le chat
453960	454660	Peut-être des yurtes
454660	456440	Peut-être qu'il a un village de yurtes maintenant à lui
456440	457640	Autant de Ketchua
457640	458440	Peut-être
458440	459700	Peut-être qu'il a plein de sacs de couchage
459700	461140	Il y en a
461140	462440	Il est en train d'agoniser à côté
462440	463380	C'est bien possible
463380	463780	Oula
463780	464260	Il y a une sorte de
464260	464580	C'est vraiment
464580	466320	Il commence à flipper à côté
466320	467140	Je m'excuse
467140	470580	Est-ce que c'est à côté ou est-ce que c'est en haut ?
470580	471380	Ah ah là tout de suite
471380	472560	Je les inquiète là tous
472560	473680	Peut-être que c'est notre ami de tout à l'heure
473680	474260	Thierry vient se venger
474260	474760	Ah merde
474760	476520	Il a sorti la perceuse
476520	478360	On va tirer la courte paille
478360	479880	Qui c'est qui va aller voir ?
479880	480560	Lors ton père vas-y
480560	481300	Lors ton père il va
481300	483160	N'oublie pas de prendre avec toi ton petit penteau
483160	483740	Il est courageux
483740	485640	Ok on continue en attendant
485640	486000	Donc voilà
486000	487300	Donc decathlon.pl
487300	488680	C'était vraiment en plus pour des polonais
488680	490260	J'imagine que c'est un polonais
490260	491440	Ils sont sportifs les polonais
491440	491920	Faut pas croire
491920	492700	Faut croire quoi
492700	493380	Donc voilà
493380	495240	On va passer à une autre news
495240	496680	Est-ce que j'ai un jingle ou j'ai pas d'autre jingle ?
496680	497580	T'as du jingle bien sûr
497580	498340	Autre news
498340	498880	Ouais
498880	500980	J'adore mon petit jingle
500980	501700	Alors
501700	503460	Et puis ça c'est spécialement pour quoi cause
503460	504740	Parce qu'on va parler de cul une fois de plus
504740	506560	On parle toujours de cul
506560	507040	Ah bon
507040	510120	Donc est-ce que vous savez que 61 des jeunes américains ?
510120	510420	Yes
510420	511100	Je le dis comme dans la news
511100	511980	Parce que c'est le titre de la news
511980	514220	De Maya Mazeret
514220	515460	Sur sexeactu.com
515460	517580	Vous pensez que leur ton père est en train de mourir ?
517580	519160	Non non je pense qu'il s'est pris un coup de perceuse dans l'oeil
519160	519520	C'est bon
519520	520460	Continue
520460	521540	J'ai pas entendu crier
521540	522700	En ma tête qu'il a pas senti la douleur
522700	523360	Il est peut-être mort vite
523360	525640	Donc ont déjà été mis sous pression
525640	527640	Pour envoyer des photos dénudées d'eux-mêmes
527640	528360	C'est une blague
528360	529740	C'est ce qu'on appelle le sexting
529740	531160	Et comment on met sous pression ?
531160	533180	Une contraction audacieuse de sex et de texting
533180	535580	Comment est-ce qu'on me met sous pression pour envoyer des photos de moi ?
535580	536740	Bah genre je sais pas
536740	538700	Écoute si tu veux sortir avec moi un jour
538700	539800	Ça serait bien que tu m'envoies une photo de tes seins
539800	541060	Parce que je ne suis pas convaincu que
541060	542240	Qu'il soit réel
542240	543980	Et donc 61% quand même
543980	544860	C'est pas mal hein ?
544860	545320	Ouais c'est pas mal
545320	546960	Ça laisserait voir t'imagines tout ce qu'on a loupé à notre époque
546960	550120	Est-ce que tu as déjà été victime de sexting Captain Webb ?
550120	550600	Oui tout le temps
550600	553040	Il faut savoir que les auditeurs m'envoient régulièrement des demandes
553040	554320	Ah alors ton père est retour
554320	555680	Il va nous dire en exclusivité
555680	557440	S'agit-il d'une attaque en règle ?
557440	558120	Soldat !
558120	560740	S'agit-il de notre voisin turc en train de découper des kebabs ?
560740	561900	C'est très étrange
561900	563200	Je ne sais pas d'où ça vient
563200	564460	Ça vient d'à côté mais
564460	565460	Ça vient d'à côté donc
565460	566840	Ah non ça vient pas du rideau de fer
566840	569380	Voilà c'est pas quelqu'un qui est en train de scier notre rideau de fer pour essayer de rentrer
569380	570060	A priori non
570060	571140	D'accord bon tout va bien
571140	572640	Il y a un abordage à l'apéro du Captain
572640	574120	C'est pas grave on a des sables abordages
574120	574860	On se décentra
574860	578300	Donc je mets lors de ton père à jour
578300	579460	Donc on est en train de parler de sexting
579460	580120	Lors de ton père
580120	581240	Sexe quoi ?
581240	581500	Ting
581500	582380	C'est quoi ?
582380	584620	C'est une contraction entre sexe et texting
584620	585540	J'aurais dû m'en douter
585540	587740	Dès que je me vous laisse 5 minutes ça y est ça part
587740	588480	Ah ouais c'est pas ma faute
588480	590340	On est tombé sur la nuve de cul juste quand tu partais
590340	594080	Donc voilà donc on disait que 61% des jeunes américains
594080	597480	Avaient déjà eu des pressions pour envoyer des photos d'eux à poil
597480	598300	De la part de quelqu'un d'autre
598300	600000	Ils ont été victimes de sexting
600000	602580	Voilà donc c'était une étude de MTV à Société de Presse
602580	603920	Je sais pas ce que MTV venait foutre là-dedans
603920	604600	Ah mais ils sont
604600	607360	Bah écoute ils commandent des sondages assez intéressant chez MTV
607360	609040	C'est un projet d'émission futur ?
609040	609620	Ah peut-être
609620	611280	Je pense que c'est eux qui ont inventé le sexting
611280	611640	Voilà
611640	613720	Il y a un long article sur Wyatt que vous pourrez lire
613720	614800	Je vais pas vous faire une dissertation dessus
615540	616080	C'est pas des masses
616080	619400	Mais juste si quelqu'un veut des photos de Lorde ton père à poil par MMS
619400	619860	Ça se vend
619860	620860	Vous pouvez envoyer
620860	621780	Quoique au satellite
621780	624240	Captainweb.net qui vous enverra des photos de Lorde ton père
624240	625360	Voilà ça se vend pas très cher
625360	626180	J'en ai plein
626180	628040	De son vieux gag
628040	629520	Oh mon dieu
629520	631940	Je comprends pas
631940	633820	C'est un podcast high tech
633820	635300	Je suis désolé
635300	637400	Moi je tombe sur une news sur laquelle je tombe sur le web
637400	639180	C'est plus high tech
639180	640060	C'est pas de sa faute
640060	640780	C'est pas de ma faute
640780	641840	Non c'est de la faute du web
641840	643120	Ok on passe à autre chose
643120	643360	Ah bon
643360	646660	Là on est dans le high tech
646660	647460	Je vais parler de Google
647460	648000	Ah
648000	651560	Google qui annonce enfin les faibles résultats en temps réel
651560	653760	Donc je pense que Lorde ton père peut-être a entendu parler
653760	654060	Quaco
654060	655420	Oui oui j'ai entendu parler ça
655420	657260	Bon bah en gros ils annoncent
657260	658580	Ça y est ils ont lancé la technologie
658580	659760	Donc maintenant tu peux avoir sur Google
659760	661000	Des réponses en temps réel
661000	662160	Donc imagine que t'es sur ton blog
662160	662720	T'es sur Twitter
662720	663660	Tu vas poster quelque chose
663660	664280	Ouais
664280	666320	Et dans les 10 secondes qui vont suivre
666320	668300	Tu fais un refresh du moteur de recherche sur les moucles que t'as mis
668300	669480	Et tu vas voir ton truc apparaître
669480	670380	Et ça marche
670380	671580	Waouh
671580	672580	Alors comment ils ont fait ça en fait
672580	674240	Ça passe pas par l'index habituel de Google
674240	675140	Donc il y a un truc séparé
675140	677940	Tout ce qu'ils ont passé des accords avec Facebook, Twitter
677940	680580	Je pense différents trucs de blog etc
680580	682380	Et donc ils ont toutes ces sources là
682380	683680	Qu'ils agglutinent en temps réel
683680	685100	Et ils doivent faire régulièrement
685100	687260	Donc je sais pas comment ça se passe techniquement
687260	688260	Je suis pas trop au point là dessus
688260	690400	Et donc ils rajoutent un index en temps réel
690400	691220	Ces informations
691220	693920	Alors pour l'instant c'est que sur le site US uniquement
693920	694200	Ouais
694200	696100	Mais il faut activer l'option
696100	697680	Qui je crois est dans les options de recherche
697680	698480	C'est tout en haut
698480	699560	Quand tu cliques
699560	700180	D'accord
700180	700380	Donc voilà
700380	701160	Donc je pense que
701160	703380	Juste pour dire qu'il va y avoir un bon business à faire là dessus
703380	704080	Pour les référenceurs
704080	704400	Mais oui
704400	706840	Parce que je pense que le temps qu'ils passent ça
706840	709920	Je sais pas s'ils vont le passer définitivement en réel dessus
709920	711260	Et savoir est-ce qu'il faudra toujours cliquer l'option
711260	712800	Ou est-ce qu'à terme ça va venir
712800	713940	Oui à terme
713940	715160	Les options de base
715160	716280	Il n'y a pas de raison
716280	717600	Il n'y a aucune raison que ça va se faire
717600	718580	Aucune raison que ça ne se fasse pas
718580	720680	Quand les mecs parlent comme ça
720680	721720	Généralement c'est que je vais passer une autre chose
721720	722480	Parce qu'ils n'en ont rien à base
722480	723280	Ah bon ?
723280	724280	Ah bon ?
724280	726600	Et la suite je sais pas ce que c'est
726600	727400	Parce que j'ai pas encore lu
727400	729480	Ah oui c'était
729480	730520	Je voulais vous parler d'Apple
730520	731660	Donc Apple a racheté une boîte
731660	732160	Oh Apple
732160	733860	Lala.com
733860	735140	Oui on a un mec qui suit
735140	737220	Lala.com
737220	738420	Comment ça se prononce ça doit être américain
738420	738960	Lala
738960	739860	Lala
739860	741280	Lala.com
741280	742100	Lala
742100	743360	Et alors c'est quoi cette boîte ?
743360	744460	Alors c'est un truc de streaming en fait
744460	746780	Il diffusait de la musique en streaming
746780	749000	Alors manifestement l'objectif
749000	750460	Je crois que là c'est assez clair
750460	752420	C'est de contrer Spotify
752420	753540	Ou des futurs
753540	756580	Des futurs services concurrents de Spotify
756580	758160	Qui ont vraiment la cote en ce moment
758160	758680	Surtout Spotify
758680	759820	Il paraît que c'est une tuerie sur iPhone
759820	760420	Je ne l'ai pas essayé
760420	761560	Je ne l'ai pas essayé non plus
761560	762300	D'après ce qu'on m'en a dit
762300	763240	Bon le principe c'est toujours le même
763240	763840	Tu écoutes en streaming
763840	765380	Mais ils ont fait des applications
765380	766460	Donc sur les appareils mobiles
766460	767460	Où tu peux directement
767460	769580	Choisir de télécharger les morceaux
769580	770820	Le temps que tu te balades
770820	772060	Donc tu n'as plus besoin d'être connecté en permanence
772060	772660	Ah d'accord
772660	773200	C'est pas mal
773200	774160	C'est carrément pas mal
774160	775540	Parce que tu n'as plus besoin d'acheter des MP3
775540	776340	Parce que tu as tout en direct
776340	777100	Il y a un abonnement quand même
777100	778300	Ça coûte 9,90€ pas moins
778300	779200	Mais voilà
779200	779720	Donc en gros
779720	781700	Le rachat de Lala.com
781700	783060	Il semble clair
783060	785780	Et c'est destiné à contrer ce genre de choses
785780	788040	Et qu'on va le voir bientôt intégré dans iTunes
788040	789660	Alors je ne sais pas comment
789660	790780	C'est plutôt une bonne chose quoi
790780	792700	Ouais à part pour la taille de mon disque dur
792700	793400	Puisque iTunes
793400	795300	Et le prix de rachat tu l'as ou pas ?
795300	795900	Non je ne crois pas
795900	797480	C'est ça qui intéresse l'auditeur
797480	797860	Très cher
797860	798380	Le pognon
798380	798920	Le pognon
798920	800000	Écoute je regarde tout de suite
800000	801620	Je regarde des non je ne l'ai pas
801620	802080	Non
802080	803280	Tant pis
804160	804940	La merde
804940	806000	Ça c'est de la news
806000	807260	Vous aurez qu'à aller le chercher vous même
807260	808380	Et vous ne me faites pas chier
808380	808820	Lala
808820	809460	Ok d'accord
809460	810060	Est-ce que c'est
810060	810640	Lala
810640	811940	On m'a dit 39$ sur le chat
811940	812660	Ah 39$
812660	813880	Moi je crois sur parole les mecs
813880	816180	Donc Apple aura acheté 39$
816180	816680	C'est une info solide
816680	817180	Lala.com
