start	end	text
2293560	2294720	Mais oui, mais c'est comme
2294720	2295820	les trucs des tatouages et tout.
2295920	2296320	Au fur et à mesure,
2296380	2297440	ça évolue, ça rentre dans les mœurs
2297440	2298300	et ça ne gêne plus personne.
2298500	2300020	Mais pourquoi ça n'a pas passé
2300020	2301520	le cap de hommes politiques ?
2301520	2302000	Un homme politique
2302000	2304000	avec un piercing ?
2304000	2306260	Dans les amis de tes parents,
2306860	2307440	tu regarderas,
2307520	2307980	il y en a certains
2307980	2308540	qui ont des tatouages.
2308660	2309360	Alors, c'est des aigles,
2309440	2309940	c'est des croix.
2309940	2310380	Oui, oui.
2310380	2311420	Mais il y en a un.
2311560	2312020	Oui, c'est vrai.
2312980	2313300	Jack,
2313680	2314840	petit tribal au-dessus du cul,
2314880	2315100	mon gars.
2316180	2317460	Jack, il a un tribalos.
2318640	2319160	Ça, c'est trop bien
2319160	2319940	qu'il t'attaque pour ça.
2320280	2321080	Je suis pédophile,
2321180	2321520	mais par contre,
2321580	2322080	je ne l'ai pas.
2322100	2323000	Je n'ai pas un tribal.
2323520	2324260	Je vais vous le prouver.
2324860	2325420	Ah, putain.
2326360	2326880	Oh, merde.
2327160	2328200	Oh là là là là.
2328580	2328860	Pardon.
2329220	2329700	Bon, ok.
2330080	2330660	Sujet mort.
2331320	2332160	Non, mais non, non.
2332160	2332780	Mais un jour,
2332980	2333980	est-ce que vous pensez
2333980	2335760	qu'on aura un présidentiable
2335760	2336780	avec une vraie barde ?
2336780	2337700	Moi, je pense qu'en vrai,
2338120	2339080	techniquement pour les vieux,
2339480	2340060	ça ne passe pas le cap.
2340060	2341020	Mais bien sûr que oui.
2341180	2341460	Regarde.
2343080	2343780	Ah non, j'allais dire.
2343800	2344440	Il n'y avait que Edouard Philippe.
2344760	2345660	Lula au Brésil,
2345740	2346240	mais non, mais oui.
2346240	2347200	Mais il y aura des gars
2347200	2347560	avec des barbes,
2347640	2348060	bien sûr que oui.
2348060	2348600	Il y avait Edouard Philippe
2348600	2350340	et il a tout enlevé aussi.
2351440	2352080	Ce n'est pas un peu
2352080	2353800	la vie qui lui a enlevé aussi ?
2353800	2354160	Ah bah oui.
2354640	2355440	C'est tombé non,
2355520	2356100	Edouard Philippe ?
2356100	2357820	C'est devenu blanc,
2358320	2358780	tout blanc,
2359060	2359500	plus rien,
2359680	2360180	plus de cheveux,
2360300	2361120	plus de sourcils,
2361160	2361480	plus rien.
2362100	2362420	Maintenant,
2362500	2363820	il est en alopécie grave,
2364040	2364460	plus rien du tout.
2364480	2365060	Oui, mais il se trouve,
2365360	2365980	il le gère trop,
2366060	2366960	il l'assume, machin.
2367220	2368500	Il ne reste pas présidentiel.
2368860	2370900	Je crois qu'il a dit
2370900	2373160	que ça pouvait lui porter préjudice
2373160	2374060	pour les présidentielles.
2374200	2374760	Ah oui, oui.
2374780	2375940	Parce que le physique,
2376080	2376300	du coup,
2376360	2376980	on ne fait pas confiance.
2377100	2377560	Oui, oui.
2377760	2379060	C'est fou le beauty privilège.
2379140	2379420	Il était,
2379600	2380080	je ne rends pas compte.
2380400	2381640	C'est dur à vivre.
2381960	2382680	Tu as des problèmes
2382680	2383780	avec ça ou pas, toi ?
2383780	2384260	De quoi ?
2384260	2385060	Le beauty privilège.
2385280	2387320	T'en souffres ou pas ?
2387320	2388320	Je sens bien
2388320	2389120	que les gens me traitent mieux
2389120	2390460	parce qu'en ce moment,
2392040	2393380	ma cheveilleur est incroyable.
2393980	2394400	Je le vois bien.
2394440	2394980	C'est vrai que tu as du cheveur.
2394980	2395400	Non, mais c'est vrai,
2395660	2395920	les gens,
2395980	2396560	ils ne se rendent pas compte.
2396640	2397720	Il y a un épisode de 30 Rock
2397720	2398460	qui est une super série
2398460	2399380	où il y a une meuf
2399380	2399900	qui se rend compte
2399900	2400360	qu'elle traîne
2400360	2401520	avec quelqu'un de beau
2401520	2403460	qui d'un coup devient moche
2403460	2405080	et revit la vie de
2405080	2405520	« Ah tiens,
2405680	2407520	les gens ne sont pas gentils avec moi. »
2407520	2408340	Les gens n'ont pas...
2408340	2408940	C'est un vrai truc.
2409240	2410080	C'est la plus grosse discrimination.
2410080	2410640	Ah, il y a un épisode.
2410760	2410860	Putain,
2410920	2411220	il faut que je regarde.
2411300	2412220	Moi, je fais des sketchs là-dessus.
2412320	2412520	Il ne faudrait pas
2412520	2413300	que je fasse les mêmes vannes.
2413360	2414100	Sur le beauty privilège.
2414180	2414400	C'est une série
2414400	2416180	qui a 20 ans maintenant.
2416180	2417240	Il y a prescription,
2417380	2417720	tu peux y aller.
2417740	2418440	Sur le fait d'avoir...
2418440	2418640	De toute façon,
2418720	2419440	toi, tu es spécialiste.
2419640	2420460	Moi, j'ai pris
2420460	2421580	toutes les vannes de Friends déjà.
2422100	2422400	C'est à moi.
2423180	2423760	De toute façon,
2423840	2425160	les vannes du truc d'Arthus,
2425280	2425920	dans 15 jours,
2426000	2426160	c'est bon,
2426180	2426560	il y a prescription,
2426740	2427220	tu peux les prendre.
2427340	2427900	Pour moi, 15 jours,
2427980	2428160	c'est bon.
2428180	2428980	15 jours, c'est prescription.
2429280	2430120	Tu l'as vu le film ou pas ?
2430120	2430480	Personne l'a vu ?
2430480	2430760	Pas encore.
2430880	2431780	Je vais y aller avec un petit calme.
2431800	2432280	On est très content.
2432460	2433060	Moi, je suis très content
2433060	2433420	que ça marche.
2433700	2434700	Oui, c'est un bon gars,
2434780	2435400	Artus, en vrai.
2435740	2436100	En vrai, moi,
2436140	2436640	je ne le connais pas.
2436720	2437100	Je ne veux pas faire
2437100	2437720	comme vous Al Susé,
2437780	2438380	mais il a l'air sympa.
2438620	2439300	Non, moi, je le connais.
2439560	2440340	Je l'ai vu deux, trois fois.
2440340	2440980	Et gros,
2441100	2442460	grosses félicitations,
2442560	2442880	par contre,
2442980	2445000	sur la perte,
2445240	2446060	enfin, motive sport,
2446180	2446840	perte de poids et tout.
2447000	2447820	Toutes mes félicitations, bonhomme.
2447840	2449000	Il a arrêté la tease aussi.
2449220	2449320	Oui.
2449680	2450260	C'est un de ceux
2450260	2450940	où je me suis dit,
2451100	2452600	si on a perdu lui aussi,
2452760	2453380	il va falloir que j'y aille.
2453900	2454920	Oui, tu arrêtes là, du coup.
2455560	2455840	J'arrête.
2455840	2456940	C'est la dernière cuitier.
2457280	2458040	Non, mais ce n'est pas ça.
2458120	2458460	C'est qu'à un moment,
2458500	2459240	il faut faire une prise de sang.
2460460	2460840	Tu vois, moi,
2460860	2461380	je commence à en faire
2461380	2461760	de temps en temps
2461760	2462260	des prises de sang.
2462640	2463400	Et quand ça va, ça va.
2463480	2463920	S'il y a un truc
2463920	2464700	qui commence à déconner,
2464820	2465760	il faut adapter.
2466640	2467620	C'est du mercure et tout.
2467780	2468280	C'est le système
2468280	2468900	de rester en vie.
2469060	2470020	Après, on s'en bat les couilles.
2470260	2471000	Non, non, je dois faire
2471000	2471580	un petit check-up.
2471740	2472020	Ça, tu vois,
2472060	2472780	c'est un vrai sujet pour moi.
2472820	2473440	Moi, ça me flingue.
2473480	2474240	Quel sujet ?
2474240	2476380	Que tu fais une prise de sang ou quoi.
2476640	2477260	Le médecin, il dit
2477260	2478800	ça, là, il faut se calmer.
2479020	2479540	Et il y a des gens,
2479580	2479740	ils disent
2479740	2480380	bah, nique sa mère.
2481160	2481640	Je m'en mets les couilles,
2481680	2481980	je continue.
2482460	2483580	Ça, moi, c'est un truc
2483580	2484380	qui me flingue, quoi.
2484440	2485000	Mais pas vraiment.
2485240	2486380	En vrai, c'est une certaine logique.
2486780	2487400	C'est-à-dire qu'en gros,
2488080	2488680	par exemple, moi,
2488720	2489380	je sais que le sucre,
2489600	2490240	c'est pas bon.
2490320	2490500	Oui.
2490760	2491560	Bah, je craque quand même.
2491720	2492580	Moi, je te parle vraiment
2492580	2493460	le moment où t'es mis
2493460	2494300	face au fait de là.
2494380	2494800	Vous avez vu, là,
2494840	2495500	on a fait une prise de sang.
2495580	2496340	Ça, c'est monté, là.
2496600	2497160	Ça, ça veut dire que
2497160	2498040	si vraiment tu continues,
2498500	2499460	tu vas te foutre dans la merde
2499460	2499840	et tu vas avoir
2499840	2500860	des vrais gros problèmes de santé.
2501380	2502160	Moi, le cerveau,
2509740	2510360	c'est même plus...
2510360	2511100	J'ai aucune addiction.
2511380	2512140	Tu veux, je prends un miroir,
2512240	2512820	je te le colle devant.
2512920	2513840	Ça devrait marcher aussi, normalement.
2514540	2516980	Ça devrait te faire un petit...
2516980	2517840	Oh, putain !
2517840	2518500	Oh, putain !
2518500	2520340	Attends, il est quelle heure, là ?
2520340	2521200	Non, non, mais j'en sais rien.
2521260	2521560	Mais je sais pas.
2521720	2522500	Moi, ça me fascine.
2522840	2524620	Mais c'est parce que peut-être...
2524620	2524920	Les médecins en transition...
2524920	2525360	J'en sais rien.
2525400	2526540	Je dis pas que quand t'es dans la merde,
2526660	2527540	genre là, ça va à peu près.
2527640	2528520	Demain, je vis un drame.
2528660	2529120	J'en sais rien.
2529200	2530120	Je me réfugie dans tout tel truc.
2530380	2531660	Même si je sais que le médecin
2531660	2532320	me dit qu'il a fallu arrêter,
2532440	2533240	je continuerai peut-être, tu vois.
2533720	2534940	Mais moi, ça me fascine un peu.
2535100	2536320	Les gens...
2536320	2537800	Tu sais, qu'au dévi...
2537800	2539580	Je te parle pas des comportements
2539580	2540620	destructeurs de ouf, tu vois,
2540660	2541700	mais juste genre ça picole
2541700	2542340	parce que culturellement,
2542400	2542940	on picole beaucoup.
2543480	2544640	En général, c'est vers 40-50
2544640	2545360	les premiers coups de pression
2545360	2545840	que tu les prends.
2546460	2547140	40, prise de sang.
2547260	2548120	Là, mon gars, là,
2548140	2548660	il faut arrêter.
2548820	2550200	Les gars, nique sa mère, je continue.
2550480	2551360	J'ai pris des gamins et tout.
2551420	2552340	Je continue, nique sa mère.
2552540	2553240	Je trouve ça chelou.
2553240	2553820	En fait, je dis ça.
2554860	2556240	Je parlais de ce coup de pression
2556240	2557120	d'Arthus,
2557200	2558080	mais j'en ai pris un deuxième.
2558080	2558680	C'est que moi,
2558820	2560560	un de mes groupes préférés du monde,
2561260	2562000	c'est Zwinkel.
2562100	2563240	C'est un groupe de rap français
2563240	2564180	qui faisait que...
2564180	2565140	Ah, c'est pas Kyo ?
2565140	2566160	Kyo aussi, bien sûr.
2566320	2566720	Mais c'est la main.
2566740	2567740	Ah, mais il y a un gars
2567740	2568780	qui est mort, voilà.
2568800	2569060	Oui, oui, oui.
2569060	2569960	Et c'est quelqu'un...
2569960	2570220	Ah, il est mort.
2570400	2571420	Ouais, à 51,
2571560	2573220	pile comme mon daron.
2573680	2574140	Et c'est pareil.
2574860	2576100	51 à cause de la tease ?
2576100	2576980	C'est pas la tease.
2576980	2577920	À la ref, elle est dure, ouais.
2578060	2579680	Mais c'est crise cardiaque,
2579800	2581480	donc c'est le rythme de vie, quoi.
2581820	2582640	Et ça fait vraiment tôt.
2582780	2583540	Là, je me suis dit,
2583540	2584200	waouh,
2584640	2585840	ça fait vraiment mal celui-là.
2586220	2587320	Derrière, j'ai pris une virasse,
2587620	2588600	mais vraiment,
2589100	2590120	en vrai, je sens que je suis à la fin.
2590260	2590940	Je suis au bout de l'alcool.
2590940	2592240	Mais non, mais je sais pas,
2592340	2592740	j'en sais rien.
2592800	2593880	Je sais pas s'il faut arrêter complètement
2593880	2594740	si tu kiffes et tout, quoi.
2595100	2596460	Mais c'est juste...
2596460	2597260	Enfin, je sais pas.
2598000	2598460	Les amis,
2598520	2599720	on a parlé de tout sauf du cinéma.
2600020	2600500	Ben c'était bien.
2600680	2601020	C'était bien.
2601020	2601840	C'est ça le cinéma,
2601920	2602740	le cinéma aborde tout.
2603540	2604300	Le cinéma, c'est tout.
2604360	2605280	On arrive à la fin de l'épisode,
2605360	2605660	malheureusement,
2605760	2606680	on peut pas trop dépasser
2606680	2607940	puisqu'on en a un deuxième derrière.
2608560	2609400	Le mot de la fin,
2609480	2610200	peut-être qu'on peut parler
2610200	2611780	de Jack Lang avant de finir.
2613680	2614420	Vas-y, arrête.
2614540	2615220	Vas-y, laisse-le tranquille.
2615220	2615640	J'arrête, j'arrête.
2616280	2616620	J'arrête.
2618080	2619160	Pour terminer cet épisode,
2619300	2620080	on a parlé de tout
2620080	2621580	sauf du cinéma.
2621780	2622920	T'as compris ce que c'était un podcast.
2623160	2623900	J'ai compris ce que c'était.
2624060	2624820	Je lutte plus.
2625020	2626220	Mais le prochain épisode,
2626500	2627500	ça sera filmé ici aussi.
2627840	2628920	Et je vais essayer d'imposer un sujet.
2630020	2630280	Vas-y.
2630360	2630540	J'essaye.
2631480	2632280	Le mot de la fin,
2632540	2633380	on a une petite promo,
2633480	2634140	c'est super important.
2634360	2635300	On joue dans vos villes.
2635440	2636480	On a rajouté d'ailleurs Toulouse.
2636480	2637680	qu'on joue le 13 février.
2638240	2638960	Voilà, donc venez.
2640020	2640760	Cadeau de Saint-Valentin.
2641200	2641980	On a un cadeau de Saint-Valentin.
2642460	2643060	On joue à Lille.
2643360	2643960	On joue à Lyon.
2644320	2645900	On joue à Toulouse.
2645960	2647300	Attends, on n'est pas à Paris
2647300	2648640	le 14 février ?
2648640	2649520	Non, on est à Paris le 14 février.
2649540	2650240	Je peux me prendre un missile,
2650360	2651740	moi, si je préviens pas pour ça.
2651920	2652440	Ah bah voilà, ouais.
2652480	2652780	Non, non.
2652800	2653460	Elle s'en fout.
2654120	2654900	Donc on est en tournée.
2655020	2655960	On filme un épisode live
2655960	2657460	le 15 septembre à 17h30
2657460	2658340	à l'Apollo Théâtre.
2659000	2660160	On n'a pas encore d'invités,
2660480	2661020	mais ça va venir.
2661740	2662400	De toute façon, on va...
2662400	2663580	Moi, j'ai une bête d'idée.
2663740	2664800	On lui envoie un message.
2665460	2666200	Salut Jackos.
2667140	2668120	Jackos qui vient.
2668240	2669020	Il faudra se faire un compte
2669020	2670740	avec une photo plus jeune, quoi.
2671880	2674280	Ah, ta gueule, putain !
2674280	2675200	Mec, ce serait ouf.
2675560	2676520	Non, mais Jack, il viendra jamais.
2676800	2677600	Il viendra jamais, Jack.
2677960	2678920	Jack, après cet épisode,
2679000	2679480	il viendra jamais.
2680840	2683180	Donc voilà, 15 septembre à 17h30.
2683740	2684360	Venez nous voir
2684360	2686120	dans nos spectacles respectifs
2686120	2687940	et surtout Urbain le vendredi soir.
2688880	2689720	J'ai une blague scandaleuse.
2690120	2691240	Non, non, mais la fais pas.
2691320	2691900	La fais pas, la fais pas.
2691900	2694040	Moi, pareil, je joue dans toute la France.
2694260	2695240	À Paris, République.
2696800	2697940	Ah oui, République aussi, moi.
2698060	2699100	République, tournée dernière.
2699260	2700560	Moi, ça y est, c'est le dernier tour.
2700680	2701000	Après, j'arrête.
2701400	2702400	C'est la fin de ce spectacle.
2702520	2703020	Ce sera le suivant.
2703360	2705400	On attaque la dernière session de tournée
2705400	2705940	après Poubelle.
2706380	2706780	Allez le voir.
2706960	2707360	Donc venez.
2707480	2708260	Il fait le requin à un moment.
2708800	2709600	C'est exceptionnel.
2709680	2711120	Voilà, Franjo, il fait des super jeux de mots
2711120	2712160	parce qu'il y a une dame,
2712240	2712700	elle est un peu grosse.
2712900	2713460	C'est super drôle.
2714740	2715640	Et moi, Urbain,
2715780	2716620	on n'a pas vu de tes sketchs.
2716680	2717200	Je vais pas se mentir.
2717200	2718540	Point virgule, point virgule, point virgule.
2718600	2719060	Point virgule.
2719060	2719820	Point virgule.
2719920	2722200	Et surtout, aidez-nous plus que jamais
2722200	2723920	parce que je vois qu'il y a un petit relâchement
2723920	2724380	sur le Tipeee.
2724900	2725380	C'est vrai ?
2725380	2726240	Et j'ai pas regardé l'argent.
2726380	2728000	Mais attends, les gars, on va vraiment arrêter.
2728320	2730140	Non, moi, je suis allé voir sur le Gmail.
2730760	2731840	Je pensais que personne donnait.
2731940	2732760	Ça va, en fait ?
2732760	2733780	Non, les gens donnent.
2734340	2735100	Merci à ceux qui donnent.
2735100	2737220	Attends, mais moi, j'ai pas accès à ces...
2737220	2738480	Il y a de l'argent, mais je sais pas.
2738640	2739380	Ah, vaut mieux pas que tu regardes,
2739460	2740400	tu vas être dans la dépression.
2741000	2741960	Non, mais les gens, aidez-nous.
2742300	2743300	Vraiment, on va devoir arrêter.
2743560	2744620	Moi, j'ai envie de vous dire maintenant,
2744720	2745780	je vois que ça...
2745780	2748820	Fronjo va devoir faire...
2748820	2750280	Les mecs, on paye l'argent.
2750280	2753480	On va faire une promo.
2754260	2756660	Mais mec, si on fait des placements de produits,
2756760	2757640	c'est à cause des gens qui donnent pas.
2757960	2758240	Merci.
2758600	2759860	Quand est-ce qu'on fait un placement de produits ?
2759860	2761140	On va en faire un, on va être obligés.
2761800	2762720	Coche-nous, ce que tu veux,
2762780	2763260	je m'en bats les couilles.
2763260	2765100	On va être obligés de payer les Davidson,
2765360	2766020	parce qu'ils bouffent quand même.
2766760	2767720	Merci Davidson d'être là.
2768380	2769500	Voilà, donc donnez à Tipeee,
2769660	2770540	venez nous voir en spectacle.
2770840	2771800	Big up à Davidson, en vrai.
2771800	2772620	Et big up à Davidson.
2772980	2773920	Big up à Davidson,
2774000	2775100	qui fait ce qu'Urbain ne fait pas.
2775340	2777580	Qui a mis une petite image subliminale
2777580	2779000	de Marine Le Pen dans le dernier épisode.
2779600	2780360	Merci Davidson.
2781140	2782220	Ça vient d'arrêter de le suivre.
2782360	2782960	Je te jure que c'est vrai.
2782980	2784400	Tu mets pas une seule photo de Jack.
2784840	2785800	Parce que là, je pense que là,
2785860	2786540	on peut se faire emmerder.
2787340	2788200	Là, on peut se faire emmerder.
2788820	2789860	Même pas, même pas Jack.
2790980	2791300	Merci.
2791580	2792920	Et puis on se retrouve dans une semaine.
2792920	2793580	Bisous à tous.
2794940	2795720	Salut tout le monde.
2795720	2795760	Salut tout le monde.
